,paragraph,length
0,"中国货币政策执行报告二○○六年第一季度中国人民银行货币政策分析小组2006年5月31日内容摘要2006年一季度,我国国民经济继续保持平稳较快增长，总体形势良好。国内需求比较旺盛，对外贸易继续快速发展，居民收入、企业利润和财政收入都有较大幅度增长，市场价格平稳。一季度，国内生产总值增长10.3,居民消费价格同比上涨1.2。中国人民银行按照党中央、国务院的统一部署，继续实行稳健的货币政策，合理调控货币信贷总量，着力优化信贷结构。同时，稳步推进人民币汇率形成机制改革，加快金融企业改革和金融市场建设，改进外汇管理，发展外汇市场，不断完善货币政策传导机制。",276.0
1,一是加强流动性分析与管理，灵活开展公开市场操作。,24.0
2,二是加强窗口指导和信贷政策引导，促进商业银行改善信贷结构。,29.0
3,三是继续推出人民币汇率形成机制改革配套措施，在银行间即期外汇市场引入做市商制度和询价交易方式，推出人民币外汇掉期交易和人民币利率互换试点，建立外汇一级交易商制度等。,82.0
4,四是稳步推进国有商业银行股份制改革，进一步发挥资金支持政策对农村信用社改革试点的正向激励作用，促进农村信用社的健康可持续发展。,63.0
5,五是加快金融市场制度性建设，积极推动产品创新。,23.0
6,六是加快外汇管理体制改革，促进国际收支基本平衡。2006年一季度，金融运行总体平稳，货币信贷总量增长明显快于预期目标。3月末，M2余额为31万亿元，同比增长18.8。基础货币余额为6.3万亿元，同比增长8.6。一季度，金融机构新增人民币贷款为1.26万亿元，同比多增5193亿元。货币市场利率有所回升。3月末，外汇储备余额为8751亿美元，比上年末增加562亿美元，人民币对美元汇率中间价为8.0170元人民币/美元。当前我国经济虽然总体形势良好、金融运行平稳，但需要高度关注固定资产投资增长过快、对外贸易结构性矛盾突出、流动性过多以及全球经济失衡可能给我国带来的风险等问题。中国人民银行将根据中央经济工作会议精神和十届全国人大四次会议要求，继续执行稳健的货币政策，保持政策的连续性和稳定性，合理调控货币信贷总量，加强本外币政策协调，提高调控的主动性，防止货币信贷过快增长，为经济结构调整和经济增长方式的转变提供稳定的货币金融环境。,416.0
7,一是综合运用各种货币政策工具，提高货币政策主动性；二是继续贯彻落实利率市场化的政策；三是加强政策引导，提示金融机构合理均衡放款，着力优化贷款结构；四是加快农村金融改革，加强对“三农”和社会主义新农村建设的金融服务；五是大力培育和发展金融市场；六是继续深化金融企业改革；七是进一步完善人民币汇率形成机制，保持人民币汇率在合理、均衡水平上的基本稳定；深化外汇管理体制改革，促进国际收支平衡。一、货币总量增长较快2006年3月末，广义货币供应量M2余额31万亿元，同比增长18.8，增速比上年同期高4.7个百分点。狭义货币供应量M1余额10.7万亿元，同比增长12.7，增速比上年同期高2.8个百分点。M2增长较快，主要是由于M2构成中的储蓄存款和企业定期存款增长较快。3月末，流通中现金MO余额2.3万亿元，同比增长10.5??。,363.0
8,一季度累计现金净回笼560亿元，同比多回笼330亿元。二、金融机构存款稳定增长3月末，全部金融机构（含外资金融机构，下同）本外币各项存款余额31.8万亿元，同比增长18.4%，比年初增加1.98万亿元，同比多增6781亿元。其中，人民币各项存款余额30.6万亿元，同比增长19.6，比年初增加1.9万亿元，同比多增6990亿元；外汇存款余额1589亿美元，同比下降2.6，比年初增加66亿美元，同比少增13亿美元。企业和居民依然偏好定期存款。3月末，人民币企业存款余额9.8万亿元，同比增长15.8，比年初增加2706亿元，同比多增2446亿元；其中，企业定期存款比年初增加2299亿元，同比多增1150亿元。,305.0
9,"人民币储蓄存款余额15.3万亿元，同比增长18.2，比年初增加1.18万亿元，同比多增2071亿元，其中，定期储蓄存款比年初增加8463亿元，同比多增1428亿元。财政存款余额1万亿元，同比增长24.3，比年初增加2152亿元，同比多增214亿元。三、金融机构贷款增长较快3月末，全部金融机构本外币贷款余额21.9万亿元，同比增长14，比年初增加1.28万亿元，同比多增4554亿元。其中，人民币贷款余额20.6万亿元，同比增长14.7，比年初增加1.26万亿元，同比多增5193亿元；外汇贷款余额1546亿美元，同比增长6.5，比年初增加43亿美元，同比少增65亿美元。一季度,金融机构人民币贷款增加较多。",304.0
10,一是各地新开工项目持续增加、新开工项目计划总投资增速逐步提高、“十一五”重大项目建设启动，导致贷款需求持续上升。,56.0
11,二是商业银行股份制改革上市后，资本金得到较大补充，为提升资产收益率和股东回报，商业银行出于“早放款、早受益”的考虑，扩张贷款的动机增强。,68.0
12,三是外汇流入较多，货币环境宽松，给银行扩张信贷提供了资金条件。从投向看，流动资金贷款及基建贷款增加较多。一季度，企业用于流动资金的人民币短期贷款和票据融资合计增加7496亿元，同比多增3416亿元。其中，票据融资比年初增加3105亿元，同比多增2039亿元。人民币中长期贷款比年初增加4908亿元，同比多增1753亿元，其中基建贷款增加2849亿元，同比多增1111亿元。,186.0
13,一季度主要金融机构（包括政策性银行、国有商业银行、股份制商业银行和城市商业银行）中长期贷款投向主要集中在房地产、交通运输、能源、制造业、环境和公共设施管理等方面。从增速看，投向服务业方面的贷款增长较快。个人消费贷款增长趋缓。一季度，个人消费贷款比年初增加434亿元，同比少增202亿元，余额同比增长9.1。分机构看，各类金融机构人民币贷款普遍多增。,174.0
14,一季度，政策性银行、四大国有商业银行、股份制商业银行、城市商业银行、农村金融机构（包括农村合作银行、农村商业银行、农村信用社）和外资金融机构人民币贷款分别增加894亿元、6005亿元、2863亿元、415亿元、1925亿元和160亿元，同比分别多增327亿元、2752亿元、1738亿元、95亿元、157亿元和66亿元。,160.0
15,四、基础货币平稳增长，银行体系流动性充足3月末，基础货币余额6.3万亿元，同比增长8.6，比年初减少1792亿元。3月末，金融机构超额存款准备金率为3，比上年同期低1.2个百分点；其中四大国有商业银行超额存款准备金率为2.71，股份制商业银行为2.84，农村信用社为5.91。五、金融机构贷款利率有所降低一季度，商业银行人民币1年期贷款加权平均利率为5.85，为基准利率的1.05倍，利率水平比上季度降低0.22个百分点。其中，固定利率贷款占比为86.03，加权平均利率为5.85，比上季度降低0.23个百分点；浮动利率贷款占比为13.97，加权平均利率为5.82，比上季度降低0.2个百分点。中国人民银行对全国金融机构2006年第一季度贷款利率浮动情况的统计显示，一季度金融机构发放的全部贷款中，实行基准利率的贷款占比较上季度上升1.73个百分点；实行下浮利率和上浮利率的贷款占比较上季度有所下降。,400.0
16,一季度，单笔金额在3000万元以上的人民币协议存款利率略有上升，其中61个月期协议存款加权平均利率为3.71，比上季度上升0.46个百分点；37个月期协议存款加权平均利率为3.46，比上季度上升0.39个百分点。,106.0
17,受美联储连续加息、国际金融市场利率上升影响，境内外币贷款、大额存款（300万美元以上）利率水平继续上升。3月份，3个月以内美元大额存款（占金融机构美元大额存款全部发生额的86）加权平均利率为3.4，比年初上升0.12个百分点；1年期固定利率美元贷款加权平均利率为5.58，浮动利率贷款加权平均利率为5.67??，分别比年初上升0.14和0.15个百分点。六、人民币汇率弹性显著增强一季度，人民币汇率弹性显著增强，与国际主要货币之间汇率联动关系明显。人民币对美元汇率中间价最高达8.0170元人民币/美元，最低为8.0705元人民币/美元，累计升值0.66；共有58个交易日，其中有34个交易日升值、24个交易日贬值，最大单日波动幅度为0.12。一季度，人民币汇率日均波幅为24个基点，比2005年7月21日至2005年底日均波幅17个基点有所扩大，人民币汇率灵活性明显提高。,387.0
18,3月31日，人民币对美元汇率中间价为8.0170元人民币/美元。汇改后人民币对美元、欧元和日元名义汇率分别累计升值3.24、2.70和7.02。第二部分货币政策操作2006年一季度，中国人民银行按照党中央、国务院的统一部署，全面落实科学发展观，继续执行稳健的货币政策，合理调控货币信贷总量，加强银行体系流动性管理，着力优化信贷结构，稳步推进人民币汇率形成机制改革，加快金融企业改革和金融市场建设，改进外汇管理，不断完善货币政策传导机制，保持金融平稳运行，促进经济平稳较快增长。一、灵活开展公开市场操作一季度，中国人民银行密切关注元旦、春节期间及春节后银行体系流动性的变化情况，认真监测分析外汇占款、财政库款及现金等影响流动性的因素，继续加强流动性管理，合理安排公开市场操作的工具组合与期限结构，适时适度调控银行体系流动性。,361.0
19,春节前，主要通过发行1年期央行票据收回流动性，并适时开展短期逆回购操作，既保持了必要的对冲力度，又支持了商业银行春节前支付流动性的需要；春节后，针对银行体系流动性总体宽松的情况，加大对冲操作力度，主要运用发行1年期、3个月期央行票据和7天正回购操作工具组合，并尝试以多重价位招标方式发行6个月期央行票据，合理调节银行体系流动性，有效引导货币市场利率，取得了预期的调控效果。,186.0
20,一季度，通过人民币公开市场操作净回笼基础货币4250亿元。期间，共发行19期央行票据，发行总量13200亿元，其中3个月期4000亿元，6个月期850亿元，1年期8350亿元。3月末，中央银行票据余额为28002亿元。二、上调金融机构贷款基准利率中国人民银行决定，从2006年4月28日起上调金融机构贷款基准利率。金融机构一年期贷款基准利率上调0.27个百分点，由现行的5.58提高到5.85。,197.0
21,其他各档次贷款利率也相应调整。上调人民币贷款基准利率有利于抑制过度投资，协调投资与消费的关系，引导资产的合理定价；有利于优化经济结构，促进经济增长方式的转变；有利于增强金融体系防范风险的能力，保持国民经济持续、快速、协调、健康发展的良好势头。三、加强窗口指导和信贷政策引导，促进商业银行改善信贷结构2006年以来，中国人民银行认真贯彻落实党中央、国务院确定的“区别对待，有保有压”的宏观调控方针，加强信贷政策与产业政策的协调配合，有针对性地对商业银行加强“窗口指导”和风险提示，引导金融机构优化信贷结构，完善各项金融服务。,261.0
22,一是加强商业银行存贷期限错配预警监测分析，合理控制中长期贷款，扩大流动资金贷款。,40.0
23,二是鼓励和引导金融机构通过机制、体制和工具创新，进一步加大对“三农”的有效信贷投入，提高对农民工的金融服务水平。,56.0
24,三是积极引导金融机构加大对就业、助学、非公经济和中小企业等的支持力度。四、稳步推进金融企业改革国有商业银行股份制改革工作继续稳步推进。通过财务重组、内部改革和不断发展，中国银行、中国建设银行和中国工商银行的财务状况显著改善，盈利能力明显提高，公司治理不断完善，相对独立的内控体系和完善的风险防范体制初步形成。三家银行的资本充足率、净利润、净资产收益率等绩效指标稳步提升，不良贷款率继续保持较低水平。中国建设银行上市后，市场表现良好，并于2006年3月10日成为恒生中国企业指数成份股。中国银行积极推进发行上市各项准备工作，于2006年6月1日在香港上市。工商银行于2006年1月与战略投资者正式签署了战略投资和合作协议，战略合作项目进入实质性操作阶段。中国农业银行股份制改革方案正在积极研究之中。农村信用社改革试点工作取得了重要进展和阶段性成果。,373.0
25,一是逐步落实各项扶持政策，化解历史包袱。截至2006年3月末，中国人民银行会同中国银行业监督管理委员会（以下简称银监会）按照规定条件和程序严格审查考核，已完成9期农村信用社改革试点专项票据的发行工作，共计对2355个县（市）发行专项票据1649亿元，对吉林、陕西农村信用社发放专项借款2.6亿元。专项票据发行和专项借款发放共计占核定资金支持总额的99。根据监管部门提供的数据，考虑专项票据置换因素，全国农村信用社不良贷款比例为13.5，比2002年末下降23.4个百分点。全国农村信用社、农村合作银行、农村商业银行资本充足率分别提高到7.43、12.32、8.44。,283.0
26,二是不断增加支农信贷投放，支持“三农”发展。2006年3月末，全国农村信用社农业贷款余额11668亿元，占其各项贷款的比例由2002年末的40提高到49；农村信用社农业贷款占全国金融机构农业贷款的比例由2002年末的81提高到91。,116.0
27,三是稳步推进产权制度改革，转换经营机制。部分农村信用社在加强内部管理、强化信息披露、完善法人治理结构方面进行了有益的探索，形成了一些好的经验和做法。,74.0
28,四是将农村信用社管理和风险责任移交省级政府。目前，25个省（区、市）的省级联社，北京农村商业银行、上海农村商业银行、天津农村合作银行等省级管理机构相继成立，新疆自治区农村信用联社也即将挂牌，地方政府的管理职责初步得到明确。五、继续推出人民币汇率形成机制改革配套措施2005年7月21日，我国开始实行以市场供求为基础、参考一篮子货币进行调节的有管理的浮动汇率制度。为配合人民币汇率形成机制改革的实施，中国人民银行按照主动性、可控性、渐进性的原则，继续推出进一步完善和发展我国外汇市场的改革配套措施：一是完善外汇市场体系，在银行间即期外汇市场引入做市商制度和询价交易方式，改进人民币汇率中间价形成方式。,299.0
29,二是推出人民币外汇掉期交易和人民币利率互换试点，丰富外汇市场产品，健全我国金融衍生产品的定价机制。,49.0
30,三是继续扩大外汇市场成员，丰富市场结构，目前境内银行间人民币远期市场已包括64家会员银行。,45.0
31,四是建立央行外汇一级交易商制度，保证央行外汇公开市场操作的安全性和有效性，增强外汇公开市场操作的市场化程度。,54.0
32,"五是加强外汇市场的基础性建设，为市场参与者提供更多的外汇交易产品，促进金融机构提高自主定价和风险管理能力。专栏1：进一步完善银行间即期外汇市场为完善以市场供求为基础、参考一篮子货币进行调节、有管理的浮动汇率制度，促进外汇市场发展，丰富外汇交易方式，提高金融机构自主定价能力，2006年1月4日,中国人民银行发布《关于进一步完善银行间即期外汇市场的公告》（银发［2006］第1号），在我国银行间即期外汇市场引入做市商制度和询价交易方式（OverTheCounter，简称OTC方式）。做市商制度是国际成熟场外市场中普遍采用的一种市场交易制度，它是指在一定监管体系下，部分实力雄厚、信誉度较高的市场成员持有一定的交易标的存货，并以此承诺维持市场的双向买卖交易，这些维持双向买卖交易、承担市场出清义务的市场成员就是做市商。做市商制度具有活跃市场、稳定市场的功能，依靠其公开、有序、竞争性的报价驱动机制，保障交易的规范和效率。做市商制度是金融市场发展到一定阶段的必然产物，是提高市场流动性和稳定市场运行、规范发展市场的有效手段。",460.0
33,询价交易方式（OTC方式）是指交易主体以双边授信为基础，通过自主双边询价、双边清算进行交易的交易方式。询价交易方式是国际外汇市场上的基本制度。全球即期外汇市场的绝大部分交易量都集中在场外市场。外汇交易的国际性及外汇交易主体的广泛性、差异性决定了询价交易方式具有成本低、信用风险分散等优点。1994年外汇管理体制改革后，我国银行间外汇市场采用撮合竞价交易方式，并将日加权平均价作为下一工作日人民币汇率中间价。,203.0
34,自2005年7月21日新的人民币汇率形成机制开始实施起，银行间外汇市场仍采用撮合竞价交易方式，但将每日银行间外汇市场最后5笔交易加权平均价作为收盘价，并以此作为下一工作日人民币汇率中间价。2006年1月4日，中国人民银行在我国银行间即期外汇市场引入做市商制度和询价交易方式。考虑到中小金融机构在短期内获取授信存在一定困难，为满足中小金融机构的外汇交易需要，中国人民银行决定在银行间即期外汇市场保留撮合交易方式。由于交易方式的多元化，我国即期外汇市场呈现撮合市场和场外市场并存的格局，两个市场并存的格局决定了撮合市场成交价不再具有广泛的代表性，因此，将撮合市场收盘价作为下一工作日中间价的做法有必要得到相应的改进。另外，为进一步体现市场供求关系在人民币汇率形成机制中的基础性作用，提高金融机构的自主定价能力，中国人民银行决定参照国际上通行的基准利率、汇率的确定方式，将人民币兑美元汇率中间价的形成方式改进为：中国外汇交易中心于每日银行间外汇市场开盘前向所有银行间外汇市场做市商询价，当日人民币兑美元汇率中间价由全部做市商报价加权平均计算得出。,470.0
35,人民币兑欧元、日元和港币汇率中间价根据当日人民币兑美元汇率中间价与上午9时国际外汇市场欧元、日元和港币兑美元汇率套算确定。在新的人民币汇率中间价形成方式下，由于做市商向中国外汇交易中心报人民币汇率参考价前，主要基于对柜台结售汇情况、银行间市场外汇供求、自身头寸情况和国际外汇市场主要货币走势等因素的综合考虑，因此由做市商报价得出的中间价体现了“以市场供求为基础、参考一篮子货币”的人民币汇率制度框架。但由于做市商向中国外汇交易中心报出的人民币汇率参考价并不需要考虑信用风险、手续费等因素，且银行间外汇市场交易期间，国际外汇市场主要货币走势随时动态变化，因此银行间外汇市场人民币汇率和人民币汇率中间价会存在一定差异，体现为银行间外汇市场人民币汇率在规定的幅度内围绕中间价上下波动。在新市场框架下，我国银行间外汇市场中场外市场和撮合市场并存，由此决定了人民币汇率体系主要包括三个相互联系又有区别的概念，即人民币汇率中间价、场外市场汇率和撮合市场汇率。,423.0
36,三个价格之间主要存在以下关系：一是人民币汇率中间价对场外市场汇率和撮合市场汇率起指导作用，场外市场和撮合市场人民币汇率以当日中间价为基准，随着市场供求的变化在规定幅度内浮动。,87.0
37,二是场外市场汇率和撮合市场汇率之间存在较强的相关性，场外市场和撮合市场只是交易方式不同，市场间的套利行为使得二者联动明显。,61.0
38,"三是由于手续费和清算风险等因素的存在，场外市场汇率和撮合市场汇率之间通常会存在一定差异，场外市场的交易量大，因此，场外市场的人民币汇率水平更能反映外汇市场供求关系的变化情况，场外市场人民币汇率较撮合市场人民币汇率更具代表性。新市场机制推出以来，银行间即期外汇市场运行平稳，场外市场交易日益活跃，人民币汇率弹性显著增强。从交易量看，新市场机制推出伊始，场外市场交易量就远远超过撮合市场，目前场外市场交易量是撮合市场交易量的30倍左右，且场外市场交易量占比呈继续扩大态势。从价格传导机制看，各做市商报价逐步趋同，场外市场、撮合市场和柜台结售汇市场之间价格传导顺畅。专栏2：外汇一级交易商制度中国人民银行于2006年1月4日在银行间即期外汇市场推出询价交易（OTC）方式,并引入做市商制度。",342.0
39,新市场框架虽然继续保留撮合交易方式，但场外市场是外汇市场的主体，主要由做市商向市场提供流动性。与外汇市场交易方式的转变相适应，中央银行的外汇公开市场操作方式也要相应转变。在外汇市场以撮合为主的市场模式下，市场成员通过匿名集中竞价方式交易，外汇交易中心承担市场成员的清算风险。当汇率剧烈波动时，央行可在撮合市场进行外汇公开市场操作；在外汇市场以OTC为主的市场模式下，市场成员主要在双边授信的基础上，通过双边询价、双边清算进行外汇交易，中央银行进行外汇公开市场操作不但需要考虑交易对手的价格传导能力，市场信息的收集和反馈能力，还需考虑其信用风险状况。发达国家中央银行（美联储和欧洲央行等）外汇公开市场操作的一般做法是选择信用状况好、承诺向央行及时报告信息的金融机构作为外汇交易对手，也称外汇一级交易商，以保证央行公开市场外汇操作的安全性和效率。,371.0
40,而且，从维护各国中央银行外汇公开市场操作的有效性出发，尽管有的中央银行会公布外汇一级交易商的准入标准，但所有的中央银行均不公布外汇一级交易商的名单。借鉴发达国家央行外汇公开市场操作的成熟做法，适应中国外汇市场结构的变化，中国人民银行决定建立外汇一级交易商制度，并公布《外汇一级交易商准入指引》。根据《外汇一级交易商准入指引》，凡具备外汇市场做市能力的外汇指定银行，只要遵守有关经济、金融法律、法规和中国人民银行各项规定，符合监管当局的监管指标要求，且信用状况达到中国人民银行要求的标准，可向中国人民银行申请外汇一级交易商资格。中国人民银行根据申请人在银行间外汇市场交易的活跃程度以及市场信息的收集和分析能力，决定是否同意其成为外汇一级交易商。经中国人民银行指定的外汇一级交易商，在享有与央行交易权利的同时，需履行相应的义务，具体包括：在银行间外汇市场积极做市，保持市场价格平稳；按照诚实信用的原则与央行进行外汇交易，提供市场最优报价；与央行保持沟通，按要求及时报送有关信息等。,438.0
41,中国人民银行根据外汇一级交易商履行义务的情六、加快外汇管理体制改革，促进国际收支基本平衡一季度，围绕促进国际收支基本平衡的中心工作，加快了外汇管理体制改革，出台一系列政策措施：一是统一中外资银行短期外债管理口径和方式，从严控制短期外债过快增长势头。,124.0
42,加强对外汇资金流入的检查和非法外汇交易的打击力度。,25.0
43,二是进一步完善境外合格机构投资者制度。一季度，共批准合格境外机构投资者（QFII）投资额度3.25亿美元。,53.0
