,paragraph,length
44,三是对经常项目外汇账户等六项外汇管理政策进行调整。取消经常项目外汇账户开户事前审批，提高企业账户限额。简化服务贸易售付汇凭证并放宽审核权限，对居民个人购汇实行年度总额管理。拓展境内银行代客境外理财业务，允许符合条件的银行在一定额度内以购汇形式代理境内机构和个人投资境外固定收益类产品。允许基金管理公司等证券机构在一定额度内集中境内机构和个人的自有外汇开展境外证券投资，允许符合条件的保险公司在一定比例内购汇投资于境外固定收益类产品和货币市场工具。,223.0
45,货币市场流动性充足，交易活跃，短期债券收益率止跌回升，中长期债券收益率稳中趋降。金融市场产品创新不断推出，制度性建设取得较大进展。一、金融市场运行分析一季度，国内非金融机构部门（包括住户、企业和政府部门）融资结构变化明显，受年初企业债券特别是短期融资券继续快速发展影响，企业债融资比重明显上升，贷款和股票融资有所下降。一季度，国内非金融机构部门贷款、股票、国债和企业债融资之比为91.3:0.5:2.5:5.7。（一）货币市场交易活跃，季末利率有所上升受市场利率水平较低、金融机构流动性较充足等多种因素影响，一季度，银行间债券回购市场成交量明显增加，累计成交5.15万亿元，同比增加2.54万亿元，增长97.3。,306.0
46,其中主要是3月份质押式债券回购成交较多，当月成交2.37万亿元，月成交量首次超过2万亿元，占一季度债券全部回购量的46，同比增长1.1倍。交易所国债回购累计成交0.32万亿元，同比下降56.6。从质押式债券回购期限看，1、2月份隔夜品种市场份额与7天期品种相差不多，3月份隔夜品种的市场份额明显上升，当月为50，高于7天期品种9.6个百分点，资金运用短期化趋势增强。一季度，银行间同业拆借市场累计成交3810亿元，同比增加622亿元，增长19.5，是2004年二季度以来首次出现明显的正增长。成交品种主要集中在7天和隔夜两个短期品种上。,268.0
47,其中，隔夜品种的市场份额同比上升11.5，7天品种同比下降17.9。货币市场利率受春节因素和央行加大公开市场操作力度影响有所起伏。1月，受春节因素影响，质押式债券回购和同业拆借加权平均利率分别升至1.74和1.88。2月份利率有所下降。3月下旬起，受市场利率上升预期增强和前一阶段央行加大公开市场操作力度以及金融机构贷款发放较多的滞后影响，市场利率有所回升。,179.0
48,"3月份质押式债券回购和同业拆借交易月加权平均利率分别为1.47和1.66，比2月份分别上升0.12和0.08个百分点。从资金净融出、融入情况看，回购（包括质押式和买断式）市场上，四大国有商业银行仍是最大的净融出部门，净融出资金为2.52万亿元，同比增加1.16万亿元；其他金融机构1净融入资金增长较快，同比增加1.02万亿元。同业拆借市场上,四大国有商业银行和其他商业银行2分别净融出资金602亿元和1116亿元，四大国有商业银行同比少融出240亿元，其他商业银行同比多融出201亿元。其他金融机构净融入资金1232亿元，是主要的资金净融入部门，其中证券公司净融入资金730亿元。外资金融机构净融入资金486亿元，同比增加173亿元。",317.0
49,（二）债券市场规模明显扩大一季度，银行间债券市场现券交易累计成交2.3万亿元，同比增加1.33万亿元，创季度成交量历史最高水平，日均成交384亿元，同比增长1.4倍；交易所国债现券成交512亿元，同比减少198亿元。,108.0
50,银行间现券市场上，净买入方的四大国有商业银行买入量是2005年同期的23倍，增加较多。其他商业银行净卖出较多，证券及基金公司、保险公司和外资金融机构由上年净买入转为净卖出，资金需求明显增加。银行间市场与交易所市场的债券指数均呈稳步上升趋势。银行间债券指数由年初的113.42点上升至3月末的114.91点，上升1.49点，升幅1.31；交易所国债指数由年初的109.19点上升至3月末的110.11点，上升0.92点，升幅0.84。国债收益率曲线扁平化趋势进一步明显。,234.0
51,一季度，银行间债券市场短期债券收益率略有上升，而中长期债券收益率总体呈下降趋势，收益率曲线的总体趋势可分为两个阶段：第一阶段为1月份的整体下移阶段，由于债券市场持续去年年底价格走高趋势，各期限债券到期收益率普遍下降，收益率曲线延续2005年底变化趋势，继续呈现一定幅度的整体下移；第二阶段为2月份至3月末的扁平化趋势阶段，随着短期债券价格稳步回落，短期债券收益率不断上升，而中长期债券价格继续走高，中长期债券收益率稳步下降，收益率曲线呈现扁平化趋势。,225.0
52,一季度，债券市场累计发行各类债券3162亿元，同比增加1053亿元，增长49.9。其中，国债发行1600亿元，同比增加650亿元，增长68.4；政策性金融债发行692亿元，同比减少108亿元，下降13.5；企业债（包括企业短期融资券600亿元）发行820亿元，同比增加800亿元。2006年是国债由增量管理转为余额管理的第一年。实行国债余额管理，发行短期国债，可以降低财政利息支出，为中央银行公开市场操作提供良好工具，同时有利于金融机构的市场定价，形成一个完整有效的短期国债收益率曲线。受居民通胀预期下降、市场流动性较多等因素影响，一季度债券发行利率明显下行。,280.0
53,2月份发行的7年期记账式国债第1期利率为2.51，比上年5月份发行的记账式国债第5期低0.86个百分点，比上年11月份发行的记账式国债第13期低0.5个百分点；3月份发行的凭证式1期国债的发行利率也明显低于上年同期和上年4季度水平；2月份发行的10年期国家开发银行固定利率债券第1期利率为3.01，比上年9月份发行的第19期固定利率债券低0.41个百分点。,178.0
54,（三）票据市场继续快速发展一季度，企业累计签发商业汇票1.38万亿元，同比增长35；累计贴现2.28万亿元，同比增长68；累计办理再贴现0.1亿元，同比减少14.73亿元。一季度末，商业汇票未到期金额2.34万亿元，同比增长51；贴现余额1.93万亿元，同比增长72；再贴现余额1.35亿元，同比减少22亿元。专栏3：票据融资业务快速发展的原因及影响近年来，以商业汇票为主体的票据融资业务快速发展，无论是业务规模和参与主体，还是交易方式和组织体系等都发生了显著变化。商业汇票已成为重要的信用工具和短期直接融资方式。2000年以来，商业汇票年累计签发量和期末未到期金额年均增幅超过40；票据贴现量和贴现余额年均增幅超过60。,311.0
55,票据融资相当于贷款的比重，以及新增票据融资相当于新增贷款的比重逐年稳步上升。从市场份额看，鉴于各商业银行经营战略、资产负债结构及其客户群体等方面的差异，票据二级市场（贴现、转贴现）由四大国有商业银行主导；中小商业银行及其他存款类机构在一级市场（承兑授信）上所占份额较高。随着业务规模扩大和所占融资总量比例提高，票据融资的作用和影响逐步增强：首先，票据融资已成为重要的短期融资渠道，出现短期贷款票据化的趋势。票据融资的财务成本较低，审批程序相对简单，为企业提供了比传统银行贷款更为方便灵活的短期融资方式，在一定程度上缓解了中小企业融资难问题。第二，票据业务的发展促进了商业银行资产结构调整和流动性管理。,300.0
56,通过大力开发票据业务，各商业银行增强了资产结构调整的主动性和灵活性，缓解了资产负债期限结构错配问题；降低了超额储备需求水平，改善系统流动性管理；创新了服务方式，带动相关中间业务的发展；改善了商业银行长期以来经营收益主要依赖存贷利差的粗放经营模式，增强了盈利能力和竞争力。,135.0
57,第三，商业汇票的推广使用丰富了货币市场工具。近年来，票据市场的发展明显快于其它货币市场子市场，所占货币市场交易量的比重呈上升趋势。商业汇票的推广使用，对提高市场效率、丰富市场工具、深化货币市场发展发挥了积极作用。此外，从宏观层面看，发展票据融资业务有利于防范金融系统性风险，缓解间接融资压力。票据融资业务的快速发展是市场主体广泛参与、主动开拓的结果，是融资方式多样化的必然要求。,189.0
58,票据业务作为传统而实用的信用工具和融资方式，具有期限短、周转快、风险度低、成本收益稳定等特点，其较快发展具有比较扎实的市场基础。尤其是在现阶段直接融资渠道不畅、货币市场利率走低和商业银行竞争压力加大的情况下，企业和商业银行关注和运用票据融资业务有其必然性和合理（四）股票市场成交活跃受国民经济形势良好、股权分置改革取得重大进展等因素影响，股票市场信心明显增强，成交活跃，指数明显回升。一季度，沪、深股市累计成交1.12万亿元，同比增加4492亿元；日均成交200亿元，同比增长67，季度日均成交量创2004年二季度以来最高水平。一季度，上证综指和深证综指分别在3月份最高升至1313点和327点，是2005年4月份以来的最高水平。3月末，上证综指和深证综指分别收于1298和323点，比上年末分别上升11.8和16，市场信心明显增强。,367.0
59,一季度，企业在境内外股票市场上通过发行、增发和配股累计筹资71.7亿元，同比增加7.5亿元，增长11.7，全部为H股筹资，而上年同期则以A股筹资为主。证券投资基金继续较快增长。3月末，证券投资基金总数为229只，比上年底增加11只。基金总规模4768亿元，同比增长21.5；总资产净值5016亿元，同比增长30.2。（五）保费收入稳步增长，资金运用进一步多元化一季度，保险业累计实现保费收入1601亿元，同比增长8.4。,210.0
60,累计赔款、给付319亿元，同比增长23.1。3月末，保险公司总资产达1.64万亿元，同比增长24.7，继续保持较快的增长速度。随着保险业投资渠道的逐步扩大和债券市场的快速发展，保险公司资产运用明显多元化，其他投资(包括金融债券、企业债券、股票投资等)占总资产比重28.2，同比增加5.9个百分点；银行存款占总资产比重33.5，同比下降4.4个百分点。（六）银行间外汇市场货币对交易较为活跃银行间外汇市场“货币对”交易日趋活跃。一季度银行间外汇市场八种“货币对”累计成交折合181亿美元，成交品种主要为美元/港币、美元/日元和欧元/美元，成交量合计占全部成交量的比重为88.1。,288.0
61,一季度，银行间外汇市场人民币远期交易累计成交34.2亿元。4月26日香港人民币无本金交易1年期远期外汇合约买入价为1美元兑7.705元人民币，贴水3170点，比2005年7月21日汇改当日的贴水点数缩小1680点，贴水点数比汇改前明显收窄。随着人民币汇率形成机制完善和汇率弹性增强，人民币单边升值预期弱化。二、金融市场制度性建设（一）大力加强金融市场基础性建设工作一是2006年1月17日，在银行间债券市场正式实现现券买卖、质押式回购以及买断式回购、债券远期交易事前控制的直通式处理，提高了市场运行效率，完善了风险控制手段。一季度，通过直通式处理方式的结算金额共计74856亿元，占全部结算金额的97。,301.0
62,二是2006年2月，中国人民银行授权全国银行间同业拆借中心每日发布回购定盘利率。回购定盘利率的推出对于增强银行间债券市场价格发现功能，完善市场收益率曲线以及推动金融衍生产品的发展将起到积极作用。,97.0
63,三是2006年3月，中国人民银行发布《信用评级管理指导意见》，对信用评级机构的工作制度和内部管理制度、信用评级原则、信用评级工作程序进行规范和指导，完善市场约束机制。（二）积极推动产品创新，丰富市场交易品种及交易工具一是开展利率互换交易试点，满足市场投资者利率风险管理及资产负债管理的迫切需要。截至2006年3月末，已有18家金融机构按照《中国人民银行关于开展人民币利率互换交易试点有关事宜的通知》要求，将互换交易风险管理制度和内部控制制度予以备案。人民币利率互换交易名义本金总额达到95.1亿元。,249.0
64,二是积极引入公司债券、资产支持证券在银行间市场交易流通。一季度，共有28只公司债券进入银行间债券市场交易流通，流通规模为468.84亿元。,69.0
65,三是逐步扩大企业短期融资券、一般性金融债券发行规模，促进债券远期交易增长。一季度，债券远期交易量达到340.9亿元。（三）积极稳妥地推进股权分置改革和证券公司的重组工作一季度，共推出10批347家股权分置改革公司，股权分置改革速度明显加快。截至3月底，沪深两市共有26批768家上市公司完成或进入了股权分置改革程序，占应改革A股上市公司的57%。根据国务院的统一部署，按照“标本兼治，重在治本”的原则，中国人民银行会同有关部门继续推进有重组价值、社会影响较大的证券公司的重组工作。,240.0
66,一季度，中国人民银行和证监会会同山东省人民政府、重庆市人民政府分别对天同证券和西南证券进行了重组，在解决证券公司资本金不足、流动性困难等财务问题的同时，着力于促进证券公司转换经营机制，建立符合现代企业制度的公司治理结构和严密的内控机制，加强证券公司的制度建设和创新。,133.0
67,（四）积极推进保险市场发展拓宽保险资金运用渠道，规范保险资金投资。中国保险监督管理委员会（以下简称保监会）发布《保险资金间接投资基础设施项目试点管理办法》，对保险机构投资基础设施项目的投资方式、投资项目范围、投资规模和比例、资质条件以及风险监控等方式进行了规范。完善相关规章制度，加强保险市场制度建设。,151.0
68,一是保监会发布《关于规范保险公司治理结构的指导意见（试行）》，通过强化股东义务、加强董事会建设、发挥监事会作用、规范管理层运作、加强关联交易和信息披露管理、治理结构监管等方面的要求，完善保险公司治理结构，全面提升全行业公司治理结构的整体水平，切实防范经营风险，保护被保险人、投资者及其它利益相关者的合法权益。,154.0
69,二是保监会发布《寿险公司非现场监管规程（试行）》，建立寿险公司非现场监管制度，规范非现场监管工作流程，设立非现场监管操作标准，以提高监管的效率和有效性，增强监管工作的计划性和系统性。美国经济强劲增长，欧元区经济持续复苏，日本经济稳步回升，主要发展中国家继续保持强劲增长势头。国际原油价格持续高位运行，贸易保护主义抬头和全球经济失衡仍是影响全球经济增长的主要风险。国际货币基金组织2006年4月预计，2006年全球经济增长4.9，比2005年9月的预测调高0.6个百分点；其中美国、欧元区和日本经济分别增长3.4、2.0和2.8，比2005年9月的预测分别调高了0.2、0.2和0.8个百分点。（一）主要经济体经济状况美国经济强劲增长。,317.0
70,一季度，季节调整后的GDP环比折年率增长5.3。就业状况持续改善，1－3月份失业率分别为4.7、4.8和4.7，明显低于2005年同期水平。受国际油价上涨影响，通货膨胀压力有所增加，一季度消费价格指数（CPI）同比上涨3.7，比上年同期增加0.7个百分点。商品和服务贸易逆差继续扩大，1－3月份达1962亿美元，较上年同期增加241.1亿美元。欧元区经济持续复苏。,182.0
71,一季度，GDP同比增长2.0。就业状况有所改善，1－3月份失业率分别为8.2、8.2和8.1，仍处高位。通货膨胀压力依然存在，综合消费价格指数（HICP）月均同比上涨2.3，高于上年同期2.0的水平，其中1－3月份同比分别上升2.4、2.3和2.2。一季度，贸易逆差为116亿欧元，而上年同期为58亿欧元顺差。日本经济稳步回升。,164.0
72,一季度，GDP同比增长3.1。失业率呈下降趋势，月均同比上涨4.2，比上年同期下降0.4个百分点，其中1－3月失业率分别为4.5、4.1和4.1。一季度CPI同比上涨0.4，而上年同期为-0.2，其中1－3月份CPI同比分别上涨0.5、0.4和0.3。扣除生鲜食品的核心CPI各月同比均上涨0.5。一季度，贸易顺差为1.56万亿日元。,167.0
73,主要新兴市场和发展中国家（地区）继续保持强劲增长势头。亚洲的中国香港、印度、新加坡、印度尼西亚和拉美地区的阿根廷、智利、哥伦比亚、秘鲁和委内瑞拉等经济体均取得较快的增长。初级商品价格上涨使俄罗斯以及中东的部分国家受益。险等问题将加剧不稳定性并进一步恶化全球经济的脆弱性，各方应承担起责任，实施必要的政策，加快结构调整，化解风险。一、全球经济失衡的基本表现2005年2月，国际货币基金组织总裁拉托在题为“纠正全球失衡——避免相互指责”的演讲中对“全球失衡”进行了概括：失衡现象是指一国拥有巨额贸易赤字，而与该国贸易赤字相对应的贸易盈余则集中在其他少数国家。,277.0
74,当前全球经济失衡的基本表现是，美国贸易赤字庞大、债务增长迅速，而日本、中国、亚洲其他主要新兴市场国家等对美国持有大量贸易盈余。作为失衡的一方，美国2005年贸易赤字总额达到了空前的7257亿美元，占其GDP的比率由10年前的1.2骤升至5.8。而作为失衡的另一方，日本、中国等亚洲国家、主要石油出口国及部分欧洲国家的贸易顺差则达到1000亿美元的规模。其中我国尤受关注，2005年我国贸易顺差达1019亿美元，特别是对美国的贸易顺差达1142亿美元。二、全球经济失衡的原因分析对于全球经济失衡现象及我国贸易不平衡问题产生的原因，可从两种角度加以分析，一是贸易视角，二是储蓄视角。,289.0
75,从贸易视角看，国际贸易不平衡产生的重要原因是近年来全球分工格局调整过程中跨国外包与供应链重组的加速发展。劳动密集型生产和服务通常率先外包到劳动力成本较低的中国、印度等国；发达国家感受到压力，转而生产更高档次的产品或提供服务，以期创造新的就业机会和新的出口优势，但这一过程往往滞后一段时间。在这一阶段，贸易不平衡会扩大。此外，贸易不平衡还涉及各国贸易、汇率政策等多种因素。中国贸易顺差的形成在很大程度上反映了国际分工和贸易格局的变化：一是加工贸易成为中国贸易顺差的主要来源。,236.0
76,2005年，加工贸易进出口占进出口总值的比例达到49，加工贸易顺差达1425亿美元。,42.0
77,"二是外国直接投资在跨国外包和改变贸易平衡中发挥了很大作用。中国形成了以外资企业为主的加工贸易基地，且供应链不断延长，附加值不断提高。外国直接投资企业在中国的生产和销售大幅增加，其产品部分替代了中国的进口。还应该看到，中国在对美国有较大贸易顺差的同时，对亚洲一些国家和地区有较大逆差，中美贸易不平衡实际上是亚洲与美国贸易不平衡的集中体现或结果。从储蓄视角看，根据“储蓄缺口=贸易缺口”的宏观经济恒等式，全球失衡问题可以用储蓄缺口联系起来，即：美国贸易逆差=美国储蓄负缺口=其他地区储蓄缺口=其他地区贸易顺差。其中，储蓄缺口指储蓄与投资之差,贸易缺口指出口与进口之差。中国及亚洲一些国家有着非常高的储蓄率，过多的储蓄没有全部转化为投资，对应为贸易顺差。中国储蓄率较高可能有多种原因。",339.0
78,一是与转轨因素有关，包括社会保障体系改革、教育体制改革、住房制度改革等，在社会上暂时产生了不确定性，影响了居民的消费信心，从而增加了当前的储蓄倾向。,74.0
79,二是与社会、文化传统有重要关系。包括中国在内的某些信奉儒家文化的亚洲国家由于崇尚节俭等原因会形成较高的储蓄率。,55.0
80,三是与人口结构特性有关。例如，受计划生育政策、生育观念变化等影响，子女数量普遍减少，人们的行为模式从“养儿防老”转向增加自身储蓄作为养老之需。在储蓄率较高的情况下，随着国内投资边际收益率的降低，储蓄资金会倾向于投资到国外，寻找更好的投资机会，包括官方和民间的对外投资。日本和欧洲一些国家由于长期结构性原因也存在储蓄过剩的问题，因此对美国也有较大贸易顺差。作为全球失衡的核心，美国巨额贸易赤字则对应着其总体储蓄的空前萎缩。,210.0
81,不仅个人储蓄率降至零以下，政府财政赤字也不断膨胀。美国经济是以消费为主的经济，过去几年这一倾向在扩张性的货币政策刺激下进一步加强。美国利率水平在2004年中降到1的历史低位，消费占GDP的比例则从2000年的68上升到2005年的70以上，并且更多地建立在借贷的基础上。同时，美国的财政政策也强化了储蓄率下降的趋势。2000年以来，美国维持扩张性的财政政策，财政赤字占GDP的比例在2004年达到4。,200.0
82,由于美国过度消费，国内储蓄短缺，不得不引入国外过剩储蓄，从而造成了巨额贸易赤字。三、调整全球经济失衡的政策措施全球经济失衡从长期来看是不可持续的，一旦发生无序调整，就会对全球经济增长和金融市场稳定构成重大威胁。因此，解决全球经济失衡问题已经成为各主要经济体政策制定者的共识。由于全球经济失衡涉及到复杂的结构性因素和多层面的相互关联，因此调整全球经济失衡要充分考虑各方所应承担的责任。提高美国的储蓄率、加快日本和欧洲的结构改革、健全发展中国家的经济金融体系，三者缺一不可。,235.0
83,其中，采取有助于提高美国储蓄率的政策起着最为关键的作用。中国政府已开始采用扩大内需、降低储蓄率、增加进口、开放市场以及改革汇率形成机制等综合政策措施来促进国际收支平衡。扩大内需方面，采取了包括减税、增加居民收入、加快农村基础设施建设和鼓励金融机构拓展面向居民个人的信贷业务等各项政策措施。降低储蓄率方面，采取了加快养老体制、医疗体制、教育体制改革和发展住房抵押贷款等措施。通过这些组合措施，中国经济的发展将更多地依靠内需，减少对出口的依赖，促进了中国经济和世界经济更为平衡地发展。,240.0
84,（二）国际金融市场概况美元相对其他主要货币总体走弱。3月31日，欧元兑美元、美元兑日元和英镑兑美元汇率分别收于1.21、117.66、1.74，美元对欧元、日元和英镑较2005年末分别贬值2.34、0.22和0.98。国际主要债券市场收益率普遍出现上升，但总体仍保持在较低水平。3月31日，美国、欧元区和日本的10年期国债收益率分别收于4.85、3.77和1.77，较2005年末分别提高0.46、0.47和0.30个百分点。全球股市在波动中呈现出不同程度的上升势头。,234.0
85,3月31日，美国道·琼斯工业平均指数和纳斯达克指数分别收于11109.32点和2339.79点，较2005年末分别上涨3.66和6.10；英国金融时报100指数收于5964.60点，较2005年末上涨6.15；欧元区STOXX50指数收于3507.13点，较2005年末上涨2.0；日经225指数收于17059.66点，较2005年末上涨5.89。,174.0
