,paragraph,length
38,9月末，7天期、3个月期和1年期Shibor分别为1.9878%、3.8534%和4.0554%，分别比年初上升46、105和105个基点。前三季度，综合回购与拆借市场，国有商业银行和其他商业银行仍是市场上的资金净融出主体，其他金融机构和外资金融机构是资金净融入主体。外资金融机构由于贷款快速扩张等因素，在回购和拆借两个市场上的资金需求都很旺盛，净融入资金均是上年同期的3.4倍。（二）现券交易活跃，债券发行利率逐步上升受国民经济继续平稳快速增长和资本市场活跃影响，现券交易活跃。前三季度，银行间债券市场现券交易累计成交10.5万亿元，日均成交557亿元，同比增长36.3%，日均成交量为历史同期最高水平。,303.0
39,交易所国债现券成交925亿元。在银行间现券市场上，国有商业银行是主要的净买入方，净买入现券4407亿元，同比下降9.2%。净卖出方主要是其他商业银行和证券及基金公司，其他商业银行净卖出现券同比增长19.1%。债券市场金融创新产品规模稳步扩大。商业银行直接融资规模进一步扩大。,137.0
40,9月末，商业银行未到期一般金融债券余额为1035亿元。前三季度，商业银行累计发行次级债券、混合资本债券305亿元，9月末，未到期余额为2278亿元，对于补充商业银行资本，提高资本充足率水平起到了积极作用。短期融资券市场继续保持快速发展。前三季度，企业短期融资券共发行204只，合计发行面额为2581亿元，同比增长19.5%，9月末未到期余额为2983.7亿元。9月26日，在交易所市场成功发行了第一只公司债（中国长江电力股份有限公司2007年第一期公司债券），金额为40亿元人民币。,241.0
41,银行间债券市场国债收益率曲线总体上行。具体来看，1-7月份，银行间市场债券价格逐步回落，各期限债券收益率均呈上升趋势，收益率曲线总体上行增陡；8月份前后，短期收益率略有上升，中长期收益率下降，收益率曲线总体呈现平坦化趋势；进入9月份，各期限债券收益率均有所上升。债券发行利率逐步走高，市场融资成本不断上升。受通胀预期及系列金融宏观调控措施实施特别是上调存贷款基准利率等因素影响，2007年8月份发行的7年期记账式国债利率为3.9%，比5月份和2月份分别上升0.16和0.97个百分点；政策性银行9月份发行的5年期固定利率债券利率为4.55%，比1月份、4月份、6月份分别上升1.05、0.99和0.55个百分点；中央企业债10年期利率9月份为5.3%，比5月份和6月份分别上升0.82和0.47个百分点。Shibor成为中长期企业债券定价的主要参考指标。,377.0
42,前三季度，657亿元的企业债以1年期Shibor为基准实行市场化定价发行，占发行的全部中长期债券的92.6%。企业债发行利率逐步上升。9月份，10年期企业债券发行利率在1年期Shibor的基础上加144～178个基点，票面利率为5.2%～5.7%，比年初提高110个基点。（三）票据融资增幅趋缓前三季度，票据业务增长速度放缓，票据贴现余额呈下降趋势。截至9月末，企业累计签发商业汇票4.5万亿元，同比增长11.1%；累计贴现8万亿元，同比增长23.7%。,227.0
43,期末商业汇票未到期金额2.6万亿元，同比增长16.5%；贴现余额1.6万亿元，同比下降10.4%。随着宏观调控力度加大，部分中小金融机构的流动性趋紧，办理再贴现的需求增强。前三季度累计办理再贴现92.3亿元，同比增加65.4亿元；9月末再贴现余额56.1亿元，同比增加34.7亿元。（四）股票市场交易活跃，股指上涨强劲股权分置改革的积极效应继续显现，股票市场交易活跃，投资者投资股票和基金市场意愿较强。前三季度，新增投资者开户数4761万户，是上年全年新增开户数的9倍；市场交易量价屡创新高，沪、深股市累计成交37.1万亿元，同比多成交31.3万亿元，已相当于上年全年交易量的4.1倍；日均成交2039亿元，同比增长5.4倍。,313.0
44,股票市场指数时有调整，但总体呈现较快上涨态势。9月末，上证、深证综合指数分别达到5552点和1533点，比上年末增长107%和178%，为历史最高水平。沪市A股平均市盈率高达64倍，而2006年末和2005年末分别为33倍和17倍。股票市场融资功能明显提升。前三季度，企业（含金融企业）在股票市场上通过发行、增发和配股累计筹资5346亿元，是历史同期最高水平，同比增长1.5倍；主要是A股筹资增加较多，A股发行（含增发）筹资4655亿元，同比增长4.4倍，H股筹资80.9亿美元。,240.0
45,基金市场呈现快速发展态势。受股票市场指数较快上扬和投资者对基金认可度提高等影响，市场对基金理财需求明显上升。前三季度，新增证券投资基金40只，基金总规模增加13288亿份，同比多增13447亿份。9月末，基金总资产净值3.1万亿元，同比增长584.1%，增速比上年同期提高569个百分点。（五）保险业总资产快速增长，投资类资产在资产运用中占比超过六成保费收入和保险业总资产继续快速增长。,193.0
46,前三季度，保险业累计实现保费收入5328亿元，同比增长23.6%，其中财产险收入同比增长35.9%。受寿险产品集中到期影响，保险业赔款、给付增加较多，累计赔款、给付1643亿元，增长68.1%，其中寿险支出814亿元，是上年同期的2.8倍。9月末，保险业总资产达到2.8万亿元，同比增长54.5%。随着保险业加强资金运用管理，资金运用结构变化明显。前三季度，投资类资产增速上升明显，同比增长66.6%，特别是股票、证券投资基金投资快速增长。,220.0
47,（六）银行间外汇市场运行平稳，人民币掉期交易持续活跃银行间即期外汇市场运行平稳，询价市场的主导地位进一步突出。掉期交易量大大超过远期交易量，呈快速增长态势。前三季度，人民币掉期市场共成交2340亿美元，是2006年成交量总和的4.6倍。银行间远期市场共成交150亿美元，同比增长32%，主要成交品种为美元/人民币。外汇市场会员进一步扩大。,169.0
48,9月末，银行间外汇市场即期、远期和掉期市场会员银行分别为269家、80家和75家。外币对交易量有所增长。前三季度，八种“货币对”累计成交折合709亿美元，增长8%，成交品种主要为美元/港币、美元/日元和欧元/美元，成交量合计占全部成交量的78%，同比下降4个百分点，主要是美元/港币成交量占比下降较多。二、金融市场制度性建设（一）加强金融市场自律性管理中国银行间市场交易商协会，作为银行间债券市场、拆借市场、票据市场、外汇市场和黄金市场参与者共同的自律组织，于2007年9月3日成立。中国银行间市场交易商协会的成立，有助于充分动员市场参与者自身的力量进行自律性管理，有助于政府部门转变职能，有助于市场管理更加贴近市场需求，通过市场化方式更好地促进市场的创新和发展。,332.0
49,（二）进一步丰富金融衍生产品一是在银行间债券市场推出远期利率协议业务，为投资者提供更多管理利率风险的工具，有利于促进市场稳定，提高市场效率，促进市场的价格发现，为中央银行的货币政策操作提供参考。,97.0
50,二是在银行间外汇市场推出人民币外汇货币掉期产品，现阶段掉期交易品种包括人民币兑美元、欧元、日元、港币、英镑五个货币对的交易。新产品的推出进一步丰富了银行间外汇市场交易品种，有利于进一步增强银行间外汇市场的市场化程度，能更好地满足各市场主体规避汇率风险的需要。（三）扩大信贷资产证券化试点一是规范信息披露行为。要求受托机构、发起机构和其他证券化服务机构严格按照相关要求做好基础资产池的信息披露工作，并对涉及基础资产池信息披露的内容、投资者在资产支持证券发行期限内查阅基础资产池全部具体信息的途径和方法等作了具体规定和要求。,260.0
51,二是提高资产支持证券的流动性，允许资产支持证券在全国银行间债券市场进行质押式回购交易。（四）适应股份全流通后股票市场的新情况，进一步加强市场监管方面的基础性制度建设一是试行《内部交易认定办法》和《市场操纵认定办法》，进一步明确内幕交易和市场操纵行为的认定标准。相关规定细化了内幕人的认定，补充了内幕人、内幕信息的范围，对当然内幕人、法定内幕人、规定内幕人和其他途径获取内幕信息者的举证责任进行了合理划分。将一些典型的操纵手法，如虚假申报、抢先交易、蛊惑交易、特定交易、尾市交易操纵等行为纳入了认定范围。相关规定的试行有利于提高对内幕交易和市场操纵行为的查处效率，增强对相关行为人的威慑力。,294.0
52,二是出台一系列涉及上市公司并购重组和非公开发行的法规，针对上市公司并购重组过程中可能出现的内幕交易等违法违规行为，进一步强化了上市公司和相关各方的信息披露要求，加大了对虚假信息披露和内幕交易等违法犯罪行为的打击力度，有利于进一步营造良好的市场秩序，优化上市公司结构、提高上市公司质量。,142.0
53,三是初步建立股票、股指期货跨市场监管协作制度。8月13日，上海证券交易所、深圳证券交易所、中国金融期货交易所、中国证券登记结算公司和中国期货保证金监控中心公司五方在上海签署了股票市场和股指期货市场跨市场监管协作系列协议，标志着证券、期货监管跨市场监管协作制度的正式建立。协作主要内容包括构建信息交换机制、风险预警机制、共同风险控制机制和联合调查机制等。监管协作制度的建立，有利于加强相关各方之间的联系和沟通，提高监管效率，在各自职责范围内及时采取有效的联合监管措施，防范并及时查处跨市场操纵、内幕交易等违法违规行为，确保股指期货交易的顺利推出和平稳运行。（五）强化保险市场监管制度一是完善保险机构资产管理。自7月25日开始，允许保险机构运用自有外汇或购汇进行境外投资。此举既有利于保险机构改善资产配置，分散风险，增加收益，提高竞争力，也有助于缓解人民币升值压力。,381.0
54,二是进一步加强了对保险公司资本保证金的管理，对保险公司提存、处置资本保证金等行为进行了规定。,46.0
55,三是加强保险公司合规管理，明确保险公司合规管理的制度、组织架构、责任等，要求保险公司有效识别并积极主动防范化解合规风险。这对于规范保险公司治理结构，加强保险公司风险管理，实现有效的内部控制具有重要意义。第四部分宏观经济分析一、世界经济金融形势分析2007年第三季度以来，全球经济整体保持平稳增长势头，但影响未来经济增长的风险加大，国际原油价格不断走高，通胀压力明显上升。受美国次级抵押贷款风波影响，全球主要股市和债市均经历较大波动。国际货币基金组织2007年10月预测，2007年全球经济增长率为5.2%，维持了其在2007年7月份的预测，但比2006年的实际经济增长率低0.2个百分点。,294.0
56,其中，2007年美国经济增长率从2.0%下调至1.9%，欧元区经济增长率从2.6%下调至2.5%，日本经济增长率从2.6%下调至2.0%，分别比2006年的实际经济增长率低1、0.3和0.2个百分点。新兴市场经济体仍维持强劲的增长势头。（一）主要经济体经济状况美国经济保持增长态势。第三季度，GDP季节调整后环比折年率增速为3.9%，比第一、二季度分别加快3.3和0.1个百分点。通货膨胀整体保持温和态势，第三季度各月同比CPI分别为2.4%、2.0%和2.8%，平均为2.4%，比第二季度下降0.3个百分点，与第一季度持平。,263.0
57,就业状况基本稳定，第三季度失业率为4.7%，比第一、二季度均上升0.2个百分点，但与上年同期持平。商品和服务贸易逆差有所下降，1—8月份为4718.5亿美元，同比减少456亿美元。财政赤字大幅减少，在9月30日结束的2007财年里，联邦政府预算赤字为1628亿美元，比2006财年下降34.4%，为近5年来最低。欧元区经济稳步增长。第一、二季度实际GDP同比增长分别为3.2%和2.5%。,194.0
58,通货膨胀压力依然存在，第三季度各月综合消费价格指数（HICP）同比上涨分别为1.8%、1.7%和2.1%，平均为1.9%，与第一、二季度持平。值得注意的是，由于能源和粮食价格持续上涨，9月HICP同比上涨为2.1%，这是自2006年9月以来欧元区HICP升幅首次高于欧央行设定的2.0%的通胀目标。就业状况持续改善，第三季度各月失业率分别为7.4%、7.4%和7.3%。出口增长较快，1-8月份贸易顺差为191亿欧元，而上年同期为逆差235亿欧元。日本经济持续增长。,233.0
59,第一、二季度实际GDP同比增长分别为2.6%和1.6%。价格走势基本平稳，第三季度各月CPI分别为0%、-0.2%和-0.2%，平均为-0.1%，和第一、二季度持平。就业形势整体呈好转趋势，第三季度各月失业率分别为3.6%、3.8%和4.0%，平均为3.8%，比第一季度下降0.2个百分点，与第二季度持平。贸易顺差继续大幅增加，三季度实现贸易顺差3万亿日元，同比增加9848亿日元。主要新兴市场经济体和发展中国家（地区）的经济增长依然相当强劲，但部分国家通胀压力明显上升。,236.0
60,拉美经济继续维持稳步增长态势。（二）国际金融市场概况各主要货币汇率波动相对平稳。美元相对欧元和日元呈贬值态势，9月28日收于1.43美元/欧元和114.79日元/美元，美元相对欧元和日元分别较年初贬值8.33%和3.58%，较第二季度末分别贬值5.93%和6.78%。国际主要债券收益率7、8月份持续走低，自9月初开始逐步回升。9月28日，美国和日本的10年期国债收益率分别收于4.59%和1.68%，较年初分别降低0.1和0.04个百分点，较第二季度末分别降低0.44和0.19个百分点；欧元区10年期国债收益率收于4.34%、较年初上涨0.4个百分点，较第二季度末下降0.22个百分点。,295.0
61,受美国次级抵押贷款风波影响，国际金融市场利率大幅波动。伦敦同业拆借市场美元Libor在波动中下降，一年期美元Libor于9月20日达到2006年以来的低点4.85%后有所回升，9月28日为4.9%，比年初下降0.43个百分点。受欧央行连续加息影响，欧元利率延续了2006年以来缓慢上升的态势，9月28日，欧元区一年期同业拆借利率Euribor升至4.73%，比年初上升0.7个百分点。全球主要股指波动较大。在经历了2月27日的大幅下跌后，全球主要股指逐步反弹走高。,232.0
62,但从7月中下旬起，受美国次级抵押贷款波动影响，全球主要股指开始持续下跌，美国道琼斯工业平均指数、纳斯达克指数、欧元区STOXX50指数、英国金融时报指数分别于8月末跌至当季最低点，而日经225指数则在9月18日跌至当季最低点。,113.0
63,在几大央行联手采取措施后，主要股指有所反弹。9月28日，美国道琼斯工业平均指数、纳斯达克指数分别收于13896点和2702点，较第二季度末分别上涨3.63%和3.80%；而欧元区STOXX50指数、英国金融时报指数、日经225指数分别收于3820点、6467点和16786点，较第二季度末分别下跌3.22%、2.13%和7.45%。（三）主要经济体房地产市场走势主要工业国家房价自1997年起总体呈快速上升态势，但近年来荷兰、澳大利亚、英国和美国等国的房价增速开始放缓。特别是随着美国次级抵押贷款市场问题的逐步显现并最终发生动荡，美国房地产市场的调整更加剧烈。但爱尔兰、法国、西班牙和瑞典等欧洲国家房价上涨依然十分迅速。,310.0
64,与美欧不同，由于日本土地价格持续走低，日本房价一直呈现负增长。随着美国次级抵押贷款市场问题的逐步显现，近期美国房地产市场降温明显。2007年第二季度，美国全国房价指数同比增长3.2%，为1997年第三季度以来的最小涨幅。受住房抵押贷款市场问题的拖累，9月份，美国新房开工数量、新房销售数量和待售新房数量季节调整后折年率分别为119.1万户、77万户和52.3万户，同比分别下降30.8%、23.3%和6.6%。欧洲部分国家房地产市场依然活跃。,221.0
65,尽管英国房价增速有所回落，但房价仍维持在较高水平。爱尔兰、西班牙、希腊等国房价上涨较快，2006年分别增长约12%、15%和14%，较2005年分别高出约2个、10个和8个百分点。与此同时，德国、葡萄牙房地产市场则停滞不前。日本土地价格持续走低，房价持续负增长。泡沫经济破灭后，日本土地价格一直在下降，2006年3月末和9月末，全国土地价格指数同比分别下跌4.8%和3.5%。,188.0
66,2007年以来，土地价格继续维持下降态势，截至3月末，全国土地价格指数同比下降2.1%。（四）主要经济体货币政策美联储公开市场委员会于8月17日和9月18日两次调低贴现率各50个基点至5.25%。同时，美联储公开市场委员会于9月18日和10月31日将联邦基金利率分别调低50和25个基点至4.5%。欧央行于7月5日、8月2日和9月6日均宣布保持4%的基准利率不变。日本银行在7月12日、8月23日和9月19日的例会上均决定维持0.5%的无担保隔夜拆借利率不变。,230.0
67,英格兰银行于7月5日加息25个基点，官方利率达到5.75%，并在8月2日和9月6日宣布维持该利率不变。（五）影响未来全球经济增长的主要风险未来全球经济增长依然面临着一些现实和潜在的风险，主要包括美国次级抵押贷款风波冲击全球金融市场、贸易保护主义趋势加强、国际原油价格持续走高、全球通货膨胀压力加大等。美国次级抵押贷款风波导致全球性金融市场震荡。由于流动性紧缩，私募基金、对冲基金、金融机构等难以筹集足够的资金进行并购活动，业绩良好的公司发债成本也有所提高。如果不能有效控制此次次级抵押贷款风波对金融市场和企业的连锁影响，实体经济部门的发展可能会受到影响，美国及世界经济未来增长的风险也将加大。,296.0
68,专栏1：关注美国次级抵押贷款风波的中期影响2007年4月，美国第二大次级抵押贷款公司新世纪金融公司濒临破产拉开了美国次级抵押贷款（以下简称“次贷”）风波的序幕。之后，美国次贷市场违约率不断提高，大量房贷机构特别是与美国次贷市场相关的基金陷入困境或破产，并由此引发了国际金融市场剧烈动荡。IMF等国际组织在10月份调低了2008年全球经济增长的预测值，并认为未来全球金融市场的不确定性有所加大，房地产市场疲软、信贷市场趋紧以及国际汇市波动加剧的状况将会持续一段时间。次贷风波的直接动因是美国房地产市场降温，但更深层次原因则是全球流动性过剩背景下市场约束力的下降。,280.0
69,一是长期的低利率政策导致全球风险偏好上升。全球过剩资本寻找高回报机会，刺激了房地产价格的上涨。在高房价、低利率环境下，金融机构从事高杠杆房贷风险小，收益高，导致其放宽房地产信贷标准，风险意识下降，使得信用等级较低的借款者也能便捷地获得贷款，次贷市场迅速膨胀。,129.0
70,二是对金融衍生产品的过度依赖和风险控制不当。近年来，房地产市场资产证券化迅猛发展，金融机构按照投资人和客户的需求对原有信用等级较低的信贷产品所隐含的风险进行分解或重组，经评级公司重新评级后打包出售，将信贷风险转移出去。这些产品的推出无形中鼓励了贷款者从关注贷款质量转向数量扩张。由于一些评级公司对该类产品的风险定价低估，误导了投资者，助长了市场对该类产品的过度乐观情绪，使房贷衍生产品在政府托管基金、养老金等保守型基金中广为销售，埋下了较大的风险隐患。,226.0
71,三是市场自律性下降与监管不当的共同作用。近年来，全球金融市场运行相对平稳，各国市场的自律性和对市场的监管力度有所下降。尽管当局在2004年初已开始关注贷款标准的放松问题，但由于监管协调困难和信息沟通不畅等种种原因一直未能有效实施监管，错过了调整时机。从目前情况看，美国次贷风波还会持续一定时间，对国际经济金融的影响不容小觑。当前，美国次贷风波的影响主要集中在美国和欧洲，对我国经济金融运行影响有限，但次贷风波可能通过其广泛的投资者、衍生品及影响市场预期和实体经济运行等多个渠道向其他地区蔓延。,246.0
72,全球风险溢价上升趋势也有可能对资产价格产生调整压力，而一旦资产价格出现调整，可能对银行信贷安全产生影响。因此，有必要密切关注美国次级抵押贷款市场对国际金融市场的影响及对我国可能产生的冲击，并采取措施加强风险防范工作，确保国家金融安全。近期中国人民银行与中国银行业监督管理委员会联合发出了《关于加强商业性房地产信贷管理的通知》，并颁布了《公告》，要求信贷资产证券化试点各参与机构加强信贷资产证券化基础资产池信息披露工作，切实保护投资者利益，防范风险，以维护投资者合法权益，推动信贷资产证券化业务的健康发展。同时，主要金融机构已开始着手调整房地产抵押贷款的放款条件。未来，中国人民银行将与各监管机构进一步加强信息沟通，密切关注相关市场动态，完善金融市场的透明度监管，逐步实施金融机构资本充足率监管的国际标准，金融机构也应大力加强风险控制机制建设，在稳步实施“走出去”战略的同时，提高自身风险定价和风险控制的能力。,404.0
73,2007年以来持续的全球失衡问题引发贸易保护主义倾向进一步增强。美国国会不断抛出汇率议案，向中国等国家施加压力；美国商务部不断发起对中国等国家的反补贴调查，并借助多边场合在有关问题上加大施压力度。美国的做法已经蔓延至其他国家，并引起效仿。这显示当前贸易摩擦已由产品层面延伸至政策层面，并且不断升级，有可能对世界经济的持续健康发展以及全球失衡的有序调整带来不利的影响。全球通货膨胀压力加大。,194.0
74,全球化一方面使越来越多的低廉劳动力等生产要素参与到全球分工链条之中，规模经济效应得以进一步发挥，供给能力显著增强，从而抑制了一般商品特别是可贸易商品的价格上涨；另一方面，全球化所带来的工业和经济的快速增长也造成了世界范围内的能源和大宗商品紧张，价格持续上扬；此外，全球流动性过剩进一步加剧了价格全面上涨的压力。,155.0
75,自2006年以来，石油、金属、粮食等初级产品市场价格上涨明显。虽然受美国“次贷”风波影响，2007年7月末国际有色金属价格从历史高位跌落，但铜、铅和锡等有色金属价格在9月中旬以后再度反弹。国际主要粮食品种价格快速上涨，小麦价格创历史新高，稻米和大豆价格也接近历史最高水平。近期，国际油价在波动中持续走高。11月上旬，纽约商品交易所的原油价格接近每桶100美元，不断刷新历史记录。,189.0
76,当前，世界经济增长形势较好，石油需求明显上升，而国际原油供给难以跟上需求的变化。如果地缘政治局势动荡，尤其是一些石油产品和出口国政治局势持续动荡，原油供给安全难以得到切实保障，油价可能进一步上涨。二、我国宏观经济运行分析2007年第三季度，我国国民经济继续平稳快速发展。三次产业均较快增长，经济效益继续提高，人民生活进一步改善。但进出口贸易顺差仍在扩大，居民消费价格继续上涨，国际收支持续失衡下的通货膨胀风险加大。,207.0
77,前三季度，实现国内生产总值（GDP）16.6万亿元，同比增长11.5%，比上年同期加快0.7个百分点，但与2007年上半年持平；CPI同比上涨4.1%，比上年同期提高2.9个百分点；累计顺差1857亿美元，比上年同期扩大758亿美元。,117.0
