,paragraph,length
40,总体来看，我国与美国的利率水平比较接近，部分利率品种还低于美国。目前欧元区银行间市场和商业银行存贷款利率总体高于我国。批发性质的欧元区银行间隔夜拆借利率为1.20%，较我国高0.38个百分点；3个月Euribor为2.05%，较我国高0.71个百分点。零售性质的商业银行对居民1年期存款利率为4.27%，较我国高2.02个百分点；对企业1年期贷款平均利率为6.04%，较我国的贷款平均利率6.23%略低0.19个百分点；10年以上个人住房贷款利率为5.27%，较我国个人住房贷款利率下限高1.11个百分点。四、适度发挥再贴现引导信贷资金投向、促进信贷结构调整的功能2008年，适应金融宏观调控取向的变化，中国人民银行进一步完善再贴现政策，适度发挥再贴现引导信贷资金投向和促进信贷结构调整的功能。,347.0
41,一是适时增加再贴现额度。上半年，对遭受严重雨雪冰冻灾害和地震灾害的省（区、市）及时安排增加再贴现额度共256亿元，用于解决受灾地区金融机构增加灾后恢复生产信贷投入的流动性2欧元区存贷款利率为2008年11月数据，我国贷款平均利率为2008年12月数据，其余利率数据均为2009年2月4日数据。需求。12月，对票据业务量较大的16个省（区、市）增加再贴现额度共346亿元，用于支持其扩大“三农”信贷投放和中小企业融资。,208.0
42,二是两次下调再贴现利率共2.52个百分点，支持金融机构进一步扩大票据融资。,37.0
43,三是进一步完善再贴现制度管理。下发《关于完善再贴现业务管理，支持扩大“三农”和中小企业融资的通知》，要求中国人民银行分支机构适当增加再贴现窗口，扩大再贴现的对象和机构范围；运用再贴现推广使用商业承兑汇票，促进商业信用票据化；通过票据选择明确再贴现支持的重点，对商业承兑汇票、涉及“三农”和中小企业的票据优先办理再贴现；进一步明确再贴现可采取回购和买断两种方式，提高业务效率。五、加强窗口指导和信贷政策引导2008年初，中国人民银行指导金融机构实事求是地编制全年信贷规划，合理安排信贷投放总量和节奏，适当控制基本建设等中长期贷款，严格限制对高耗能、高排放和产能过剩行业劣质企业的贷款，加大对“三农”、中小企业等重点领域和薄弱环节的信贷支持。鼓励金融机构加强对受灾地区的金融服务，全年安排增加再贷款资金194亿元，支持灾后恢复重建。,364.0
44,下半年根据形势变化，适时取消对商业银行信贷规划的硬约束，引导金融机构坚持“区别对待、有保有压”的原则，根据实体经济有效需求合理均衡放款，在风险可控的前提下，努力优化信贷结构、改进和加强信贷服务，加大对民生工程、“三农”、重大工程建设、中小企业、服务业、节能减排、科技创新、扩大就业、技术改造和兼并重组、区域协调发展等重点领域的信贷投放。,168.0
45,完善住房信贷政策，加大对普通住房消费、经济适用住房和廉租住房建设的信贷支持力度。六、稳步推进金融企业改革大型国有银行改革基本完成，成效显著。自2003年以来，我国前瞻性地推进大型国有银行的改革，2006年底前相继完成了中国银行、中国建设银行、交通银行、中国工商银行的股份制改革并成功上市。2008年，在全球金融危机的背景下，国家果断启动国家开发银行和中国农业银行改革，向两家银行分别注资200亿美元和190亿美元，向国内外表明中国继续深化金融改革，维护金融稳定的决心与举措。至此，我国大型国有银行股份制改革基本顺利完成。,260.0
46,目前，无论是资产规模、资产质量、盈利能力，还是资本充足率、流动性比例，包括大型商业银行在内的中国银行业的整体实力正处在历史的较好时期。截至2008年9月末，中国工商银行、中国银行、中国建设银行和交通银行的资本充足率分别为12.6%、13.9%、12.1%和13.8%，不良贷款率分别为2.4%、2.6%、2.2%和1.8%，税前利润分别为1206亿元、803亿元、1087亿元和296亿元。中国金融体系的稳定性与安全性不断提高，为国民经济抵御全球金融危机、维持健康平稳运行奠定了扎实的基础。中国农业银行股份有限公司正式设立。按照2007年全国金融工作会议的部署，中国人民银行会同有关部门在深入调查研究和广泛国际比较的基础上，围绕“面向三农、商业运作、整体改制、择机上市”的总体目标，抓紧研究论证中国农业银行改革方案，稳步推进改革各项工作。,369.0
47,2008年10月21日，国务院召开第32次常务会议审议并原则通过了《农业银行股份制改革实施总体方案》。10月29日，中国投资有限责任公司通过中央汇金投资有限责任公司向中国农业银行注资1300亿元人民币等值美元，与财政部各持有中国农业银行50%的股份。中国农业银行相继完成了资产评估、土地确权和不良资产剥离等工作；同时，不断扩大县域事业部制改革试点，增加对“三农”的信贷支持。2009年1月9日，召开了中国农业银行股份有限公司创立大会，“三会一层”的公司治理架构初步设立。2009年1月16日，中国农业银行股份有限公司正式挂牌成立。,265.0
48,国家开发银行股份有限公司正式挂牌，商业化转型取得突破性进展。2008年2月和4月，国家开发银行改革总体方案和具体实施方案获得批准。方案明确了财务重组中有关外汇资本金汇兑损失的处理、共管基金、风险准备等问题；明确了国有股权管理方案，财政部和中央汇金投资有限责任公司作为发起人分别占51.3％和48.7％的股份。12月1日，召开了国家开发银行股份有限公司创立大会，按照公司法程序要求，产生了新一届董事会、监事会、高管等。12月16日，国家开发银行股份有限公司正式挂牌成立。,234.0
49,中国进出口银行和中国农业发展银行也不断深化内部改革，加强风险管理和内控机制建设，稳步开展新业务，为全面改革创造条件。农村信用社改革取得重要进展和阶段性成果。资金支持基本落实到位。第四季度，对海南省农村信用社发行专项票据20.96亿元，标志着全国农村信用社专项票据发行工作全面完成。截至2008年年末，专项票据兑付进度已达到90%以上，累计兑付票据1530亿元；发放专项借款15亿元。,191.0
50,随着资金支持基本落实到位，农村信用社的历史包袱有效化解。资产质量明显改善。按贷款四级分类口径统计，2008年年末，全国农村信用社不良贷款余额和比例分别为2965亿元和7.9%，比改革之初分别下降2182亿元和28.9个百分点。自2004年实现近十年来的首次盈利后，盈利水平逐年提高，2008年实现盈利545亿元，同比多增92亿元。资金实力明显增强。,174.0
51,2008年年末，农村信用社的项贷款为3.7万亿元，占金融机构贷款总额的比例由改革之初的10.6%提高到12.3%。服务“三农”力度加大。2008年年末，农业贷款余额为1.7万亿元，占其项贷款的比例由改革之初的40%提高到46%；占全国金融机构农业贷款的比例由改革之初的81%提高到96%。产权制度改革进展顺利。截至2008年年末，全国共组建农村商业银行22家，农村合作银行163家，组建以县（市）为单位的统一法人机构1966家。,214.0
52,七、深化外汇管理体制机制创新加快外汇管理体制改革，深化外汇管理体制机制创新，积极推进贸易投资便利化，完善跨境资金流出入均衡管理，努力改善国际收支状况。,75.0
53,一是促进贸易投资便利化取得新进展。实行小额本外币兑换特许业务试点；允许符合条件的企业集团财务公司开展即期结售汇业务；开通“绿色通道”，简化外汇业务手续，全力开展奥运和抗震救灾服务；根据形势变化提高一般企业预收货款结汇比例和延期付款比例，为企业应对国际金融危机提供支持。,134.0
54,二是跨境资金流动监管进一步加强。修订施行《外汇管理条例》；实施出口收结汇联网核查和贸易信贷债权债务登记管理制度，加强贸易外汇资金流与货物流的真实性一致性核查；初步建立服务贸易外汇业务非现场监管体系；推广直接投资外汇管理信息系统；实施银行执行外汇管理规定情况考核办法；进一步发挥异常外汇资金流动监管协调机制作用，打击地下钱庄违法犯罪活动。,168.0
55,三是外汇储备经营管理经受住重大考验，审慎应对席卷全球的国际金融危机，严格风险管理和内控监督，实现国家外汇储备的保值增值。,60.0
56,"四是进一步完善国际收支监测预警制度。八、完善人民币汇率形成机制继续按照主动性、可控性和渐进性原则，进一步完善以市场供求为基础、参考一篮子货币进行调节、有管理的浮动汇率制度，发挥市场供求在人民币汇率形成中的基础性作用，保持人民币汇率在合理均衡水平上的基本稳定。货币市场人民币交易成交活跃，市场利率大幅下降；债券市场交易活跃，债券收益率曲线整体大幅下行，发行利率先升后降；股票市场波动中大幅走低；保险市场需求明显增加；外汇市场平稳发展。2008年,国内非金融机构部门(包括住户、非金融企业和政府部门)融资总量继续较快增长。融资结构中，贷款融资的主导地位有所加强，企业债券融资快速增长，在全社会资金配置中的作用显著上升，股票和国债融资占比明显下降。",321.0
57,"受股票市场大幅回调影响，全年非金融企业股票融资额同比减少2875亿元，下降44.0%；国债融资占比下降，主要是2008年国债到期兑付较多，全年同比多兑付1685亿元所致。一、金融市场运行分析（一）货币市场交易活跃，利率水平下降较多，市场流动性充足货币市场人民币交易活跃，债券回购、拆借成交量增长较快。2008年，银行间市场债券回购累计成交58.1万亿元，日均成交2316亿元，日均成交同比增长28.7%；同业拆借累计成交15.0万亿元，日均成交600亿元，日均成交同比增长40.2%。资金需求短期化明显,回购、拆借市场交易均主要集中于隔夜品种，其交易份额分别为63.7%和70.8%。交易所市场政府债券回购累计成交2.4万亿元，同比增长32.3%。",324.0
58,综合回购市场与拆借市场来看，供给方的国有商业银行净融出资金量有所减少，其他商业银行资金供给增加较多；从需求方看，受资本市场大幅回落影响，保险公司资金需求有所下降。证券及基金公司受第四季度市场利率明显下降影响，资金需求明显上升。第四季度证券及基金公司净融入资金同比增长2倍，多融入额占全年同比多融入资金的96.6%。利率衍生产品市场保持快速发展态势，产品类型日益丰富，市场规模快速增长。2008年债券远期及利率互换成交量均比2007年增长近一倍。,222.0
59,2008年前三季度利率衍生产品交易稳步增长，但受金融危机影响，第四季度利率衍生产品交易量有所减少，债券远期及利率互换交易量比前三季度明显萎缩，远期利率协议交易市场仍保持平稳增长。Shibor在利率衍生产品交易定价中的作用加强。2008年共成交以Shibor为基准的利率互换1783笔，义本金额为899.19亿元，比上年增长215%，占利率互换交易总量的22%，同比提高9个百分点。远期利率协议成交137笔，义本金额113.6亿元，全部以3个月Shibor为基准。货币市场利率先升后降。,242.0
60,上半年，受市场通货膨胀预期较强等因素影响，同业拆借和质押式回购加权平均利率稳步上升至6月份的3.07%和3.08%，分别比上年12月份高0.98个和0.29个百分点。第三季度市场利率水平基本保持平稳。进入第四季度，受适度宽松货币政策操作以及市场预期发生明显逆转影响，市场利率水平明显下降，12月份拆借和质押式债券回购加权平均利率分别为1.24%和1.22%，分别比6月份低1.84个和1.85个百分点，比上年12月份低0.85个和1.57个百分点，拆借利率创历史最低水平，回购利率达2005年底以来最低水平。年末，1周和2周Shibor分别为1.0058%和1.1620%，比年初分别下降1.59个和1.82个百分点；3个月和1年期Shibor分别为1.7782%和2.3597%，比年初下降2.66个和2.22个百分点。（二）债券市场交易活跃，发行利率先升后降银行间债券市场现券交易活跃。,395.0
61,全年累计成交37.1万亿元，日均成交1479亿元，同比增长1.4倍。交易所国债现券成交2123亿元，比上年同期多成交922亿元。银行间现券市场上，除其他商业银行净卖出现券1.5万亿元外，其余类型金融机构均为净买入现券。其中，国有商业银行净买入现券5783亿元，其他金融机构净买入6031亿元。债券指数走高。,153.0
62,2008年，银行间市场和交易所市场债券指数总体呈现上行走势，特别是9月份以来，随着国际金融危机蔓延，市场普遍预期政策面趋于宽松，受此影响债券指数快速大幅攀升。全年来看，银行间市场债券指数由年初的114.84点升至年末的132.05点，上升14.99%；交易所市场国债指数由年初的110.78点升至年末的121.30点，上升9.50%。银行间市场国债收益率曲线整体大幅下行。2008年银行间市场国债收益率曲线变化大致分为三个阶段：第一阶段为1-4月份，国债收益率曲线整体下移。第二阶段为5-6月份，市场资金趋紧和紧缩预期增加，国债价格下降，市场投资行为谨慎，收益率曲线持续上移。,288.0
63,"第三阶段为7月份至年底，由于宏观经济政策调整，市场资金充裕，收益率曲线整体呈现快速大幅下行趋势。债券发行平稳增长,发行利率先升后降。2008年累计发行类债券（不含中央银行票据）29381亿元，基本与上年同期持平，其中企业债券发行额同比增长68.7%，增幅加大37.4个百分点。短期融资券、次级债券以及资产支持证券的发行量较上年均有较大幅度增加。分期限看，5年期以下债券品种发行量占比为61%，同比下降3.6个百分点，其中1年期以下品种占比同比下降5.7个百分点，1-3年品种占比同比上升2.6个百分点。",251.0
64,年末，中央国债登记结算公司债券托管量余额为15.1万亿元，比上年增长25.7%(扣除特别国债因素)。Shibor在债券发行定价中继续发挥作用。2008年共发行以Shibor为基准的浮息债3只，发行量为122亿元，分别包括政策性金融债、商业银行次级债和企业债1只。全年共发行固定利率企业债57只，总发行量为2346.9亿元，全部参照Shibor定价；参照Shibor定价的短期融资券为156只，发行量为1786.3亿元，占短期融资券总发行量的42%，基本与上年持平；中期票据自4月份问世以来，参照Shibor定价的为17只，发行量为449亿元，占中期票据总发行量的26%。（三）票据业务增长较快票据承兑保持稳定增长，票据利率市场化程度高。,318.0
65,2008年，企业累计签发商业汇票7.1万亿元，比上年增长20.7%；累计贴现13.5万亿元，同比增长33.6%；累计办理再贴现109.7亿元。年末，商业汇票承兑余额为3.2万亿元，同比增长30.9%；贴现余额为1.9万亿元，同比增长50.4%。随着中国人民银行下调存贷款基准利率、存款准备金率，货币市场利率逐步走低，票据市场利率持续下降，特别是第四季度票据贴现、转贴现利率下降幅度较大。全年看，票据融资波动较大。年初，根据加强宏观调控的整体要求，商业银行调整资产结构，压缩票据融资规模。,243.0
66,票据融资增幅趋缓，余额持续下降，3月末票据融资余额为1.2万亿元，为本年度票据融资最低值。下半年，随着金融宏观调控要求的转变，商业银行大力拓展票据业务，票据融资增长较快，余额快速回升。2008年，票据承兑、贴现累计融资量计超过20万亿元，全年新增票据融资0.65万亿元，新增票据融资占新增贷款的比重高达13.2%。票据融资的快速发展有效地扩大了金融机构对中小企业的信用支持。票据融资是中小企业、关联企业和下游企业的主要短期融资方式。,216.0
67,近年来，尽管票据签发以大企业为主导的基本格局未发生根本改变，但中小企业票据签发呈现增长趋势。（四）股票市场波动中大幅走低受市场信心不足、国际金融危机对我国影响不断加剧、上市公司利润下滑等多种因素影响，2008年股票市场在波动中大幅回调，成交量明显萎缩。全年沪、深股市累计成交26.71万亿元，同比少成交19.34万亿元；日均成交1086亿元，同比下降43%。2008年年末市场流通市值4.52万亿元，比2007年年末缩水51.4%。2008年年末，上证、深证综指数分别收于1821点和553点，分别较上年末下跌65.4%和61.8%。,267.0
68,随着股票市场持续震荡走低，上年股票价格过快上涨的风险逐步释放。沪、深两市A股平均市盈率分别由上年末的59倍和72倍下降为2008年年末的15倍和17倍。股票市场融资明显减少。初步统计，2008年非金融企业及金融机构在境内外股票市场上通过发行（含增发）、配股以及可转债累计筹资3657亿元，比上年少筹资5023亿元，下降57.9%。其中，A股发行和配股融资3281亿元，同比少融资4388亿元，下降57.2%。,204.0
69,（五）保险市场需求明显增加，保险总资产增长减缓保险需求明显增加。2008年，保险业累计实现保费收入9784亿元，同比增长39.1%，增速同比上升14.3个百分点。其中寿险收入增长49.2%，增幅同比上升24.9个百分点；财产险收入增长17%。保险业累计赔款、给付2971亿元，同比多支出706亿元，增长31.2%，其中财产险和寿险分别同比多支出398亿元和251亿元，分别增长39.0%和23.5%。保险总资产增长减缓。,210.0
70,2008年年末保险总资产3.34万亿元，同比增长15.2%，增速同比下降31.8个百分点。其中，投资类资产增速为11.2%，增幅同比下降60.1个百分点；银行存款增速为24.1%，增幅同比上升15.3个百分点。（六）外汇市场平稳发展，人民币掉期交易活跃即期外汇市场运行平稳，询价交易的主导地位进一步显现，人民币掉期交易活跃，“货币对”交易量下降较多。在外汇即期市场交易中，询价仍然是市场的主导交易模式，询价模式成交占比99%；美元币种仍然是交易的主要货币，美元币种成交占比99%。人民币外汇掉期市场累计成交4403亿美元，同比增长39.6%，人民币外汇掉期作为一种衍生产品，在外汇市场上规避汇率风险的作用正在逐渐增强。,309.0
71,人民币外汇远期市场累计成交174亿美元，同比下降22.4%；八种“货币对”累计成交折620亿美元，同比下降30.9%，成交品种主要为美元/港币和欧元/美元，计成交量占全部成交量的77.6%。二、金融市场制度性建设（一）推动金融市场产品创新全面展开人民币利率互换业务。在总结利率互换试点经验的基础上，2008年1月，中国人民银行发布《关于开展人民币利率互换有关事宜的通知》，扩大了参与者范围，取消了对利率互换交易具体形式的限制，同时进一步加强了对参与者的风险控制要求，促进利率互换业务的平稳、健康发展。2008年，利率互换累计成交4040笔，义本金额4121.5亿元，同比分别增长104%和88%。推出中期票据，进一步拓宽企业直接融资渠道。,319.0
72,2008年4月中期票据开始注册发行，企业（公司）可以一次性注册一个较大的额度，在有临时资金周转需求时，根据市场情况享受小额分期发行便利。中期票据推出后市场供求两旺，2008年，有24家企业累计发行39只共计1672亿元中期票据。（二）加强银行间债券市场基础性建设一是加强自律管理。2008年4月，中国人民银行发布《银行间债券市场非金融企业债务融资工具管理办法》，明确银行间市场交易商协会对债务融资工具的发行和交易实施自律管理，标志着银行间债券市场管理方式的重大转变。2008年10月，经国务院批准，中国人民银行要求银行间债券市场交易商协会优先接受大型权重股上市公司中期票据注册，允许上市公司使用发行中期票据所募集的资金按照国家有关规定回购本公司股份，优先接受煤电油运等国民经济基础行业中的主要企业发行中期票据的注册报告，充分发挥债券市场的融资功能，稳定资本市场，促进经济平稳较快增长。,392.0
73,二是全面实现券款对付结算方式。2008年7月，中国人民银行发布2008年第12号公告，对非银行机构DVP结算的具体路径和相关制度作了安排，并对银行间债券市场的DVP结算进行了全面规范。这标志着我国银行间债券市场的券款对付结算全面实现，极大地提高了市场结算效率，更加有力地降低和控制了结算风险。2008年银行间债券市场结算量共101.32万亿元，其中通过DVP结算的为60.64万亿元，占比59.85％。,201.0
74,三是推动非法人机构进入银行间债券市场。2008年4月和12月，中国人民银行陆续发布《关于保险机构以产品义开立债券托管账户有关事项的通知》和关于信托公司开立信托专用债券账户有关事项的第22号公告，将通过保险产品、信托产品募集的资金引入银行间债券市场投资。（三）完善证券市场基础性制度建设一是加强股票市场稳定运行机制建设。2008年4月，证监会发布《上市公司解除限售存量股份转让指导意见》，推动解除限售存量股份依法有序转让。8月，修订《上市公司收购管理办法》，提高上市公司股东增持公司股份的灵活性，10月，发布《关于上市公司以集中竞价方式回购股份的补充规定》，简化上市公司回购的核准程序，以此促进市场内在稳定机制发挥作用。,309.0
75,二是推进多层次资本市场体系的构建，深入推进创业板筹备工作。,29.0
76,三是进一步完善证券市场法制，推动《证券公司监督管理条例》和《证券公司风险处置条例》颁布实施，完善了证券公司监管和风险处置的基本制度。（四）进一步完善保险保障基金制度2008年9月，中国保险业监督管理委员会会、财政部、中国人民银行联发布了《保险保障基金管理办法》，明确了保险保障基金的性质，并对保险保障基金管理体制、缴纳基数、缴纳范围和比例以及投资渠道等多个方面进行了修订。办法的发布，进一步完善了保险保障基金制度，规范了保险保障基金的运作。美国、欧元区、日本均已陷入衰退，新兴市场经济增速明显放缓。大宗商品价格迅猛上涨至7月份高点后急剧回落，全球通货膨胀压力缓解，通货紧缩风险同步增加。,293.0
77,"为应对危机，全球主要经济体相继降息，多渠道向市场注入流动性，通过多种方式救助问题金融机构，还推出大规模经济刺激计划。在11月召开的二十国集团领导人“金融市场和世界经济峰会”上，方就加强国际作、共同应对危机、改革国际金融体系等问题达成共识，国和有关国际组织也纷纷就落实峰会宣言和行动计划推出后续政策。国际货币基金组织2009年1月28日宣布，2008年全球经济增长率降至3.4%，比2007年下降1.8个百分点。（一）主要经济体经济状况美国经济进入衰退。受消费支出大幅下滑、企业投资减少、出口拉动作用减弱、房地产市场持续低迷等影响，2008年GDP季节调整后环比折年率仅为1.3%,比2007年低0.7个百分点，季增速分别为0.9%、2.8%、-0.5%和-3.8%。",333.0
78,就业形势持续恶化，失业率从年初的4.9%攀升至12月的7.2%，创16年来新高。对外贸易萎缩明显，贸易逆差收窄，全年贸易逆差为6771.0亿美元，比上年减少231.6亿美元。受经济放缓和大规模财政计划影响，联邦政府财政赤字大幅攀升。在9月30日结束的2008财政年度中，财政赤字创4550亿美元新高，同比增长180.9%，财政赤字占GDP的比重从2007财年的1.2%升至3.2%。通货膨胀压力先升后降，同比CPI从年初的4.3%升至7月的18年来高点5.6%，此后快速回落，12月同比降至0.1%。,250.0
