,paragraph,length
37,中国农业发展银行也不断深化内部改革，加强风险管理和内控机制建设，稳步开展新业务，为全面改革创造条件。农村信用社改革取得重要的阶段性成果。资金支持政策实施进展顺利，对支持和推进改革发挥了重要的正向激励作用，农村信用社资产质量明显提高。截至2009年年末，已累计向2340个县（市）农村信用社兑付专项票据1641亿元，兑付进度达到97以上；发放专项借款21亿元。2009年年末，按贷款四级分类口径统计，全国农村信用社不良贷款余额和比例分别为3490亿元和7.4，比2002年末分别下降1657亿元和30个百分点。,254.0
38,资金实力显著增强，支农服务力度明显加大。2009年年末，全国农村信用社的各项存贷款余额分别为7万亿元和4.7万亿元。各项贷款余额占全国金融机构各项贷款余额的比例为12，比2002年末提高了1.4个百分点。农业贷款余额2.1万亿元，占其各项贷款和全国金融机构农业贷款的比例分别为44和95，比2002年末分别提高4个和14个百分点。产权改革进展顺利，法人治理架构初步建立。,185.0
39,截至2009年年末，全国共组建以县（市）为单位的统一法人农村信用社2054家，农村商业银行43家，农村合作银行195家。部分农村信用社在明晰产权关系、完善法人治理方面进行了有益探索，取得了初步成效。进一步深化农村信用社改革应着力解决当前改革发展中存在的机制体制问题，促进建立农村信用社可持续发展的长效机制；坚持服务“三农”原则，督促和引导农村信用社始终坚持支农服务方向不动摇；坚持重点突破原则，明晰产权关系、改革产权制度务必取得实质性进展；坚持市场化原则，鼓励农村信用社自主选择产权组织形式，总体保持县（市）法人地位稳定；坚持适度竞争原则，建立市场准入退出机制，强化外部约束；坚持商业可持续原则，着力构建系统性、制度性农村金融政策扶持体系。六、深化外汇管理体制改革适时调整外汇管理的方向和重点，出台应对国际金融危机的多项措施，支持涉外经济稳步发展。改进出口收结汇联网核查管理，提高预收货款和延期付款等基础比例；将2009年度调增的金融机构短期外债指标全部用于支持企业贸易融资。,438.0
40,继续深化外汇管理体制改革，提升外汇管理服务经济发展的功能。简化服务外包企业外汇收支审核手续，对符合条件的服务外包企业给予账户开立、资金汇兑等政策便利;将境外投资外汇资金来源审核和资金汇出核准调整为登记管理，在汇兑环节上对境外直接投资给予便利。将个人本外币兑换特许业务试点扩至13个省市自治区和4个计划单列市，进一步满足国际旅游中心、部分涉外经济发达地区的个人兑换需求。完善QFII和QDII外汇管理，扩大QDII投资额度，全面公布合格机构投资者投资额度审批情况，提高行政许可的透明度。截至2009年年末，累计批准83家合格境外机构投资者，投资额度为165亿美元；批准65家商业银行、基金公司和保险公司等合格境内机构投资者，投资额度为633亿美元。,323.0
41,完善跨境资本流动监管，防范异常跨境资本流动风险。规范个人结售汇监管，堵塞个人以分拆等方式规避管理，规范个人手持外币现钞结汇行为。修订《银行执行外汇管理规定情况考核办法》，提高银行外汇业务合规性管理。打击“地下钱庄”等违法违规外汇交易活动。七、完善人民币汇率形成机制继续按主动性、可控性和渐进性原则，进一步完善以市场供求为基础、参考一篮子货币进行调节、有管理的浮动汇率制度，发挥市场供求在人民币汇率形成中的基础性作用，保持人民币汇率在合理均衡水平上的基本稳定。,229.0
42,货币市场交易活跃，利率从低位有所回升；债券收益率曲线总体逐步上移，债券发行规模快速增加；股票交易量明显放大，股票指数大幅上扬。2009年国内非金融机构部门(包括住户、企业和政府部门)融资总量快速增加，全年累计融资1.31万亿元，同比增长1.2倍。从融资结构看，贷款仍然是主要融资方式，但占比有所下降；随着积极财政政策的实施，国债融资规模大幅增加，占比明显上升；股票及企业债券融资量均保持较快增长势头，占比则略有下降。一、金融市场运行分析（一）货币市场交易活跃，利率从低位有所回升2009年，货币市场回购、拆借交易量保持较快增长。全年回购累计成交70.3万亿元，日均成交2812亿元，同比增长21.4；同业拆借累计成交19.4万亿元，日均成交774亿元，同比增长29.1。,335.0
43,回购、拆借交易均主要集中于隔夜品种，其交易份额分别为77.7和83.6，同比分别上升14.0个和12.8个百分点。交易所市场国债回购累计成交3.6万亿元，同比增长46.2。从货币市场融资结构看，融资主体主要呈现以下特点：一是国有商业银行流动性保持充裕，资金供给的主导地位进一步增强；二是受货币市场融资收益相对较低及资产配置策略影响，其他商业银行资金净融出规模同比明显减少；三是受股票市场震荡上行、下半年新股密集发行等因素影响，证券、基金及保险公司等非银行金融机构的融资需求大幅上升；四是外资金融机构资产扩张放缓，融资需求有所减弱。利率衍生产品市场运行平稳。债券远期交易相对活跃，成交量同比增长31.1，其中2-7天品种占总交易量的63.4；利率互换交易量稳步增加，成交量同比增长12，其中1年期及1年期以下品种占成交总额的56.5。,366.0
44,远期利率协议交易较为清淡，名义本金额同比有所减少。Shibor在利率衍生产品交易定价中的作用不断加强，2009年，以Shibor为基准的利率互换占人民币利率互换交易总量的28，远期利率协议全部以Shibor为基准。货币市场利率整体较上年下降，但下半年较上半年有所提高。随着积极财政政策和适度宽松货币政策的实施，银行体系流动性总体充裕，加之受2008年末超额准备金利率有所下调影响，2009年上半年，质押式回购和同业拆借月加权平均利率基本稳定在0.85左右的历史较低水平；下半年，随着宏观经济企稳向好，受新股密集发行及中央银行票据发行利率有所上行等因素影响，货币市场利率从低位有所回升。12月份，质押式回购和同业拆借月加权平均利率分别为1.26和1.25，分别比6月份上升35个和34个基点。,345.0
45,截至2009年年末，隔夜、7天期Shibor分别为1.1467和1.5650，分别较6月末上升6个和36个基点；3个月和1年期Shibor分别为1.8319和2.2502，分别较6月末上升51个和38个基点。,104.0
46,Shibor为金融市场产品定价提供了基准。,21.0
47,一是Shibor在债券定价中的指导作用逐步增强。从浮动利率产品来看，自2007年6月第一只Shibor浮息债面世至今，共发行以Shibor为基准的浮息债23只，总发行量为1860亿元。发行主体包括政策性银行、商业银行和企业，发行范围涵盖内地和香港。从固定利率产品来看，2007年4月以来，企业债全部参照Shibor定价，截至2009年年末累计发行逾8千亿元；参照Shibor定价的短期融资券累计发行逾4千亿元，约占总发行量的37。,215.0
48,二是以Shibor为基准的衍生品市场不断深化。截至2009年年末，以Shibor为基准的利率互换累计成交2501亿元，约占全部交易量的22。远期利率协议成交184.1亿元，全部以Shibor为基准。此外，2008年10月以来，中国人民银行与马来西亚、韩国等国家的中央银行签署了6500亿元货币互换协议，全部采用Shibor为基准利率。Shibor在商业银行内外部定价中发挥重要作用。,191.0
49,一是Shibor为商业银行内部资金转移定价（FTP）提供了定价基准。目前，16家报价行的FTP价格已不同程度地与Shibor结合。一方面，商业银行在Shibor基础上加点生成回购、拆借及票据等业务的FTP价格；另一方面，报价行还采用市场化产品的FTP价格作为Shibor报价的基础，Shibor与FTP价格之间实现了较好的互动。,164.0
50,二是Shibor促进贴现利率定价机制不断完善。Shibor推出后，报价行每日通过票据网对以Shibor为基准的票据转贴现进行双边报价。在此基础上，多家报价行先后建立了贴现利率参照Shibor的定价机制。此外，2009年10月，中国人民银行电子商业汇票系统上线，其中票据业务利率采取参照Shibor的方式，在完善贴现利率形成机制的同时，也有助于提高3个月以上Shibor的基准性。,189.0
51,三是Shibor推动了同业存款业务的科学定价。同业存款为金融机构间的资金互存，其利率本质上与Shibor类似。目前，大部分报价行的同业存款均已不同程度地参照Shibor定价。2009年，我国同业定期存款发生额约为4万亿元。同业存款参照Shibor定价对于理顺利率传导机制具有重要意义。,142.0
52,（二）债券收益率曲线总体有所上移，债券发行规模快速增加银行间债券市场交易活跃。2009年，银行间债券市场累计成交47.3万亿元，日均成交1891亿元，同比增长27.9。从交易主体看，国有商业银行是银行间债券市场的主要净买入方，全年净买入债券12423亿元；其他商业银行及其他金融机构分别净卖出债券10864亿元和1559亿元。交易所国债市场现券成交2085亿元，与上年基本持平。银行间债券市场债券指数有所下行。,205.0
53,2009年，全国银行间债券市场财富指数由年初的132.11点降至年底的130.23点，跌幅1.42；净价指数由年初的105.25点降至年底的101.13点，跌幅3.921。银行间债券收益率曲线总体逐步上移。2009年，在经济形势总体向好、债券发行规模增加以及市场预期有所波动等多种因素共同作用下，银行间债券收益率曲线总体逐步有所上移，并呈陡峭化上行走势。银行间市场国债收益率曲线整体上行幅度明显，其中5-10年中期国债的收益率全年涨幅超过100个基点。债券市场发行规模快速增加。,239.0
54,2009年累计发行各类债券（不含中1财富指数是以债券全价计算的指数值，并将付息日利息再投资计入指数之中；净价指数是以债券净价计算的指数值，未考虑应计利息和利息再投资因素，更能客观反映债券收益率的变化情况。,102.0
55,央银行票据）4.9万亿元，同比增长64.3，其中，国债、银行次级债、中期票据及公司债券发行量同比增幅均超过100，为促进我国经济企稳向好提供了有力的资金支持。2009年年末，中央国债登记结算有限责任公司债券托管量余额为17.5万亿元，比上年末增长16.0。债券发行利率持续走高，10年期记账式附息国债发行利率由3月份的3.05上升至11月份的3.68，累计上升63个基点。债券发行有所创新。为弥补中央项目配套资金需要，财政部首次代理发行地方政府债券，全年累计发行2000亿元。,238.0
56,2009年11月，中小企业集合票据成功发行，开辟了中小企业新的融资渠道。此外还推出中期票据的含权产品及美元中期票据等创新品种，满足了市场多样化融资需求。Shibor对债券定价的指导作用有所增强。2009年企业债发行全部参照Shibor定价，全年共发行190只，发行总量4252亿元，较上年增长80；参照Shibor定价的短期融资券共发行1272亿元，占该类债券发行总量的28；以Shibor为基准的政策性银行浮动利率债券共发行728亿元，占该类债券发行总量的19。（三）票据融资增长较快票据融资总体增长较快，波动较大。,259.0
57,2009年，企业累计签发商业汇票10.3万亿元，同比增长45.0；累计贴现23.2万亿元，同比增长71.4；累计办理再贴现248.8亿元，同比增长126.8。期末商业汇票未到期金额4.1万亿元，同比增长29.4；贴现余额2.4万亿元，同比增长23.7；再贴现余额181.2亿元，同比增长684.8。上半年，商业银行大力拓展票据业务，票据融资快速增长，增速快于同期贷款增速。截至6月末，票据承兑余额超过5万亿元、贴现余额超过3.6万亿元，均达到历史最高水平。下半年，商业银行调整资产结构，票据承兑和贴现余额逐月下降，年末票据承兑、贴现余额分别比6月份最高峰下降0.9万亿元和1.2万亿元。,293.0
58,票据市场利率先抑后扬，总体水平较上年下降。随着一揽子经济刺激政策的实施，年初票据市场利率大幅下降，并在历史低位徘徊；6月以来，受经济企稳向好、IPO重启及货币市场利率有所上升等因素影响，票据市场利率逐步回升，并于年末处于年内相对高位平稳运行。（四）股票市场交易量明显放大，股指大幅上涨受国民经济企稳向好、市场资金充裕及上市公司利润回升等多种因素影响，股票市场交易量明显放大，股票指数在波动中大幅上涨。2009年，沪、深股市累计成交53.6万亿元，同比多成交26.9万亿元；日均成交2197亿元，同比增长100.7。年末上证、深证综合指数分别收于3277点和1201点，分别比上年末上涨80.0和117.1。,303.0
59,截至2009年年末，股票市场流通市值为15.1万亿元，同比增长2.3倍。沪、深两市A股平均市盈率分别从上年末的15倍和17倍回升到2009年年末的29倍和47倍。股票市场筹资额明显增加。2009年各类企业在境内外股票市场上通过首次发行、再融资和可转债方式累计筹资6084亿元，筹资额同比增加2423亿元。其中，下半年筹资5030亿元，占全年筹资额的82.7。,179.0
60,经多方精心筹备，10月份创业板市场正式启动，标志着我国境内多层次的资本市场初步形成。截至2009年年末，共有36家公司在创业板上市，累计筹资204亿元，占全年股票市场筹资总额的3.4；市价总值1610亿元，占沪深两市总市值的0.7。（五）保险业保持平稳较快增长保费收入首次突破万亿元。2009年，保险需求稳定增长，全年保险业累计实现保费收入1.1万亿元，同比增长13.8，其中财产险收入增长23.1，人身险收入增长10.9。全年保险业累计赔款、给付3125亿元，同比增长5.2。,239.0
61,保险业总资产增速稳步回升。2009年年末，保险总资产4.1万亿元，同比增长21.6，增速比上年末上升6.4个百分点。从资产配置结构看，年末银行存款在总资产中的占比为25.9，比上年末上升1.7个百分点；投资类资产占比为66.2，比上年末下降1.0个百分点。（六）外汇市场运行平稳外汇市场保持平稳运行。人民币外汇掉期在规避汇率风险中作用明显增强，全年累计成交8018亿美元，同比增长82.1，增幅比上年提高42.5个百分点；其中美元仍是主要的交易货币，交易短期化趋势有所上升，全年隔夜人民币对美元外汇掉期成交量占掉期成交总量的64.8，同比上升21个百分点。,278.0
62,人民币外汇即期交易继续保持稳定增长，询价仍然是市场的主要交易方式。人民币外汇远期市场累计成交98亿美元，同比下降43.8。“外币对”市场累计成交折合407亿美元，同比下降35.8，成交主要品种为美元/港币和欧元/美元，合计成交量占总成交量的78.8；“外币对”远期和掉期分别成交20亿美元和39亿美元，同比分别增长2.8倍和4倍。(七)黄金价格震荡上行上海黄金交易所交易量稳步增加。2009年，黄金交易累计成交4710.8吨，同比增长5.5％；成交金额10288.8亿元，同比增长18.3；日均成交19.3吨，同比增长6.3％。,264.0
63,白银累计成交16247.8吨，同比增长267.6；成交金额586.6亿元，同比增长296.1；日均成交66.6吨，同比增长270.6％。铂金累计成交56.7吨，首次超过50吨，同比增长29.5；成交金额155.3亿元，同比增长2.6；日均成交0.23吨，同比增长30.5。黄金价格震荡上行。2009年国际市场黄金价格创历史新高，连续突破每盎司1000美元和1100美元，并于11月份创历史最高价1183美元。上海黄金交易所黄金价格也呈上涨态势，并创每克269元历史最高价；年末收盘价245元，比年初上涨27.0；全年加权平均价215元，比上年提高18元。,277.0
64,二、金融市场制度性建设（一）加强银行间债券市场制度性建设一是进一步完善管理制度。进一步完善金融债券发行管理，提高金融债券发行审核的透明度，健全市场约束与风险分担机制。规范与细化银行间债券市场金融债券信息披露操作相关行为，促进提高市场透明度。规范债券登记、托管和结算业务，保护投资者合法权益，防范相关业务风险。同时，取消债券发行规模须超过5亿元才可交易流通的限制条件，为中小企业通过发债进行小额融资创造了较好的政策条件。,209.0
65,二是丰富债券品种及发行主体。2009年11月，在银行间债券市场推出中小非金融企业集合票据业务。集合票据是首个根据中小企业融资需求量身定做的规范化产品，不仅为中小企业直接融资开辟了新的渠道，也丰富了银行间市场的投资产品。此外，允许金融租赁公司和汽车金融公司发行金融债券，在控制风险的前提下，稳步扩大金融债券发行主体的范围。,160.0
66,三是稳步推进基础设施建设。2009年11月28日，银行间市场清算所股份有限公司在上海挂牌成立，向市场参与者提供本外币交易及衍生产品交易清算服务，有利于提高清算效率、降低清算成本、提高市场透明度、防范系统性金融风险。银行间市场新一代本币交易系统于2009年6月正式上线。2009年10月，在总结前期试点经验基础上，在全国范围内推广银行承兑汇票和商业承兑汇票转贴现标准合同文本。同时，电子商业汇票系统上线运行，标志着我国商业汇票业务进入电子化时代。（二）完善证券市场基础性制度建设一是改革和完善新股发行体制。中国证券监督管理委员会(以下简称“证监会”)于2009年6月发布《关于进一步改革和完善新股发行体制的指导意见》，就完善询价和申购机制、优化网上发行制度、重视中小投资者参与意愿、加强风险提示、推动市场参与主体归位尽责等方面提出进一步改革措施。,372.0
67,二是加强证券公司监管。2009年，证监会出台《证券公司分类监管规定》和《关于加强上市证券公司监管的规定》等法律法规，促进证券公司持续规范发展，提升公司治理水平。,80.0
68,三是推动基金业规范化运作。2009年11月，证监会发布《证券投资基金评价业务管理暂行办法》，规范证券投资基金评价业务，引导长期投资理念，保护投资者合法权益。12月，发布《开放式证券投资基金销售费用管理规定》，规范基金销售市场秩序，完善基金销售费用结构和水平，促进基金业健康发展。,139.0
69,四是完善期货市场制度建设。2009年9月，《期货公司分类监管规定（试行）》开始实施，对于强化期货公司合规经营意识、促进期货行业稳定健康发展具有积极意义。此外，2009年10月30日，创业板市场正式推出。融资融券业务试点和股指期货已获原则同意。（三）加强对保险机构投资债券的管理，推进商业银行投资保险公司股权试点工作为进一步加强对保险机构投资债券的管理，中国保险监督管理委员会于2009年9月发布《关于债券投资有关事项的通知》，对保险机构投资企业（公司）债券的比例、债券发行人资质等规定进行了调整；并于2009年12月正式允许保险机构投资银行间债券市场发行的无担保企业债券，同时还明确了无担保债券的条件、信用级别、发行方式及保险机构的投资比例。,321.0
70,此外，为有序推动商业银行和保险公司开展相互投资试点，中国银行业监督管理委员会于2009年11月26日发布了《商业银行投资保险公司股权试点管理办法》，内容涉及商业银行准入、风险管理等多方面，并明确规定现阶段每家商业银行只能投资一家保险公司，且原则上应选择现有保险公司。,133.0
71,该办法将对规范和引导当前商业银行投资保险公司股权试点工作起指导作用，有利于防范风险跨行业传递，推动银保深层次合作顺利开展。美国、欧元区、日本复苏缓慢，失业率处于历史高位。新兴市场经济体，特别是亚洲经济体，则出现了较为明显的恢复性增长。国际货币基金组织2010年1月26日宣布，2009年全球经济增长率为-0.8，比2008年下降3.8个百分点。当前世界经济面临的主要风险包括，部分国家债务负担过大，财政可持续性堪忧；资金快速流入新兴市场经济体，推动局部地区资产价格过快上涨；发达经济体需求下降，贸易保护主义抬头等。,257.0
72,展望2010年，世界经济有望延续复苏的趋势，但是各经济体调整经济刺激计划的可能性加大、部分国家主权债务风险上升、局部地区通货膨胀上升，经济复苏不排除出现反复的可能。（一）主要经济体经济状况美国经济显现复苏迹象，但复苏内在动力不足，就业形势尚未好转。2009年美国GDP增长-2.4，而2008年为0.4，各季GDP增速经季节调整后折年率分别为-6.4、-0.7、2.2和5.7，增速逐季攀升。全年季节调整后的失业率为9.3，其中12月份为10，比上年同期上升2.6个百分点，创17年来新高。对外贸易总量萎缩，贸易逆差收窄。,261.0
73,"全年贸易总量为34868亿美元，占GDP比重为24.5，比上年减少5.6个百分点；贸易逆差为3807亿美元，占GDP比重为2.7，比上年减少2.1个百分点。受经济放缓和大规模财政计划影响，联邦政府财政赤字大幅攀升。在9月30日结束的2009财年，联邦财政赤字创下1.42万亿美元新高,占GDP的比重达到10,是二战以来最高纪录。CPI持续小幅上涨，但长期通货膨胀预期稳定。2009年全年CPI涨幅为-0.4，比2008年回落4.2个百分点。",220.0
74,12月份同比CPI为2.7。各季CPI环比经季节调整后折年率分别为2.2、3.3、2.5和3.3。欧元区经济缓慢复苏。2009年前三季度各季GDP增长经季节调整后折年率分别为-9.6、-0.4、1.7，从第三季度开始转正。就业形势逐月恶化，12月份季节调整后的失业率已达10，比上年同期上升1.8个百分点。,153.0
75,对外贸易总量大幅缩减，但由于出口降幅小于进口降幅，贸易差额从逆差转为顺差，1-11月份贸易总额同比下降21.5，贸易顺差达到1860亿欧元，而上年同期为逆差5310亿欧元。欧元区各国政府在财政刺激计划和银行救助上投入大量资金，公共领域债务和赤字问题严重。2009年欧元区预算赤字占GDP的比重达到6.4，比上年提高4.4个百分点，几家国际评级公司已经下调了希腊和西班牙的主权债务评级。通胀出现回升态势，但仍处于较低水平。2009年全年综合消费价格指数（HICP）上涨0.3，比上年回落3个百分点，同比涨幅从年初的1.1降至7月的-0.7，之后逐步上升，12月升至0.9。,285.0
76,日本经济依然疲弱，处于通缩状态。2009年前三季度各季GDP增长经季节调整后折年率分别为-11.9、2.7、1.3。就业形势不容乐观，11月份季节调整后的失业率为5.7，比上年同期上升1.7个百分点。对外贸易总量大幅缩减，但受外需增长拉动，出口持续回升，尽管全年贸易总额同比下降34，贸易顺差仍达到2.8万亿日元，同比增长36。新财年预算、债务创纪录，财政状况进一步恶化，2010财年的财政支出计划达到92万亿日元，而税收仅为37万亿日元，公共债务余额预计将达到973万亿日元。,239.0
77,通货紧缩重现，2009年全年CPI下降1.4，比上年回落2.8个百分点，其中2月份以后同比CPI已连续11个月负增长，12月份为-1.7??。新兴市场经济体经济复苏喜忧参半。亚洲新兴经济体由于财政和国际收支状况较好，外债负担较轻，复苏势头明显。中东地区由于经济结构相对单一，经济复苏一波三折。2009年11月25日迪拜债务事件爆发，引起全球市场动荡，并直接波及到希腊、西班牙、波罗的海三国等地。,197.0
