,paragraph,length
0,中国货币政策执行报告二○○九年第四季度中国人民银行货币政策分析小组2010年2月11日内容摘要2009年中国经济经受了国际金融危机的严峻考验。面对极其复杂的国内外形势，我国坚持积极的财政政策和适度宽松的货币政策，全面实施并不断完善应对国际金融危机的一揽子计划，2009年率先实现经济形势总体回升向好。2009年，实现国内生产总值（GDP）33.5万亿元，同比增长8.7，经济增速逐季加快。居民消费价格（CPI）下降0.7，年底出现上升。中国人民银行按照党中央、国务院统一部署，认真贯彻适度宽松的货币政策，保持银行体系流动性充裕，引导金融机构扩大信贷投放，优化信贷结构，加大金融支持经济发展的力度。,298.0
1,总体上，适度宽松的货币政策得到了有效传导，对扩张总需求、支持经济回升、遏制年初的通货紧缩预期发挥了关键性作用。同时，中国人民银行十分重视信贷平稳可持续增长和防范金融风险，前瞻、灵活地调整政策重点、力度和节奏。经过努力，三、四季度信贷增长比上半年有所放缓，节奏更趋平稳，有利于防范和化解可能影响经济长期稳定发展的风险。2009年年末，广义货币供应量M2余额为60.6万亿元，同比增长27.7，增速比上年高10.0个百分点。狭义货币供应量M1余额为22.0万亿元，同比增长32.4，增速比上年高23.3个百分点，货币流动性不断增强。,264.0
2,存款增长较快，活期化态势明显。贷款快速增长，中长期贷款增加较多。人民币贷款年末余额为40.0万亿元，同比增长31.7，增速比上年高13.0个百分点，比年初增加9.6万亿元，同比多增4.7万亿元。金融机构贷款利率先降后升，12月份，非金融性公司及其他部门贷款加权平均利率为5.25，比年初下降0.31个百分点。人民币汇率保持在合理均衡水平上的基本稳定。,175.0
3,2009年年末，人民币对美元汇率中间价为6.8282元。2010年我国经济面临的有利因素较多，国民经济有望继续保持平稳较快增长的基本态势，但也面临国内外复杂局面的挑战。一方面，尽管世界经济运行中的积极变化增多，但全球经济新的增长点尚不明朗，主要经济体继续加大刺激政策的空间有限，贸易摩擦加剧及刺激政策退出等不确定因素也会对国际经济和我国外部发展环境产生重要影响。另一方面，目前内需回升的基础还不平衡，民间投资和内生增长动力尚待强化，持续扩大居民消费、促进经济结构优化的任务还很艰巨。同时，要关注价格走势，加强金融风险防范。,261.0
4,必须把保持我国经济当前平稳较快发展和为长远发展营造良好条件有机结合起来，毫不动摇地加快经济发展方式转变。下一阶段，中国人民银行将按照中央经济工作会议和国务院统一部署，坚持市场机制和宏观调控有机结合，处理好保持经济平稳较快发展、调整经济结构和管理通胀预期的关系，巩固和增强经济回升向好势头。继续实施适度宽松的货币政策，把握好政策实施的力度、节奏和重点，保持政策的连续性和稳定性，根据新形势新情况着力提高政策的针对性和灵活性，提高金融支持经济发展的可持续性，维护金融体系健康稳定运行。加强流动性管理，综合运用多种货币政策工具，引导货币信贷总量合理增长，加大金融支持经济发展方式转变和经济结构调整的力度。同时，继续推进利率市场化改革，完善人民币汇率形成机制，加快金融市场产品创新，推动金融市场健康发展，继续深化金融企业改革。,359.0
5,一、货币供应量增长较快2009年年末，广义货币供应量M2余额为60.6万亿元，同比增长27.7，增速比上年高10.0个百分点。狭义货币供应量M1余额为22.0万亿元，同比增长32.4，增速比上年高23.3个百分点。流通中现金M0余额为3.8万亿元，同比增长11.8，增速比上年低0.9个百分点。全年现金净投放4027亿元，同比少投放71亿元。货币总量增长较快，货币流动性不断增强。,190.0
6,"前11个月，M2和M1增速总体呈上升势头，其中上半年加速态势更为明显。12月末，两者增速均有所回落，但仍保持较高水平，这与上年同期基数较高也有一定关系。年初，M1增速相对较低，1月末仅为6.7，比同期M2增速低12.1个百分点。此后M1增速明显加快，年中已恢复至危机前水平，9月份后，M1增速开始高于M2，第四季度持续维持30以上。二、金融机构存款增长较快，活期化态势明显2009年年末，全部金融机构（含外资金融机构，下同）本外币各项存款余额为61.2万亿元，同比增长27.7，增速比上年高8.4个百分点,比年初增加13.2万亿元，同比多增5.4万亿元。",277.0
7,其中，人民币各项存款余额为59.8万亿元，同比增长28.2，增速比上年高8.5个百分点，比年初增加13.1万亿元，同比多增5.4万亿元；外汇存款余额为2089亿美元，同比增长8.4，增速比上年低3.6个百分点，比年初增加162亿美元，同比少增157亿美元。,128.0
8,从人民币存款的部门分布和期限看，非金融性公司存款增长明显快于居民户存款，存款呈活期化态势。受经济逐步回升、资本市场活跃等因素影响，居民个人用于生产经营投资的资金增多，居民户存款增长明显放缓。年末金融机构居民户人民币存款余额为26.5万亿元，同比增长19.3，增速比上年低7.0个百分点，比年初增加4.3万亿元，同比少增3290亿元。非金融性公司存款全年加速增长态势较为明显，5月份后增速持续高于居民户存款。年末，非金融性公司人民币存款余额为29.8万亿元，同比增长37.2，增速比上年提高22.0个百分点，比年初增加8.1万亿元，同比多增5.2万亿元。,276.0
9,其中，企业存款增长较快，企业总体支付能力显著增强。年末，企业存款比年初增加6.6万亿元，同比多增4.2万亿元。活期存款多增较多，企业活期存款同比多增3.1万亿元，居民户活期存款同比多增1.1万亿元。年末，财政存款余额为2.2万亿元，同比增长24.2，比年初增加4368亿元，同比多增4098亿元。三、金融机构贷款快速增长，中长期贷款增加较多2009年年末，全部金融机构本外币贷款余额为42.6万亿元，同比增长33.0，增速比上年同期高15.1个百分点，比年初增加10.5万亿元，同比多增5.5万亿元。,250.0
10,本外币中长期贷款主要投向基础设施行业（交通运输、仓储和邮政业，电力、燃气及水的生产和供应业，水利、环境和公共设施管理业）、租赁和商务服务业、房地产业、制造业。2009年，主要金融机构（包括国有商业银行、政策性银行、股份制商业银行和城市商业银行）投向这四个行业的本外币中长期贷款分别为2.5万亿元、6404亿元、6013亿元和5025亿元，占全部产业新增中长期贷款的比重分别为50.0、13.1、12.3和10.2。人民币贷款保持较快增长。年末余额为40.0万亿元，同比增长31.7，增速比上年高13.0个百分点，比年初增加9.6万亿元，同比多增4.7万亿元。分机构看，2009年全国性金融机构新增贷款占全部金融机构新增贷款的比重比上年提高2个百分点，其中国有商业银行提升幅度较大，为6个百分点；地方金融机构信贷份额总体有所下降。,364.0
11,从部门分布看，居民户贷款增长逐步加快，非金融性公司及其他部门贷款保持较快增长。年末居民户贷款同比增长43.3，增速比上年高29.6个百分点，比年初增加2.5万亿元，同比多增1.8万亿元，其中主要是居民户消费性贷款，特别是个人住房贷款同比大幅多增。非金融性公司及其他部门贷款同比增长29.1，增速比上年高9.1个百分点，比年初增加7.1万亿元，同比多增2.9万亿元。其中，中长期贷款增长较快，比年初增加5.0万亿元，同比多增2.9万亿元。票据融资比年初增加4563亿元，同比少增1898亿元，全年呈现上半年大幅增加、下半年持续下降态势。,267.0
12,金融机构继续加大对中小企业的信贷支持力度。2009年我国银行业机构中小企业人民币贷款（含票据贴现）全年新增3.4万亿元，年末同比增长30.1，增速比年初高16.6个百分点。其中，小企业贷款同比增长41.4，增速比年初高34.2个百分点。国际金融危机发生后，国际金融市场受到巨大冲击，金融机构出于风险控制及增加收益的考虑将境外资产调回境内，在外汇贷款需求快速增长且外汇存款增长有限的情况下，支持了外汇贷款的发放。2009年年末，外汇贷款余额为3799亿美元，同比增长56.0，增速比上年提高44.1个百分点，比年初增加1362亿美元，同比多增1105亿美元，其中第四季度同比大幅多增600亿美元，主要与我国进出口逐步回暖、企业“走出去”步伐加快等因素有关。,327.0
13,从投向上看，进出口贸易融资和中长期贷款增加较多，2009年分别新增579.7亿美元和589.4亿美元，同比分别多增582.8亿美元和211.2亿美元。由于境外流动性头寸减持空间有限，年末外汇贷款增速有所放缓。专栏1：把握好货币信贷增速和节奏引导金融机构优化信贷结构为应对国际金融危机，2009年货币信贷支持经济发展力度很大，且随着形势变化信贷投放的波动性也比较大。2010年要更加注重根据实体经济的信贷需求均衡把握信贷投放节奏，改善信贷服务，着力优化信贷结构。一、2009年货币信贷增速、节奏和结构的基本情况2009年货币信贷总量较快增长。,270.0
14,年末M2和M1分别增长27.7和32.4，分别为1996年和1993年以来最高。全年新增人民币贷款9.59万亿元，同比多增达4.69万亿元，增速为31.7，为1985年以来最高，信贷支持经济发展力度很大。分季度看，上半年尤其一季度贷款投放较为集中，四个季度新增贷款分别为4.58万亿元、2.79万亿元、1.30万亿元和0.93万亿元。这一方面是年初反危机特殊时期的需要，另一方面也受到金融机构早投放早收益经营观念的影响。票据融资和短期贷款波动较大，中长期贷款季度波动相对缓和，四个季度分别为新增1.86万亿元、1.91万亿元、1.69万亿元和1.23万亿元。,279.0
15,从投向看，项目贷款投放较多，消费贷款增速持续加快，票据融资前增后降，对“三农”和小企业等薄弱环节的信贷支持力度较强。扣除消费贷款的中长期贷款全年新增5.15万亿元，同比多增2.99万亿元，有力支持了4万亿投资计划的实施。个人消费贷款全年新增1.80万亿元，同比多增1.30万亿元，其中上半年增加6508亿元，下半年增加1.15万亿元，加速增长态势明显。新增个人消费贷款中75左右为个人住房贷款，主要与住房消费有关。票据融资第一、二季度分别增加1.48万亿元和2248亿元，第三、四季度分别下降8262亿元和4240亿元。,260.0
16,涉农贷款和小企业贷款全年分别增加2.36万亿元和1.41万亿元，占同期新增各项贷款的比重分别为22.4和24.8，占比均呈明显上升态势。二、中国人民银行采取多项措施引导信贷合理增长在引导金融结构加大对经济发展支持力度的同时，中国人民银行十分重视信贷平稳可持续增长、信贷结构优化和金融风险防范，前瞻、灵活地调整政策重点、力度和节奏。2009年4、5月份连续对商业银行进行“窗口指导”，要求商业银行成为“稳定器”而不是“放大器”，合理把握信贷投放进度，正确处理金融支持经济发展与防范风险的关系。2009年年中以来，随着内需对经济增长的拉动作用显著增强，中国人民银行进一步加强窗口指导，提示金融机构加强对已发放贷款的风险评估。公开市场操作力度逐步加大并引导利率适当上行，7月初重启1年期央票发行，流动性回收力度增大，逐步从少量净投放过渡为持续净回笼，并对部分贷款增长过快的银行通过发行定向央票引导其注重贷款平稳适度增长。,407.0
17,指导金融机构按照“有保有控”的原则，加大对“三农”、中小企业、灾后重建等国民经济重点领域和薄弱环节的信贷支持，严格控制对高耗能、高污染和产能过剩行业企业的贷款，密切监测地方融资平台贷款可能潜藏的系统性金融风险隐患。,107.0
18,在多项措施的综合作用下，经过努力，三、四季度信贷增长比上半年有所放缓，从全年的分布情况看，贷款增速较高，但增势趋稳。三、2010年要力争实现信贷总量适度、节奏均衡、结构优化按照中央经济工作会议精神和国务院统一部署，2010年要处理好保持经济平稳较快发展、调整经济结构和管理好通胀预期的关系，促进经济发展方式转变。这就要求结合2010年经济增长实际需求、物价变动并综合考虑国内和国际市场流动性状况等因素，合理引导货币条件逐步从反危机状态回归常态水平。金融机构要切实把握好信贷投放节奏，使贷款保持均衡，防止季度、月度间过大波动。同时，要着力优化信贷结构，落实有保有控的信贷政策，使贷款真正用于实体经济，加大对重点领域和薄弱环节的支持力度。,317.0
19,一是信贷资金重点用于支持在建项目，严格控制新上项目贷款。新增中长期项目贷款额中用于新、老项目的比例按2/8开～3/7开安排。,62.0
20,二是优化贷款期限结构。新增中长期贷款占各项贷款的比重应较2009年有所回落，掌握在正常年份的平均水平。,51.0
21,三是继续加大对“三农”的信贷投入。春耕在即，涉农贷款增速原则上不应低于各项贷款平均增速。,44.0
22,四是大力增加对小企业和民营企业的信贷支持。力争小企业贷款增速高于全部企业贷款增速，新增小企业贷款占新增企业贷款的比重有所提高。,63.0
23,五是继续发展个人消费信贷，促进消费。四、银行体系流动性充裕2009年年末，基础货币余额为14.7万亿元，比年初增加1.8万亿元，同比增长14.1。年末货币乘数为4.11，较年内8月末的高点下降0.53，但比上年末高0.43，货币扩张能力总体较强。年末金融机构超额准备金率为3.13。其中，四大国有商业银行为1.72，股份制商业银行为3.13，农村信用社为8.78。,182.0
24,五、金融机构贷款利率先降后升，整体比上年下降2009年前三季度，非金融性公司及其他部门贷款利率水平回落后保持低位平稳运行。截至9月份，贷款加权平均利率为5.05，比年初下降0.51个百分点。进入第四季度后，受市场环境变化影响，利率小幅回升。12月份，非金融性公司及其他部门贷款加权平均利率达到5.25，但仍比年初下降0.31个百分点。其中，一般贷款加权平均利率为5.88，比年初下降0.35个百分点；票据融资加权平均利率为2.74，比年初下降0.15个百分点。,230.0
25,12月份，个人住房贷款加权平均利率为4.42。从利率浮动情况看，执行下浮和基准利率的贷款占比增加。12月份，非金融性公司及其他部门一般贷款实行下浮和基准利率的占比分别为33.19和30.26，比年初分别上升7.63个和0.13个百分点；实行上浮利率的贷款占比为36.55，比年初下降7.76个百分点。受国际金融市场利率波动和境内资金供求变化影响，境内外币利率总体呈下行走势。12月份，3个月以内、3（含3个月）-6个月美元贷款加权平均利率分别为1.59和1.66，比年初分别下降2.06个和2.36个百分点。,254.0
26,活期、3个月以内大额美元存款加权平均利率分别为0.17和0.46，比年初分别下降0.68个和0.76个百分点。2008年末至2009年上半年，部分金融机构多次自主下调了本行小额外币存款利率，1年期小额美元存款利率由3下调至0.8左右。为增加外币资金来源，2009年9月份部分金融机构小幅上调了本行小额外币存款利率，调整后的1年期美元存款利率为1左右。六、人民币汇率保持在合理均衡水平上的基本稳定2009年以来，为应对全球金融危机，人民币汇率保持在合理均衡水平上的基本稳定。年末，人民币对美元汇率中间价为6.8282元，比上年末升值64个基点，升值幅度为0.09；人民币对欧元、日元汇率中间价分别为1欧元兑9.7971元人民币、100日元兑7.3782元人民币，分别较上年末贬值1.41和升值2.53。,350.0
27,汇改以来至2009年年末，人民币对美元汇率累计升值21.21，对欧元汇率累计升值2.21，对日元汇率累计贬值0.98。根据国际清算银行的计算，汇改以来至2009年12月，人民币名义有效汇率升值12.7，实际有效汇率升值16.3。2009年，人民币对美元汇率中间价最高为6.8201元，最低为6.8399元，最大单日升值和贬值幅度均为0.07（50个基点），244个交易日中129个交易日升值、1个交易日持平和114个交易日贬值，2009年以来人民币对美元双边汇率保持稳定，基本上在6.81—6.85元的区间内运行，人民币汇率预期相对平稳。总体上，适度宽松的货币政策得到了有效传导，对扩张总需求、支持经济回升、遏制年初的通货紧缩预期发挥了关键性作用。同时，中国人民银行十分重视信贷平稳可持续增长和防范金融风险，前瞻、灵活地调整政策重点、力度和节奏。,373.0
28,经过努力，三、四季度信贷增长比上半年有所放缓，节奏更趋平稳，有利于防范和化解可能影响经济长期稳定发展的风险。一、适时适度开展公开市场操作2009年以来，中国人民银行按照适度宽松的货币政策要求，密切监测经济金融新形势及市场环境新变化，进一步加强对银行体系流动性供求的预测分析，灵活开展公开市场操作，促进银行体系流动性合理适度和货币市场利率平稳运行。,173.0
29,一是针对不同时期流动性形势变化，合理把握公开市场操作力度和频率，灵活适度加强流动性管理。全年累计发行中央银行票据4.0万亿元，开展正回购操作4.2万亿元；截至2009年年末，中央银行票据余额为4.2万亿元。,103.0
30,二是科学设计公开市场操作工具组合。视国内外经济金融形势和银行体系流动性供求情况，上半年以3个月内短期操作为主，7月初恢复了1年期中央银行票据发行，适当延长了流动性冻结时间。同时，灵活调整3个月以内的短期正回购操作期限结构，与中央银行票据在期限上形成互补，增强了流动性管理的针对性和灵活性。,144.0
31,三是适当提高公开市场操作利率弹性。上半年保持公开市场操作利率大体平稳，下半年随着经济企稳回升趋势的进一步确立，顺应新股IPO重启后市场利率波动上升的走势变化，及时增强了公开市场操作利率弹性，操作利率由小步上行到逐步企稳，有助于促进货币市场利率合理回升，发挥市场利率调节资金供求关系的作用。截至2009年年末，28天期正回购和3个月期中央银行票据操作利率分别为1.18和1.3280，较年初分别上升28个和36个基点；1年期中央银行票据发行利率为1.7605，自重启以来累计上升近26个基点。,245.0
32,四是及时开展中央国库现金管理商业银行定期存款业务。加强与积极财政政策的协调配合，逐步提高了中央国库现金管理商业银行定期存款业务的操作频率及规模，操作品种也进一步丰富。全年共开展11期业务，操作规模共计3100亿元，年末余额为1200亿元。二、引导金融机构合理把握信贷投放节奏，优化信贷结构加强货币政策与财政政策、产业政策的协调配合，引导金融机构加大对中央投资项目的配套贷款投放，做好“家电下乡”、“汽车下乡”等金融配套服务；按照“有保有控”的原则，加大对“三农”、中小企业、西部大开发、节能减排、就业、助学、灾后重建等国民经济重点领域和薄弱环节的信贷支持；严格控制对高耗能、高污染和产能过剩行业盲目发放的贷款。改进和完善再贴现管理方式，优先为涉农票据、县域企业及中小金融机构签发、承兑、持有的票据办理再贴现，对于促进扩大涉农行业和中小企业融资发挥了积极的引导作用。,382.0
33,同时，密切监测地方投融资平台贷款可能潜藏的系统性金融风险隐患。督促商业银行合理把握信贷投放进度，正确处理金融支持经济发展与防范风险的关系，执行好资本充足率、贷款集中度、固定资产投资项目最低资本金等监管指标要求，确保自身健康和维护整体金融稳定，实现可持续发展。三、稳定存贷款基准利率在2008年9月份以来五次下调存贷款基准利率的基础上，2009年利率政策保持稳定，其中，一年期存款基准利率维持在2.25，一年期贷款基准利率维持在5.31。同时，稳步推进利率市场化改革，继续积极培育货币市场基准利率，指导金融机构完善利率定价机制。四、积极参与国际金融危机应对合作，稳步推进跨境贸易人民币结算试点中国人民银行积极呼应周边国家和地区的需求，先后与韩国、香港、马来西亚、印尼、白俄罗斯和阿根廷货币当局签署了6份总规模为6500亿元人民币的双边本币互换协议。,373.0
34,积极推动国际货币基金组织（IMF）发债融资，在积极参与并充分考虑自身情况的前提下，与IMF签署了购买不超过500亿美元IMF债券的协议。积极推动包括清迈倡议多边化在内的区域货币金融合作，2009年12月24日，东盟10+3以及中国香港正式签署了总额为1200亿美元的清迈倡议多边化协议。为了促进贸易发展，积极参与了国际金融公司贸易融资计划以及泛美开发银行贸易融资计划。积极推动贸易投资便利化，跨境贸易人民币结算试点顺利展开。经国务院批准，2009年7月上海市和广东省广州市、深圳市、珠海市、东莞市的365家企业开始跨境贸易人民币结算试点，以帮助企业规避汇率风险，减少汇兑损失，推动我国与周边国家和地区经贸关系发展。,307.0
35,试点以来，人民币跨境收付信息管理系统运行稳定，人民币账户融资、跨境项目融资、人民币购售等相关业务有序进行。人民币结算、出口退（免）税及进出口报关政策清晰明确、操作流程便利，人民币资金跨境清算渠道便捷、顺畅，企业在进行人民币报关、结算和出口退税不用提交核销单、出口收入也不用先进待核查账户，简化了试点企业的办事手续，缩短了资金到账时间，有利于节约交易费用。截至2009年年末，银行累计为企业办理跨境贸易人民币结算业务409笔，金额为35.8亿元。境内代理银行为境外参加银行共开立160个人民币同业往来账户，账户余额6.9亿元；中银香港为境外参加银行开立53个人民币同业往来账户，账户余额486.2亿元。五、稳步推进金融机构改革中国工商银行、中国银行、中国建设银行和交通银行四家已改制上市的大型国家控股商业银行改革继续深化，经营业绩和服务效能不断提高。,374.0
36,中国农业银行2009年1月16日股份公司挂牌以来，现代公司治理架构初步建立，内部改革和经营机制转换工作稳步推进，“三农”金融事业部制改革试点取得了一定成效，并向全国推开。国家开发银行加快商业化转型步伐，强化风险管理和内控建设。2009年8月末，国开金融有限责任公司挂牌成立，国家开发银行在传统业务基础上通过该公司大力发展股权投资业务。同时，继续推进政策性金融机构改革。根据国务院要求，2009年3月，中国人民银行会同有关单位和部门成立了中国进出口银行和中国出口信用保险公司改革工作小组，围绕政策性功能定位、业务范围、国家注资、公司治理和内部改革、章程修订、外部监管、协调机制、配套改革措施等问题，重点研究论证改革实施总体方案及章程修订工作。,320.0
