,paragraph,length
35,"2005年人民币汇率形成机制改革以来至2011年6月末，人民币对欧元汇率累计升值6.97，对日元汇率累计贬值8.95。上半年，银行间外汇市场人民币对俄罗斯卢布、马来西亚林吉特等新兴市场货币报价活跃，为微观经济主体提供了双边直接汇率，支持了双边经贸发展。七、继续推进金融机构改革重点金融机构改革稳步推进。积极支持和指导中国农业银行“三农金融事业部”改革，相关部门出台的营业税减免、监管费减免和差别化存款准备金率等支持政策基本落实到位。密切关注改革试点进展情况，中国人民银行分支机构顺利完成对四川、重庆、湖北等八个试点省（区、市）现场检查评估工作，客观评估和总结中国农业银行“三农金融事业部”改革成效和存在的问题,提出下一步的改革建议。",316.0
36,继续牵头研究论证中国进出口银行和中国出口信用保险公司改革方案，5月份中国出口信用保险公司改革实施总体方案经国务院批准后，中国人民银行会同有关部门正在积极推动注资、建立健全公司治理等相关工作。此外，会同有关部门积极推动中国农业发展银行不断深化内部改革，加强风险管理和内控机制建设，为全面改革创造条件。农村信用社改革取得重要进展和阶段性成果。,169.0
37,一是农村信用社资产质量明显改善。6月末，按贷款五级分类口径统计，全国农村信用社不良贷款余额和比例分别为3865亿元和6.1，比上年末分别下降339亿元和1.3个百分点。资本充足率为8.3。,94.0
38,二是农村信用社资金实力显著增强。6月末，全国农村信用社的各项存贷款余额分别为9.5万亿元和6.4万亿元，占全国金融机构各项存贷款余额的比例分别为12.1和12.4，比上年末分别提高0.2个和0.6个百分点。,103.0
39,三是农村信用社支农服务力度明显加大。6月末，全国农村信用社的涉农贷款、农户贷款余额分别为4.4万亿元和2.3万亿元，比上年末分别增加4799亿元和2575亿元，增幅分别为12.4和12.7。,95.0
40,四是产权制度改革继续推进。截至6月末，全国共组建以县（市）为单位的统一法人农村信用社1954家，农村商业银行115家，农村合作银行216家。八、深化外汇管理体制改革加大对“热钱”流入打击力度，有效抑制违法违规资金流入。在2010年11月出台加强银行结售汇头寸、出口收结汇、短期外债管理等七项措施的基础上，2011年3月再次启动应对预案，强化对转口贸易收汇、预收货款和延期付款、银行结售汇头寸的管理，进一步下调2011年度境内金融机构短期外债指标总规模。组织开展对外商投资企业资本金结汇和银行外汇业务等专项检查，加大对大要案件的查处力度，破获多起地下钱庄、非法网络炒汇等违法犯罪案件，有力打击各类违法犯罪活动。,304.0
41,完善跨境资金流动监管，防范异常跨境资本流动风险。加强与商务部门沟通协调，从严控制外资房地产企业设立备案，严格控制对返程投资设立外资房地产企业的外汇登记及结汇。更新银行执行外汇管理规定情况考核制度，督促银行合规经营。完善部分资本项目外汇管理，进一步规范了资本项下人民币业务、返程投资以及中央企业境外衍生交易等操作规程。加强跨境资金流动监测分析，建立《跨境资金流动监测分析月报》制度，完善国际收支风险监测和指标预警体系。,208.0
42,推进货物贸易外汇管理改革，规范并引导外汇业务发展。继续做好进口付汇核销改革推广工作，积极准备出口收汇核销改革，将进出口核销改革统筹考虑、通盘规划。调整简化部分资本项目管理政策措施，下放贸易信贷、对外担保等五项业务的审批权限，帮助企业降低经营成本，提高经营效率。完善银行自身结售汇业务管理，促进银行有序开展自身结售汇业务及相关经营活动。出台《电子银行个人结售汇业务管理暂行办法》，以便利个人通过电子银行渠道办理结售汇业务。,210.0
43,推出人民币对外汇期权交易，加强银行期权交易风险头寸的管理，进一步满足市场主体规避汇率风险的多样化需求。加强外汇储备资产投资和风险管理，努力提高投资收益。灵活调整投资策略，积极优化货币资产结构，拓展多元化经营管理，创新外汇储备运用方式，加强委托贷款办公室的建设，支持和配合国家经济和社会发展。货币市场交易活跃，利率波动走高；债券收益率曲线总体上移，债券发行规模明显增加；股市指数小幅回落，股票成交较为稳定。一、金融市场运行分析（一）货币市场交易活跃，利率波动走高银行间回购、拆借市场交易活跃，成交量大幅增加。,253.0
44,上半年，银行间市场债券回购累计成交46.5万亿元，日均成交3810亿元，日均同比增长21.1；同业拆借累计成交14.5万亿元，日均成交1192亿元，日均同比增长30.5。从期限结构看，市场交易仍主要集中于隔夜品种，债券回购和拆借隔夜品种的成交分别占各自总量的76.8和86.7，占比同比分别下降2.6个和1.0个百分点。交易所市场政府债券回购累计成交5.31万亿元，同比增长101.4。从机构融资情况看，上半年国有商业银行净融出资金8.5万亿元，同比减少1.5万亿元；其他商业银行净融入资金1.8万亿元，同比减少2.3万亿元。非银行金融机构融资需求大幅增长，同比多增5369亿元，其中保险公司融资需求明显增加。,305.0
45,此外，随着自身资产负债状况的改善，外资金融机构融资量同比减少1.3万亿元。货币市场利率波动中趋于上升。受连续上调存贷款基准利率和法定存款准备金率、通胀预期上升以及考核要求强化等因素综合影响，货币市场利率在波动中明显上行。6月份同业拆借加权平均利率为4.56，分别比3月和上年12月份高263个和164个基点；质押式回购加权平均利率为4.94，分别比3月和上年12月份高296个和182个基点。6月末，隔夜、7天Shibor分别为5.0和6.6，分别较年初上升207个和229个基点；3个月和1年期Shibor分别为6.39和5.14，分别较年初上升183个和149个基点。,286.0
46,人民币利率互换交易大幅增加。2011年上半年，共发生交易9609笔，名义本金总额为12275亿元，同比大幅增长152.8。从参考利率来看，人民币利率互换交易的浮动端参考利率主要包括7天回购定盘利率和Shibor，与之挂钩的利率互换交易名义本金占比分别为60.3和35.3。（二）国债收益率曲线总体有所上移，债券发行规模明显增加银行间债券市场现券交易量平稳增长。上半年累计成交30.7万亿元，日均成交2519亿元，日均成交同比增长25.6。,219.0
47,从交易主体看，国有商业银行和外资金融机构是银行间现券市场上的净买入方，分别净买入现券3042亿元和1244亿元；其他商业银行是主要的净卖出方，净卖出现券3627亿元。交易所国债现券成交610亿元，同比少成交360亿元。银行间债券市场走势总体偏弱。银行间市场中债综合净价指数1由年初的99.8点下降至6月末的99.1点，下跌0.64；银行间市场中债综合全价指数由年初的132.9点升至6月末的134.1点，上涨0.87。交易所市场国债指数由年初的126.3点升至6月末的128.6点，上涨1.77。,248.0
48,5.00国债收益率曲线总体有所上移。2011年上半年，国债短期收益率受货币市场利率波动影响较大，3、4月份处于相对较低水平，随1中债综合净价指数反映债券净价走势，不含利息再投资因素；中债综合全价指数反映债券投资总收益，既包含债券净价的变动，也包含利息再投资因素。着货币市场利率快速上行，短期国债收益率也于6月末达到年内较高水平。中长期收益率由于机构债券配置需求较为旺盛，前4个月基本保持平稳，5、6月份随着前期一系列调控措施的累积效用逐步体现，加之受通胀预期有所增强的影响，中长期收益率上行幅度较大，国债收益率曲线总体较年初有所上移。债券市场发行规模明显增加。,280.0
49,上半年累计发行各类债券（不含中央银行票据）3.19万亿元，同比增长38.9。其中商业银行为提高资本充足率而发行的银行次级债和混合资本债增长较快，同比增长183.8；政策性金融债也保持较快的发行进度，同比增长109.2；国债发行规模稳步增加，上半年共发行8378亿元，同比增长1.0。截至6月末，中央国债登记结算有限责任公司债券托管量余额为20.4万亿元。债券发行利率总体呈走高趋势。2011年6月，财政部发行的10年期记账式付息国债票面利率为3.99，比3月发行的同期限国债高16个基点；国家开发银行发行的5年期固定利率政策性金融债利率为4.33，比3月发行的同期限债券高34个基点。,292.0
50,Shibor对债券类产品定价基准作用不断提升。2011年上半年，一级市场共发行以Shibor为基准的浮动利率债券12只，总发行量为1271.3亿元，占全部浮息债发行总量的30.1，其中浮动利率政策性金融债8只，发行量为1147亿元。此外，发行固定利率企业债124只，总发行量为1411亿元，全部参照Shibor定价。发行参照Shibor定价的固定利率短期融资券1225亿元，占固定利率短融发行总量的24.8。（三）票据融资企稳回升，票据市场利率有所上行票据融资余额企稳回升，票据市场交易活跃。,246.0
51,上半年，企业累计签发商业汇票7.6万亿元，同比增长38.3；累计贴现13.2万亿元，同比增长9.0。期末商业汇票未到期金额6.7万亿元，同比增长42.8；贴现余额1.4万亿元，同比下降21.6。随着金融机构调整资产结构，一般贷款增速趋缓，金融机构提供票据融资的意愿有所增强，票据融资呈逐步回升趋势。期末票据融资余额比上个季度末增加1200亿元，在各项贷款中占比为2.6，比上个季度上升0.1个百分点。受货币市场利率和票据市场供求变化等多种因素影响，第二季度票据市场利率震荡上行，总体处于高位运行。,248.0
52,（四）股指小幅回落，股票成交较为稳定股票市场总体有所回落。6月末，上证综合指数和深证成份指数分别收于2762点和12111点，比3月末分别回落5.7和3.6，比上年末分别回落1.6和2.8。沪市A股平均市盈率从上年末的21.6倍下降到6月末的16.5倍；深市从45.3倍回落到30.7倍。股票市场成交量小幅增加。2011年上半年，沪、深股市累计成交24.7万亿元，同比增长9.1；日均成交2075亿元，同比多成交156亿元。,212.0
53,6月末市场流通市值20.1万亿元，比上年末增长4.0。股票市场筹资额有所减少。初步统计，2011年上半年各类企业和金融机构在境内外股票市场上通过发行、增发、配股、行权以及可转债方式累计筹资3362亿元，同比少筹资667亿元。（五）保险业总资产保持较快增长2011年上半年保险业累计实现保费收入8057亿元2，累计赔款、给付1959亿元，同比增长33.0。其中，财产险赔付同比增长23.4，寿险赔付同比增长37.7。,207.0
54,保险业总资产继续保持较快增长速度。2011年6月末，保险业总资产5.7万亿元，同比增长27.0，比上年末上升1.7个百分点。其中，银行存款同比增长39.0，比上年末上升6.3个百分点；投资类资产同比增长18.8，比上年末回落6.8个百分点。2由于2011年保监会对保费收入口径进行调整，故该指标与上年不可比。（六）外汇市场交易活跃人民币外汇远期和“外币对”交易规模快速扩张。,187.0
55,上半年人民币外汇即期成交17508亿美元，同比增长13.2；人民币外汇掉期交易累计成交金额折合7926亿美元，同比增长25.7，其中隔夜美元掉期成交4418亿美元，占掉期总成交额的55.4；人民币外汇远期市场累计成交1159亿美元，同比增长2013。,125.0
56,上半年“外币对”累计成交金额折合492亿美元，同比增长74.3，其中成交最多的产品为美元对港币，市场份额为43.3，同比下降22.1个百分点。截至2011年6月末，共有即期市场会员302家，远期市场会员73家，掉期会员72家，人民币对外汇期权市场会员16家。（七）黄金市场运行平稳上半年，上海黄金交易所各贵金属品种总成交金额为19678亿元，同比增长120.7。其中，黄金累计成交2906.3吨，同比下降8.4，成交金额8891.1亿元，同比增长10.1；白银累计成交13.2万吨，同比增长630.6，成交金额10663.2亿元，同比增长1340；铂金累计成交31.9吨，同比增长14.3，成交金额123.8亿元，同比增长22.3。2011年上半年，上海黄金交易所黄金价格走势与国际市场黄金价格走势保持一致。,354.0
57,1月份，黄金价格呈下跌趋势，2月至6月，黄金价格不断上升，并连创历史新高，伦敦下午定盘价最高达每盎司1552.50美元。国内黄金价格最高为每克323.50元，最低价为每克281.20元。6月末，黄金价格为每克313.06元，比上年末上涨了3.95。二、金融市场制度建设（一）加强银行间债券市场管理规范债券招标发行管理。在总结近年来债券招标发行管理实践经验的基础上，中国人民银行对《银行间债券市场债券发行现场管理规则》（银发〔2002〕199号）进行了细化，并于2011年5月发布了《银行间债券市场债券招标发行管理细则》（银办发〔2011〕128号）。,275.0
58,加强银行间债券市场的交易管理。2011年4月发布中国人民银行公告〔2011〕第3号，对债券交易管理提出了具体要求，引入了重大异常交易披露制度、异常交易事前报备制度，并进一步强化了交易备案和结算代理人对委托人的监督责任，有利于进一步规范全国银行间债券市场债券交易行为，促进全国银行间债券市场健康发展。进一步完善市场价格发现机制。中国人民银行与财政部于2011年4月联合发布了中国人民银行、财政部公告〔2011〕第6号，引入新发关键期限国债双边报价机制。公告对全国银行间债券市场做市商应当进行做市的新发关键期限国债的期限、做市券种单笔报价数量、报价累计时间等提出了具体的要求，进一步改善市场价格发现机制，有利于完善国债收益率曲线。,313.0
59,推动非金融企业债务融资发展。经中国人民银行备案同意，中国银行间市场交易商协会于2011年4月发布了《银行间债券市场非金融企业债务融资工具非公开定向发行规则》。中国五矿集团、中国国电集团、中国航空工业集团等3家企业于5月份在银行间市场成功发行130亿元定向债务融资工具，标志着中国企业债务融资定向发行方式开始实施。（二）完善证券市场基础性制度建设建立健全期货公司分类监管制度。2011年4月，中国证券监督管理委员会发布《期货公司分类监管规定》，依据期货公司风险管理能力、公司市场竞争力、培育和发展机构投资者状况、持续合规状况，对不同类别的期货公司在监管资源分配、现场检查和非现场检查频率等方面区别对待。,300.0
60,期货公司分类结果将作为期货公司申请增加业务种类、新设营业网点等事项的审慎性条件，也将作为期货公司开展创新业务试点和确定期货投资者保障基金缴纳比例的依据。进一步规范证券市场信息披露。2011年4月，证监会发布《信息披露违法行为行政责任认定规则》，通过明确信息披露违法行为责任认定和区分的具体规则，督促、引导相关当事人诚实守信，推动发行人及上市公司不断提高信息披露质量，优化完善法人治理结构。继续推进产品与业务创新。2011年4月，经证监会批准，焦炭期货合约在大连商品交易所上市交易，旨在完善焦炭价格形成机制，更好地帮助现货企业及时、准确地把握市场变化趋势，增强决策的预见性和科学性，促进焦炭市场的平稳运行。,302.0
61,同期，证监会发布《期货公司期货投资咨询业务试行办法》，从资本实力和合规角度对期货公司申请期货咨询业务作出规定。（三）完善保险市场基础性制度建设规范人身保险业务经营。2011年7月，中国保险监督管理委员会发布《关于规范人身保险业务经营有关问题的通知》，首次明确保单贷款期限一般不超过半年，在犹豫期内，投保人可以无条件解除保险合同，保险公司除收取不超过10元的成本费以外，应退还全部保费。开展变额年金试点。2011年5月，保监会公布《关于开展变额年金保险试点的通知》和《变额年金保险管理暂行办法》，在上海、北京、广州、深圳、厦门五地正式启动变额年金保险试点。,277.0
62,变额年金保险兼顾养老、投资、最低保证三方面功能，有利于丰富寿险产品结构，促进养老年金类产品发展，发挥寿险长期储蓄功能，满足保险消费者的真实需求。调整保险资产管理公司管理。为防范资金运用风险，促进资产管理业务发展，2011年4月，保监会发布了《关于<调整保险资产管理公司管理暂行规定>有关规定的通知》，对保险资产管理公司的经营范围、设立条件等进行了调整，如放宽了成立年限，提高了偿付能力和总资产要求等。严格市场准入。为规范和指导保险公司开业验收，完善保险市场准入程序，2011年4月，保监会发布了《保险公司开业验收指引》，进一步规范了中资保险公司的开业申请材料，明确规定公司获准开业前不得动用资本金。,299.0
63,第二轮量化宽松政策（QE2）已于6月底如期结束，但美国经济仍受失业率高企、房地产市场低迷和债务风险等问题困扰，增长势头放缓。欧元区主权债务问题进一步恶化，希腊、西班牙、意大利等国风险溢价上升，为确保欧元区和整个欧盟的金融稳定，7月21日召开的欧盟领导人峰会同意向希腊提供新一轮救助贷款；由于通胀压力持续增加，7月7日欧央行宣布年内第二次加息。地震、海啸和核泄漏灾难导致日本生产、出口和消费下滑，并对全球产业链造成负面影响。,211.0
64,二是多数新兴和发展中经济体继续强劲增长，但仍面临抑制通胀和防止短期跨境资本大幅波动的挑战，宏观调控难度加大。多数新兴经济体持续强劲增长，但为应对跨境资本大幅波动和经济过热等风险，部分新兴经济体主动收紧了宏观政策，经济增速有所放缓。但受国内紧缩政策和国际市场风险上升等事件交替影响，近期跨境资本流动的波动性上升。,155.0
65,三是商品价格趋稳，但上行压力仍未消除。由于担心欧美需求疲软，且国际能源署（IEA）于6月23日宣布释放6000万桶原油储备，国际油价近期略有回落。但考虑到日本灾后重建以及西亚北非局势依然紧张，短期内石油价格大幅回调的可能性不大。遏制通胀已经成为发达国家和新兴经济体共同面临的挑战。（一）主要经济体经济形势美国复苏势头放缓，高失业率、房地产市场和政府债务等问题仍无明显改善。,186.0
66,由于消费支出疲软，美国第二季度实际GDP增速仅为1.3（环比折年率，初值），低于市场预期。此外，第一季度GDP增速由此前公布的1.9大幅下调至0.4。尽管核心通胀仍然较低，受能源和食品价格上涨影响，5、6月份CPI均同比上涨3.6，达到2008年10月以来的高点。由于新增就业岗位有限，失业率止跌回升，6月份升至9.2的年内最高水平。房地产价格跌至2002年中水平，由于库存较大，未来房价仍有下行空间。,201.0
67,与此同时，债务风险上升。5月16日美国国债总额触及14.29万亿美元的法定上限；国会两党经过多轮谈判，于美国时间8月2日通过“2011年预算控制法案”，提高了债务上限。此前标普和穆迪已先后于4月18日和7月13日将美国主权信用评级列入负面观察名单，惠誉也对美国主权债务前景表示担忧。债务上限提高后，美国违约风险在短期内基本消除，但仍面临中长期债务可持续性风险。美国时间8月5日，标普将美国长期主权信用评级由AAA调降至AA+，这是美国历史上首次失去AAA评级。,230.0
68,美国经济在复苏乏力的同时也存在部分亮点。,20.0
69,一是受“出口倍增”计划影响，4月份出口创下1758亿美元的历史新高。,34.0
70,二是税收收入增加带动联邦财政赤字大幅收窄，4、5月份分别降至408亿和576亿美元。欧元区经济受德国等带动稳固复苏，核心通胀温和上升，主权债务风险持续上升。受德、法等国投资拉动，第一季度欧元区经济同比增长2.5，但下行风险犹存。,114.0
71,一是各成员分化仍然明显。德国经济持续强劲，法国、意大利温和复苏，希腊、葡萄牙和爱尔兰等国继续疲软，主权评级连遭下调，导致融资形势再度紧张。,69.0
72,二是市场担心主权债务危机可能向欧元区核心国家蔓延，西班牙、意大利等国的风险溢价骤升。由于希腊债务重组问题迟迟无法解决，6月13日，标普公司将希腊长期主权债评级从“B”下调至“CCC”，为全球最低。为巩固市场信心、确保金融稳定，7月2日及8日，欧元区和国际货币基金组织（IMF）分别决定向希腊拨付第一轮援助计划的第五笔贷款，共计153亿欧元；7月21日，欧盟峰会批准了1090亿欧元的第二轮希腊救助方案，计划由欧洲金融稳定基金（EFSF）和IMF联合出资。,227.0
73,三是物价水平持续攀升。受能源、食品价格大幅走高影响，6月欧元区HICP同比上涨2.7，连续7个月高于欧央行2的通胀目标。地震、海啸和核泄漏灾难对日本生产和出口造成沉重打击。,86.0
74,一是经济、就业形势严峻。第一季度日本实际GDP下降3.5（环比折年率），虽然6月份失业率保持在4.6的震前水平，但该统计并未包括重震灾区。,69.0
75,二是核心CPI由负转正，但通缩趋势犹存。4-6月核心CPI时隔28个月后连续三个月实现同比增长，但耐用消费品的价格仍在下降。,62.0
76,三是贸易赤字激增。由于汽车、电子产业链遭到严重破坏，震后日本出口骤减，5月份贸易赤字高达8537亿日元，仅低于2009年1月时的危机期间水平。新兴经济体面临跨境资本波动和经济过热风险，西亚和北非政局动荡影响区域及全球经济稳定。在内外需求带动下，主要新兴经济体的生产、贸易规模已超过危机前水平，但受国内紧缩政策和国际市场风险上升等事件交替影响，跨境资本呈“先流出、后流入”的特征，加大了政策制定难度。2011年以来，西亚和北非动荡波及突尼斯、埃及等十几个国家，利比亚等国甚至发生战乱，恐慌情绪和避险行为带动国际原油和黄金价格大幅走高。,266.0
77,由于担心欧美需求疲软，加上国际能源署于6月23日宣布释放6000万桶原油储备，国际油价近期有所回落，但能源价格波动加大了金融市场和实体经济风险。（二）国际金融市场概况2011年上半年，主要国际货币对美元汇率宽幅震荡，具体可分为两个阶段：1-4月，全球经济整体运行平稳，市场避险情绪回落，投资者更多买入其他风险资产，主要货币对美元持续升值，日元受震后资金回流等影响，一度创下历史新高；5-6月，受希腊主权债务危机恶化、美国经济复苏势头放缓、全球股市普跌等影响，主要货币对美元高位震荡。6月末，欧元兑美元汇率为1.4504美元/欧元，较上年末升值8.4；日元兑美元汇率为80.52日元/美元，较上年末升值0.8；美联储公布的美元广义名义贸易加权指数上半年累计贬值4.2。避险需求压低国际主要债券收益率。4月6日，葡萄牙成为继希腊、爱尔兰之后第三个向欧盟申请救助的欧元区国家。,385.0
