,paragraph,length
0,中国人民银行货币政策分析小组2011年8月10日内容摘要2011年上半年，中国经济增长由政策刺激向自主增长有序转变，继续朝宏观调控的预期方向发展。消费需求保持稳定，固定资产投资增长较快，进出口总体平稳较快增长，农业生产形势良好，工业企业效益较好，居民收入稳定增长，但国内通胀预期依然较强，稳定物价的基础还不牢固。2011年上半年，实现国内生产总值（GDP）20.4万亿元，同比增长9.6，居民消费价格同比上涨5.4。2011年以来，中国人民银行按照国务院统一部署，围绕保持物价总水平基本稳定这一宏观调控的首要任务，实施稳健的货币政策，综合、交替使用数量和价格型工具以及宏观审慎政策工具，6次上调存款类金融机构人民币存款准备金率共计3个百分点，3次上调金融机构人民币存贷款基准利率，灵活开展公开市场操作，实施差别准备金动态调整机制，加强流动性管理，引导货币信贷增长平稳回调，保持合理的社会融资规模，引导金融机构着力优化信贷结构。在多项调控措施的综合作用下，货币信贷增长进一步向常态回归。,442.0
1,2011年6月末，广义货币供应量M2余额为78.1万亿元，同比增长15.9，增速比3月末低0.7个百分点。人民币贷款余额同比增长16.9，增速比3月末低1.0个百分点，比年初增加4.17万亿元，同比少增4497亿元。上半年社会融资规模增加7.76万亿元，直接融资占比显著上升。金融机构贷款利率继续上升，6月份非金融企业及其他部门贷款加权平均利率为7.29，比3月份上升0.38个百分点。6月末，人民币对美元汇率中间价为6.4716元，比上年末升值2.33。,228.0
2,下一阶段，中国人民银行将按照国务院统一部署，以科学发展为主题，以加快转变经济发展方式为主线，实施好稳健的货币政策，继续把稳定物价总水平作为宏观调控的首要任务，坚持调控的基本取向不变，加强对国内外经济形势的观察和分析，把握好政策的力度和节奏，提高政策的针对性、灵活性和前瞻性，巩固前期调控成果，科学评估判断政策的当期和预期效果，处理好保持经济平稳较快增长、调整经济结构和管理通胀预期之间的关系。,196.0
3,根据经济金融形势和外汇流动的变化情况，合理运用利率、汇率、公开市场操作、存款准备金率和宏观审慎管理等多种政策工具组合，保持合理的社会融资规模。着力优化信贷结构，引导金融机构提高金融服务水平，加大对结构调整特别是农业、小企业的信贷支持。进一步执行好差别化住房信贷政策，督促金融机构对符合条件的保障性住房建设项目及时发放贷款，促进房地产市场健康平稳发展。加强系统性风险防范。继续加强地方融资平台公司贷款、表外资产和房地产金融的风险管理，加强对跨境资本的有效监控。,229.0
4,进一步推进利率市场化改革和人民币汇率形成机制改革，继续深化金融企业改革。充分发挥金融市场在资源配置中的基础性作用，进一步扩大直接融资渠道，支持金融产品创新，推动金融市场服务实体经济发展。一、货币供应量增速总体回落2011年6月末，广义货币供应量M2余额为78.1万亿元，同比增长15.9，增速比3月末和上年末分别低0.7个和3.8个百分点。狭义货币供应量M1余额为27.5万亿元，同比增长13.1，增速比3月末和上年末分别低1.9个和8.1个百分点。流通中货币M0余额为4.4万亿元，同比增长14.4，增速比3月末和上年末分别低0.4个和2.3个百分点。,277.0
5,上半年现金净回笼110亿元，同比多回笼766亿元。总体看，在公开市场操作、存款准备金率、利率等多项货币政策以及宏观审慎工具的综合作用下，货币总量增长平稳回调，符合调控预期。截至5月末，M2增速和M1增速比上年末分别下降4.6个和8.5个百分点。6月份，货币供应量增速有所反弹，M2增速和M1增速分别比上月回升0.8个和0.4个百分点，货币总量调控仍存压力。6月末，基础货币余额为20.3万亿元，同比增长32.7，比年初增加2.1万亿元。,218.0
6,"6月末，货币乘数为3.84，比3月末和上年末分别低0.10和0.08。6月末，金融机构超额准备金率为0.8。其中，农村信用社为2.9。二、金融机构存款增长有所放缓6月末，全部金融机构（含外资金融机构，下同）本外币各项存款余额为80.3万亿元，同比增长17.5，增速比3月末和上年末分别低1.2个和2.3个百分点,比年初增加7.5万亿元，同比少增533亿元。人民币各项存款余额为78.6万亿元，同比增长17.6，增速比3月末和上年末分别低1.4个和2.6个百分点，比年初增加7.3万亿元，同比少增1846亿元。",254.0
7,外币存款余额为2564亿美元，同比增长17.9，比年初增加307亿美元，同比多增246亿美元。从人民币存款部门分布看，住户存款增长较快，非金融企业存款增速趋稳。6月末，金融机构住户存款余额为33.4万亿元，同比增长17.0，增速比3月末低0.9个百分点，比上年末则高0.5个百分点，比年初增加3.3万亿元，同比多增5547亿元。非金融企业人民币存款余额为29.4万亿元，同比增长14.8，增速比3月末和上年末分别低1.8个和6.7个百分点，比年初增加1.6万亿元，同比少增1.3万亿元。其中，非金融企业人民币存款增速比5月份和4月份分别回升0.5个和0.3个百分点，增速趋稳；加之企业产销较好，银行承兑汇票增长很快，企业支付能力总体良好，资金状况正常。,326.0
8,上半年企业签发的银行承兑汇票累计发生额为7.2万亿元，同比多增1.9万亿元。中国人民银行5000户企业监测数据显示，第二季度企业销货款回笼指数为70，比上年同期上升1.1个百分点；企业支付能力指数和流动比率分别比上年同期高0.7个和2.0个百分点，均处于2000年以来的较高水平。6月末，财政性存款余额为3.6万亿元，同比增长12.8，比年初增加9748亿元，同比多增103亿元。三、金融机构贷款增长向常态回归6月末，全部金融机构本外币贷款余额为54.7万亿元，同比增长16.8，增速比3月末和上年末分别低0.8个和2.9个百分点，比年初增加4.4万亿元，同比少增3888亿元。人民币贷款增速继续放缓。,301.0
9,6月末，人民币贷款余额为51.4万亿元，同比增长16.9，增速比3月末和上年末分别低1.0个和3.0个百分点，比年初增加4.17万亿元，同比少增4497亿元。其中，6月份贷款增加6339亿元，同比多增207亿元。当前信贷需求仍然旺盛，尤其是各地投资冲动较强，信贷投放压力依然较大。从部门分布看，住户贷款逐步走低，非金融企业贷款增速相对平稳。6月末，住户贷款同比增长24.8，比3月末和上年末分别低3.5个和12.8个百分点，比年初增加1.5万亿元，同比少增2883亿元。,235.0
10,其中，个人住房贷款增长放缓，比年初增加4877亿元，同比少增3828亿元。非金融企业及其他部门贷款同比增长14.1，比3月末和上年末分别低0.5个和1.2个百分点，比年初增加2.7万亿元，同比少增1885亿元。其中，中长期贷款比年初增加1.4万亿元，同比少增1.3万亿元。票据融资比年初减少1422亿元，同比少减5109亿元。分机构看，中资全国性大型银行贷款同比少增较多，全国性中小型银行贷款同比多增。,201.0
11,外币贷款增速有所回升。6月末，金融机构外币贷款余额为5018亿美元，同比增长22.2，比3月末和上年末分别提高5.0个和2.7个百分点，比年初增加513亿美元，同比多增193亿美元。从投向看，进出口贸易融资增加207亿美元，同比多增84亿美元；境外贷款与境内中长期贷款增加167亿美元，同比多增81亿美元。四、社会融资规模保持合理水平，直接融资作用继续增强初步统计，2011年上半年社会融资规模为7.76万亿元，比上年同期少3847亿元。其中，人民币贷款增加4.17万亿元，同比少增4497亿元；外币贷款折合人民币增加3361亿元，同比多增1179亿元；委托贷款增加7028亿元，同比多增3829亿元；信托贷款增加913亿元，同比少增5102亿元；银行承兑汇票增加1.33万亿元，同比少增441亿元；企业债券净融资6588亿元，同比多90亿元；非金融企业境内股票融资2677亿元，同比多274亿元。,399.0
12,从结构看，一是人民币贷款占比下降，除人民币贷款外的其他方式数量和占比明显上升。上半年新增人民币贷款占同期社会融资规模的53.7，同比下降3.2个百分点。除人民币贷款以外的其他方式融资合计3.59万亿元，同比多增649亿元。,111.0
13,二是外币贷款占比明显上升。上半年新增外币贷款占同期社会融资规模的4.3，同比提高2.0个百分点。,48.0
14,三是实体经济通过金融机构表外融资有所减少。上半年金融机构通过委托贷款、信托贷款及银行承兑汇票方式新增表外融资合计2.12万亿元，占同期社会融资规模的27.3，同比下降0.9个百分点。其中，新增委托贷款、银行承兑汇票和信托贷款分别占同期社会融资规模的9.1、17.1和1.2，分别比上年同期高5.1个百分点、高0.2个百分点和低6.2个百分点。,171.0
15,四是非银行金融机构对实体经济支持力度迅速加大。上半年保险公司赔偿和小额贷款公司与贷款公司新增贷款合计1960亿元，同比多增较多。,64.0
16,五是直接融资在配置资金中的作用继续增强。上半年企业通过企业债券和境内股票直接融资合计9265亿元，占同期社会融资规模比重为11.9，为历史同期最高水平，同比上升1.0个百分点。其中，企业债券净融资和境内股票融资分别占同期社会融资规模的8.5和3.4，同比均提高0.5个百分点。银行一般根据理财资金运用的预期收益，扣减相关费用（如手续费、销售费用等），并结合利润要求，确定理财产品预期收益率。理财资金主要投资于市场化定价的债券、票据、信托等产品，其收益一般随着市场情况的变动而变动。,240.0
17,与其他投资一样，投资者购买银行理财产品是要承担一定投资风险的，而且不同理财产品具有不同的风险收益特征。有的产品是保本型理财，属银行自营业务，投资者承担的风险相对较小。有的产品是非保本型理财，属银行代客经营的中间业务，银行收手续费，投资风险由投资者自行承担。投资者在购买理财产品时，需仔细阅读产品合同和说明，注意相关风险提示，认真评估产品的风险收益特征，根据自身承受能力审慎作出投资决策。金融业务的统计用发生额或余额，但一般使用余额来衡量存量规模，用余额的变化来衡量一段时期金融业务的增长情况。,246.0
18,由于多数理财产品期限较短、不断到期兑付滚动发行，因此发行额会远远大于余额，更远大于余额的增量。2011年上半年理财产品的累计发生额较大，但期限3个月以下的理财产品发行额占总发行额的比重接近80%，从余额看，6月末，理财产品资金余额为3.57万亿元，相当于同期存款余额（78.6万亿元）的4.5%，比上年末增加8000多亿元。其中大部分资金投入债券、股票等资本市场，促进了直接融资的发展。理财业务作为银行重要的中间业务，其发展总体上反映了金融市场投资品种不断丰富和规模不断扩大的趋势，对拓宽居民投资渠道、改进商业银行经营模式有积极作用。当然，也有些金融机构可能出于考核的需要大量发行理财产品，加大了市场流动性的波动，在规范操作方面也需进一步改进。,322.0
19,中央银行和监管部门一直注重理财产品发行、销售、投向等环节的规范化与透明化，致力于加强投资者风险意识教育，明晰发行方、投资对象、投资者的责权关系。下一阶段，将继续引导金融机构加强信息披露，提高产品透明度，严格履行产品合同所规定的义务，为客户理好财；继续引导金融机构进一步健全风险管理制度，安排好自身头寸，优化期限匹配，确保稳健经营。五、金融机构贷款利率继续上升上半年，金融机构对非金融企业及其他部门贷款利率继续上升。6月份，贷款加权平均利率为7.29，较3月份上升0.38个百分点。其中，一般贷款加权平均利率为7.36，比3月份上升0.26个百分点；票据融资加权平均利率为6.98，比3月份上升0.72个百分点。,305.0
20,个人住房贷款利率稳步上升，6月份加权平均利率为6.83，比3月份上升0.66个百分点。从利率浮动情况看，执行下浮利率和基准利率的贷款占比下降，执行上浮利率的贷款占比上升。6月份，执行下浮利率的贷款占比为9.94，比3月份下降4.02个百分点；执行基准利率的贷款占比为28.91，比3月份下降1.31个百分点；执行上浮利率的贷款占比为61.15，比3月份上升5.33个百分点。受境内资金供求关系变动影响，外币存款利率总体走高，贷款利率持续上升。6月份，3个月以内大额美元存款加权平均利率为2.79，比3月份上升0.48个百分点；3个月以内、3（含3个月）-6个月美元贷款加权平均利率分别为3.16和3.46，比3月份分别上升0.12个和0.20个百分点。,326.0
21,利率市场化实质上是一个逐步发挥市场机制在利率决定中的作用、进而实现资金流向和配置不断优化的过程。纵观世界各国，其利率市场化的演进都是与金融市场的发展及相关法律法规、制度机制等市场基础设施的完善紧密联系的。上世纪70年代，随着货币市场基金迅速发展和金融产品的不断丰富，市场交易日趋活跃，放松利率管制的市场基础逐渐成熟，美国开始逐步取消对大额可转让存单的利率管制。直到1980年，《存款类金融机构解除管制和货币控制法案》（DepositoryInstitutionDeregulationandMonetaryControlAct）通过，存贷款利率市场化才正式开始。该法基本上取消了对贷款利率的限制，并宣布成立存款类金融机构解除管制委员会，决定分阶段取消对存款利率的限制。,334.0
22,之后，金融市场工具和产品不断创新，存款利率管制逐步取消。到1986年，美国利率市场化基本实现，美联储开始通过贴现率和公开市场操作引导市场利率。利率管制取消后，美国商业银行倒闭数量有所上升，但由于有较为完善的市场基础和健全的存款保险制度，总体上未对金融稳定产生过大的冲击。日本在利率市场化过程中比较注重培育市场基础和完善市场机制，其推进进程比美国要长。1977年，日本允许金融机构持有的国债上市流通，国债收益率曲线逐步形成。,211.0
23,随后又逐步放开了国债发行利率和银行间拆借、票据利率，并批准商业银行发行利率不受限制的大额可转让定期存单。随着金融市场的不断发展，日本通过对大额可转让定期存单等已市场化定价的金融产品，采取逐步降低发行面额、扩大市场参与主体范围等方式，稳步推进利率市场化改革。到1994年，日本的利率市场化顺利完成。与发达国家相比，发展中国家金融市场起步晚，基础较为薄弱，金融机构的市场定价能力也相对较低，因此在利率市场化的过程中，市场机制的建设和培育显得更为重要。上世纪70年代，韩国通过引入可转让大额存单、短期债券回购协议等丰富金融市场产品。,263.0
24,1981年，韩国放开商业票据贴现利率，开始尝试利率市场化。1986年，韩国的银行间拆借、企业债券、大额可转让存单利率先后放开。1988年，韩国宣布取消对大多数银行、非银行金融机构的贷款和两年期以上存款利率的控制，基本实现了存贷款利率的市场化。但在1989年，韩国经济增速放缓、通胀加剧、市场利率飙升，政府不得不通过“窗口指导”重新对利率进行管制。在对前一轮利率市场化进行总结和反思的基础上，1991年，韩国再次推进利率市场化。,213.0
25,由于此时的市场基础已较为成熟，且推进计划周密，到1997年，韩国利率市场化全面实现。1974年，智利政府开始推进经济自由化改革，到1979年，银行私有化、利率市场化和资本账户开放等改革就已完成。由于利率市场化的各项基础条件尚不成熟，1976年至1982年，智利出现了一个超高利率时期，年平均实际利率高达32，银行大量破产，中央银行不得不通过公布指导性利率的方式宣布重新对利率进行管制，并对银行进行重组。直到银行重组基本完成后，智利中央银行才不再公布指导性利率，而转向通过公开市场操作引导市场利率。各经济体的利率市场化改革道路不尽相同，但总体而言均是与国内其他相关改革配套进行的。,289.0
26,在这个过程中，金融机构的定价能力得到培养和提高，市场自律逐步强化，相关产品不断丰富，中央银行政策利率对市场利率传导的有效性逐渐提高。六、人民币汇率弹性明显增强2011年以来，人民币小幅升值，双向浮动特征明显，汇率弹性明显增强，人民币汇率预期总体平稳。6月末，人民币对美元汇率中间价为6.4716元，比上年末升值1511个基点，升值幅度为2.33。2005年人民币汇率形成机制改革以来至2011年6月末，人民币对美元汇率累计升值27.89。根据国际清算银行的计算，2011年上半年，人民币名义有效汇率贬值1.50，实际有效汇率贬值3.02；2005年人民币汇率形成机制改革以来至2011年6月，人民币名义有效汇率升值13.05，实际有效汇率升值18.91。,327.0
27,一、适时适度开展公开市场操作合理把握公开市场操作力度和节奏。在对银行体系流动性供求情况科学分析的基础上，中国人民银行加强各货币政策工具间的协调配合，合理把握公开市场操作力度和节奏，促进银行体系流动性平稳运行。上半年累计发行央行票据9210亿元，开展正回购操作13600亿元。截至6月末，央行票据余额约为2.4万亿元。优化公开市场操作期限品种。,171.0
28,充分发挥公开市场操作的预调和微调功能，以1年期以内央行票据发行和短期正回购操作品种为主，3年期央行票据发行为辅，不断优化公开市场操作期限结构，进一步提高了银行体系应对短期流动性波动的有效性和主动性。增强公开市场操作利率弹性。结合市场环境和市场利率走势变化，中国人民银行适时增强了公开市场操作利率弹性，既有利于管理通胀预期，也有助于发挥市场利率调节资金供求的作用。截至6月末，3个月期和1年期央行票据的发行利率分别为3.0801和3.4982，分别较上年末上升约106个和99个基点。开展中央国库现金管理操作。,254.0
29,"2011年上半年开展了五期国库现金管理商业银行定期存款业务,共计1800亿元。二、六次上调存款准备金率，实施差别准备金动态调整机制在国际收支总体上继续保持较大顺差的背景下，为把好流动性总闸门，加强货币信贷总量调控，保持合理的社会融资规模，2011年以来，中国人民银行继续发挥存款准备金工具深度冻结银行体系多余流动性的功能，分别于1月20日、2月24日、3月25日、4月21日、5月18日和6月20日6次上调存款类金融机构人民币存款准备金率各0.5个百分点，累计上调3个百分点。中国人民银行结合宏观审慎理念和流动性管理的需要，从2011年起对金融机构引入差别准备金动态调整机制，配合存款准备金率、公开市场操作、利率等常规性货币政策工具发挥合力。上半年，对若干家资本充足率较低、信贷增长过快、顺周期风险隐患增大的金融机构实施差别准备金要求。差别准备金动态调整工具通过把信贷增长与逆周期资本要求联系起来，对金融机构信贷投放数量进行了有效引导，在信贷总量调控中发挥了积极作用，信贷投放节奏的均衡性也明显提高。",450.0
30,三、适时上调存贷款基准利率2011年以来，中国人民银行分别于2月9日、4月6日和7月7日三次上调金融机构人民币存贷款基准利率。其中，1年期存款基准利率由2.75提高到3.50，累计上调0.75个百分点；1年期贷款基准利率由5.81提高到6.56，累计上调0.75个百分点。适时上调存贷款基准利率，对于稳定通胀预期、引导货币信贷合理增长发挥了积极作用，对于巩固房地产调控效果、优化资金配置、居民财富保值等也具有积极意义。四、加强窗口指导和信贷政策引导中国人民银行继续加强和改善对金融机构的窗口指导，并通过再贷款、再贴现等货币政策工具，引导、促进金融机构合理调整信贷结构和投放节奏，加大金融支持经济结构调整和经济发展方式转变的力度，扩大“三农”、中小企业等薄弱环节的信贷投放。截至6月末，中国人民银行支农再贷款余额974亿元，比年初增加251亿元。,372.0
31,其中西部地区和粮食主产区支农再贷款余额及当年增量占全国的比重均超过93。中国人民银行再贴现余额817亿元，比年初增加26亿元。按投向划分，再贴现总量中涉农票据占33，中小企业票据占92。积极引导金融机构按照“有扶有控”的信贷政策要求，加大对“三农”、中小企业、节能减排、战略性新兴产业、巨灾应对和灾后重建、就业、助学等重点领域和薄弱环节的信贷支持，执行好差别化房贷政策，加强对地方政府融资平台的放贷管理，严格控制对高耗能、高排放行业和产能过剩行业的贷款。积极推进和完善信贷政策导向评估，全面提高信贷政策导向力，研究开展涉农信贷政策和中小企业信贷政策导向效果评估工作。,283.0
32,引导督促金融机构加强内部风险控制，合理把握信贷资金投放节奏，防范信贷风险。总体看，中小企业信贷支持力度继续加大，“三农”信贷支持保持较强力度。上半年我国银行业机构中小企业人民币贷款新增1.6万亿元，6月末余额同比增长18.2，增速比大型企业贷款同比增速高7.4个百分点。其中，小企业贷款上半年新增8659亿元，6月末余额同比增长25.9，保持较强的信贷投入力度。6月末，主要金融机构及农村合作金融机构、城市信用社、村镇银行和财务公司本外币涉农贷款余额13.4万亿元，上半年新增1.5万亿元，占当期各项贷款增量的比重为33.9。,263.0
33,五、促进跨境人民币业务发展2011年上半年，银行累计办理跨境贸易人民币结算业务9575.7亿元，同比增长13.3倍。第二季度，银行累计办理跨境贸易人民币结算业务5972.5亿元，比上季度增加2369.3亿元。其中，货物贸易结算金额4556.1亿元，服务贸易及其他经常项目出口结算金额1416.3亿元。第二季度，跨境贸易人民币结算实际收付总金额4090.3亿元，其中实收1037.8亿元，实付3052.5亿元，收付比上升至1：2.9，跨境贸易人民币结算进口与出口平衡的状况有所改善。同时，各试点地区共办理人民币境外直接投资金额54.0亿元。,269.0
34,截至2011年6月末，境内代理银行为境外参加银行共开立917个人民币同业往来账户，账户余额1333.7亿元，户均余额1.45亿元。六、完善人民币汇率形成机制继续按主动性、可控性和渐进性原则，进一步完善人民币汇率形成机制，重在坚持以市场供求为基础，参考一篮子货币进行调节，增强人民币汇率弹性，保持人民币汇率在合理均衡水平上的基本稳定。上半年，人民币对美元汇率中间价最高为6.4683元，最低为6.6349元，119个交易日中77个交易日升值、42个交易日贬值，最大单日升值幅度为0.20（133点），最大单日贬值幅度为0.16（103点）。人民币对欧元、日元等其他货币汇率双向波动。6月末，人民币对欧元、日元汇率中间价分别为1欧元兑9.3612元人民币、100日元兑8.0243元人民币，分别较2010年末贬值5.93和升值1.27。,366.0
