,paragraph,length
78,此后国际评级公司相继下调欧元区国家的信用评级，导致希腊、爱尔兰等国债收益率大幅飙升。在此背景下，虽然美国和日本的财政状况同样不容乐观，但投资者对安全资产的避险需求持续压低了主要债券的收益率。截至6月30日，美国、欧元区（德债）、日本的10年期国债收益率分别收于3.16、3.01和1.14，较3月末下降31个、34个和12个基点。发达国家复苏放缓和欧元区债务问题拖累全球主要股市。受日本银行大规模向金融市场注资、美国继续执行QE2和主要债券收益率走低的影响，第二季度开始，主要发达经济体股市持续上行。,250.0
79,随着发达国家复苏放缓，加上欧元区主权债务风险上升，主要股市全线下跌，后因希腊政府通过财政紧缩计划而反弹。截至6月30日，美国道琼斯指数收于12414点，较3月末上涨0.8；纳斯达克指数收于2774点，微跌0.3；欧元区STOXX50指数收于2561点，下跌0.8；日经225指数收于9816点，上涨0.6。（三）主要经济体房地产市场走势美国房地产市场持续低迷。全美地产经济商协会数据显示，5月住房销量（折年率）环比下降3.8，同比下降15.3。5月份，美国各类旧房销售中间价为每套16.65万美元，同比下降4.6。,257.0
80,标准普尔公司发布的凯斯-席勒房价指数也显示，5月份美国20个大中城市的平均房价同比下降4.5，创18个月来的最大跌幅。欧洲房地产市场总体呈现复苏态势。6月英国HALIFAX房价指数月环比上涨1.2，较4月的下跌1.4有所反弹，但由于经济增长前景黯淡，房价仍有下行压力。伴随经济强劲增长，德国商业和住宅市场需求继续增加。法国房地产价格出现大幅上升，但成交量有所下降。,182.0
81,受经济衰退和债务危机影响，欧元区外围国家房地产市场仍无起色。灾后重建带动日本房地产市场回暖。据日本国土交通省统计，5月份日本新房开工数量同比上升6.4，50大建筑公司接到的订单同比增长25.5。日本房地产市场已基本摆脱了震灾的负面影响，预计随着建材短缺的情况逐渐缓解，重建需求将继续推动日本房地产市场增长。（四）主要经济体货币政策经济复苏步调不一导致各经济体货币政策差异明显。,188.0
82,部分经济体继续维持宽松的货币政策。美联储如期结束QE2，继续维持0-0.25的基准利率。联邦公开市场委员会（FOMC）公布的会议记录显示，4月份联储内部曾对是否提前终结QE2产生分歧。但随着复苏动力再次减弱，联储最终决定在6月底按期结束QE2，同时维持现有的资产负债表规模不变。日本银行将银行间无担保隔夜拆借利率保持0-0.1的区间，实行“零利率”政策，同时保持40万亿日元的震后市场注资规模不变。,199.0
83,5月23日，日本银行向灾区的金融机构发放首笔741亿日元贷款，计划到10月底共发放1万亿日元。6月14日，日本银行推出总额5000亿日元的融资支持框架，鼓励金融机构对具备技术优势的中小企业提供优惠贷款，促进经济复苏。尽管通胀率持续走高，但由于国内经济疲软，7月7日，英格兰银行继续维持0.5的基准利率和2000亿英镑的资产购买规模不变。加拿大、澳大利亚等国央行继续维持基准利率不变。部分经济体央行采取加息等措施抑制通货膨胀。,212.0
84,由于通胀压力持续上升，7月7日，欧央行继4月后再次提高基准利率，决定将主要再融资利率、贷款便利利率和存款便利利率分别调高0.25个百分点至1.5、2.25和0.75。韩国、俄罗斯、印度、巴西、波兰、马来西亚、泰国、菲律宾、挪威、瑞典、智利等经济体第二季度相继采取加息和提高存款准备金等措施，抑制国内通胀压力。新加坡金管局上调新元对一篮子货币的波动区间中值，允许新元进一步升值，抑制国内通胀。越南第二季度曾3次提高再融资利率，但由于担心紧缩政策对经济造成负面影响，7月4日越南央行将再融资利率调低。（五）国际经济形势展望2011年第二季度，美国经济复苏疲软、欧元区主权债务风险上升、日本地震海啸灾害、西亚北非地区政局动荡等不利因素导致全球经济和金融市场动荡加剧，全球经济面临的下行风险增加。,344.0
85,国际货币基金组织（IMF）在6月发布的《世界经济展望》中预测2011年全球经济增长4.3，低于4月份预测的4.4。基金组织将美、日2011年经济增长率分别下调至2.5和-0.7，但将欧元区预测值提高至2。此外，基金组织还预计新兴经济体2011年增长6.6，低于去年的7.4。展望未来，全球经济主要面临以下风险：一是美国等发达经济体失业率居高不下，将抑制全球需求。,181.0
86,二是发达经济体债务问题堪忧，可能在中长期内对复苏形成制约。,29.0
87,三是能源、食品等大宗商品价格波动将给生产者和消费者带来负面影响，成为经济运行中的不确定因素。,46.0
88,四是主要新兴经济体面临抑制通胀和防止跨境资本波动的挑战，政策制定难度加大。,37.0
89,"五是金融体系风险隐患依然存在。二、我国宏观经济运行分析2011年上半年，中国经济仍然保持平稳较快增长,继续朝宏观调控预期方向发展。消费需求保持稳定，固定资产投资增长较快，进出口总体平稳较快增长，农业生产形势良好，工业企业效益较好，居民收入稳定增长，但物价上涨较快。2011年上半年，实现国内生产总值（GDP）20.4万亿元，同比增长9.6，其中第二季度GDP同比增长9.5，涨幅比上季度降低0.2个百分点；环比增长2.2，比上季度提高0.1个百分点。上半年，居民消费价格同比上涨5.4，其中第二季度同比上涨5.7，涨幅比上个季度继续扩大0.7个百分点。",276.0
90,上半年，贸易顺差449.3亿美元，其中第二季度贸易顺差464.0亿美元，恢复了贸易顺差格局。（一）消费需求保持稳定，投资增长较快，进出口贸易恢复顺差城镇居民收入稳定增长，农村居民收入增长较快，国内消费需求保持稳定。2011年上半年，城镇居民家庭人均可支配收入11041元，同比增长13.2，扣除价格因素，实际增长7.6；农村居民人均现金收入3706元，同比增长20.4，扣除价格因素，实际增长13.7。第二季度全国城镇储户问卷调查结果显示：居民当期收入感受指数为52.1，受季节因素影响比上季略有回落，但高于上年同期2.6个百分点，居民消费意愿低位回升，储蓄存款意愿更高。上半年，社会消费品零售总额8.6万亿元，同比增长16.8；实际增长11.6，实际增速与第一季度持平。,336.0
91,分城乡看，城镇消费增速快于乡村，增速差距基本保持稳定。上半年，城镇消费品零售额7.4万亿元，同比增长16.9；乡村消费品零售额1.1万亿元，同比增长16.2。固定资产投资保持较快增长，中西部投资增速明显快于东部。上半年，固定资产投资（不含农户）完成12.5万亿元，同比增长25.6，实际增长19.0。其中，国有及国有控股投资4.3万亿元，同比增长14.6。,178.0
92,分地区看，东、中、西部地区固定资产投资同比分别增长22.6、31和29.2；分产业看，第一、二、三次产业投资同比分别增长20.6、27.1和24.7，第一、二产业投资增速分别比第一季度高9.8个和2.3个百分点，第三产业增速比第一季度低0.9个百分点。,126.0
93,上半年，新开工项目计划总投资11.2万亿元，同比增长14.9，施工项目计划总投资47.1万亿元，同比增长19.6。进出口同比增速回落，贸易恢复顺差。第二季度，出口4748亿美元，同比增长22.1，增速比上季度低4.4个百分点；进口4284亿美元，同比增长23.2，增速比上季度回落9.4个百分点。从绝对额看，4至6月出口额屡创新高，进口额也处于历史高位，出口额提升扭转了第一季度逆差的局面，恢复了贸易顺差格局。进出口额处于历史高位，主要是由于2011年以来进出口价格同比快速上涨，扣除价格因素，第二季度进、出口同比实际增长分别为5.6和12.5。,273.0
94,（二）农业生产总体稳定，工业生产增长较快上半年，第一产业增加值为1.6万亿元，增长3.2；第二产业增加值为10.2万亿元，增长11.0；第三产业增加值为8.7万亿元，增长9.2。第一、二、三产业占GDP比重分别为7.7、50.0和42.3。夏粮种植面积略有扩大，粮食生产有所增加。据夏粮主产区抽样调查和非主产区统计，2011年全国夏粮总产量为12627万吨，比上年增长2.5。种植面积有所扩大，2011年全国夏粮播种面积27557千公顷，比上年增长0.4；粮食单产有所增加，2011年全国夏粮单产每公顷4582公斤，比上年提高2.1。,267.0
95,上半年，猪牛羊禽肉产量3722万吨，同比增长0.2，其中猪肉产量2443万吨，下降0.5。工业生产增长较快，企业盈利能力稳定。上半年，全国规模以上工业增加值同比增长14.3。工业产销衔接状况良好，工业产品产销率为97.8。工业企业效益继续增加。,122.0
96,"上半年，全国规模以上工业企业实现利润2.4万亿元，同比增长28.7。第二季度中国人民银行5000户工业企业调查显示，企业经营景气状况较好，市场需求略有回落，产成品库存继续减少，企业盈利能力稳定。第二季度，企业经营景气指数继续高位小幅下探0.5个百分点至70.6。企业产品市场需求指数在上季高位回落的基础上，本季再降0.6个百分点至62.9，其中，国内订单指数连续两个季度高位下行，较上季微降0.2个百分点至56.7；出口订单指数结束前两个季度持续回落趋势，较上季回升1.4个百分点至52.5，成为近12个季度以来的第三高位。产成品存货指数为48.7,比上季度低0.88个百分点。",289.0
97,盈利指数在经历了上季的短暂回落后，重新回归2009年初以来的上行走势，上扬0.5个百分点至58.6。中国人民银行及时对此进行了多种形式的调研分析。有关情况如下：一、当前我国中小企业生产经营总体平稳调查显示，当前我国中小企业订单和销售情况基本面没有实质性变化，生产经营总体平稳，没有出现部分媒体反映的中小企业“倒闭潮”现象。据工信部统计，2011年第一季度，全国规模以上中小型工业企业增加值同比增长16.9，比全国规模以上工业增加值增速高2.5个百分点。国家统计局全国企业景气调查结果显示，2011年第二季度，中、小型企业景气指数分别为135.4和116.8，比第一季度分别提高1.9和2.7。,296.0
98,另外根据中国人民银行《2011年第二季度全国企业家问卷调查报告》显示，第二季度的出口订单指数止跌回升，较第一季度提高1.4个百分点至52.5。二、金融部门多措并举加强中小企业金融服务，对中小企业的金融支持力度不断增强近年来，中国人民银行等金融部门出台了多项支持中小企业发展的政策措施，进一步改进和加强中小企业金融服务。,159.0
99,一是加强信贷政策指导，确保中小企业贷款合理增长。中国人民银行会同有关部门于2010年6月印发《关于进一步做好中小企业金融服务工作的若干意见》，引导督促金融机构全方位提升金融服务，确保中小企业贷款的合理增长。,103.0
100,二是加大金融产品创新，积极探索发展中小企业多元化融资方式。大力发展银行间债券市场，陆续推出了中小企业短期融资券、中小企业集合票据等一系列债券融资工具。,75.0
101,三是加快推进新型农村金融机构建设，加大对小企业的融资支持。截至2011年6月末，全国共组建包括村镇银行、贷款公司和农村资金互助社在内的新型农村金融机构615家；新设立小额贷款公司3366家，贷款余额2875亿元。,106.0
102,四是积极推动征信体系和中小企业信用体系建设。2010年5月，中国人民银行印发《关于开展中小企业信用体系试验区建设指导意见》，持续加强征信体系与中小企业信用体系建设。截至2011年6月底，企业征信系统收录企业及其他组织信息1787万户。截至2011年6月末，金融机构中小企业人民币贷款余额（含票据贴现）20.1万亿元，同比增长18.2。其中，小企业贷款余额9.7万亿元，同比增长25.9，比各项贷款平均增速高9个百分点；小企业贷款累计新增8659亿元。截至2011年6月末，共有160家中小企业在银行间债券市场累计发行非金融企业债务融资工具113.67亿元。三、当前中小企业生产经营和融资面临的挑战一是能源和原材料价格涨幅较大。2011年上半年，工业生产者购进价格同比上涨10.3，高于同期工业生产者出厂价格涨幅。,356.0
103,二是劳动用工成本上涨较快。各省中小企业工资涨幅普遍在10-30之间。,34.0
104,三是用电紧张问题在局部地区明显加剧。部分省市已有一些中小企业在生产经营过程中被拉闸限电。,44.0
105,四是在货币条件回归常态的过程中，信贷需求的满足难以维持前两年的宽松状态，大中小企业获取贷款的难度客观上都会有不同程度的上升。在经过商业化改革后，商业银行风险防范意识及风险管控能力不断增强，对于市场前景不好、库存积压较多、利润明显下滑的中小企业，可能会在贷款利率乃至放贷条件等方面提出更严的要求。从全国看，中小企业贷款需求的满足存在不平衡性。例如，越是建设项目多的地方，越反映资金紧张。,192.0
106,五是部分地区民间借贷利率上升较快，推升了中小企业融资成本。在物价上行的情况下，中小企业的融资利率会上升，其承受的压力也会更大一些。一旦物价得到有效控制，压力就会有所减少。四、对策建议总体看，尽管面临诸多挑战，我国企业仍然有较强的调整适应能力，总体上中小企业生产经营情况还是好的。虽然部分企业出现亏损，少数企业发生关停，但没有从根本上影响中小企业较快发展的格局，也没有出现企业集中倒闭的现象。,195.0
107,部分中小企业出现经营困难和资金短缺，主要是面临供给层面的成本约束，包括原材料、劳动力、资源等成本因素。成本约束上升是我国产业结构调整升级、劳动力转移、收入分配体制和资源价格形成机制改革中必然伴随的问题，是企业（三）价格总水平继续上升居民消费价格涨幅扩大。第二季度CPI同比上涨5.7，涨幅比上个季度继续扩大0.7个百分点。其中各月涨幅分别为5.3、5.5和6.4。从食品和非食品分类看，食品价格同比上涨12.5，涨幅比上个季度高1.5个百分点，拉动CPI上涨约3.7个百分点，其中，猪肉价格同比上涨44.2，涨幅比上个季度高25个百分点，拉动CPI上涨约1.1个百分点；非食品价格同比上涨2.9，涨幅比上个季度高0.4个百分点，拉动CPI上涨约2.0个百分点。,330.0
108,从消费品和服务分类看，消费品价格同比上涨6.5，比上个季度高1.1个百分点，上涨明显加快；服务价格同比上涨3.9，比上个季度低0.3个百分点，涨幅有所回落。从环比看，第二季度CPI及其八大类构成的平均环比涨幅均高于历史平均水平，特别是受猪肉价格大幅上涨影响，食品价格环比涨幅明显高于历史平均水平。生产价格继续上涨，工业生产者出厂价格同比涨幅有所回落。第二季度，工业生产者出厂价格同比上涨6.9，比上个季度低0.2个百分点，各月同比涨幅分别为6.8、6.8和7.1。其中，生产资料价格同比上涨7.6，比上个季度低0.4个百分点，生活资料价格同比上涨4.6，比上个季度高0.5个百分点。,291.0
109,工业生产者购进价格同比上涨10.4，比上个季度高0.2个百分点，各月涨幅分别为10.4、10.2和10.5。第二季度，全国主要农产品生产价格（指农产品生产者直接出售其产品时的价格）同比上涨18.0，涨幅比同期农业生产资料价格指数高6.3个百分点。2011年上半年，企业商品价格（CGPI）同比上涨8.8。按商品用途分类看，CGPI中投资品和消费品价格同比分别上涨8.1和10.1；按商品基本分类看，CGPI中农产品、矿产品、煤油电和加工业产品价格同比分别上涨17.9、13.0、8.4和6.5。国际大宗商品价格有所下跌。,260.0
110,第二季度各月，纽约商品交易所原油期货当月平均价格环比涨幅分别为6.9、-7.9和-5.0，6月均价比4月下跌12.5。伦敦金属交易所铜现货各月环比涨幅分别为-0.5、-5.6和1.0，6月均价比4月下跌4.6，铝现货各月环比涨幅分别为4.7、-2.7和-1.7，6月均价比4月下跌4.3。进口价格同比继续上涨。尽管近期国际大宗商品价格出现下跌，但受基数效应影响，进口价格同比继续上涨。第二季度各月，进口价格同比涨幅分别为12.9、16.7和15.7，平均为15.1；出口价格同比涨幅分别为10.9、9.4和10.9，平均为10.4。,266.0
111,GDP缩减指数继续上升。上半年，我国GDP为20.4万亿元，实际增长率为9.6，GDP缩减指数（按当年价格计算的GDP与按固定价格计算的GDP的比率）变动率为7.5，比上年同期提高2.0个百分点，比上季度提高0.3个百分点。资源性产品价格改革继续稳步推进。7月份，国家发展改革委发出通知，决定自2011年8月1日起实行新的航空煤油出厂价格形成机制。根据新机制，航空煤油出厂价格将按照不超过新加坡市场进口到岸完税价的原则，由供需双方协商确定。,220.0
112,"具体出厂价格由进口到岸完税价和贴水两部分构成。其中，贴水由供需双方考虑市场供求、运费、交易数量、国际市场油价走势等因素协商确定,每年协商一次。航空煤油出厂价格每月调整一次，调价时间为每月1日。（四）财政收支保持较快增长上半年，全国财政收入（不含债务收入）5.69万亿元，同比增长31.2，增速比第一季度回落1.9个百分点；全国财政支出4.44万亿元，同比增长31.4，增速比第一季度提高5.4个百分点。收支相抵，收入大于支出1.24万亿元。",220.0
113,从财政收入结构看，上半年累计，税收收入5.0万亿元，同比增长29.6，增速比第一季度低2.8个百分点。其中，国内增值税同比增长19.7；营业税同比增长24.4；国内消费税同比增长20.2；进口产品增值税和消费税同比增长37.1；企业所得税同比增长38.3；个人所得税同比增长35.4。上述六项税收收入共拉动全国财政收入增长23.2个百分点。从支出结构看，上半年各项支出中增长较快的主要有：医疗卫生支出同比增长61.4；住房保障支出同比增长76.6；社会保障和就业支出同比增长40.5；城乡社区事务支出同比增长43.0。在全国财政支出中最大的三项分别为：教育支出、社会保障和就业支出、一般公共服务支出，分别占财政支出的13.8、13和10.3。,321.0
114,（五）国际收支继续呈现“双顺差”2011年第一季度，我国国际收支继续呈现“双顺差”，外汇储备继续增长。其中，经常项目顺差288亿美元，同比下降21；资本和金融项目顺差861亿美元，同比增长41；外汇储备资产增加1380亿美元。2011年上半年，在复杂多变的国内外宏观环境下，我国外汇净流入压力有所加大，外汇储备增长较快。截至6月末，国家外汇储备余额为31975亿美元，同比增长30.3。在国内外经济基本面以及利差、预期汇兑收益等因素的共同作用下，预计2011年下半年，我国仍将保持外汇资金净流入格局。,250.0
115,外债总规模增长较快，短期外债余额占比上升。2011年3月末，我国外债余额为5860亿美元，同比增长32.2。其中，登记外债余额为3669亿美元，同比增长32.7；短期外债余额4117亿美元，同比增长49，占外债余额的70.3，占比较上年同期上升7.9个百分点。（六）行业分析工业利润增长较快。上半年，在39个工业大类行业中，38个行业利润同比增长，1个行业同比下降。,183.0
116,其中，石油和天然气开采业利润同比增长37.7，黑色金属矿采选业增长61.7，化学原料及化学制品制造业增长57.1，化学纤维制造业增长49.8，石油加工、炼焦及核燃料加工业下降66。上半年，原煤产量为17.7亿吨，同比增长12.7；发电量为22166亿千瓦时，同比增长13.5；原油产量为10289万吨，同比增长4.6；全社会货运量为170.9亿吨，同比增长13.9。1、房地产行业2011年1月，国务院办公厅印发了《关于进一步做好房地产市场调控工作有关问题的通知》（国办发[2011]1号，以下简称国办发1号文件）。为贯彻落实国办发1号文件精神，中央有关部门和各地方政府也相继出台了相关措施。随着各项政策措施的贯彻落实和调控的深入持续，全国房地产市场出现了积极的变化，房价过快上涨势头有所遏制，房地产贷款增速持续回落。,359.0
117,房价过快上涨势头有所减缓。6月份，全国70个大中城市中新建商品住宅价格环比下降的有12个城市，持平的有14个城市，环比价格下降和持平的城市比3月份增加了6个，环比涨幅比3月份缩小的城市有44个；二手房价格环比下降的城市有19个，持平的城市有12个，环比价格涨幅均未超过1.0。商品房销售增幅先降后升。1-4月，全国商品房累计销售面积同比增幅有所回落，之后有所上升。上半年，全国商品房销售面积44419万平方米，同比增长12.9，增幅比第一季度回落2.0个百分点，比1-5月提高3.8个百分点；商品房销售额24589亿元，同比增长24.1，增幅比第一季度回落3.2个百分点，比1-5月提高6.0个百分点。,301.0
118,其中，商品住宅销售面积增长12.1，比第一季度回落2.2个百分点，比1-5月提高3.6个百分点；商品住宅销售额增长22.3，比第一季度回落3.6个百分点，比1-5月提高6.3个百分点。房地产开发投资保持较快增长。上半年，全国完成房地产开发投资26250亿元，同比增长32.9，增幅比第一季度回落1.2个百分点。其中，商品住宅完成投资18641亿元，同比增长36.1。商品住宅完成投资占房地产开发投资总量的71，占比基本保持稳定。,214.0
119,2011年上半年，全国房屋新开工面积为9.94亿平方米，同比增长23.6，增幅比第一季度提高0.2个百分点；房屋施工面积为40.57亿平方米，同比增长31.6，增幅比第一季度回落3.6个百分点；全国房屋竣工面积为2.76亿平方米，同比增长12.8，增幅比第一季度回落2.6个百分点。,141.0
120,房地产贷款余额增速回落。房地产贷款余额同比增速在2010年4月达到最高值46.4，此后持续回落。截至2011年6月末，全国主要金融机构（含外资）房地产贷款余额10.26万亿元，同比增长16.9，增速比3月末低4.4个百分点。其中，个人住房贷款余额6.26万亿元，同比增长17.5，增速比3月末低5.3个百分点，连续14个月下滑；房产开发贷款余额2.62万亿元，同比增长18.4，比3月末低0.9个百分点；地产开发贷款余额7968亿元，同比增长0.5，增速比3月末低12个百分点。截至2011年6月末，房地产贷款余额占各项贷款余额的20.5。,270.0
121,从贷款新增量看，2011年上半年累计新增房地产贷款7912亿元，同比少增5985亿元。其中6月份当月新增房地产贷款678亿元，同比少增630亿元。上半年，房地产贷款新增额占各项贷款新增额的19.7，比第一季度低4.3个百分点，比上年全年水平低7.2个百分点。“十二五”规划纲要明确提出，要加大保障性住房供给。国办发1号文件明确提出2011年全国建设保障性住房和棚户区改造住房1000万套。,194.0
122,随着保障性住房建设的全面推进和加速，金融机构保障性住房的信贷支持力度不断加强。2011年上半年，保障性住房开发贷款累计新增908亿元，比年初增长54.8，高出同期房地产开发贷款比年初增速48.3个百分点。2、电力行业2011年上半年，电力供需总体平衡，但出现区域性、结构性电力供应紧张问题。1-5月，全国规模以上电厂发电量为18162亿千瓦时，全社会用电量为18545亿千瓦时，同比分别增长12.8和12.0。受南方部分地区持续干旱影响水力发电等短期因素影响，全国部分省市在用电淡季也采取了拉闸、限电等应对措施。,256.0
