,paragraph,length
0,中国货币政策执行报告二○一四年第四季度中国人民银行货币政策分析小组2015年2月10日内容摘要2014年，中国经济在合理区间平稳运行，结构调整呈现积极变化。第三产业增加值比重继续提高，城乡居民收入差距进一步缩小，消费对经济增长的贡献提高。消费价格温和上涨，就业形势稳定。全年国内生产总值（GDP）同比增长7.4%，居民消费价格（CPI）同比上涨2.0%。中国人民银行按照党中央、国务院统一部署，继续实施稳健的货币政策，面对全球经济增长动力不足，国内经济处于增速换挡期、结构调整阵痛期、前期政策消化期三期叠加的复杂情况，既保持定力又主动作为，不断补充和完善货币政策工具组合，瞄准经济运行中的突出问题，用调结构的方式适时适度预调微调。,315.0
1,在外汇占款投放基础货币出现阶段性放缓的情况下，增强主动提供基础货币的能力，综合运用公开市场操作、短期流动性调节工具、常备借贷便利等多种货币政策工具，保持流动性合理充裕，创设中期借贷便利（MLF）和抵押补充贷款工具（PSL），引导金融机构向国家政策导向的实体经济部门提供低成本资金。,140.0
2,非对称下调存贷款基准利率，增强公开市场操作利率弹性，引导社会融资成本下行。两次实施定向降准，改进合意贷款管理，发挥差别准备金动态调整机制的逆周期调节和信贷引导功能，新增信贷政策支持再贷款，构建中央银行抵押品管理框架，加大再贷款、再贴现政策力度，加强信贷政策的结构引导作用，鼓励金融机构更多地将信贷资源配置到“三农”、小微企业等重点领域和薄弱环节。各项金融改革有序推进，存款利率浮动区间上限扩大至基准利率的1.2倍，简并基准利率期限档次；银行间即期外汇市场人民币兑美元交易价浮动幅度由1%扩大至2%，取消商业银行对客户美元挂牌买卖价差限制；《存款保险条例（征求意见稿）》向全社会公开征求意见；外汇管理体制改革进一步深化。稳健货币政策的实施，为经济社会发展创造了良好的金融环境，货币信贷和社会融资平稳增长，贷款结构继续改善，企业融资成本高问题有一定程度缓解。2014年末，广义货币供应量M2余额同比增长12.2%。,405.0
3,人民币贷款余额同比增长13.6%，比年初增加9.78万亿元，同比多增8900亿元。全年社会融资规模为16.46万亿元。12月份非金融企业及其他部门贷款加权平均利率为6.77%，比年初下降0.42个百分点。人民银行基本退出常态化外汇干预，人民币汇率保持合理均衡水平上的基本稳定，双向浮动弹性增强，年末人民币对美元汇率中间价为6.1190元，比上年末贬值0.36%。国际金融危机后全球经济进入深刻的再平衡调整期。,204.0
4,从增速变化、结构调整和动力转换等角度看，中国经济进入“新常态”的特征也更趋明显。总体看，中国经济体量较大，韧性好、回旋空间大，市场广阔，抗风险能力也比较强，近年来宏观调控方式不断创新和完善，通过推动大众创业、万众创新和扩大公共产品和公共服务供给形成的新双引擎结构将对经济运行形成有力支撑，中国经济有望保持持续健康发展。当然也要看到，全球经济再平衡调整过程中各板块经济运行和宏观政策显著分化，溢出效应增大，环境复杂多变，国内经济内生增长动力尚待增强，结构调整过程中经济下行压力加大，并伴随一定的风险暴露，同时全社会债务水平仍在上升，供给过剩与供给不足并存，经济结构性矛盾依然突出。稳增长、调结构、促改革、惠民生和防风险的任务还十分艰巨。中国人民银行将按照党中央、国务院的战略部署，坚持稳中求进工作总基调和宏观政策要稳、微观政策要活的总体思路，更加主动适应经济发展新常态，把转方式调结构放在更加重要位置，保持政策的连续性和稳定性，继续实施稳健的货币政策，更加注重松紧适度，适时适度预调微调，为经济结构调整与转型升级营造中性适度的货币金融环境，促进经济科学发展、可持续发展。,484.0
5,综合运用数量、价格等多种货币政策工具，加强和改善宏观审慎管理，优化政策组合，保持适度流动性，实现货币信贷及社会融资规模合理增长。盘活存量，优化增量，改善融资结构和信贷结构。多措并举、标本兼治，着力降低社会融资成本。同时，更加注重改革创新，寓改革于调控之中，把货币政策调控与深化改革紧密结合起来，更充分地发挥市场在资源配置中的决定性作用。针对金融深化和创新发展，进一步完善调控模式，疏通传导机制，着力解决突出问题，提高金融运行效率和服务实体经济的能力。,225.0
6,采取综合措施维护金融稳定，守住不发生系统性、区域性金融风险的底线。第一部分货币信贷概况2014年，银行体系流动性合理充裕，货币信贷和社会融资总量增长适度，贷款结构优化，融资成本下行，货币金融环境基本稳定。一、货币总量增长平稳适度，基础货币供给渠道出现变化2014年末，广义货币供应量M2余额为122.8万亿元，按可比口径同比增长12.2%，增速比上年末低1.4个百分点。狭义货币供应量M1余额为34.8万亿元，同比增长3.2%，增速比上年末低6.1个百分点。流通中货币M0余额为6.0万亿元，同比增长2.9%，增速比上年末低4.3个百分点。,270.0
7,全年现金净投放1688亿元，同比少投放2227亿元。2014年下半年以来，货币增速有所放缓，主要与经济结构调整步伐加快、表外融资收缩、监管措施强化以及国际收支变化有关。当前M2增速仍高出名义GDP增速3个百分点左右，可以满足实体经济的有效需求。年末基础货币余额为29.4万亿元，同比增长8.5%，增速比上年末高1.1个百分点，比年初增加2.3万亿元。货币乘数为4.18，比上年末高0.10。,195.0
8,金融机构超额准备金率为2.7%。其中，农村信用社为8.5%。2014年基础货币供给渠道发生了变化，中央银行货币政策工具（包括公开市场操作、再贷款再贴现和其他流动性支持工具）取代外汇占款成为基础货币供给的主渠道。全年央行货币政策工具供给基础货币约2万亿元，同比多增2.1万亿元；外汇占款供给基础货币约6400亿元，同比少增2.1万亿元。此外，财政存款同比少增超过5000亿元，也相应同比少减了基础货币。,200.0
9,"二、金融机构存款同比少增，季末波动有所减小2014年末，全部金融机构（含外资金融机构，下同）本外币各项存款余额为117.4万亿元，同比增长9.6%，增速比上年末低3.9个百分点,比年初增加10.2万亿元，同比少增2.5万亿元。",113.0
10,"人民币各项存款余额为113.9万亿元，同比增长9.1%，增速比上年末低4.7个百分点,比年初增加9.5万亿元，同比少增3.1万亿元。受货币基金快速发展、表外理财持续较快增长以及10月份以来股市明显回暖等因素影响，2014年以来存款分流效应较为明显，人民币各项存款更多转化为货币基金等非存款类金融机构存款。随着强化存款偏离度监管要求效果逐步显现，存款三、四季度末波动性减小，9月和12月最后一天存款分别新增6998亿元和3288亿元，同比分别少增4342亿元和6743亿元。外币存款余额为5735亿美元，同比增长30.8%，比年初增加1084亿美元，同比多增800亿美元；但9月份以来呈下降态势，2014年后4个月合计减少506亿美元，同比多减547亿美元，这与美联储结束量化宽松政策（QE）以及美元加息预期上升等因素有关。从人民币存款部门分布看，住户和非金融企业存款增速放缓，非存款类金融机构存款增长较快。",403.0
11,"年末住户存款余额为50.3万亿元，同比增长8.9%，增速比上年末低4.7个百分点,比年初增加4.1万亿元，同比少增1.4万亿元。非金融企业存款余额为37.8万亿元，同比增长4.6%，增速比上年末低5.8个百分点,比年初增加2.0万亿元，同比少增1.5万亿元。财政存款余额为3.6万亿元，比年初增加5531亿元，同比少增235亿元。非存款类金融机构存款余额为9.4万亿元，同比增长59.4%，增速比上年末高27个百分点，比年初增加3.5万亿元，同比多增2.5万亿元。三、金融机构人民币贷款年度增量创历史新高2014年末，金融机构本外币贷款余额为86.8万亿元，同比增长13.3%，比年初增加10.2万亿元，同比多增8223亿元。",313.0
12,"人民币贷款增长较快。年末余额为81.7万亿元，同比增长13.6%，增速连续两个月回升，比10月末高0.4个百分点，比上年末低0.5个百分点。全年新增人民币贷款9.78万亿元，同比多增8900亿元，增量创历史新高。从人民币贷款结构看，住户贷款增速高位回落，非金融企业及其他部门贷款增速回升；新增中长期贷款占比上升。年末，住户贷款余额为23.1万亿元，同比增长16.6%，增速比上年末低6.5个百分点,比年初增加3.3万亿元，同比少增4218亿元。",222.0
13,其中，个人住房贷款比年初增加1.6万亿元，同比多增368亿元。非金融企业及其他部门贷款余额为58.3万亿元，同比增长12.5%，增速比上年末高1.4个百分点，比年初增加6.5万亿元，同比多增1.3万亿元。从期限看，中长期贷款比年初增加6.1万亿元，同比多增1.5万亿元，在新增贷款中占比达62.0%，比上年高10.4个百分点。包含票据融资在内的短期贷款比年初增加3.4万亿元；其中票据融资新增9574亿元，同比多增1.0万亿元。各类金融机构贷款普遍同比多增，其中，中资全国性大型银行、中资区域性中小型银行同比多增较多。,259.0
14,"外币贷款增长放缓。2014年末，金融机构外币贷款余额为8351亿美元，同比增长7.5%，增速比上年末低6.2个百分点,比年初增加582亿美元，同比少增353亿美元。从投向看，短期单位普通贷款及透支增加355亿美元，同比多增208亿美元；贸易融资减少348亿美元，同比少增568亿美元；境外贷款增加378亿美元，同比略少增。四、社会融资规模结构变化初步统计，2014年社会融资规模为16.46万亿元，比上年少8598亿元，为历史次高水平（历史最高为2013年的17.32万亿元）。从全年社会融资规模整体情况看，主要有以下四个特点。",264.0
15,第一，人民币贷款占比明显上升。2014年，新增人民币贷款占社会融资规模的59.4%，同比高8.1个百分点。第二，外币贷款增量低于上年。新增外币贷款折合人民币为3554亿元，同比少增2294亿元；占同期社会融资规模的2.2%，比上年低1.2个百分点。其中，12月份外币贷款折合人民币增加540亿元，由之前连续五个月减少转为增加。,163.0
16,第三，债券和股票融资大幅增加，拉动直接融资金额和占比均创历史最高水平。非金融企业境内债券和股票合计融资2.86万亿元，比上年多8273亿元；占同期社会融资规模的17.3%，创历史最高水平，比上年高5.5个百分点。第四，表外融资同比大幅少增。2014年，实体经济以委托贷款、信托贷款和未贴现的银行承兑汇票方式合计融资2.90万亿元，同比少2.27万亿元；占同期社会融资规模的17.5%，比上年低12.3个百分点。12月份，表外融资恢复增长态势，合计融资7254亿元，分别比上月和上年同期多6966亿元和1737亿元，其中，信托贷款和未贴现银行承兑汇票融资由之前连续五个月为负转为正增长。,292.0
17,五、金融机构存贷款利率总体走低，企业融资成本高问题有所缓解根据国务院的统一部署，中国人民银行会同相关部门采取多项措施，综合运用数量型、价格型工具，引导社会融资成本下行。2014年末，银行间市场3年期、7年期AA级企业债到期收益率分别为5.85%和6.34%，较上年末分别下降1.50个和1.27个百分点。2014年12月，非金融企业及其他部门贷款加权平均利率为6.77%，比年初下降0.42个百分点。其中，一般贷款加权平均利率为6.92%，比年初下降0.22个百分点；票据融资加权平均利率为5.67%，比年初下降1.87个百分点。个人住房贷款利率先升后降，12月份加权平均利率为6.25%，比年初下降0.29个百分点。,309.0
18,从利率浮动情况看，执行下浮、上浮利率的贷款占比上升，执行基准利率的贷款占比下降。12月，一般贷款中执行下浮、上浮利率的贷款占比分别为13.10%和67.26%，比年初分别上升0.63个和3.86个百分点；执行基准利率的贷款占比为19.64%，比年初下降4.49个百分点。外币存贷款利率在国际金融市场利率波动、境内外币资金供求变化等因素的综合作用下，总体较年初有所下降。12月，活期、3个月以内大额美元存款加权平均利率分别为0.14%和0.64%，比年初分别下降0.04个和1.34个百分点；3个月以内、3（含）-6个月美元贷款加权平均利率分别为2.29%和2.22%，比年初分别下降0.37个和0.60个百分点。六、人民币汇率双向浮动弹性明显增强2014年，人民币汇率小幅贬值，双向浮动特征明显，汇率弹性显著增强，人民币汇率预期总体平稳。,369.0
19,2014年末，人民币对美元汇率中间价为6.1190元，比2013年末贬值221个基点，贬值幅度为0.36%。2005年人民币汇率形成机制改革以来至2014年末，人民币对美元汇率累计升值35.26%。根据国际清算银行的计算，2014年，人民币名义有效汇率升值6.41%，实际有效汇率升值6.24%；2005年人民币汇率形成机制改革以来至2014年12月，人民币名义有效汇率升值40.51%，实际有效汇率升值51.04%。七、跨境人民币业务保持平稳发展2014年，跨境贸易和投资人民币结算业务保持平稳发展。初步统计，银行累计办理跨境贸易人民币结算业务6.55万亿元2，同比增长42%。,290.0
20,其中，货物贸易结算金额为5.9万亿元；服务贸易及其他经常项目结算金额为0.65万亿元。跨境贸易人民币结算实收2.73万亿元，实付3.82万亿元，收付比为1：1.4。直接投资方面，2014年银行累计办理人民币跨境直接投资结算金额1.05万亿元，其中，人民币对外直接投资结算金额为1865.6亿元，同比增长118%；外商直接投资结算金额为8620.2亿元，同比增长92%。自2014年8月份开始，无货物报关的转口贸易，由服务贸易调整到货物贸易进行统计，货物贸易金额扩大，服务贸易金额相应减少，历史数据一并调整。第二部分货币政策操作2014年以来，面对复杂多变的国内外经济金融形势，根据党中央、国务院统一部署，中国人民银行坚持稳中求进、改革创新，继续实施稳健的货币政策，既保持定力又主动作为，瞄准经济运行中的突出问题，不断补充和完善货币政策工具组合，适时适度预调微调。,381.0
21,一、灵活开展公开市场操作2014年，随着国际收支和人民币汇率趋向均衡，并受美联储逐步退出QE等因素影响，外汇流入减少，对银行体系流动性的影响总体趋于中性，但阶段性波动仍然存在。同时，在金融市场快速发展、金融创新持续涌现的背景下，传统季节性因素与市场因素、监管因素等相互交织，加大了银行体系流动性供求变化的不确定性。中国人民银行深入分析不同阶段流动性供求变化的特点，按照稳健货币政策要求灵活开展公开市场操作，合理安排操作工具组合，有效调节银行体系流动性，既保证了流动性总量的适度充裕，又促进了流动性和货币市场的平稳运行。,259.0
22,上半年，针对外汇占款增长前快后慢、春节等季节性因素对流动性影响较大的特点，以正回购操作为主、逆回购操作为辅，搭配使用短期流动性调节工具（SLO）灵活开展公开市场操作，保持流动性总量合理适度和分布均衡；进入下半年之后，综合考虑流动性总量仍较为充裕，但外汇占款增长进一步放缓、影响流动性供求的不确定因素有所增多的实际情况，逐步降低公开市场正回购操作的力度和频率，直至暂停正回购操作，并通过正回购和央行票据到期、开展SLO操作等适时适度投放流动性，与其它工具相配合促进流动性平稳增长，同时加强预调微调，熨平流动性短期波动。,258.0
23,全年公开市场累计开展正回购操作30210亿元，开展逆回购操作5250亿元；开展SLO操作累计投放流动性10210亿元，回笼流动性1000亿元。年末公开市场正、逆回购操作余额均为0；SLO投放流动性操作余额为1000亿元，回笼流动性操作余额为0；央行票据余额为4222亿元。中国人民银行密切监测各阶段市场利率走势变化，合理把握并适时增强公开市场操作利率弹性，有效引导市场预期。上半年，公开市场操作利率总体保持稳定;下半年，顺应市场利率走势变化，同时配合存贷款基准利率调整，公开市场14天期正回购操作利率先后4次下行，累计降幅达60个基点，对引导货币市场利率平稳下行、降低社会融资成本发挥了积极作用。适时开展中央国库现金管理操作。,313.0
24,2014年共开展12期中央国库现金管理商业银行定期存款业务，操作规模共计6200亿元，其中3个月期3800亿元，6个月期1500亿元，9个月期900亿元；年末余额为2700亿元，比上年末增加1600亿元。,102.0
25,二、适时开展常备借贷便利操作，创设中期借贷便利为加强和改善银行体系流动性管理，保持流动性合理适度，促进货币市场平稳运行，2014年1月，中国人民银行在10个省（市）开展分支机构常备借贷便利操作试点，向符合宏观审慎要求的地方法人金融机构提供短期流动性支持。,127.0
26,2014年春节前，中国人民银行总行和试点地区分支机构向符合条件的金融机构提供了短期流动性支持，探索发挥常备借贷便利利率作为货币市场利率上限的作用，稳定市场预期，促进货币市场平稳运行。根据货币市场流动性总体情况，第二季度以来人民银行未开展常备借贷便利操作，年末常备借贷便利余额为0。中国人民银行于2014年9月创设中期借贷便利，向符合宏观审慎管理要求的商业银行、政策性银行提供中期基础货币。2014年，人民银行累计开展中期借贷便利操作1.14万亿元，年末余额为6445亿元，期限均为3个月，利率为3.5%。总体看，在外汇占款渠道投放基础货币出现阶段性放缓的情况下，中期借贷便利起到了主动补充基础货币的作用，有利于引导货币信贷和社会融资稳定增长，为稳增长和调结构营造中性适度的货币金融环境。,343.0
27,中国人民银行在提供中期借贷便利的同时，引导金融机构加大对小微企业和“三农”等国民经济重点领域和薄弱环节的支持力度，发挥中期政策利率的作用，促进降低贷款利率和社会融资成本，更好地服务实体经济。三、实施定向降准，调整存款准备金交存范围两次实施定向降准，建立引导金融机构提高“三农”和小微企业贷款比例的正向激励机制。中国人民银行于2014年4月和6月，分别下调县域农村商业银行和农村合作银行人民币存款准备金率2个和0.5个百分点，对符合审慎经营要求且“三农”或小微企业贷款达到一定比例的商业银行下调人民币存款准备金率0.5个百分点。此外，下调财务公司、金融租赁公司和汽车金融公司人民币存款准备金率0.5个百分点。结合基础货币投放渠道变化情况和季节性因素影响，为弥补流动性缺口，保持流动性合理适度，中国人民银行决定自2015年2月5日起下调金融机构人民币存款准备金率0.5个百分点。,387.0
28,同时，为进一步增强金融机构支持结构调整的能力，加大对小微企业、“三农”以及重大水利工程建设的支持力度，对小微企业贷款占比达到定向降准标准的城市商业银行、非县域农村商业银行额外降低人民币存款准备金率0.5个百分点，对中国农业发展银行额外降低人民币存款准备金率4个百分点。,134.0
29,此外，中国人民银行于2015年起对存款统计口径进行调整，将存款类金融机构吸收并原在同业往来项下统计的证券及交易结算类存放、银行业非存款类存放、SPV存放、其他金融机构存放以及境外金融机构存放纳入各项存款统计范围，上述新纳入各项存款口径的存款计入存款准备金交存范围，适用的存款准备金率暂定为零。,146.0
30,"四、加强宏观审慎管理，继续发挥差别准备金动态调整机制的逆周期调节和结构引导作用继续运用差别准备金动态调整机制加强宏观审慎管理。根据国内外经济金融形势变化、金融机构稳健性状况和信贷政策执行情况，2014年各季度,人民银行均根据形势变化适时调整差别准备金动态调整机制的有关参数，并进一步完善了差别准备金动态调整规则，根据有效信贷需求状况，在参数调整上向支农支小较多的中小金融机构，以及中西部和欠发达地区金融机构倾斜，更有针对性地鼓励和引导金融机构提高对小微企业、“三农”及中西部、欠发达地区的贷款比例，引导信贷合理增长。五、新设信贷政策支持再贷款等工具，加大再贷款、再贴现力度，支持优化信贷投放中国人民银行于2014年初调整再贷款分类，设立信贷政策支持再贷款类别，包括支农再贷款和新设的支小再贷款，并创设抵押补充贷款（PSL），主要发挥促进信贷结构调整的作用，支持金融机构扩大对“三农”、小微企业和棚改等国民经济重点领域和薄弱环节的信贷投放。进一步完善信贷政策支持再贷款和再贴现管理政策，多次增加支农再贷款、支小再贷款和再贴现额度。",464.0
31,年末全国支农再贷款余额为2154亿元，比年初增加470亿元;支小再贷款余额为524亿元，比年初增加524亿元，再贴现余额为1372亿元，比年初增加235亿元。开展信贷资产质押和央行内部评级试点工作。为保障央行债权安全，防范金融机构道德风险，解决中小金融机构合格抵押品相对不足的问题，2014年，人民银行总行在山东、广东开展信贷资产质押和央行内部评级试点，将经人民银行内部评级的金融机构优质信贷资产纳入央行合格抵押品范围，完善中央银行抵押品管理框架。目前，试点地区初步建立了信贷资产质押再贷款的基本制度、操作规程和央行内部评级数据库，并开展了信贷资产质押再贷款操作，形成了可复制可推广的经验。2015年，人民银行将逐步推广分支行信贷资产质押和央行内部评级试点。,329.0
32,六、加强窗口指导和信贷政策引导中国人民银行充分发挥货币政策、宏观审慎政策工具以及信贷政策的信号和结构引导作用，加强信贷政策与产业政策的协调配合，进一步改进和完善信贷政策导向效果评估，引导金融机构优化信贷结构。,104.0
33,鼓励银行业金融机构探索创新组织、机制、抵押品、产品和服务模式，将更高比例的贷款投向“三农”和小微企业等国民经济重点领域和薄弱环节。研究拓宽农村抵押担保物范围，鼓励银行创新开展家庭农场、种养大户等新型农业经营主体“一对一”金融服务。加大民生金融力度，在14个连片特困地区全面建立了服务联动协调机制；继续完善就业、助学、少数民族、农民工、大学生村官等民生金融；做好金融支持鲁甸地震灾后恢复重建的金融服务工作。加大对有市场发展前景的先进制造业、战略性新兴产业、现代信息技术产业和信息消费、文化产业、服务业、传统产业改造升级以及绿色环保等领域的资金支持力度。保证符合条件的在建续建工程和项目的合理资金需求，积极支持棚户区改造、铁路、农田水利、地下管网等既惠民生也能提升增长质量和效益的重大基础设施和民生工程建设。,352.0
