,paragraph,length
34,对于产能过剩行业，根据“区别对待、不搞一刀切”的原则，督促金融机构按照“消化一批、转移一批、整合一批、淘汰一批”的要求，改进和强化信贷管理。改进和落实好差别化住房信贷政策。此外，注重发挥资本市场作用，积极推进信贷资产证券化盘活信贷存量，支持符合条件的商业银行发行小微企业金融债券，启动“三农”专项金融债券发行工作。在各项措施综合引导下，金融机构信贷结构继续优化，对小微企业、中西部地区等的支持力度增强。,201.0
35,一是小微企业贷款较快增长，贷款增速高于各项贷款平均水平，全年贷款增量高于上年。2014年末，小微企业贷款余额为15.26万亿元，同比增长15.5%，增速比2013年末高1.3个百分点，比同期各项贷款增速高1.9个百分点。2014年小微企业贷款新增2.13万亿元，同比多增1285亿元，占企业新增贷款的41.9%，比同期大型企业新增贷款占比高18.1个百分点。,179.0
36,"二是中西部地区贷款增速持续高于东部地区,信贷资金持续向中西部倾斜。2014年末，西部地区贷款余额同比增长16.7%，增速比中部地区高0.9个百分点，比东部地区高5.2个百分点。",88.0
37,三是产能过剩行业中长期贷款增速回落。2014年末，产能过剩行业中长期贷款余额同比增长3.9%，增速较2013年末回落3.6个百分点。七、下调金融机构存贷款基准利率，继续推进利率市场化改革针对实体经济反映的“融资难、融资贵”问题，结合物价等变动趋势，中国人民银行于2014年11月22日采取非对称方式下调金融机构人民币贷款和存款基准利率。其中，金融机构一年期贷款基准利率下调0.4个百分点至5.6%；一年期存款基准利率下调0.25个百分点至2.75%。此次利率调整适应物价水平整体走低的形势，稳健货币政策取向并未发生变化。下调存贷款基准利率，有利于发挥基准利率的引导作用，有针对性地引导市场利率和社会融资成本下行，促进实际利率逐步回归合理水平。利率市场化改革继续推进并取得重要进展。,340.0
38,一是金融机构利率管制有序放开。2014年3月1日，放开中国（上海）自由贸易试验区小额外币存款利率上限。11月22日，在下调存贷款基准利率的同时，将人民币存款利率浮动区间的上限由存款基准利率的1.1倍调整为1.2倍，并对基准利率期限档次作适当简并，金融机构自主定价空间进一步扩大。,139.0
39,二是市场利率定价自律机制不断健全。自律机制成员范围逐步扩大，新增93家金融机构作为自律机制成员，进一步发挥自律机制的激励约束作用。,65.0
40,三是同业存单发行交易稳步推进。同业存单的发行主体范围进一步扩大，发行交易日益活跃。这不仅有效提升了银行主动管理负债和自主定价的能力，也为推出面向企业和个人发行的大额存单积累了宝贵经验。2014年，89家金融机构在银行间市场发行同业存单998只，发行总量为8986亿元，二级市场交易总量为4231亿元。同业存单发行交易全部参照Shibor定价，同业存单市场的较快发展，为提高中长端Shibor的基准性奠定了基础。,205.0
41,12月，3个月期同业存单发行加权平均利率为5.01%，较3个月Shibor高43个基点。专栏1央行利率政策调整后金融机构的存贷款利率定价变化中国人民银行于2014年11月22日采取非对称方式下调了金融机构人民币贷款和存款基准利率，并进一步推进利率市场化改革。利率政策调整后金融机构贷款利率有所下行，存款利率定价的市场化程度进一步提高，政策效果初步显现。贷款定价方面，此次降息后商业银行迅速按照新的基准利率，相应下调了贷款挂牌利率和定价系统中的相关参数，银行客户的贷款利率水平有所降低，通过下调基准利率引导实际贷款利率下行的作用逐步显现。目前，贷款基础利率（LPR）报价为5.51%，较降息前下降0.25个百分点。,306.0
42,12月，非金融性企业及其他部门一般贷款（不含贴现）加权平均利率为6.92%，比降息前（2014年10月，下同）下降0.44个百分点。受12月货币市场利率变动的影响，票据融资利率有所上升，一定程度上收窄贷款利率总体降幅。当月，非金融性企业及其他部门贷款加权平均利率为6.77%，比降息前下降0.11个百分点。利率政策调整后，金融机构基本能够综合考虑资金成本、管理成本、风险溢价等因素，按照收益覆盖风险成本的原则合理确定贷款利率，贷款利率定价的差异化特征进一步显现。根据调研的情况，从金融机构看，利率政策调整后国有、股份制商业银行的贷款加权平均利率仍低于农村合作金融机构等地方法人金融机构，体现出针对不同贷款客户差异化定价的特点。,313.0
43,从企业看，降息后大中小微企业贷款利率水平均有所下降，由于客户风险溢价不同，各类型企业贷款利率较基准利率的浮动幅度呈现梯度上行。存款定价方面，此次利率政策调整后，金融机构存款挂牌平均利率总体下降，各期限品种利率浮动区间有所扩大，但距1.2倍的上限仍有一定空间。据调查，12月金融机构活期、3个月、6个月、1年期、2年期和3年期存款加权平均利率分别为0.37%、2.74%、2.98%、3.23%、3.92%和4.61%，除活期存款利率保持不变、3年期存款利率较调整前小幅上升外，其余各期限品种利率均有所下降。总体看，各期限存款加权平均利率相当于基准利率的1.17倍左右。利率政策调整后，金融机构存款利率定价策略有所分化，存款利率初步形成分层。,320.0
44,国有商业银行存款挂牌利率最低，地方法人金融机构普遍较高，股份制商业银行介于二者之间。同时，国有商业银行和股份制银行普遍对分支机构扩大了存款利率定价权限，授权分支机构根据自身经营策略、不同区域市场竞争环境、客户综合贡献度等因素差别化定价，合理控制资金成本。总体看，此次利率调整并推进利率市场化改革后，金融机构自主定价空间进一步扩大，实际存贷款利率均有所下行，对促进降低企业融资成本、提高金融机构自主定价能力、健全市场化利率形成和传导机制都发挥了积极作用。考虑到此次利率调整政策的执行时间尚短，贷款利率的下降还会受到金融机构筹资成本、年初重定价、贷款风险溢价等多方面因素影响，政策执行效果仍需进一步观察。八、完善人民币汇率形成机制继续按主动性、可控性和渐进性原则，进一步完善人民币汇率市场化形成机制，保持人民币汇率在合理均衡水平上的基本稳定。,369.0
45,2014年3月15日，中国人民银行宣布将银行间即期外汇市场人民币兑美元交易价浮动幅度由1%扩大至2%。7月2日，中国人民银行取消银行对客户美元挂牌买卖价差管理。让市场供求在汇率形成中发挥更大作用，人民币汇率弹性增强，汇率预期分化，央行基本退出常态外汇干预，建立有管理的浮动汇率制度。2014年，人民币对美元汇率中间价最高为6.0930元，最低为6.1710元，245个交易日中107个交易日升值、138个交易日贬值，最大单日升值幅度为0.37%（225点），最大单日贬值幅度为0.18%（111点）。人民币对欧元、日元等其他国际主要货币汇率有所升值。,275.0
46,2014年末，人民币对欧元、日元汇率中间价分别为1欧元兑7.4556元人民币、100日元兑5.1371元人民币，分别较2013年末升值12.92%和升值12.46%。2005年人民币汇率形成机制改革以来至2014年末，人民币对欧元汇率累计升值34.32%，对日元汇率累计升值42.22%。为促进双边贸易和投资，中国人民银行继续采取措施推动人民币直接交易市场发展。2014年，在银行间外汇市场先后推出人民币对新西兰元、英镑、欧元以及新加坡元直接交易，推出人民币对哈萨克斯坦坚戈银行间市场区域交易。银行间外汇市场人民币直接交易成交活跃，流动性明显提升，降低了微观经济主体的汇兑成本。,289.0
47,专栏2人民币对外币直接交易稳步发展2009年跨境人民币业务试点以来，人民币在国际上的使用范围更加广泛，加之国际金融危机后主要货币汇率波动加大，一些新兴市场的微观经济主体出于节约汇兑成本等考虑，对人民币与新兴市场货币兑换交易的需求上升。,117.0
48,为满足经济主体的需求，中国人民银行开始探索在银行间外汇市场挂牌人民币对新兴市场货币直接交易。2010年，人民币对马来西亚林吉特和俄罗斯卢布直接交易在我国和对方国家银行间外汇市场同时挂牌。随着人民币国际影响力提升以及人民币对外币直接交易市场的发展，一些发达经济体希望其货币与人民币开展直接交易。截至2014年末，已实现人民币与八种货币在双方银行间外汇市场直接交易。境外人民币直接交易市场获得长足发展。,199.0
49,人民币对外币直接交易日益活跃，成交快速增长，2014年，人民币对外币直接交易共成交10482亿元人民币，在银行间外汇市场即期交易中占比为4.7%，而2010年前银行间外汇市场人民币对非美货币成交量占比不到0.5%。,107.0
50,开展直接交易以来至2014年末，人民币直接交易日均成交102.22亿元人民币，与各币种推出直接交易前一年日均成交12.12亿元人民币相比，提升了8.4倍。人民币对外币直接交易有以下特点：一是建立不经套算的直接汇率形成机制。在未实现直接交易前，银行的通常做法是先将柜台非美货币结售汇头寸在银行间外汇市场兑换为美元头寸，然后再通过人民币对美元交易平盘。实现直接交易后，银行将不对头寸进行拆分而直接在银行间外汇市场平盘，促进直接汇率的形成。在此基础上，人民币对直接交易货币的中间价也不再经美元套算，而是由直接交易做市商报价形成，市场汇率主要受双边本币结算的供求关系和国际汇市的影响。,288.0
51,二是做市商结构优化。每一个直接交易货币都有各自独立的做市商体系，涵盖不同类型的做市商，以体现差异化的市场需求。既有柜台基础较好的中资银行，也有做市经验丰富的外资银行，中资银行中不仅包含业务覆盖面广的全国性商业银行，也有边贸活跃地区的地方性银行；外资银行则包含全球性商业银行以及直接交易货币发行国银行在中国境内的分行。,158.0
52,三是直接交易货币更为丰富。五年来，人民币直接交易货币顺应市场需求从最初的林吉特、卢布等周边国家货币扩展到了欧元、英镑、日元等主要储备货币以及澳大利亚元、新西兰元、新加坡元等可兑换货币，初步形成人民币直接交易网络，这与人民币国际化进程也是相适应的。,123.0
53,四是境内外人民币对外币市场协同发展。在推动人民币对外币直接交易的过程中，注重双边对等挂牌的原则，形成境内外人民币直接交易市场的联动、相互促进，对于韩元等部分有一定兑换限制的货币，则在对方市场先进行人民币直接交易。目前，莫斯科、伦敦、法兰克福、新加坡和澳大利亚等地都已形成一定规模的人民币直接交易离岸市场，不仅为境外主体进行人民币对当地货币的兑换提供了便利，也产生了规模效应。人民币直接交易稳步发展的好处逐步显现。,206.0
54,一是降低汇兑成本。银行通过直接交易一次平盘可降低平盘成本，再通过内部定价机制向柜台结售汇牌价传导。从银行对个人的结售汇牌价看，直接交易货币银行柜台买卖差价从原来的0.8%缩小为0.7%，汇兑成本降低12.5%，由于企业有一定的议价空间，节省的汇兑成本更多。,128.0
55,二是提高价格透明度。未实现直接交易前，经济主体缺乏人民币对该货币汇率信息。直接交易形成人民币对该货币的双边汇率，能降低汇率信息的搜寻成本和摩擦成本。,74.0
56,三是推动人民币国际化。近年来，在俄罗斯、韩国已形成相当规模的当地货币对人民币直接交易。以俄罗斯外汇市场人民币对卢布交易快速发展为例，2014年莫斯科交易所（MICEX）人民币对卢布交易量是2013年交易量的7倍。,106.0
57,四是促进外汇市场发展，服务实体经济。实现双边货币直接交易，银行间市场直接交易为柜台结售汇提供了流动性，可促进银行增加柜台挂牌币种，这些都有助于为实体经济提供汇兑便利。,83.0
58,五是有助于增强汇率弹性，推动人民币汇率市场化形成机制改革。随着我国与世界各国经贸往来的发展，人民币与外币直接交易需求将逐步上升。中国人民银行将继续推动人民币对外币直接交易市场发展，促进双边经贸往来，为促进贸易投资便利化提供更加便捷高效且低成本的金融服务。2014年，在中国人民银行与境外货币当局签署的双边本币互换协议下，境外货币当局共开展交易11305.50亿元人民币，共实际动用380.07亿元人民币，动用余额为158.01亿元人民币，对促进双边贸易投资发挥了积极作用。九、深入推进金融机构改革《存款保险条例（征求意见稿）》向全社会公开征求意见。,274.0
59,2014年，国务院常务会议审议通过了《中国人民银行关于建立存款保险制度实施方案的汇报》，拟建立存款保险制度，覆盖所有存款类金融机构，实行最高50万元的有限赔付，以低费率起步，将保费建立存款保险基金。12月30日，《存款保险条例（征求意见稿）》向全社会公开征求意见已经结束。存款保险制度是市场经济条件下保护存款人利益和完善金融安全网的重要制度安排，对于理顺政府与市场的关系、深化金融改革、维护金融稳定和提升金融业竞争力具有重要作用。50万元的保护限额，能够为目前全部金融机构99.6%的存款人提供全额保护，确保绝大多数存款人的信心和稳定。金融机构改革继续深化。,279.0
60,2014年7月，国家开发银行住宅金融事业部获批开业。同时，进一步发挥开发性金融对棚户区改造的支持作用，为棚改提供依法合规、操作便捷、成本适当、来源稳定的融资渠道。2014年，国家开发银行共新增发放棚改贷款4086亿元，较上年增加3026亿元，增长286%。农业发展银行改革方案经国务院63次常务会议原则同意，明确了改革的总体目标和主要政策措施。加快推进国家开发银行和进出口银行改革，进一步强化两家银行服务国家战略的功能和作用。,213.0
61,资产管理公司转型改制工作取得新进展。8月，华融资产管理公司与八家战略投资者正式签署战略合作协议，战略投资者投资共计145.4亿元，占华融资产管理公司增资后股份总额的21.0%。农村信用社改革稳步推进，经营财务状况和涉农金融服务持续改善。2014年末，全国农村信用社不良贷款比例为3.8%，同比下降0.3个百分点；资本充足率为13.2%，同比提高2.8个百分点；拨备覆盖率为135.2%，同比提高8.7个百分点；全年实现利润2339亿元。涉农贷款和农户贷款余额分别为7.1万亿元和3.4万亿元，分别同比增长13.4%和12.0%。,264.0
62,截至2014年末，全国共组建以县（市）为单位的统一法人农村信用社1484家，农村商业银行665家，农村合作银行89家。全国农村信用社普遍基本建立了“三会一层”的法人治理组织架构和制度规则并初步运行，内部管理水平有所提升。十、深化外汇管理体制改革推进简政放权和便利化取得新成效。,138.0
63,一是行政审批项目进一步下降。2014年取消5项行政审批项目，共废止外汇管理法规88件。,43.0
64,二是支持外贸平稳发展措施不断深化。继续深化贸易外汇管理改革，推进边贸和个人贸易便利化，取消边贸账户行政许可，简化个人贸易单证要求，促进外贸多元化发展。,75.0
65,三是跨境电子商务外汇支付业务试点稳步推进。全国22家试点企业累计办理跨境收付已超过10亿美元，支持电子商务等新型服务业发展。资本项目可兑换程度不断提高。,76.0
66,一是跨国公司外汇资金集中运营试点推广到全国。允许200余家国有、民营和外资跨国企业集中管理其境内外外汇资金，切实降低大型企业和跨国公司的财务成本。,73.0
67,二是资本金意愿结汇改革试点逐步扩大。按照负面清单的思路，在上海自贸区、天津滨海新区等17个国家级经济金融改革试验区，开展资本金意愿结汇改革试点，赋予企业资本金结汇的自主权和选择权。,90.0
68,三是“走出去”资金运用渠道进一步拓宽。大幅简化返程投资外汇管理，允许购付汇用于境外特殊目的公司设立及营运，取消对特殊目的公司境外放款限制。,69.0
69,四是资本市场双向开放不断扩大。简化人民币合格境外机构投资者额度管理，支持部分地区开展合格境内有限合伙人（QDLP）试点。,60.0
70,五是资本项目便利化措施有效落地。取消全部跨境担保事前审批，统一中外资企业外保内贷政策；取消外债转贷款在相关环节的核准；在部分地区开展外商投资企业外债比例自律试点，降低企业融资成本。此外，完善跨境资金流动统计监测体系，提高对外汇资金流动的监测预警与管理水平，进一步完善国际收支统计制度。第三部分金融市场分析2014年，金融市场健康平稳运行，货币市场交易活跃，市场利率总体平稳；债券发行规模显著扩大，债券收益率曲线大幅下移；股票市场指数明显上升，筹资额大幅增加。金融市场各项改革稳步推进，产品创新不断深化，市场制度逐步完善，金融市场对于降低社会融资成本、促进实体经济发展的作用得以进一步发挥。,294.0
71,一、金融市场运行分析（一）货币市场交易活跃，市场利率总体平稳银行间回购交易量增速大幅上升，拆借交易量快速增长。2014年，银行间市场债券回购累计成交224.4万亿元，日均成交8977亿元，同比增长41.9%，增速比上年高30.7个百分点；同业拆借累计成交37.7万亿元，日均成交1507亿元，同比增长6.0%，增速比上年高30.3个百分点。从期限结构看，市场交易仍主要集中于隔夜品种，回购和拆借隔夜品种的成交量分别占各自总量的78.1%和78.3%。交易所债券回购累计成交90.72万亿元，同比增长37.2%。从融资主体结构看，主要呈现以下特点：一是大型银行作为市场资金供给方的作用进一步突出，全年净融出量同比增长87.1%，增速比上年高111.8个百分点。,329.0
72,二是中小型银行、证券及基金公司的资金需求持续增长，资金融入量同比分别增长114.8%和90.7%，其中中小型银行三、四季度资金净融入大幅增加，占全年净融入量的73.9%。货币市场利率运行平稳。上半年总体下行，受季节性等因素影响，6、7月份市场利率有所波动，12月份有所上升，但仍低于上年同期水平。12月新股密集发行、股市持续升温，同时在外汇占款净下降、年末备付增加等因素作用下，货币市场利率有所上升，当月同业拆借和质押式回购月加权平均利率均为3.49%，比上年同期分别低67个和79个基点。2014年末，隔夜、1周Shibor分别为3.53%和4.64%，分别较上年末上升38个基点和下降61个基点；3个月和1年期Shibor分别为5.14%和4.73%，分别较上年末下降42个和23个基点。,346.0
73,"利率衍生品交易较快增长。2014年，人民币利率互换市场名义本金总额为4.03万亿元，同比增长47.9%。从期限结构来看，1年及1年期以下交易最为活跃，其名义本金总额为3.18万亿元，占总量的78.9%。从参考利率来看，人民币利率互换交易的浮动端参考利率主要包括7天回购定盘利率（FR007）和Shibor,与之挂钩的利率互换交易名义本金占比分别为81.1%和18.2%。为满足市场成员日益增长的利率避险需求，促进现货市场和衍生品市场联动发展，2014年11月中国外汇交易中心推出银行间市场标准利率衍生品，包括以FR007和SHIBOR为基准的四种产品。",276.0
74,截至2014年末，标准利率衍生产品共成交212笔，总计413.5亿元。（二）债券发行规模显著扩大，收益率曲线大幅下移银行间债券市场现券交易量接近上年同期水平。2014年累计成交40.36万亿元，日均成交1614亿元，同比下降3%。从交易主体看，中资中小型银行是银行间现券市场的主要净卖出方，全年净卖出现券1.11万亿元；其他金融机构及产品、外资金融机构是主要净买入方，全年分别净买入现券5988亿元和4186亿元；四季度中资大型银行由前三季度的净卖出方转为净买入方，全年净买入397亿元。从交易品种看，全年国债现券交易累计成交5.88万亿元，占银行间市场现券交易的14.6%；金融债券和公司信用类债券现券交易分别累计成交18.46万亿元和15.89万亿元，分别占45.7%和39.4%。,343.0
75,2014年交易所债券现券成交2.81万亿元，同比增长61.6%。银行间债券市场指数呈上行趋势。2014年，中债综合净价指数由年初的96.07点上升至年末的101.42点，升幅为5.57%；中债综合全价指数由年初的107.47点上升至年末的114.50点，升幅为6.54%。交易所国债指数由年初的139.52点升至年末的145.60点，升幅为4.36%。银行间市场国债收益率曲线整体大幅下移。,195.0
76,2014年末，国债收益率曲线1年、3年、5年、7年、10年期收益率较上年末分别下降96个、105个、95个、98个、93个基点，10年期与1年期国债期限利差为36个基点，较上年末扩大3个基点。收益率曲线整体下移的主要原因，一是宏观经济增速放缓和物价涨幅回落；二是规范商业银行同业业务后，到期资金逐步回流债券市场；三是央行综合运用货币政策工具加强调控，资金面波幅整体收窄，增强了债券市场的投资需求。债券发行规模显著增加。2014年累计发行各类债券（含中央银行票据）10.98万亿元，比上年多发行2.12万亿元。主要是非金融企业债务融资工具和金融债券发行增加较多。,280.0
77,年末国内各类债券余额为35.32万亿元，同比增长17.8%。创新推出项目收益票据、碳排放收益债券等产品。项目收益票据由项目公司发行，并以项目经营性现金流作为主要还款来源。项目收益票据的创设，有利于探索建立透明规范的城市建设投融资机制，有效控制和化解地方政府性债务风险，为城镇化建设提供资金保障。碳排放收益债券按固定利率加浮动利率的方式进行定价。,172.0
78,其中，浮动利率参考发行人特定项目的碳收益率。碳排放收益债券的推出，开创了国内债务融资工具定价挂钩“非常规标的”并推广低碳概念的先河，对于改善低碳经济、发展金融生态、促进产业结构转型升级具有重要意义。债券发行利率总体明显回落。12月发行的10年期国债利率为3.77%，比上年11月发行的同期限国债利率低31个基点。12月国开行发行的10年期金融债利率为4.37%，比上年同期发行的同期限债券利率低67个基点。,203.0
79,公司信用类债券发行利率12月份有所回升，但仍明显低于上年同期水平。主体评级AAA的企业发行的短期融资券（债券评级A-1）平均利率为5.3%，比9月份高26个基点，比上年同期低129个基点；主体评级AAA的企业发行的5年期中期票据（债券评级AAA）平均利率为5.67%，比9月份高18个基点，比上年同期低81个基点。Shibor对债券产品定价基准作用不断提升。2014年，发行以Shibor为基准定价的浮动利率债券2只，总量为80亿元；发行固定利率企业债582只，总量为6892亿元，全部参照Shibor定价；发行参照Shibor定价的固定利率短期融资券10341亿元，占固定利率短期融资券发行总量的98%。（三）票据融资快速增长，利率呈下降趋势票据承兑业务小幅增长。,333.0
