,paragraph,length
40,试点地区人民银行分支机构对辖内地方法人金融机构的部分贷款企业进行央行内部评级，将评级结果符合标准的信贷资产纳入人民银行发放再贷款可接受的合格抵押品范围。信贷资产质押再贷款试点是完善央行抵押品管理框架的重要举措，有利于提高货币政策操作的有效性和灵活性，有助于解决地方法人金融机构合格抵押品相对不足的问题，引导其扩大“三农”、小微企业信贷投放，降低社会融资成本，支持实体经济。将优质信贷资产纳入央行抵押品范围，为地方法人金融机构获得更多的央行流动性提供了必要前提，但并不意味着所有地方法人金融机构将因此自动获得央行流动性支持。人民银行将继续执行稳健货币政策，合理调控流动性投放，确保流动性总体适度，合格抵押品范围的扩大不会导致央行大规模投放流动性。七、结合下调存贷款基准利率，放开存款利率上限继2015年上半年连续三次降息后，为继续发挥基准利率的引导作用，推动社会融资成本下行，加大金融支持实体经济的力度，中国人民银行分别于8月26日和10月24日两次下调金融机构人民币存贷款基准利率，其中一年期贷款基准利率累计下调0.5个百分点至4.35%，一年期存款基准利率累计下调0.5个百分点至1.5%。,496.0
41,随着各项政策措施效果的逐步显现，金融机构贷款利率明显下降，货币市场、债券市场利率继续走低，企业融资成本高问题得到有效缓解。存款利率总体下行，分层有序、差异化竞争的金融机构存款定价格局进一步形成。目前，下调贷款及存款基准利率的政策效果仍在逐步释放，并将继续为促进降低社会融资成本发挥积极作用。寓改革于调控之中，放开存款利率上限。结合下调存贷款基准利率，8月26日，放开金融机构一年期以上（不含一年期）定期存款利率浮动上限；10月24日，放开商业银行和农村合作金融机构等活期及一年期（含）以内定期存款利率的上限。,254.0
42,存款利率上限的放开，标志着我国的利率管制已经基本取消，利率市场化迈出了非常关键的一步，改革进入新的阶段。利率管制的基本放开，既有利于进一步增强利率的价格杠杆功能，促进优化资源配置；也有利于推动金融机构提高自主定价能力，加快经营模式转型，提升金融服务水平；同时，还为货币政策调控方式由数量型为主向价格型为主转变、提高宏观调控效率创造了条件。专栏2利率市场化改革迈出关键一步经国务院批准，中国人民银行决定自10月24日起结合降息降准，对商业银行和农村合作金融机构等不再设置存款利率浮动上限。这标志着我国的利率管制已经基本放开，利率市场化改革迈出了关键的一步。这在利率市场化进程中，在整个金融改革的历史上，都具有重要的里程碑意义，充分体现了我国坚定推进改革的信心和决心。,332.0
43,利率管制的基本放开，对优化资源配置具有重大意义。在利率市场化条件下，利率的价格杠杆功能将进一步增强，推动金融资源向真正有资金需求和发展前景的行业、企业配置，有利于发挥市场在资源配置中的决定性作用，提高资源配置的效率。特别是在当前我国经济处在新旧产业和发展动能转换接续的关键期，放开利率管制可为金融机构按照市场化原则筛选支持的行业、企业提供更大空间，有利于稳增长、调结构、惠民生，促进经济健康可持续发展。利率管制的基本放开，为推动金融机构转型发展注入新的动力。随着存款利率上限的放开，金融机构在利率受保护情况下“规模即效益”的传统经营模式将不可持续，有利于推动金融机构树立起“以利润为中心”的经营理念，加快转变经营模式，完善利率定价机制，提高自主定价能力，实现差异化定价，满足日益多样化的金融需求，切实提升金融服务水平。,359.0
44,利率管制的基本放开，为货币政策调控框架转型创造了有利条件。随着金融创新发展，作为中介目标的货币总量与经济增长、物价等最终目标之间的相关性也有所降低。利率市场化有利于促使利率真正反映市场供求情况，并发挥调节市场供求和配置资源的作用，从而推动货币政策调控方式由数量型为主向价格型为主转变。从国际经验看，强化价格调控是提高宏观调控效率的必然选择，而放开利率管制是实现这一转变的重要前提。当前物价低位运行，市场利率总体下行，为推进利率市场化改革、结合降息降准放开存款利率上限提供了较为平稳的宏观环境。,246.0
45,从政策出台后的初步情况看，金融机构存贷款利率总体下行。存款利率方面，定价行为较为理性，分层有序、差异化竞争的定价格局进一步显现。截至11月5日，国有大型银行、股份制银行、城市商业银行和农村合作金融机构的一年期存款挂牌利率平均水平分别为1.75%、1.94%、2.03%和2.04%，较降息前下调25个、26个、34个和33个基点。11月5日，一年期贷款基础利率报价为4.3%，较降息前下降25个基点。目前降息的政策效果正在逐步释放，估计金融机构实际贷款利率水平也将有所降低，有利于进一步降低社会融资成本。,252.0
46,取消对利率浮动的行政限制后，并不意味着央行不再对利率进行管理，相反中央银行的利率调控和传导将更加重要，会更加倚重市场化的货币政策工具和传导机制。从这个角度讲，我国的利率市场化改革和货币政策调控开始进入新阶段，核心将转向建立健全与市场相适应的利率形成和调控机制。下一阶段，央行将继续督促商业银行提高自主合理定价能力，以更好地适应市场竞争的格局和客户需求。同时，进一步建立健全央行政策利率调控机制，培育完善市场基准利率体系，疏通利率传导渠道。在此基础上，形成一个以市场参与者为主体、各类金融市场为主线、央行可调控、辐射整个金融市场的利率形成、传导和调控机制，使市场机制在利率形成和资源配置中发挥决定性作用。,301.0
47,在利率管制基本放开的条件下，对市场利率也要有一定的监督和自律管理，以有效预防和处置市场上可能出现的个别非理性定价行为。在继续推进利率市场化建设的一段时间里，央行将继续公布存贷款基准利率，为金融机构利率定价提供重要参考和指引。同时，指导市场利率定价自律机制，按照激励与约束并举的原则，发挥好金融机构利率定价的行业自律作用。此外，还将把金融机构存贷款利率定价行为纳入宏观审慎管理，并研究运用有效工具，引导金融机构科学合理定价，保持审慎稳健经营。八、继续完善人民币汇率形成机制中国人民银行继续按主动性、可控性和渐进性原则，进一步完善人民币汇率形成机制，重在坚持以市场供求为基础，参考一篮子货币进行调节，增强人民币汇率弹性，保持人民币汇率在合理均衡水平上的基本稳定。,329.0
48,为增强人民币兑美元汇率中间价的市场化程度和基准性，人民银行决定完善人民币兑美元汇率中间价报价机制。自2015年8月11日起，做市商在每日银行间外汇市场开盘前，参考上日银行间外汇市场收盘汇率，综合考虑外汇供求情况以及国际主要货币汇率变化向中国外汇交易中心提供中间价报价。第三季度，人民币对美元汇率中间价最高为6.1133元，最低为6.4085元，64个交易日中35个交易日升值、29个交易日贬值，最大单日升值幅度为0.22%（141点），最大单日贬值幅度为1.82%（1136点）。人民币对欧元、日元等其他国际主要货币汇率双向波动。9月末，人民币对欧元、日元汇率中间价分别为1欧元兑7.1608元人民币、100日元兑5.3043元人民币，分别较6月末贬值4.06%和5.64%。,338.0
49,2005年人民币汇率形成机制改革以来至2015年9月末，人民币对欧元汇率累计升值39.85%，对日元汇率累计升值37.74%。9月末，在中国人民银行与境外货币当局签署的双边本币互换协议下，境外货币当局动用人民币余额230.05亿元，人民银行动用外币余额折合14.06亿美元，对促进双边贸易投资发挥了积极作用。专栏3完善人民币汇率中间价报价机制2005年汇率形成机制改革以来，人民币汇率中间价作为基准汇率，对于引导市场预期、稳定市场汇率发挥了重要作用。但前一段时间，市场预期美联储将在2015年年内加息，导致美元总体走强，人民币实际有效汇率相对于全球多种货币表现较强。根据国际清算银行的测算，2014年以来至2015年7月人民币名义有效汇率和实际有效汇率分别升值11.6%和11.3%，与此同时我国货物贸易则保持较大顺差，市场主体对人民币汇率的趋势认识不同，导致人民币汇率中间价偏离市场汇率幅度较大，持续时间较长，影响了中间价的市场基准地位和权威性。,424.0
50,为避免失衡过度累积，需要通过增强中间价的市场化程度和基准性加以调整。2015年8月11日，人民银行宣布完善人民币汇率中间价形成机制，做市商在每日银行间外汇市场开盘前，参考上日银行间外汇市场收盘汇率，综合考虑外汇供求情况以及国际主要货币汇率变化向中国外汇交易中心提供中间价报价。一方面在机制上加大市场供求对汇率形成的决定性作用，提高中间价的市场化程度；另一方面则顺应市场的力量对人民币汇率适当调整，使汇率向合理均衡水平回归。中间价与市场汇率之间的偏离得到校正，中间价的基准作用明显增强。各方面对此次改革的评价总体正面，改革取得了预期效果。,268.0
51,完善人民币汇率中间价形成机制改革推出后，外汇市场一度出现短暂波动。人民银行加强沟通，引导预期，向市场提供流动性，同时采取了宏观审慎措施，抑制投机性交易，防止顺周期行为和“羊群效应”。这些宏观审慎措施并非行政管制，而是具有价格型、透明、非歧视性、临时性的特征。在综合措施的作用下，目前外汇供求趋于平衡，汇率预期平稳，外汇市场稳定。从国际国内经济金融形势看，当前不存在人民币汇率持续贬值的基础。,195.0
52,一是我国经济增速相对较高。2015年前三季度，面对复杂严峻的国际国内环境和各种困难挑战，我国经济仍增长6.9%，从全球横向比较看保持了较高的增速。近期主要经济指标总体较为平稳，经济运行有积极变化，为人民币汇率保持稳定提供了良好的宏观经济环境。,121.0
53,二是我国经常项目长期维持顺差，2015年前三季度货物贸易顺差达4241亿美元，这是决定外汇市场供求的主要基本面因素，也是支持人民币汇率的重要基础。,73.0
54,三是近年来人民币国际化和金融市场对外开放进程加快，境外主体在贸易投资和资产配置等方面对人民币的需求逐渐增加，为稳定人民币汇率注入了新动力。,69.0
55,四是市场预期美联储加息导致美元在较长一段时间走强，市场对此已基本消化。未来美联储加息这一时点性震动过后，相信市场会有更加理性的判断。,66.0
56,五是我国外汇储备充足，财政状况良好，金融体系稳健，为人民币汇率保持稳定提供了有力支撑。未来，人民银行将坚持市场化取向，根据中央的改革部署和国际收支格局的变化规律，稳妥有序完善市场化汇率形成机制，发挥市场在汇率形成中的决定性作用，增强人民币汇率双向浮动弹性，建立汇率调节国际收支的市场化长效机制，促进国际收支平衡。推动外汇市场发展和对外开放，丰富外汇产品，延长外汇交易时间，引入合格境外主体，促进形成境内外一致的人民币汇率。九、深入推进金融机构改革存款保险制度稳步实施。建立存款保险制度，对于完善金融安全网、理顺政府与市场的关系、深化金融改革、维护金融稳定和提升金融业竞争力具有重要作用。,293.0
57,《存款保险条例》已于2015年3月31日公布，自5月1日起正式施行。截至2015年6月30日，全国吸收存款的银行业金融机构已全部办理完结投保手续。截至7月20日，2015年5月和6月应交保费已归集完毕，制度实施各项工作扎实有序推进。目前，各方反映总体积极正面，金融市场运行平稳，银行业金融机构经营秩序平稳有序。政策性、开发性金融机构改革取得突破性进展。,176.0
58,2015年7月，国家外汇储备分别向国家开发银行、进出口银行注资480亿美元、450亿美元，顺利完成改革方案要求的资本金补充工作。与此同时，三家银行业务范围认定与划分、完善治理结构、修订章程等改革方案其他内容也在稳步推进过程中。改革提高了三家银行的资本实力和抗风险能力，有利于充分发挥政策性开发性金融在支持薄弱环节、重点领域中的功能和作用，积极服务稳增长、调结构、惠民生，促进经济社会持续健康发展。农村信用社改革进展顺利，成效显著。,215.0
59,一是资产质量显著提升。9月末，全国农村信用社不良贷款余额和比率分别为5000亿元和4.2%；资本充足率为11%，同比提高0.2个百分点。,68.0
60,二是涉农金融服务明显改善。9月末，全国农村信用社各项存贷款余额分别为18.3万亿元和11.9万亿元，同比分别增长14.7%和15.1%。各项贷款占全国金融机构各项贷款的比例为12.9%；涉农贷款和农户贷款余额分别为7.7万亿元和3.7万亿元，同比分别增长10.5%和9.2%。,138.0
61,三是产权制度改革平稳推进。截至9月末，全国共组建农村商业银行758家、农村合作银行79家、县（市）统一法人农村信用社1397家。随着产权制度改革稳步推进，可持续发展机制基本建立。十、进一步深化外汇管理体制改革着力提升贸易投资便利化水平。,118.0
62,一是推进跨国公司外汇资金集中运营服务外向型经济。2015年8月，进一步调整优化跨国公司外汇资金集中使用政策，简化账户开立和使用要求，简化外汇收支手续，试行跨国公司借用外债比例自律管理政策，便利更多的优秀企业优化资金运用。,110.0
63,二是合理安排机构投资者额度支持资本市场发展，促进资本市场双向开放。前三季度，共批准65家QFII机构投资额度276亿美元，48家RQFII机构投资额度1178亿元，40家QDII机构投资额度503.8亿美元。有序推进资本项目可兑换。,116.0
64,一是稳步推进外债宏观审慎管理试点。2015年8月，对北京中关村试点政策进行“升级”，扩大了外债资金用途，放宽了外债专用账户管理，并对部分高新技术企业给予最低外债额度支持，以更好地服务于“大众创业、万众创新”的需求。,107.0
65,二是制定内地与香港“基金互认”的相关操作指引，便利两地基金跨境发行销售所涉资金汇兑及流出入。加强跨境资本流动监管。,57.0
66,一是加强银联人民币卡境外提现管理。自2016年1月1日起，银联人民币卡在境外提取现钞，每卡每年不得超过等值10万元人民币。2015年10月1日至12月31日期间，每卡不得超过等值5万元人民币。此项措施将有效减少境外大额提现，抑制资产非法转移。,121.0
67,二是加强事中事后监管。加强对外汇领域购付汇真实性审核，遏制外汇资金异常流动。,38.0
68,三是开展重点领域和渠道的专项监管。先后开展“出口不收汇”、个人外币现钞等专项调查，做好转口贸易、远期结汇、橡胶行业进口贸易融资、融资租赁类公司等专项检查，防范跨境资本流动冲击。,88.0
69,四是开展打击利用离岸公司和地下钱庄转移赃款专项行动，严厉打击外汇违法违规活动。第三部分金融市场运行第三季度，金融市场总体运行平稳。货币市场交易活跃，市场利率维持低位。债券发行规模显著扩大，发行利率明显下降；银行间债券指数小幅上行，国债收益率曲线趋于平坦化。股票市场出现较大幅度震荡。,141.0
70,保险业资产快速增长。外汇掉期和远期交易增长较快。一、金融市场运行概况（一）货币市场交易活跃，市场利率维持低位银行间回购交易量增速大幅上升，拆借交易量快速增长。前三季度，银行间市场债券回购累计成交300.5万亿元，日均成交1.6万亿元，日均成交同比增长92.3%；同业拆借累计成交42.2万亿元，日均成交2256亿元，日均成交同比增长54.2%。从期限结构看，市场交易进一步集中于隔夜品种，前三季度回购和拆借隔夜品种的成交量分别占各自总量的83.5%和82.6%，较上年同期分别上升4.4个和2.5个百分点。,253.0
71,交易所债券回购累计成交90万亿元，同比增长40.7%。从融资主体结构看，主要呈现以下特点：一是交易规模同比大幅增长，其中大型银行通过回购和同业拆借共融出资金137.7万亿元，同比增长131.6%，中资中小型银行融入资金量是上年同期的2倍多。,120.0
72,二是大型银行成为市场唯一的资金供给方，保险业机构资金需求下降。,31.0
73,三是外资银行和其他金融机构及产品融入资金量大幅增加，其中外资银行前三季度融入9.4万亿元，是上年同期融资量的45.5倍，其他金融机构及产品融入资金47.8万亿元，同比增长211%。利率互换交易较快增长。前三季度，人民币利率互换市场交易名义本金总额为58309.3亿元。第三季度，人民币利率互换市场发生交易16474笔，成交名义本金总额22531.1亿元，同比增长135.2%。从期限结构看，1年及1年期以下交易最为活跃，其名义本金总额20170.3亿元，占总量的89.5%。,237.0
74,"从参考利率来看，人民币利率互换交易的浮动端参考利率主要包括7天回购定盘利率和Shibor,与之挂钩的利率互换交易名义本金占比为92.9%和7.1%。标准利率衍生品成交235笔，成交金额为1688亿元。同业存单发行交易明显增加。随着市场利率定价自律机制成员机构范围的扩大，同业存单发行主体范围进一步拓宽，发行交易明显增加。截至9月末，已有193家金融机构披露了2015年同业存单年度发行计划，其中171家机构已在银行间市场完成发行。",215.0
75,前三季度，银行间市场陆续发行同业存单3849只，发行总量为3.29万亿元，二级市场交易总量为6.77万亿元，同业存单发行交易全部参照Shibor定价。同业存单市场的加快发展，对进一步提高中长端Shibor的基准性发挥了积极作用。9月份，3个月期同业存单发行加权平均利率为3.22%，较3个月Shibor高10个基点。同时，大额存单发行交易稳步推进，发行主体范围有序扩大，期限品种日趋丰富。截至2015年9月末，大额存单共发行1860期，累计发行1.36万亿元。,230.0
76,大额存单市场的有序发展，进一步扩大了金融机构负债产品市场化定价范围，为推动金融机构提高负债定价能力发挥了积极作用。货币市场利率维持低位，7天与隔夜品种利差收窄。受国庆长假现金集中投放及节前7天期以上交易量占比有所上升、隔夜利率有所上升等因素影响，9月份同业拆借和质押式回购月加权平均利率分别为2.05%和2.01%，比6月份分别高61个和60个基点，均比上年同期低92个基点。9月末，隔夜、1周Shibor分别为1.99%和2.41%，分别较6月末上升73个和下降24个基点；7天与隔夜Shibor利差由6月末的140个基点收窄为42个基点。3个月和1年期Shibor为3.15%和3.41%，分别较6月末下降8个和上升2个基点。,315.0
77,（二）债券现券交易活跃，债券发行规模显著扩大，发行利率明显下降前三季度，银行间债券市场现券交易量58万亿元，日均成交3091亿元，日均成交同比增长103%；交易所债券现券成交2.6万亿元，同比多成交7914亿元。,106.0
78,从交易主体看，中资中小型银行和证券业机构是银行间现券市场的主要净卖出方，当季净卖出现券1.2万亿元；其他金融机构及产品是主要的净买入方，净买入现券1.3万亿元。从交易品种看，当季国债现券交易累计成交3万亿元，占银行间市场现券交易的12%；金融债券和公司信用类债券现券交易分别累计成交13.4万亿元和8.1万亿元，占比分别为54%和32.6%。银行间债券市场指数小幅上行。中债综合净价指数由6月末的102.21点上升至9月末的103.20点，升幅0.97%；中债综合全价指数由6月末的115.87点上升至9月末的117.17点，升幅1.12%。交易所国债指数由6月末的149.64点上升至9月末的151.62点，升幅1.32%。,313.0
79,银行间市场国债收益率短端上行、中长端下行，收益率曲线趋于平坦化。第三季度，受宏观经济仍有下行压力、股市及大宗商品市场走势低迷、货币市场流动性较为充裕等因素叠加影响，市场对中长久期债券配置需求大幅增加，推动国债中长端收益率明显下行，收益率曲线趋于平坦化。9月末，国债1年、3年期收益率较6月末分别上升65个、2个基点，5年、7年和10年期收益率较6月末分别下降16个、27个和36个基点，10年期与1年期国债期限利差为84个基点，较6月末收窄102个基点。债券发行规模显著扩大。前三季度，累计发行各类债券15.8万亿元，同比多发行7.3万亿元，主要是国债同比多发行2.3万亿元，金融债券中的同业存单同比多发行2.9万亿元，公司信用类债券中的非金融企业债务融资工具同比多发行7780亿元。,342.0
80,"9月末，国内各类债券余额44.8万亿元，同比增长30.9%。9月21日，人民银行正式批复同意香港上海汇丰银行有限公司和中国银行（香港）有限公司在银行间债券市场发行金融债券，这是继2005年和2013年国际开发机构和境外非金融企业之后，国际性商业银行首次获准在银行间债券市场发行人民币债券。各类债券发行利率均明显回落。9月份，10年期国债发行利率为3.51%，比6月末发行的同期限国债利率下降13个基点；国开行发行的10年期金融债利率为3.71%，比6月末下降37个基点；主体评级AAA的企业发行的短期融资券（债券评级A-1）平均利率为3.52%，比6月末下降46个基点，7年期公司债平均发行利率为4.48%,比6月末下降32个基点。Shibor对债券产品定价基准作用继续提升。",338.0
81,前三季度，发行以Shibor为基准定价的浮动利率债券和同业存单46只，总量为238亿元；发行固定利率企业债214只，总量为2307亿元，全部参照Shibor定价；发行参照Shibor定价的固定利率短期融资券6916亿元，占固定利率短期融资券发行总量的92%。,129.0
82,（三）票据融资余额增长较快，利率呈下降趋势票据承兑业务增幅趋缓。前三季度，企业累计签发商业汇票16.6万亿元，同比增长2.3%；期末商业汇票未到期金额10.6万亿元，同比增长9.3%。9月末，票据承兑余额较年初增加7472亿元，同比多增611亿元。从行业结构看，企业签发的银行承兑汇票余额仍集中在制造业、批发和零售业；从企业结构看，由中小型企业签发的银行承兑汇票约占三分之二。票据融资余额持续较快增长，票据市场利率呈下降趋势。,213.0
83,前三季度，金融机构累计贴现75.2万亿元，同比增长77.0%；期末贴现余额4.3万亿元，同比增长59.7%。9月末，票据融资余额比年初增加14003亿元，同比多增6648亿元；占各项贷款的比重为4.7%，同比上升1.3个百分点。在票据市场供求较为均衡的情况下，票据市场利率主要受货币市场利率影响总体呈现下降趋势。（四）股票市场指数回落，成交额和筹资额明显下降股票市场指数有较大幅度回落。9月末，上证综合指数收于3053点，比6月末下降28.6%，比上年末下降5.6%；深证成份指数收于9988点，比6月末下降30.3%，比上年末下降9.3%；创业板指数收于2083点，比6月末下降27.1%，比上年末上升41.5%。,308.0
