,paragraph,length
38,人民币兑欧元、日元等其他国际主要货币汇率多数贬值。6月末，人民币兑欧元、日元汇率中间价分别为1欧元兑7.7496元人民币、100日元兑6.0485元人民币，分别较上年末贬值5.71和1.48%。2005年人民币汇率形成机制改革以来至2017年6月末，人民币兑欧元汇率累计升值29.22，兑日元汇率累计升值20.79。6月末，在人民银行与境外货币当局签署的双边本币互换协议下，境外货币当局动用人民币余额为221.87亿元，人民银行动用外币余额折合15.48亿美元，对促进双边贸易投资发挥了积极作用。专栏2外汇市场自律机制在人民币中间价报价模型中引入“逆周期因子”随着汇率市场化改革持续推进，近年来人民币汇率中间价形成机制不断完善。,314.0
39,2015年8月11日，人民银行组织中间价报价行进一步改进了人民币兑美元汇率中间价形成机制，强调中间价报价要参考前一日收盘价；2015年12月11日，中国外汇交易中心发布人民币汇率指数，加大了参考一篮子货币的力度，以更好地保持人民币兑一篮子货币汇率基本稳定，初步形成了“收盘价+一篮子货币汇率变化”的人民币兑美元汇率中间价形成机制。,165.0
40,2016年6月份成立了外汇市场自律机制，以更多地发挥金融机构在维护外汇市场运行秩序和公平竞争环境方面的作用，其中汇率工作组主要负责规范人民币汇率中间价报价行为。2017年2月，外汇市场自律机制将中间价对一篮子货币的参考时段由报价前24小时调整为前一日收盘后到报价前的15小时，避免了美元汇率日间变化在次日中间价中重复反映。总体看，中间价形成机制在不断完善，有效提升了汇率政策的规则性、透明度和市场化水平，在稳定汇率预期方面发挥了积极作用。2017年以来，我国经济增长的稳定性增强，主要经济指标总体向好，出口同比增速也明显加快。同时，美元汇率持续走弱，其他主要货币对美元汇率升值较多。,291.0
41,1-5月份，欧元、日元、英镑和澳元对美元汇率分别升值6.91%、5.58%、4.46和3.08%，俄罗斯卢布、印度卢比、墨西哥比索和南非兰特等新兴市场货币对美元汇率也分别升值8.31%、5.29%、11.32%和4.74%。,112.0
42,同期，人民币兑美元汇率中间价仅升值1.07%，不符合经济基本面和国际汇市变化。其中一个重要原因是外汇市场存在一定的顺周期性，市场主体容易受到非理性预期的影响，忽视宏观经济等基本面向好对汇率的支持作用，放大单边市场预期并自我强化，增大市场汇率超调的风险。针对这一问题，以中国工商银行为牵头行的外汇市场自律机制“汇率工作组”总结相关经验，建议将中间价报价模型由原来的“收盘价+一篮子货币汇率变化”调整为“收盘价+一篮子货币汇率变化+逆周期因子”。这一建议得到了外汇市场自律机制核心成员的赞同，并于2017年5月末由外汇市场自律机制秘书处宣布正式实施。在计算逆周期因子时，可先从上一日收盘价较中间价的波幅中剔除篮子货币变动的影响，由此得到主要反映市场供求的汇率变化，再通过逆周期系数调整得到“逆周期因子”。,350.0
43,逆周期系数由各报价行根据经济基本面变化、外汇市场顺周期程度等自行设定。在中间价报价模型中引入“逆周期因子”，对于人民币汇率市场化形成机制的进一步优化和完善具有重要意义。,84.0
44,一是有助于中间价更好地反映宏观经济基本面。如前所述，前期人民币兑美元汇率走势与经济基本面和国际汇市变化明显不符，表明在市场单边预期的背景下，简单的“收盘价+一篮子货币汇率变化”可能会导致中间价比较多地反映与预期方向一致的变化，少反映或不反映与预期方向不一致的基本面变化，呈现出一定的非对称性，在中间价报价模型中引入“逆周期因子”有助于校正这种非对称性。不少市场人士也认为，引入“逆周期因子”是解决“非对称贬值”问题很好的数学方式。,215.0
45,二是有助于对冲外汇市场的顺周期波动，使中间价更加充分地反映市场供求的合理变化。汇率作为本外币的比价，具有商品和资产的双重属性，后者意味着汇率波动可能触发投资者“追涨杀跌”的心理，导致外汇市场出现顺周期波动，进而扭曲与基本面相一致的合理市场供求，放大供求缺口。在中间价报价模型中引入“逆周期因子”，可通过校正外汇市场的顺周期性，在一定程度上将市场供求还原至与经济基本面相符的合理水平，从而更加充分地发挥市场供求在汇率形成中的决定性作用，防止人民币汇率单方面出现超调。事实上，引入“逆周期因子”不会改变外汇供求的趋势和方向，只是适当过滤了外汇市场的“羊群效应”，并非逆市场而行，而是在尊重市场的前提下促进市场行为更加理性。由于适当对冲了外汇供求中的非理性因素，引入“逆周期因子”的中间价报价模型适当加大了参考篮子的权重，有助于保持人民币对一篮子货币汇率基本稳定，也能够更好地防止预期发散。当然，加大参考篮子的权重并不是盯住篮子，市场供求仍是汇率变动的决定性作用。,429.0
46,三是完善后的中间价报价机制保持了较高的规则性和透明度。基准价格报价机制的规则性和透明度，取决于其规则、制度是否明确以及报价机构能否自行对机制的规则性进行验证。在中间价报价机制中引入“逆周期因子”的调整方案，是由外汇市场自律机制“汇率工作组”成员提出，经全部14家人民币兑美元汇率中间价报价行充分讨论并同意后实施的，每一家报价行均在充分理解新机制的基础上进行报价，并可结合本行报价结果和市场公开数据自行计算验证实际发布的中间价。此外，“逆周期因子”计算过程中涉及的全部数据，或取自市场公开信息，或由各报价行自行决定，不受第三方干预。总的来看，引入逆周期因子后，中间价报价机制的规则性、透明度和市场化水平得到进一步提升。,308.0
47,从运行情况看，新机制有效抑制了外汇市场上的羊群效应，增强了我国宏观经济等基本面因素在人民币汇率形成中的作用，保持了人民币汇率在合理均衡水平上的基本稳定。2017年6月30日，人民币兑美元汇率中间价报6.7744元，较上年末升值2.40%，市场汇率收于6.7796元，较上年末升值2.51%。七、深入推进金融机构改革全面落实开发性、政策性金融机构改革方案。自国家开发银行、中国进出口银行、中国农业发展银行改革方案获批以来，人民银行积极发挥统筹协调作用，多次召开改革工作小组会议，稳步推动落实改革方案。目前，人民银行正会同改革工作小组成员单位有序推动建立健全董事会和完善治理结构、划分业务范围等改革举措，并配合有关部门做好完善风险补偿机制、制定审慎监管办法等相关工作。,332.0
48,着力完善存款保险制度功能。2015年5月1日《存款保险条例》施行以来，制度实施各项工作稳步推进。金融机构存款平稳增长，大、中、小银行存款格局保持稳定。金融机构50万元限额内的客户覆盖率为99.6%，保持稳定。继续做好风险差别费率实施工作，开展存款保险评级和费率核定，发挥差别费率的风险约束和正向激励作用。,152.0
49,做好投保机构风险监测、识别，依法采取风险警示和早期纠正措施。积极与地方政府、监管部门沟通协调，推动风险依法处置。发布存款保险标识，积极开展存款保险宣传和业务培训，扎实、规范做好基金管理工作。农村信用社改革取得重要成果。农村信用社经营财务状况持续改善，涉农信贷投放继续扩大，产权制度改革稳步推进。,147.0
50,按贷款五级分类口径统计，6月末，全国农村信用社不良贷款余额和比例分别为5755亿元和4%，不良贷款比例同比下降0.2个百分点；资本充足率为12%，同比提高0.8个百分点。全国农村信用社各项存贷款余额分别为23.15万亿元和14.47万亿元，同比分别增长9.2和12.9；各项贷款占全国金融机构各项贷款的比例为12.6%；涉农贷款和农户贷款余额分别为8.69亿元和4.25万亿元，同比分别增长9.7和10.6%。截至6月末，全国共组建以县（市）为单位的统一法人农村信用社997家，农村商业银行1171家，农村合作银行37家。八、深化外汇管理体制改革积极促进贸易投资便利化。,285.0
51,一是推动“债券通”正式上线试运行，便利境外投资者通过香港投资内地银行间债券市场，稳步推进我国金融市场对外开放进程。,57.0
52,二是开展并扩大跨境电子商务、旅游采购、第三方支付机构外汇支付试点，加大对外贸新业态的支持力度。,47.0
53,三是完善全口径跨境融资宏观审慎管理政策，提高了跨境融资的便利化程度。继续加强真实性合规性审核。,47.0
54,一是完善货物贸易外汇管理，向银行开放企业报关电子信息，便利银行贸易单证审核。,38.0
55,二是完善境外投资外汇管理，严格真实性审核，密切关注房地产等五大行业出现的非理性对外投资倾向，以及大额非主业投资、有限合伙企业对外投资、“母小子大”、“快设快出”等四类风险隐患，促进我国对外投资持续健康发展。提升事中事后监管能力。,114.0
56,一是完善银行卡境外交易统计，要求金融机构报送银行卡境外交易信息，维护银行卡境外交易秩序。,44.0
57,二是与海关、税务部门完善联合监管合作机制，推动实施信息共享，开展联合监管合作。,39.0
58,三是加强典型案例通报和宣传警示教育，震慑外汇违法违规行为。货币市场利率总体有所上升，市场流动性基本稳定。在经济基本面回暖、美联储加息以及金融体系适度去杠杆等的大背景下，债券市场收益率呈平坦化上行趋势，债券现券交易量和发行量有所下降。股票市场指数基本平稳，成交量和筹资额同比继续下降，保险业资产和保费收入增速均有所放缓。一、金融市场运行分析（一）货币市场回购交易有所回升，隔夜品种占比下降，市场利率上升银行间回购交易量有所回升，拆借交易量继续下降。,223.0
59,上半年，银行间市场债券回购累计成交275.7万亿元，日均成交2.2万亿元，同比下降4.5，比第一季度增长8.6%；同业拆借累计成交38.8万亿元，日均成交3156亿元，同比下降14.1%，比第一季度下降7.3%。,106.0
60,从期限结构看，市场交易隔夜品种占比下降，上半年回购和拆借隔夜品种的成交量分别占各自总量的80.5%和87%，占比较上年同期分别低5.9个和1.3个百分点。交易所债券回购累计成交127万亿元，同比增长28.5%。从融资主体结构看，主要呈现以下特点：一是中资大型银行与保险业机构均为货币市场的资金融出方，上半年大型银行经回购和拆借净融出资金75.6万亿元，保险业机构自上年三季度以来持续作为资金供给方，上半年经回购和拆借净融出2.3万亿元；二是其他金融机构及产品、证券业机构是主要的资金融入方，其他金融机构及产品上半年净融入38.5万亿元，占市场净融入资金的49.4%，占比较第一季度高1.9个百分点，证券业机构上半年净融入24.5万亿元，占市场净融入资金的31.5%，占比较第一季度高1.7个百分点。利率互换交易活跃。上半年，人民币利率互换市场达成交易61192笔，同比增长50.0；名义本金总额55343.8亿元，同比增长26.7。,416.0
61,从期限结构来看，1年及1年期以下交易最为活跃，名义本金总额达41982.0亿元，占总量的75.9。从参考利率来看，人民币利率互换交易的浮动端参考利率主要包括7天回购定盘利率和Shibor，与之挂钩的利率互换交易名义本金占比分别为88.9和10.9。同业存单市场发展趋于平稳，大额存单业务进一步发展。截至6月末，共有527家金融机构披露了2017年同业存单年度发行计划，其中377家机构已在银行间市场完成发行。上半年，银行间市场陆续发行同业存单1.26万只，发行总量为9.52万亿元，二级市场交易总量为47.17万亿元。,259.0
62,其中，第二季度，同业存单发行量为4.53万亿元，较第一季度减少0.46万亿元。同业存单发行交易全部参照Shibor定价，发行利率与中长端Shibor保持较强的相关性。6月份，3个月期同业存单发行加权平均利率为4.88%，较3个月Shibor高21个基点。上半年，金融机构已陆续发行大额存单1.14万期，发行总量为3.12万亿元，同比增加0.43万亿元。货币市场利率总体有所上升。,189.0
63,随着金融机构主动调整资产负债，3月下旬开始银行间市场活跃度减弱，利率有所抬升。进入5月份，随着预期逐步稳定，市场利率有所回落。6月拆借月加权平均利率为2.94，比3月高32个基点，比上年12月高50个基点；质押式回购月加权平均利率为3.03%，比3月份高19个基点，比上年12月高47个基点。6月份，银行业存款类金融机构间利率债质押式回购月加权平均利率为2.83，低于银行间市场质押式回购月加权平均利率20个基点。Shibor总体有所上升。,220.0
64,截至6月末，隔夜、1周Shibor分别为2.62%和2.85，分别较上年末上升39个和30个基点；3个月和1年期Shibor为4.5和4.42，分别较上年末上升123个和105个基点。（二）债券市场收益率整体平坦化上行，成交量、发行量有所下降上半年，机构整体交投偏谨慎，银行间债券市场现券交易44.6万亿元，日均成交3623亿元，同比下降21.9%。从交易主体看，中资中小型银行和证券业机构是净卖出方，净卖出现券2.2万亿元；其他金融机构及产品是主要的净买入方，净买入现券1.7万亿元。从交易品种看，上半年银行间债券市场国债现券交易累计成交4.8万亿元，占银行间市场现券交易的10.9%；金融债券和公司信用类债券现券交易分别累计成交30.6万亿元和8.7万亿元，占比分别为68.6%和19.4。交易所债券现券成交2.6万亿元，同比增长19.7%。,373.0
65,债券市场收益率呈平坦上行趋势。4月份以来，金融监管加强，同时叠加我国经济稳中向好、美联储缩表预期升温等，国债收益率水平抬升明显，曲线进一步平坦化。5月下旬以来，监管加强预期减弱，资金面趋稳，国债收益率有所回落。6月末，1年期、3年期、5年期、7年期和10年期收益率较3月末分别上升60个、48个、41个、39个和29个基点。6月末，1年期和10年期国债利差为11个基点，较3月末收窄31个基点。,197.0
66,银行间债券市场指数小幅下行。中债综合净价指数由3月末的100.73点下降至6月末的99.77点，降幅为0.95%；中债综合全价指数由3月末的115.89点下降至6月末的114.87点，降幅为0.88%。交易所上证国债指数由3月末的160.18点上升至6月末的160.41点，升幅为0.14%。债券发行规模同比下降。上半年累计发行各类债券17.6万亿元，同比下降2%。,183.0
67,其中，同业存单发行增长较快，地方政府债券和公司信用类债券发行量比上年同期明显减少。6月末，国内各类债券余额为68.6万亿元，同比增长19.4%。各类债券发行利率总体上升。6月份发行的10年期国债发行利率为3.52%，比3月份发行的同期限国债利率上升12个基点；国开行发行的10年期金融债利率为4.15%，比3月份发行的同期限金融债利率下降14个基点；主体评级AAA的企业发行的一年期短期融资券（债券评级A-1）平均利率为5.16%，比3月份高53个基点；5年期中期票据平均发行利率为6.01%，比3月份高78个基点。Shibor继续对债券及同业存单产品定价发挥重要的基准作用。,288.0
68,上半年，发行以Shibor为基准定价的浮动利率债券及同业存单66只，总量为443.6亿元；发行固定利率企业债92只，总量为891.6亿元，全部参照Shibor定价；发行参照Shibor定价的固定利率短期融资券1352.3亿元，占固定利率短期融资券发行总量的68.5。,133.0
69,（三）票据融资持续下降，利率小幅震荡票据承兑业务持续下降。上半年，企业累计签发商业汇票9.5万亿元，同比上升0.6%；期末商业汇票未到期金额为8.3万亿元，同比下降15.6%。票据承兑余额逐月下降，6月末较年初下降7503亿元。从行业结构看，企业签发的银行承兑汇票余额仍集中在制造业、批发和零售业；从企业结构看，由中小型企业签发的银行承兑汇票约占三分之二。票据融资余额下降，票据市场利率小幅震荡。,198.0
70,上半年，金融机构累计贴现22.4万亿元，同比下降56.9%；期末贴现余额为3.9万亿元，同比下降27.0%。票据融资余额逐月下降，6月末较年初下降15882亿元，占各项贷款的比重为3.39%，同比下降1.85个百分点。票据市场利率小幅震荡，略有上行。（四）股票市场指数基本平稳，成交量和筹资额同比下降股票市场指数基本平稳，大盘蓝筹股涨势较好。6月末，上证综合指数收于3192点，比3月末低0.9%，比上年末高2.9%；深证成份指数收于10530点，比3月末高1%，比上年末高3.5%；上证50指数收于2550点，比3月末高8.1，比上年末高11.5；创业板指数收于1818点，比3月末低4.7%，比上年末低7.3%。,308.0
71,6月末，沪市A股加权平均市盈率从上年末的15.9倍升至17倍，深市A股加权平均市盈率从上年末的41.6倍降至36倍。股票市场成交量同比继续下降。上半年，沪、深股市累计成交52.3万亿元，日均成交4391亿元，同比下降17.7%，比第一季度下降2%；创业板累计成交7.8万亿元，同比下降32.1%。6月末，沪、深股市流通市值41.6万亿元，同比增长14.5%；创业板流通市值为3万亿元，同比下降1.3%。股票市场筹资额同比下降。,213.0
72,上半年各类企业和金融机构在境内外股票市场上通过发行、增发、配股、权证行权等方式累计筹资5626亿元，同比下降15%；其中A股筹资5244亿元，同比下降18.6。（五）保险业资产和保费收入增速均有所放缓上半年，保险业累计实现保费收入2.3万亿元，同比增长23，增速比上年同期下降14.3个百分点；累计赔款、给付5786亿元，同比增长9.9%，其中，财产险赔付同比增长6%，人身险赔付同比增长12.7%。保险业资产增速继续放缓。6月末，保险业总资产16.4万亿元，同比增长15.2，增速比第一季度低1.6个百分点。其中，银行存款同比下降8.5%，投资类资产同比增长21。,283.0
73,（六）外汇掉期交易增长较快外汇市场交易量保持平稳增长。人民币外汇即期成交2.9万亿美元，同比增长14.6%；人民币外汇掉期累计成交金额折合5.6万亿美元，同比增长25.6，其中隔夜美元掉期成交3.3万亿美元，占掉期总成交额的60%；人民币外汇远期市场累计成交404亿美元，同比减少8.5%。上半年“外币对”累计成交金额折合558亿美元，同比减少18.8，其中成交最多的产品为美元对欧元，占市场份额比重为32.4。外汇市场交易主体进一步扩展。截至6月末，共有即期市场会员601家，远期、外汇掉期、货币掉期和期权市场会员各167家、167家、138家和96家，即期市场做市商32家，远掉期市场做市商27家。,301.0
74,（七）黄金交易规模保持增长黄金价格震荡上行。上半年，美国减税等财政刺激政策不及预期、国际地缘政治事件频发促使市场避险情绪升温，推升黄金价格总体波动上行，6月有所回落。国际黄金价格最高1293.50美元/盎司，最低1151.00美元/盎司，6月末收于1242.25美元/盎司，较上年末上涨7.17。受此带动，国内黄金价格也呈现出先上涨后回落的趋势。上海黄金交易所AU9999最高价为300.00元/克，最低价为258.00元/克，6月末收于273.10元/克，较上年末上涨3.49。,240.0
75,上海黄金交易所总体交易规模保持增长。上半年，上海黄金交易所总成交金额为8.92万亿元，同比增长12.36%。其中，黄金累计成交2.41万吨，同比下降4.56；成交金额6.66万亿元，同比增长2.31%。白银累计成交55.76万吨，同比增长38.35%；成交金额2.26万亿元，同比增长58.38%。铂金累计成交19.87吨，同比下降33.37；成交金额45.24亿元，同比下降29.03%。,195.0
76,二、金融市场制度性建设（一）积极发展银行间债券市场积极稳妥推进内地与香港债券市场互联互通合作（简称“债券通”）。发布《内地与香港债券市场互联互通合作管理暂行办法》及有关配套文件，同时与香港金融管理局就“债券通”所涉及的跨境监管合作原则等相关事项达成共识，签署了相关监管合作谅解备忘录。2017年7月3日，“债券通”正式试运行，境外投资者可经由香港与内地基础设施间互联互通的机制安排，通过“北向通”参与银行间债券市场的发行认购。“债券通”试运行首月，国家开发银行、农业发展银行等机构通过“债券通”同时面向境内外投资者发行债券515亿元。进一步便利境外机构投资者投资银行间债券市场，银行间债券市场对外开放稳步推进。,305.0
77,一是延长境外机构投资者的债券交易结算周期，为境外机构投资者参与的债券交易额外提供T+2结算的选择。,49.0
78,二是在人民银行英文网站建立境外机构投资者进入银行间债券市场专栏，并不断丰富英文网站内容，向境外机构投资者提供英文服务。此外，发布中国人民银行公告〔2017〕第7号，推动符合条件的境外信用评级机构进入银行间债券市场开展信用评级业务，规范银行间债券市场信用评级业务，促进银行间债券市场平稳健康发展。截至6月末，共有506家境外机构进入银行间债券市场，包括境外中央银行或货币当局、主权财富基金、国际经济组织、港澳地区人民币业务清算行、跨境贸易人民币结算境外参加行、境外保险机构、RQFII、QFII等类型，总投资规模约8500亿元人民币。此外，配合财政部开展国债做市支持操作，正式启动国债做市支持机制，推动完善国债收益率曲线。（二）加强资本市场制度建设和监管多层次资本市场制度建设取得进展。,342.0
79,证监会发布《区域性股权市场监督管理试行办法》，建立了合格投资者标准及穿透核查制度和投资者资金管理制度，明确了运营机构可开展的中介业务范围及其应承担的义务，并加强市场自律。该《办法》统一了区域性股权市场业务及监管规则，有利于完善监管协同机制，打击各类违法违规行为，防止监管空白和监管套利，保护投资者合法权益，有助于防范和化解金融风险，促进区域性股权市场健康稳定发展。对证券公司、证券投资基金公司和期货公司的监管进一步强化。,210.0
80,一是证监会发布《证券公司和证券投资基金管理公司合规管理办法》，通过明晰董事会、监事会、高级管理人员、合规负责人等各方职责，提高合规履职保障，加大违法违规追责力度等措施，切实提升公司合规管理有效性，不断增强公司自我约束能力，促进行业持续健康发展。,122.0
