,paragraph,length
0,中国货币政策执行报告二○一七年第二季度中国人民银行货币政策分析小组2017年8月11日内容摘要2017年上半年，中国经济保持平稳较快增长，经济增长的稳定性、协调性和包容性增强，投资增长总体稳定，进出口较快增长，就业稳中向好，主要指标好于预期。,121.0
1,上半年，国内生产总值（GDP）同比增长6.9，居民消费价格（CPI）同比上涨1.4。中国人民银行继续实施稳健中性的货币政策，注重根据形势变化加强预调微调和预期管理，为经济稳定增长和供给侧结构性改革营造了良好的货币金融环境。综合运用公开市场操作、中期借贷便利等工具，保持银行体系流动性基本稳定，中标利率“随行就市”适度上行。运用支农支小再贷款、扶贫再贷款和抵押补充贷款等工具并发挥信贷政策的结构引导作用，支持经济结构调整和转型升级，将更多金融资源配置到经济社会发展的重点领域和薄弱环节。进一步完善宏观审慎政策，将表外理财纳入广义信贷指标范围，并做好将同业存单纳入宏观审慎评估（MPA）同业负债占比指标的准备工作。,305.0
2,完善全口径跨境融资宏观审慎管理，提高跨境融资的便利化程度。人民币兑美元汇率中间价报价模型中引入“逆周期因子”，对冲市场情绪的顺周期波动，更充分地反映基本面变化。总体看，稳健中性的货币政策取得了较好效果。银行体系流动性保持中性，货币信贷和社会融资规模合理增长，利率水平总体适度，人民币汇率预期稳定。2017年6月末，广义货币供应量M2余额同比增长9.4；人民币贷款余额同比增长12.9，比年初增加79678亿元，同比多增4362亿元；社会融资规模存量同比增长12.8，保持在年初预期增速之上。,245.0
3,6月份非金融企业及其他部门贷款加权平均利率为5.67。6月末，CFETS人民币汇率指数为93.29，人民币兑美元汇率中间价为6.7744元，较上年末升值2.40。当前全球经济延续平稳复苏态势，外需环境总体改善，同时国际金融危机的深层次影响尚未消除，地缘政治风险及不确定性仍然较多，主要央行货币政策将逐步回归正常化，也可能增加金融市场调整的风险。从国内看，随着供给侧结构性改革、简政放权和创新驱动战略深化实施，产业结构调整加快，过剩产能继续化解，适应消费升级的行业和战略性新兴产业快速发展，总供求更加平衡。但经济运行中的矛盾和问题还不少。,268.0
4,要站在经济长周期和结构优化升级的角度，把握经济发展阶段性特征，坚定不移深化供给侧结构性改革，深入推进“三去一降一补”，紧紧抓住处置“僵尸企业”这个牛鼻子，更多运用市场机制实现优胜劣汰。下一阶段，要按照党中央、国务院统一部署，贯彻落实好全国金融工作会议精神，遵循金融发展规律，紧紧围绕服务实体经济、防控金融风险、深化金融改革三项任务，继续实施稳健中性的货币政策，处理好稳增长、调结构、控总量的关系，为供给侧结构性改革营造中性适度的货币金融环境。保持总量稳定，综合运用价、量工具和宏观审慎政策加强预调微调，调节好货币闸门。把发展直接融资放在重要位置，改善间接融资结构。围绕实体经济全面提升金融服务效率和水平，加强对小微企业、“三农”和偏远地区的金融服务，鼓励发展绿色金融。,334.0
5,完善宏观审慎政策框架，推进汇率和利率市场化改革，畅通政策传导渠道和机制。同时，履行好国务院金融稳定发展委员会办公室职责，加强金融监管协调，把主动防范化解系统性金融风险放在更加重要的位置，着力防范化解重点领域风险，牢牢守住不发生系统性金融风险的底线。一、货币总量平稳增长6月末，广义货币供应量M2余额为163.1万亿元，同比增长9.4%，增速比3月末低1.2个百分点。狭义货币供应量M1余额为51.0万亿元，同比增长15.0%，增速比3月末低3.8个百分点。流通中货币M0余额为6.7万亿元，同比增长6.6。,253.0
6,上半年现金净回笼1326亿元，同比多回笼928亿元。M1与M2剪刀差缩窄至5.6个百分点，延续上年8月份以来差幅缩小的趋势。当前M2增速比过去低一些，需要全面客观认识。,84.0
7,一是过去M2增速高于名义GDP增速较多与住房等货币化密切相关，而目前住房商品化率已经很高，货币需求增长相应降低。,56.0
8,二是近些年M2增长较快还与金融深化有关，主要体现为同业、理财等业务发展较快，但金融深化进程并非是线性的，为了兴利除弊也会有一定起伏，近期M2增速有所降低正是加强金融监管、缩短资金链条、减少多层嵌套的合理反映。预计随着去杠杆的深化和金融进一步回归为实体经济服务，比过去低一些的M2增速可能成为新的常态。同时，随着市场深化和金融创新，影响货币供给的因素更加复杂，M2的可测性、可控性以及与经济的相关性亦在下降，对其变化可不必过度关注。6月末，基础货币为30.4万亿元，较年初减少3048亿元。货币乘数为5.37，比3月末高0.08。,264.0
9,金融机构超额准备金率为1.4%。其中，农村信用社为8.1。2017年以来基础货币总量略有下降，从结构上看主要与超额存款准备金总量出现一定下降有关。观察银行体系流动性状况，不仅要看超额准备金的绝对水平，也要看超额准备金率。近年来，我国金融机构超额准备金率总体呈下行态势。,134.0
10,2001年超额准备金率超过7%，之后总体呈下降态势，2003-2008年平均超额准备金率在3.5%左右，之后进一步下行，目前超额准备金率在1.5%左右。这种趋势性下降与下列因素有关：一是支付体系现代化大大缩短了资金清算占用时间，基本消除了在途资金摩擦，降低了其他资产转换为超额存款准备金的资金汇划时间成本和交易成本。,158.0
11,二是金融市场快速发展使得商业银行有更方便的融资渠道，在需要资金时可以随时从市场融入资金，从而降低预防性需求。,54.0
12,三是商业银行流动性管理水平和精细化程度不断提高，可以更加准确地预测流动性影响因素，降低了不确定性冲击的影响。一些银行开发了先进的流动性管理系统，能够实时掌握全系统各分行的资金往来情况，能够把超额存款准备金维持在零附近从而提高资金使用效率，个别时点还在合规的法定存款准备金透支机制下将超额准备金临时性降至负值。近年来央行不断完善货币政策操作框架，释放出制度红利，也使得银行体系超额存款准备金需求明显降低。如双平均法考核存款准备金给予商业银行在考核期内更加灵活摆布流动性的空间，常备借贷便利工具和自动质押融资工具使得商二、金融机构人民币存款平稳增长6月末，金融机构本外币各项存款余额为165.0万亿元，同比增长9.6%，增速比3月末低1.1个百分点，比年初增加9.5万亿元，同比少增1.3万亿元。人民币各项存款余额为159.7万亿元，同比增长9.2%，增速比3月末低1.1个百分点，比年初增加9.1万亿元，同比少增1.5万亿元。,412.0
13,外币存款余额为7931亿美元，比年初增加801亿美元，同比多增513亿美元。从人民币存款期限看，活期存款比重降低。上半年，住户存款和非金融企业存款增量中活期存款占比为32.1%，比上年同期低12.1个百分点，一定程度上与地方政府债和企业债发行放缓、房地产销售增速趋缓以及基数较高等因素有关。从人民币存款部门分布看，住户存款、非银行业金融机构存款分别同比多增3951亿元、6052亿元；非金融企业存款同比少增2.1万亿元。三、金融机构贷款较快增长6月末，金融机构本外币贷款余额为120.2万亿元，同比增长12.7，增速比3月末高0.4个百分点，比年初增加8.2万亿元，同比多增8118亿元。,294.0
14,6月末，人民币贷款余额为114.6万亿元，同比增长12.9，增速比3月末高0.5个百分点，比年初增加79678亿元，同比多增4362亿元。2017年以来，月度贷款增量均在万亿元以上，上半年增量和6月份增量还是历史同期最高水平，若考虑地方平台存量贷款置换因素，实际贷款增加更多。从人民币贷款期限看，中长期贷款增量比重提高。中长期贷款比年初增加7.1万亿元，同比多增1.9万亿元，增量占比为88.9，比上年同期提高19.8个百分点。产能过剩行业中长期贷款增速显著放缓。,232.0
15,从人民币贷款部门分布看，住户贷款增速高位有所放缓，6月末为23.9，比3月末低0.7个百分点。其中，个人住房贷款6月末增速回落至30.8%，较年内最高点低6.0个百分点，3月份以来持续月度同比少增，上半年增量为2.2万亿元，同比少增708亿元，增量占比下降至27.8，较上年同期低2.6个百分点。非金融企业及机关团体贷款回升，比年初增加4.4万亿元，其中4、5、6月份分别新增5087亿元、5661亿元和7004亿元，同比分别多增3672亿元、2064亿元和914亿元。分机构看，中资中小型银行和小型农村金融机构贷款同比多增较多。外币贷款增加较多。,274.0
16,6月末，金融机构外币贷款余额为8327亿美元，比年初增加469亿美元，同比多增921亿美元。从投向看，非金融企业及机关团体短期贷款比年初增加70亿美元，同比多增650亿美元；境外贷款比年初增加398亿美元，同比多增267亿美元。四、社会融资规模合理增长初步统计，6月末社会融资规模存量为166.92万亿元，同比增长12.8，增速比上年同期高0.4个百分点。上半年社会融资规模增量累计为11.17万亿元，比上年同期多1.36万亿元。上半年社会融资规模增量主要有以下三个特点：一是对实体经济发放的人民币贷款同比多增。,256.0
17,上半年对实体经济发放的人民币贷款增加8.21万亿元，比上年同期多增7288亿元，占同期社会融资规模增量的73.5。,57.0
18,二是信托贷款和未贴现银行承兑汇票同比多增较多，委托贷款同比明显少增。上半年信托贷款增加1.31万亿元，比上年同期多增1.03万亿元；未贴现银行承兑汇票增加5696亿元，比上年同期多增1.85万亿元；委托贷款增加5988亿元，比上年同期少增4477亿元。,126.0
19,三是企业债券融资同比多减较多，股票融资少于上年同期。上半年企业债券融资净减少3708亿元，比上年同期多减2.14万亿元；非金融企业境内股票融资4702亿元，比上年同期少1321亿元。五、金融机构存贷款利率小幅上升6月，非金融企业及其他部门贷款加权平均利率为5.67%，同比上升0.41个百分点，比3月上升0.14个百分点，比上年12月上升0.4个百分点。其中，一般贷款加权平均利率为5.71%，比3月上升0.08个百分点；票据融资加权平均利率为5.39%，比3月上升0.62个百分点。个人住房贷款利率略有上升，6月加权平均利率为4.69，比3月上升0.14个百分点。,283.0
20,从利率浮动情况看，执行上浮、基准利率的贷款占比上升，执行下浮利率的贷款占比下降。6月，一般贷款中执行上浮利率的贷款占比为64.39，比3月上升5.82个百分点；执行基准利率的贷款占比为19.47%，比3月上升1.34百分点；执行下浮利率的贷款占比为16.13，比3月下降7.17个百分点。外币存贷款利率在国际金融市场利率波动、境内外币资金供求变化等因素的综合作用下，小幅上升。6月，活期、3个月以内大额美元存款加权平均利率分别为0.22%和1.41%，分别与3月持平和上升0.27个百分点；3个月以内、3（含）-6个月美元贷款加权平均利率分别为2.43%和2.45，分别比3月上升0.26个和0.13个百分点。六、人民币汇率双向浮动弹性明显增强第二季度，美元整体走弱，主要货币对美元多数升值，人民币兑美元汇率也有所升值。,360.0
21,随着汇率形成机制的规则性、透明度和市场化水平不断提升，人民币兑美元双边汇率弹性进一步增强，双向浮动的特征更加显著，汇率预期总体平稳。6月末，CFETS人民币汇率指数为93.29，较上年末下跌1.62%。参考BIS货币篮子和SDR货币篮子的人民币汇率指数分别为94.25和94.18，较上年末分别下跌2.07%和下跌1.38%。根据国际清算银行的计算，上半年，人民币名义有效汇率贬值2.27，实际有效汇率贬值3.32；2005年人民币汇率形成机制改革以来至2017年6月末，人民币名义有效汇率升值34.26，实际有效汇率升值42.24。6月末，人民币兑美元汇率中间价为6.7744元，比2016年末升值1626个基点，升值幅度为2.40。,318.0
22,2005年人民币汇率形成机制改革以来至2017年6月末，人民币兑美元汇率累计升值22.17。七、跨境人民币收付金额同比下降上半年，跨境人民币收付金额合计3.74万亿元，同比下降22，其中实收1.7万亿元，实付2.04万亿元，净流出3354.0亿元，收付比为1：1.2。经常项目下跨境人民币收付金额合计2.15万亿元，同比下降19%；其中，货物贸易收付金额1.65万亿元，服务贸易及其他经常项下收付金额5058.1亿元；资本项目下人民币收付金额合计1.59万亿元，同比下降26。根据党中央、国务院的统一部署，中国人民银行保持货币政策稳健中性，调节好货币闸门，维护流动性基本稳定，为稳增长、调结构、促改革、惠民生、抑泡沫、防风险营造了适宜的货币金融环境。一、张弛有度开展公开市场操作按照稳健中性货币政策要求，为把握好去杠杆与维护流动性基本稳定的平衡，中国人民银行提高公开市场操作的前瞻性、灵活性和精细化程度，加强预调微调和预期管理，有机搭配公开市场操作工具组合，合理摆布操作力度和开停节奏，“削峰填谷”熨平流动性波动。,457.0
23,货币市场、债券市场总体平稳运行，金融体系降低内部资金杠杆也取得进展。第一季度，银行体系流动性运行平稳、中性适度，货币市场利率总体保持稳定，个别时点的利率波动很快在市场机制作用下得到修复。4月份，针对金融体系存在的潜在风险因素，监管力度加大，市场预期有所变化。按照部署，“一行三会一局”在金融监管协调部际联席会议机制下加强金融监管协调，有机衔接监管政策出台的时机和节奏，通过预调微调稳定市场预期，同时保持定力，注重发挥市场力量的修正作用。一方面，中国人民银行公开市场业务操作室在5月下旬释放操作信号，随即于6月6日开展4980亿元MLF操作，提前对冲全月4313亿元MLF到期并安排适中的增量资金供应；6月7日重启到期日跨过半年末的28天期逆回购，此后连续操作，对冲税期、金融机构缴纳法定存款准备金、央行流动性工具到期等影响流动性的客观因素，以中性适度的取向对流动性总量进行“填谷”。,391.0
24,另一方面，考虑到每月下旬财政支出可大量投放流动性，为引导流动性总量向中性适度水平收敛，6月23日起公开市场业务操作室连续12个工作日暂停操作，利用央行逆回购到期对流动性总量进行“削峰”。同时，通过公开市场业务交易公告阐释操作力度调整或暂停操作的原因，加强与市场沟通，不断提高透明度。总体看，第二季度以来市场预期趋于稳定，金融机构对央行以中性适度取向对流动性进行“削峰填谷”的理解加深，舆论误读减少。银行间市场最具代表性的7天回购利率（DR007）总体在2.75%-3.0%的区间内运行，利率中枢稳中有降，债券市场也有所回暖。随着经济总量增加、金融体系资产负债表规模扩大和资金跨市场、跨机构联动增强，近年来财政收入与支出、金融机构法定存款准备金缴纳与退缴、现金投放和回笼、市场预期等因素对流动性的影响放大，不同因素还容易叠加。,362.0
25,如每月中旬往往是多个因素叠加收紧流动性的时点，故公开市场操作“填谷”的力度会大一些。而下旬则有财政支出供应流动性，公开市场操作的方向主要体现为“削峰”，削峰的尺度拿捏主要看财政支出的进度和力度，保持灵活性。为避免某一阶段资金面持续收紧或宽松引发市场对稳健中性货币政策取向的误读，公开市场操作将增强主动投放和回笼的灵活性，研究丰富逆回购期限品种，提高资金面稳定性并引导金融机构优化资产负债期限结构，维护银行体系流动性基本稳定、中性适度。二、开展常备借贷便利和中期借贷便利操作根据货币政策调控需要和银行体系流动性状况，上半年，中国人民银行综合运用临时流动性便利（TLF）、中期借贷便利（MLF）、常备借贷便利（SLF）等货币政策工具，进一步增强央行流动性管理的灵活性和有效性，保持银行体系流动性基本稳定。2017年1月，为保障春节前由现金投放形成的集中性流动性需求，促进银行体系流动性和货币市场平稳运行，中国人民银行通过临时流动性便利（TLF）操作为现金投放量较大的大型商业银行提供了临时流动性支持，明显降低春节前现金投放因素对银行体系流动性和金融市场运行的扰动。,480.0
26,开展常备借贷便利操作，对地方法人金融机构按需足额提供短期流动性支持，发挥常备借贷便利利率作为利率走廊上限的作用，促进货币市场平稳运行。上半年，累计开展常备借贷便利操作共3069亿元，期末余额为446亿元。为反映经济基本面企稳向好和货币市场利率中枢上行，第一季度两次上调常备借贷便利利率，其中7天、1个月利率分别上调20个基点，第二季度末利率水平与第一季度末持平，隔夜、7天、1个月利率分别为3.30%、3.45、3.80%。为促进经济平稳增长，保证基础货币供给，结合金融机构流动性需求情况，每月适时开展中期借贷便利操作。上半年，累计开展中期借贷便利操作28940亿元，期末余额为42245亿元，比年初增加7672亿元，弥补银行体系中长期流动性缺口，成为央行基础货币供给的重要渠道。,340.0
27,中期借贷便利采取招标方式，第二季度6个月期和1年期中期借贷便利中标利率分别为3.05和3.20%。三、继续完善宏观审慎政策框架防止发生系统性金融风险是金融工作的永恒主题。宏观审慎政策本质上采用的是宏观、逆周期、跨市场的视角，以防范系统性风险为主要目标，着力于减缓金融体系的顺周期波动和跨市场风险传染对宏观经济和金融稳定造成的冲击。目前，宏观审慎评估（MPA）是我国构建宏观审慎政策框架的重要探索之一。MPA将信贷增长与资本水平、经济发展合理需要紧密挂钩，具有宏观审慎政策工具和货币政策工具的双重属性。,250.0
28,根据形势变化和调控需要，中国人民银行不断完善MPA，在进行2017年一季度MPA评估时正式将表外理财纳入广义信贷指标范围。从实施情况看，包括表外理财在内的广义信贷增速从高位有所回落，抑制金融体系内部杠杆过快增长、促进金融机构稳健经营、增强金融服务实体经济可持续性的作用进一步显现。同时，做好将同业存单纳入MPA同业负债占比指标的准备工作，并在利率定价自律机制会议等场合披露相关考虑，为平稳实施留出充分的过渡期。四、综合运用货币政策工具，支持金融机构扩大重点领域和薄弱环节信贷投放中国人民银行积极运用信贷政策支持再贷款、再贴现和抵押补充贷款等工具引导金融机构加大对小微企业、“三农”和棚改等国民经济重点领域和薄弱环节的支持力度。6月末，全国支农再贷款余额为2360亿元，支小再贷款余额为759亿元，扶贫再贷款余额为1429亿元，再贴现余额为1402亿元。,376.0
29,对国家开发银行、中国进出口银行和中国农业发展银行发放抵押补充贷款，主要用于支持三家银行发放棚改贷款、重大水利工程贷款、人民币“走出去”项目贷款等。根据三家银行贷款的发放进度，第二季度，人民银行向三家银行提供抵押补充贷款共1953亿元，6月末抵押补充贷款余额为24111亿元。动态调整定向降准机构存款准备金率。2017年2月，人民银行根据2016年度金融机构信贷支农支小情况，实行了定向降准例行考核。大多数银行上年度信贷支农支小情况满足定向降准标准，可以继续享受优惠准备金率；部分此前未享受定向降准的银行达到了定向降准标准，可以在新年度享受优惠准备金率；部分银行不再满足定向降准标准，将不能继续享受优惠准备金率。,305.0
30,五、发挥信贷政策的结构引导作用中国人民银行继续探索和发挥信贷政策的信号和结构引导作用，支持经济结构调整和转型升级。引导金融机构围绕去产能、去库存、去杠杆、降成本、补短板五大任务，更加注重供给侧的存量重组、增量优化、动能转换，合理使用央行提供的资金支持，探索创新组织架构、抵押品、产品和服务模式，将更多金融资源配置到经济社会发展的重点领域和薄弱环节，更好满足人民群众和实体经济多样化的金融需求。,196.0
31,一是鼓励和引导银行业金融机构全面支持制造强国建设，继续做好产业结构战略性调整、基础设施建设和棚改、地下管廊、船舶、铁路、流通、能源等重点领域改革发展的金融服务，以扩大服务消费为重点带动产业转型，引导金融机构创新组织、产品和服务方式，加大养老、健康等新消费重点领域支持力度。,136.0
32,二是扎实做好涉农和小微企业金融服务，慎重稳妥推进“两权”抵押贷款试点，鼓励中小企业通过发行非金融企业债务融资工具募集资金，支持符合条件的金融机构发行金融债券专项用于发放小微企业贷款，鼓励发展中小银行和民营金融机构。,107.0
33,三是督促银行业金融机构落实好金融支持钢铁、煤炭、煤电等行业化解过剩产能的各项政策，建立完善绿色金融政策体系，大力发展绿色金融。,63.0
34,四是做好京津冀协同发展、一带一路、长江经济带发展、西部大开发等国家战略的金融支持工作，推动区域经济协调发展。,54.0
35,五是继续完善扶贫、就业、助学、少数民族、农民工、大学生村官等民生金融服务。促进金融支持“双创”，积极推动科技金融结合试点。深入推进金融精准扶贫，加强易地扶贫搬迁信贷资金筹集、投放和管理工作，强化金融精准扶贫信息共享、统计监测和政策效果评估，着力支持贫困地区经济社会持续健康发展和贫困人口脱贫致富。此外，进一步完善信贷政策导向效果评估工作机制，进一步推进信贷资产证券化，以改革创新盘活存量资金。六、完善人民币汇率形成机制第二季度，外汇市场自律机制组织各美元报价行完善人民币兑美元汇率中间价报价机制，在原有“收盘价+一篮子货币汇率变化”的报价模型中加入“逆周期因子”，以适度对冲市场情绪的顺周期波动，缓解外汇市场可能存在的“羊群效应”。,316.0
36,调整后，“收盘汇率+一篮子货币汇率变化+逆周期因子”的人民币兑美元汇率中间价形成机制有序运行，更好地反映了我国经济基本面和国际汇市的变化，人民币兑美元双边汇率弹性进一步增强，双向浮动的特征更加显著，汇率预期平稳。,106.0
37,第二季度，人民币兑美元汇率中间价最高为6.9066元，最低为6.7744元，60个交易日中29个交易日升值、31个交易日贬值，最大单日升值幅度为0.80%（543点），最大单日贬值幅度为0.25%（174点）。,105.0
