,paragraph,length
0,中国货币政策执行报告二○一九年第四季度中国人民银行货币政策分析小组2020年2月19日内容摘要2019年中国经济运行总体平稳，结构持续优化，就业保持稳定，物价结构性上涨特征明显，内外部风险挑战增多，经济下行压力加大。,108.0
1,全年国内生产总值（GDP）同比增长6.1%，居民消费价格指数（CPI）同比上涨2.9%，外汇储备保持在3万亿美元以上。中国人民银行坚持金融服务实体经济的根本要求，实施稳健的货币政策，加强逆周期调节，在多重目标中寻求动态平衡，保持货币信贷合理增长，推动信贷结构持续优化，以改革的办法疏通货币政策传导，千方百计降低企业融资成本，为实现“六稳”和经济高质量发展营造了适宜的货币金融环境。,190.0
2,一是保持银行体系流动性合理充裕。三次降低存款准备金率，为金融机构支持实体经济提供2.7万亿元长期资金，灵活开展公开市场和中期借贷便利操作，合理把握流动性投放节奏。,81.0
3,二是既稳总量又优结构。构建完善“三档两优”存款准备金框架，继续发挥再贷款、再贴现、宏观审慎评估等工具的作用，引导金融机构加大对小微、民营企业和制造业的信贷支持。,80.0
4,三是以我为主，兼顾对外均衡。人民币汇率双向波动，对美元汇率双向“破7”。建立在香港常态化发行人民币央行票据的机制，多渠道发声引导预期。,67.0
5,四是用改革的办法疏通货币政策传导。深化利率市场化改革，改革完善贷款市场报价利率（LPR）形成机制，遵循市场化、法治化原则，推动存量贷款定价基准由原来的贷款基准利率转换为LPR或固定利率。以永续债为突破口助力银行补充资本，缓解银行信用面临的资本约束。,124.0
6,五是牢牢守住风险底线。金融风险总体可控，重点金融机构风险处置取得突破性进展，有针对性地处置个别中小银行风险。针对结构性流动性紧张局面，增加再贴现额度2000亿元、常备借贷便利额度1000亿元提供流动性支持，建立了防范中小银行流动性风险的“四道防线”，及时稳定市场信心。总体来看，稳健的货币政策成效显著，体现了前瞻性、精准性、主动性和有效性。2019年末，广义货币（M2）同比增长8.7%，社会融资规模存量同比增长10.7%，M2和社会融资规模增速略高于国内生产总值名义增速。,237.0
7,2019年普惠小微贷款“量增、面扩、价降”，民营企业和制造业融资条件明显改善。企业贷款利率显著下降，12月新发放企业贷款加权平均利率为5.12%，较2018年高点下降0.48个百分点。人民币汇率双向波动，弹性进一步增强。中国发展仍处于并将长期处于重要战略机遇期，近期新冠肺炎疫情对中国经济的影响是暂时的，中国经济长期向好、高质量增长的基本面没有变化。当前，世界经济增长持续放缓，仍处在国际金融危机后的深度调整期，外部不确定不稳定因素增多。,219.0
8,我国经济正在由高速增长转向高质量发展，结构性、体制性、周期性问题相互交织，增长速度换挡期、结构调整阵痛期、前期刺激政策消化期“三期叠加”影响持续深化。经济增长保持了韧性，同时也必须认识到经济下行压力仍然较大。下一阶段，人民银行将坚持以习近平新时代中国特色社会主义思想为指导，全面贯彻落实党的十九届四中全会和中央经济工作会议精神，坚决贯彻执行党中央、国务院决策部署，紧扣全面建成小康社会目标任务和“十三五”规划收官，坚持稳中求进工作总基调，全面做好“六稳”工作。科学稳健把握逆周期调节力度，守正创新，勇于担当，稳健的货币政策要灵活适度，加强逆周期调节、结构调整和改革的力度，保持物价水平基本稳定。打好防范化解重大金融风险攻坚战，牢牢守住不发生系统性金融风险的底线。,331.0
9,将疫情防控作为当前最重要的工作来抓，加大对新冠肺炎疫情防控的货币信贷支持。灵活运用多种货币政策工具，保持流动性合理充裕，促进货币信贷、社会融资规模增长同经济发展相适应。推动银行通过发行永续债等途径多渠道补充资本，提升银行服务实体经济和防范化解金融风险的能力。创新和运用结构性货币政策工具，引导金融机构加大对小微、民营企业和制造业的信贷支持，加大对疫情防控相关领域、相关地区的信贷支持。在做好防控工作的前提下，全力支持各类生产企业复工复产。,219.0
10,完善LPR传导机制，推进存量浮动利率贷款定价基准转换，坚决打破贷款利率隐性下限，疏通货币政策传导。把握好保持人民币汇率弹性、完善跨境资本流动宏观审慎政策和加强国际宏观政策协调三方面的平衡，保持人民币汇率在合理均衡水平上基本稳定。一、银行体系流动性合理充裕2019年，面对内外部风险挑战增多等诸多不确定性影响，中国人民银行实施稳健的货币政策，综合运用公开市场操作、中期借贷便利、存款准备金率、再贷款、再贴现、常备借贷便利等多种货币政策工具，加强逆周期调节，保持流动性合理充裕，引导货币市场利率稳定运行。2019年末，金融机构超额存款准备金率为2.4%，与上年末持平。二、金融机构贷款增长较快，贷款利率下降贷款较快增长，信贷支持实体经济力度增强。,321.0
11,2019年末，金融机构本外币贷款余额为158.6万亿元，同比增长11.9%，比年初增加16.8万亿元，同比多增6987亿元。人民币贷款余额为153.1万亿元，同比增长12.3%。信贷结构进一步优化，普惠小微贷款快速增长。2019年以来，中国人民银行引导金融机构加大对普惠小微贷款的投放，效果明显。2019年普惠小微贷款新增2.1万亿元，是上年增量的1.7倍，年末余额增速为23.1%，比上年末提高7.9个百分点。,206.0
12,住户贷款增速放缓，2019年末为15.5%，比上年末低2.7个百分点。非金融企业及机关团体贷款同比多增。中长期贷款比年初增加11.3万亿元，同比多增7986亿元，占同期贷款增量的67.3%，较上年提高2.3个百分点。LPR小幅下降，贷款加权平均利率明显下行。11月1年期LPR较10月下降5个基点至4.15%，5年期以上LPR较10月下降5个基点至4.80%。,180.0
13,12月，新发放贷款加权平均利率为5.44%，比9月下降0.18个百分点，同比下降0.2个百分点。2019年初至7月，新发放企业贷款加权平均利率在5.30%附近波动，LPR改革后贷款利率下降明显，12月新发放企业贷款加权平均利率为5.12%，较LPR改革前的7月下降0.2个百分点，为2017年第二季度以来最低点，降幅明显超过LPR降幅（见图2），反映LPR改革增强金融机构自主定价能力、提高贷款市场竞争性、促进贷款利率下行的作用正在发挥。12月，一般贷款中利率高于LPR的贷款占比为76.81%，利率等于LPR的贷款占比为1.32%，利率低于LPR的贷款占比为21.87%，贷款利率加减点区间整体较9月有所下移。在LPR下降的情况下，贷款实际利率低于LPR的占比仍在扩大。受美联储降息等因素影响，外币存贷款利率有所下降。,360.0
14,12月，活期、3个月以内大额美元存款加权平均利率分别为0.30%和1.93%，分别较9月下降0.09个和0.32个百分点；3个月以内、3（含）-6个月美元贷款加权平均利率均为3.01%，分别较9月下降0.30个和0.03个百分点。,115.0
15,存款增长平稳。2019年末，金融机构本外币各项存款余额为198.2万亿元，同比增长8.6%，比上年末高0.8个百分点。人民币各项存款余额为192.9万亿元，同比增长8.7%，比上年末高0.5个百分点。外币存款余额为7577亿美元，比年初增加301亿美元，同比多增935亿美元。三、货币供应量、社会融资规模适度增长广义货币M2和社会融资规模增速略高于国内生产总值名义增速，体现了逆周期调节。,194.0
16,2019年末，M2余额为198.6万亿元，同比增长8.7%，比上年末高0.6个百分点，以适度的货币增长支持了经济高质量发展。狭义货币M1余额为57.6万亿元，同比增长4.4%，比上年末高2.9个百分点。流通中货币M0余额为7.7万亿元，同比增长5.4%。2019年现金净投放3981亿元，同比多投放1418亿元。初步统计，2019年末社会融资规模存量为251.31万亿元，同比增长10.7%，增速比上年末高0.4个百分点。,211.0
17,2019年社会融资规模增量累计为25.58万亿元，比上年多3.08万亿元。2019年社会融资规模增量主要有以下特点：一是人民币贷款同比多增较多。,72.0
18,二是委托贷款、信托贷款和未贴现银行承兑汇票同比少减。,26.0
19,三是企业债券融资增加较多，股票融资增长略低于上年。,25.0
20,四是政府债券融资同比少增。,13.0
21,五是存款类金融机构资产支持证券融资少于上年，贷款核销同比多增。稳健的货币政策要灵活适度，保持流动性合理充裕，货币信贷、社会融资规模增长同经济发展相适应，降低社会融资成本。2019年，面对经济下行和局部性社会信用收缩压力，人民银行有效发挥银行货币创造、支持实体经济潜力，对症下药，着力化解流动性、利率和资本三大约束，接上金融支持实体经济的活水，取得了较好效果：一是三次降低存款准备金率，为金融机构支持实体经济提供2.7万亿元长期资金，灵活开展公开市场和中期借贷便利操作，保持流动性合理充裕。,244.0
22,二是以永续债为突破口助力银行补充资本，全年银行共发行永续债5696亿元。,36.0
23,三是疏通货币政策传导，改革完善贷款市场报价利率（LPR）形成机制，推进存量浮动利率贷款定价基准转换。中期借贷便利中标利率、公开市场操作中标利率下降，推动了实际贷款利率明显下降，激发实体经济贷款需求。总体看，2019年广义货币M2和社会融资规模增速略高于国内生产总值名义增速。稳健的货币政策灵活适度，贷款结构持续优化，为高质量发展营造了适宜的货币金融环境。按照党中央、国务院部署，2020年人民银行将坚持稳中求进工作总基调，坚持新发展理念，科学稳健把握货币政策逆周期调节力度，确保经济运行在合理区间。,249.0
24,一是科学把握总量的度。现阶段，货币政策中介目标转为广义货币M2和社会融资规模增速与国内生产总值名义增速基本匹配，是科学稳健把握货币政策逆周期调节力度的着力点，既兼顾经济增长，又有利于保持物价稳定。由于经济下行压力加大往往和社会信用收缩交织共振，广义货币M2和社会融资规模增速略高于国内生产总值名义增速，体现了强化逆周期调节，以适度的货币增长支持高质量发展，防范社会信用收缩和经济下行压力之间形成恶性循环的风险。当前宏观杠杆率仍处在高位，这一机制设计也有助于保持宏观杠杆率基本稳定，使得宏观杠杆率很难像2009年至2017年一样年均上升超过十个百分点。,275.0
25,二是有效把握结构的度。运用结构性货币政策精准滴灌，发挥“三档两优”四、人民币汇率总体稳定2019年，跨境资本流动和外汇供求基本平衡，市场预期总体平稳。人民币汇率以市场供求为基础，有贬有升，双向浮动，在合理均衡水平上保持基本稳定。1-4月，主要受国民经济开局平稳，积极因素逐渐增多，境外投资者增持境内股票等影响，人民币汇率有所升值；5月份之后，受国际经济金融形势和贸易保护主义措施影响，人民币对美元汇率有所贬值。8月初，贸易摩擦进一步升级，受市场力量推动，人民币汇率跌破了7元。,238.0
26,9月以来，汇率预期趋于平稳，人民币对美元汇率和对一篮子货币汇率升值，离岸和在岸人民币对美元市场汇率多次升破7元，并在12月之后稳定在7元以内。从全年来看，人民币汇率弹性明显增强，发挥了其调节宏观经济和国际收支“自动稳定器”的作用。2019年，人民币汇率小幅贬值，汇率继续保持弹性。2019年末，中国外汇交易中心（CFETS）人民币汇率指数和参考特别提款权（SDR）货币篮子的人民币汇率指数分别为91.39和91.81，分别较上年末下跌2.03%和1.43%。2018年末至2019年末，国际清算银行测算的人民币名义和实际有效汇率分别贬值1.50%和升值1.11%；2005年人民币汇率形成机制改革以来至2019年12月末，人民币名义和实际有效汇率分别升值32.31%和46.69%。,341.0
27,2019年末，人民币对美元汇率中间价为6.9762元，较2018年末贬值1.62%，2005年人民币汇率形成机制改革以来累计升值18.64%。2019年，人民币对美元汇率年化波动率为4%，与国际主要货币基本相当。跨境人民币业务保持增长，收支基本平衡。2019年，跨境人民币收付金额合计19.7万亿元，同比增长23%，其中实收10万亿元，实付9.7万亿元。经常项目下跨境人民币收付金额合计6万亿元，同比增长18%，其中，货物贸易项下收付金额4.2万亿元，服务贸易及其他经常项下收付金额1.8万亿元。,248.0
28,资本项目下人民币收付金额合计13.6万亿元，同比增长26%。一、灵活开展公开市场操作灵活搭配长中短期货币政策工具，保持银行体系流动性合理充裕。2019年，在综合运用降准、定向降准、中期借贷便利（MLF）等工具投放中长期流动性的基础上，中国人民银行以7天期逆回购为主灵活开展公开市场操作，进一步提高操作的前瞻性、针对性和主动性，保持流动性合理充裕。第四季度以来，通过合理安排逆回购操作期限品种，精准对冲税期高峰、节前现金投放、年末监管考核等短期流动性扰动因素。从12月中旬开始连续开展14天期逆回购操作提前投放跨年流动性，为各类市场主体平稳跨年提供了有利的流动性环境。,283.0
29,公开市场操作中标利率小幅下行，货币市场利率运行平稳。2019年中期借贷便利和逆回购操作中标利率分别下行5个基点，有利于释放逆周期调节信号，并通过LPR传导进一步降低实体经济融资成本。随着公开市场操作利率小幅下降，货币市场利率中枢也有所下行。银行间市场存款类机构以利率债为质押的7天期回购利率（DR007）在合理区间平稳运行，2019年均值为2.54%，比2018年低20bp。年末货币市场利率走势平稳，波动性进一步下降，12月末DR007为2.81%，比2018年末低23bp。,239.0
30,持续开展央行票据互换（CBS）操作。为提升银行永续债的市场流动性，支持银行发行永续债补充资本，增强金融服务实体经济的能力，2019年中国人民银行累计开展了7次共计320亿元CBS操作，换入债券既有国有大行、股份制银行发行的永续债，也有城商行发行的永续债。中国人民银行在银行永续债发行之初及时创设CBS工具并连续开展操作，对于提升银行永续债的流动性发挥了积极作用。在香港常态化发行人民币央行票据。2019年，中国人民银行逐步建立了在港常态化发行人民币央行票据的机制，全年在香港成功发行12期共计1500亿元人民币央行票据，目前余额为800亿元，丰富了离岸市场高信用等级人民币资产，优化了离岸市场的结构，促进了离岸人民币货币市场健康发展，有利于进一步推动人民币国际化。,332.0
31,二、开展常备借贷便利和中期借贷便利操作及时开展常备借贷便利操作，对地方法人金融机构按需足额提供短期流动性支持。2019年，累计开展常备借贷便利操作共5465亿元，第一至第四季度分别开展常备借贷便利操作753亿元、1239亿元、1190亿元、2284亿元，期末余额为1021亿元。发挥常备借贷便利利率作为利率走廊上限的作用，促进货币市场平稳运行。第四季度下调常备借贷便利利率5个基点，下调后隔夜、7天、1个月利率分别为3.35%、3.50%、3.85%。为促进经济平稳增长，保证基础货币供给，定期开展中期借贷便利操作。,258.0
32,2019年，累计开展中期借贷便利操作36900亿元，期限均为1年。第一季度运用降准资金置换到期中期借贷便利，未对金融机构开展中期借贷便利操作。第二至四季度分别开展中期借贷便利操作11400亿元、11500亿元、14000亿元，期末余额为36900亿元，比年初减少12415亿元。中期借贷便利采取招标方式，2019年11月5日中期借贷便利中标利率下降5个基点，2020年2月17日中期借贷便利中标利率下降10个基点，为3.15%。三、加大对新冠肺炎疫情防控的货币信贷支持力度为切实贯彻落实中共中央《关于加强党的领导、为打赢疫情防控阻击战提供坚强政治保证的通知》精神和中央应对新冠肺炎疫情工作领导小组工作部署，2020年2月1日，人民银行、财政部、银保监会、证监会、外汇局发布《关于进一步强化金融支持防控新型冠状病毒感染肺炎疫情的通知》（银发〔2020〕29号），进一步强化金融对疫情防控工作的支持，重点是加大货币信贷支持力度，保持流动性合理充裕，强化对重点医用物品和生活物资生产企业的金融支持，更好地满足人民群众正常的金融服务需求，为打赢疫情防控阻击战、维护经济稳定发展大局提供有力支持。,493.0
33,一是专项再贷款定向支持疫情防控重点领域和重点企业。为支持打赢新冠肺炎疫情防控阻击战，2020年1月31日，中国人民银行下发《关于发放专项再贷款支持防控新型冠状病毒感染的肺炎疫情有关事项的通知》（银发〔2020〕28号），向主要全国性银行和湖北等10个重点省（市）的部分地方法人银行提供总计3000亿元低成本专项再贷款资金，对直接参与防疫的重点医用物品和生活物资的生产、运输和销售重点企业实行名单制管理，支持金融机构向名单内的企业提供优惠利率信贷支持。,225.0
34,二是保持流动性合理充裕，实施好逆周期调节。为应对疫情对市场流动性的影响，稳定市场预期，中国人民银行于春节假期最后一天2月2日提前宣布将于2月3日开展1.2万亿元公开市场逆回购操作投放资金。2月3日上午人民银行公开市场操作7天期逆回购和14天期逆回购的中标利率分别为2.40%和2.55%，均较前期下行10个基点。2月4日进一步开展5000亿元公开市场逆回购操作投放资金，两日投放流动性累计1.7万亿元。流动性投放推动货币市场和债券市场利率下行，并将进一步推动贷款市场利率下行，有利于降低资金成本，缓解企业特别是小微企业的财务压力，扩大融资规模，支持实体经济。,279.0
35,三是引导金融机构加大对疫情防控的信贷投放力度。人民银行督促分支机构和金融机构主动加强与有关医院、医疗科研单位和相关企业的服务对接，提供足额信贷资源，全力满足相关单位和企业卫生防疫、医药用品制造及采购、公共卫生基础设施建设、科研攻关、技术改造等的合理融资需求，提升受疫情影响严重地区的金融供给能力。对受疫情影响较大的批发零售、住宿餐饮、物流运输、文化旅游等行业，以及有发展前景但受疫情影响暂遇困难的企业，特别是小微企业，不得盲目抽贷、断贷、压贷。四、降低金融机构存款准备金率2019年三次下调金融机构存款准备金率，建立“三档两优”存款准备金框架。其中，1月和9月全面下调金融机构存款准备金率共1.5个百分点，释放长期流动性约2.3万亿元。,318.0
36,自5月起分三次定向下调服务县域的农商行存款准备金率2至3.5个百分点至农信社档次，自10月起分两次下调仅在本省经营的城商行存款准备金率1个百分点。定向降准共释放流动性约4000亿元，全部用于发放小微、民营企业贷款。定向降准旨在鼓励中小金融机构服务当地，支持实体经济健康发展。同时，我国的存款准备金制度根据机构规模和支持实体经济特点和成效形成了更加清晰、简明的“三档两优”基本框架，即存款准备金率基准档大体分为三档，并在此之上还有两项存款准备金率优惠政策。2020年1月下调金融机构存款准备金率，支持实体经济发展。,256.0
37,中国人民银行于2020年1月6日下调金融机构存款准备金率0.5个百分点（不含财务公司、金融租赁公司和汽车金融公司），释放长期资金约8000多亿元，并节约银行资金成本约150亿元，有效增加金融机构支持实体经济的稳定资金来源，降低金融机构支持小微、民营企业等实体经济的资金成本。,137.0
38,同时，此次降准与春节前的现金投放形成对冲，稳健货币政策取向没有改变。至2019年三季度末，A股上市银行总市值占全部上市公司总市值约16.56%，利润总额占全部上市公司利润总额约39.01%。2019年前三季度，我国商业银行实现净利润1.65万亿元，同比增长9.19%。从利润使用看，商业银行利润大部分用于补充资本，有助于增强银行支持实体经济和防范风险的能力。我国金融体系以间接融资为主，银行是实体经济获取融资的主要渠道。,210.0
39,商业银行利润增长是伴随着对实体经济的持续支持逐步积累的。近几年，商业银行对实体经济的信贷支持力度进一步增强，在增加对小微、民营企业信贷支持，降低企业融资实际成本，推动结构调整等方面都发挥了重要作用，取得了一定成效。商业银行利润主要用于缴纳所得税、分配股利、提取一般准备、提取盈余公积和留存未分配利润，其中后三项都用来补充核心一级资本。A股上市银行近三年数据显示，商业银行利润约17%用于缴纳所得税，23%用于普通股股利分配，剩余的60%全部用于补充核心一级资本。由此可见，银行利润来源于实体经济，大部分又用于补充银行资本，并通过资本的杠杆作用，扩大对实体经济的信贷支持，最终反哺实体经济，促进经济平稳发展。,303.0
40,当前，银行加大对实体经济的信贷支持需要有资本金，化解风险也要有资本金，而银行资本补充渠道少、难点多、进展慢，存在较大资本缺口，在拓展外源资本补充渠道的同时，保持内源资本补充能力尤为重要，维持一定的利润增长有助于银行补充资本，增强银行支持实体经济和防范风险的能力，也有利于达到国际监管标准，维护境内外投资者对我国宏观经济的信心。,163.0
41,从利润来源看，我国商业银行利润增长与资产规模较大和管理成本较低有关。2018年我国商业银行净息差平均为2.2%，处于国际中等水平，高于亚洲银行业，低于美欧银行业。但我国大型商业银行资产规模较大，与国际主要银行相比管理成本也较低。五大国有商业银行资产规模已位居全球银行业前列。2017和2018年我国商业银行平均成本收入比低于30%，而大部分国际主要银行成本收入比高于50%。,187.0
42,这一方面与人员成本有关。我国商业银行人均职工费用低于国际主要银行，而人均资产规模在国际上却处于中等水平，约是亚洲新兴市场的1.5倍，相当于用较低的职工费用水平，实现了与国际主要银行相当的人均资产管理水平。另一方面也与商业银行喜欢“垒大户”有关。银行相当一部分贷款提供给了大型国企、地方政府平台，有隐性担保，单笔规模大、风险小，拉低了平均管理成本。同时，银行此前还将基准利率0.9倍视为贷款利率隐性下限，在利率下行周期不愿主动下调，一定程度上也维持了银行利差。,229.0
