,paragraph,length
43,进一步发挥银行服务实体经济的作用，畅通经济金融良性循环。当前，各方面反映小微企业融资难融资贵问题还比较多，党中央、国务院高度重视小微企业融资问题，反复要求更好地缓解小微企业融资难融资贵问题。量大面广的小微企业是经济发展和容纳就业的生力军，有助于稳增长、稳就业。当前，我国处在转变发展方式、优化经济结构、转换增长动力的攻关期，银行要发挥利润较多的优势，进一步加大对实体经济尤其是小微企业的支持力度，用小成本办大事，把更多金融资源转向小微企业，坚决打破贷款利率隐性下限，降低企业融资成本，适当降低对短期利润增长的过高要求，向实体经济让利，畅通经济金融良性循环。中长期看，激发小微企业等微观主体的活力有助于促进经济高质量发展，无论对实体经济还是对银行都是有利的，最终将有助于银行利润长期可持续增长。,346.0
44,五、继续完善宏观审慎政策框架发挥好宏观审慎评估（MPA）在优化信贷结构和促进金融供给侧结构性改革中的作用。2019年第一季度，中国人民银行在MPA考核中增设民营企业融资、小微企业融资、制造业中长期贷款和信用贷款专项指标，加大MPA对小微、民营企业等领域的鼓励引导。第二季度和第三季度，为配合对服务县域农商行和对仅在省级行政区域经营的城商行定向降准，将相关金融机构使用降准资金发放小微、民营企业贷款情况纳入MPA考核，引导相关金融机构将降准资金全部用于发放小微、民营企业贷款，并降低小微、民营企业贷款利率。第三季度，将贷款市场报价利率（LPR）运用情况及贷款利率竞争行为纳入MPA的定价行为项目考核，推动银行更多运用LPR，坚持用改革的办法降低实体经济融资成本。完善系统重要性金融机构监管框架。,346.0
45,为落实《关于完善系统重要性金融机构监管的指导意见》，按照分行业、分步骤制定实施细则的思路，2019年中国人民银行开展了系统重要性银行评估工作，牵头起草了《系统重要性银行评估办法（征求意见稿）》，经国务院批准，于11月26日向社会公开征求意见。,121.0
46,《评估办法》从规模、关联度、可替代性和复杂性四个维度初步确立了我国系统重要性银行的评估指标体系。研究制定金融控股公司监管规则。为推动金融控股公司规范发展，有效防控金融风险，更好地服务实体经济，中国人民银行牵头起草了《金融控股公司监督管理试行办法（征求意见稿）》，并向社会公开征求意见。办法遵循宏观审慎管理理念，从强化对非金融企业投资形成的金融控股公司的监管入手，切实强化监管约束，促进经济金融良性循环。六、积极发挥结构性货币政策工具作用积极运用信贷政策支持再贷款、再贴现和抵押补充贷款等工具，引导金融机构加大对小微、民营企业、“三农”、扶贫等国民经济重点领域和薄弱环节的支持力度。,290.0
47,一是增加再贴现额度2000亿元、常备借贷便利额度1000亿元，加强对中小银行流动性支持。,44.0
48,二是全面实施优化运用扶贫再贷款发放贷款定价机制工作，引导金融机构合理确定运用扶贫再贷款资金发放贷款的利率。,53.0
49,三是设立专项扶贫再贷款，支持扩大“三区三州”信贷投放，降低“三区三州”融资成本。,40.0
50,四是完善再贷款和常备借贷便利质押品管理，按信用等级和流动性对质押品进行分类，根据货币政策操作需要设置差异化质押品。年末，全国再贷款、再贴现余额合计10148亿元，比年初增加1815亿元，其中第四季度增加881亿元。全年支农再贷款余额2602亿元（含扶贫再贷款1642亿元），支小再贷款余额2832亿元，再贴现余额4714亿元。2019年，对政策性银行和开发性银行净发放抵押补充贷款1578亿元，其中第四季度净发放204亿元，年末余额35374亿元。开展定向中期借贷便利（TMLF）操作。定向中期借贷便利为金融机构扩大对小微、民营企业的信贷投放提供了优惠利率的长期稳定资金来源。1月、4月、7月操作金额分别为2575亿元、2674亿元、2977亿元，期限为1年，利率为3.15%。年末定向中期借贷便利余额8226亿元。七、发挥信贷政策的结构引导作用中国人民银行引导资金投向供需共同受益、具有乘数效应的先进制造、民生建设、基础设施短板等领域，促进产业和消费“双升级”。,432.0
51,一是深入开展金融精准扶贫。持续做好扶贫小额信贷监测，促进金融精准扶贫提质增效。进一步督促金融机构加大对“三区三州”深度贫困地区的资金供给，加大深度贫困地区融资支持力度。,84.0
52,二是持续加大乡村振兴金融服务投入。鼓励商业银行结合自身职能定位和业务优势，积极创新金融产品和服务方式，打造综合化特色化乡村振兴金融服务体系，积极满足乡村振兴多元化融资需求。,86.0
53,三是不断提升小微、民营企业金融服务水平。强化宏观审慎评估、小微企业信贷政策导向评估的引导作用，督促金融机构加强小微金融服务能力建设，加大对民营企业融资支持力度。支持商业银行发行小微企业专项金融债券，拓宽信贷资金来源，全年累计发行2048亿元。,121.0
54,四是积极做好金融支持就业创业。加大创业担保贷款政策力度，支持退役军人、高校毕业生、农民工等重点人群就业创业。加强对养老服务、旅游、家政等服务业的金融支持，带动扩大社会就业。,86.0
55,五是继续加强产业转型升级的金融支持，持续完善区域发展金融政策引导。,33.0
56,六是全力以赴做好防疫的各项金融服务工作，加强对生产、运输和销售重要医用物资和重要生活物资的骨干企业的信贷支持力度，全力满足其合理融资需求。定向降准共释放流动性约4000亿元，全部用于小微、民营企业贷款投放。第三档小型银行的存款准备金率最低已达6%。5-7月，降准农商行新发放小微、民营企业贷款是降准释放资金量的2.8倍，利率比前4个月平均水平低0.3个百分点。9-11月，降准城商行新发放小微、民营企业贷款是降准释放资金总量的4.5倍，利率较1-8月平均水平低0.7个百分点。,238.0
57,二是充分发挥再贷款、再贴现精准滴灌作用。加大支持力度，引导金融机构扩大对涉农、扶贫、小微和民营企业等信贷投放。增加再贴现和常备借贷便利额度，加强对中小银行流动性支持。全面实施优化运用扶贫再贷款发放贷款定价机制工作，引导金融机构合理确定运用扶贫再贷款资金发放贷款的利率。设立专项扶贫再贷款，支持扩大“三区三州”信贷投放，降低“三区三州”融资成本。全年再贴现额度增加2000亿元，常备借贷便利额度增加1000亿元。年末全国再贷款再贴现余额为10148亿元（含扶贫再贷款1642亿元），比年初增加1815亿元。,252.0
58,三是发挥宏观审慎评估（MPA）工具的结构引导作用。将定向降准农商行、城商行使用降准资金发放小微、民营企业贷款情况纳入考核，对民营企业融资、小微企业融资、制造业中长期贷款和信用贷款进行专项考核，并将中小银行服务基层、服务实体的情况纳入考核，促进优化信贷结构和金融供给侧结构性改革。制造业中长期贷款增速创2012年以来的最高水平，2019年末余额同比增长14.9%，比上年末高4.4个百分点，全年新增5021亿元，同比多增1804亿元，有力支持制造业投资增速回升。,230.0
59,"四是创新并运用定向中期借贷便利（TMLF）。支持大型商业银行、股份制商业银行向小微、民营企业提供长期稳定资金，操作量与其支持小微、民营企业的力度挂钩，利率较中期借贷便利（MLF）优惠，有利于大中型银行发挥好“头雁”作用，带动小微、民营企业融资成本下行。全年TMLF操作三次，年末余额8226亿元。总体看，结构性货币政策工具取得积极成效，小微、民营企业支持力度加大。普惠小微贷款“量增、面扩、价降”，2019年增加2.1万亿元，是上年的1.7倍,年末增速23.1%，同比提高7.9个百分点；支持小微经营主体2704万户，同比增长26.4%；工农中建交五家大型银行新发放小微企业贷款平均利率为4.7%，同比下降0.74个百分点。",312.0
60,民营企业贷款2019年增加3.8万亿元，同比多增1.1万亿元，八、深化利率市场化改革改革完善LPR形成机制，疏通货币政策传导。2019年8月17日人民银行宣布完善LPR形成机制，推出新的LPR报价原则、形成方式、期限品种、报价银行、报价频率和运用要求。提高银行贷款定价的自主权，推动银行改进经营行为，坚决打破贷款利率隐性下限，疏通市场化利率传导渠道。积极督促LPR推广运用，稳妥推进存量贷款定价基准转换。将银行新发放贷款运用LPR的占比情况纳入宏观审慎评估（MPA），促进银行积极有序运用LPR定价，转变传统定价思维，将LPR下降效果有效传导至贷款利率。,277.0
61,2019年末，新发放贷款中运用LPR的占比已达到90%。2019年12月28日人民银行发布了存量浮动利率贷款定价基准转换的公告，遵循市场化、法治化原则，推动存量贷款定价基准由原来的贷款基准利率转换为LPR或固定利率。LPR改革降低企业融资成本的作用已经显现。2019年年初至7月，企业贷款加权平均利率一直在5.3%附近波动，市场利率下行向企业贷款利率传导不足。8月份以来，全国银行间同业拆借中心已6次发布新机制下的LPR，1年期LPR较同期限基准利率下降了20个基点。,234.0
62,随着LPR报价稳中有降，企业贷款利率显著下降。九、完善人民币汇率形成机制继续推进汇率市场化改革，完善以市场供求为基础、参考一篮子货币进行调节、有管理的浮动汇率制度，保持人民币汇率弹性，发挥汇率调节宏观经济和国际收支自动稳定器的作用。同时，注重预期引导，保持人民币汇率在合理均衡水平上的基本稳定。2019年，人民币对美元汇率中间价最高为6.6850元，最低为7.0884元，244个交易日中113个交易日升值、130个交易日贬值，1个交易日持平。最大单日升值幅度为0.70%（469点），最大单日贬值幅度为0.66%（458点）。,264.0
63,人民币对国际主要货币汇率有贬有升，双向浮动。2019年末，人民币对美元、欧元、英镑、日元汇率中间价分别较2018年末贬值1.62%、升值0.41%、贬值5.18%和贬值3.43%。2005年人民币汇率形成机制改革以来至2019年末，人民币对美元汇率累计升值18.64%，对欧元汇率累计升值28.13%，对日元汇率累计升值14.00%。银行间外汇市场人民币直接交易成交活跃，流动性提升，降低了微观经济主体的汇兑成本，促进了双边贸易和投资。2019年，在中国人民银行与境外货币当局签署的双边本币互换协议下，境外货币当局动用人民币余额为329.22亿元，中国人民银行动用外币余额折合3.23亿美元，对促进双边贸易投资发挥了积极作用。,313.0
64,十、稳妥有序推进金融风险处置，深化金融机构改革中国人民银行牵头实施防范化解重大金融风险攻坚战行动方案，重点金融机构风险处置取得突破性进展。针对结构性流动性紧张局面，建立再贴现、常备借贷便利、动用存款准备金、流动性再贷款等防范中小银行流动性风险的“四道防线”，及时稳定了市场信心。稳妥有序推进包商银行风险处置。包商银行因出现严重信用风险被接管以来，在各方共同努力下，接管托管工作进展顺利，第一阶段大额债权收购与转让工作、第二阶段清产核资相关工作已顺利完成，在此基础上，第三阶段市场化改革重组工作正在有序推进。总体看，果断实施接管发挥了及时“止血”作用，避免了包商银行风险进一步恶化。,290.0
65,在最大限度保护存款人和客户合法权益、维护社会稳定大局的同时，依法依规打破了刚性兑付，严肃了市场纪律，防范道德风险，促进了金融市场信用分层，推动了市场风险合理定价。在处置过程中，人民银行充分发挥了央行“最后贷款人”作用，适时适度投放流动性，及时稳定了市场信心，有效遏制了包商银行风险向其他中小金融机构蔓延，守住了不发生系统性风险的底线。积极推进恒丰银行、锦州银行改革重组，防止风险蔓延。在地方政府和监管部门指导下，恒丰银行遵照市场化、法治化原则制定实施了“剥离不良、引战增资”两步走改革方案。2019年12月31日，恒丰银行顺利完成股改建账工作，标志着市场化重组基本完成。,285.0
66,2019年6月，根据党中央、国务院统一部署，人民银行、银保监会会同辽宁省政府推动锦州银行进行改革重组，增强了市场对锦州银行的信心，改善了市场对中小金融机构稳健性预期，阻断了风险向其他中小金融机构蔓延。目前人民银行正在会同有关部门指导锦州银行通过市场化、法治化方式处置相当规模的风险资产并同步增资扩股，修复资产负债表，增强风险抵御能力。推动全面落实开发性、政策性金融机构改革方案。中国人民银行会同改革工作小组成员单位有序推动建立健全董事会和完善治理结构、划分业务范围等改革举措。国家开发银行新一届董事会、中国进出口银行董事会、中国农业发展银行董事会均已成立并有效运转，继续推动其强化职能定位，加强风险防控，更好服务国家战略。,311.0
67,十一、深化外汇管理体制改革外汇管理服务实体经济。,24.0
68,一是推进贸易投资便利化，发布《国家外汇管理局关于进一步促进跨境贸易投资便利化的通知》，推出12项跨境贸易投资便利化措施，简化相关业务操作，便利银行和企业等市场主体办理外汇业务。,88.0
69,二是推动服务贸易付汇税务备案电子化全面落地，实现服务贸易项下付汇税务备案网上办理。,41.0
70,三是精简外汇账户，发布《国家外汇管理局关于精简外汇账户的通知》，切实提高市场主体经营效率。深化外汇管理重点领域改革。,58.0
71,一是制定《关于进一步便利境外机构投资者投资银行间债券市场有关事项的通知》，完善银行间债券市场开放政策，提高境外机构投资者入市投资的便利性。,69.0
72,二是在自由贸易试验区试点取消部分外汇管理行政许可申报材料，进一步优化营商环境。强化外汇市场监管，联合多部门开展打击地下钱庄转移赃款专项行动，加强跨境监管合作，持续重拳整治非法网络炒汇，全力打击外汇违法犯罪行为。货币市场交易活跃，各类债券发行利率回落，债券现券交易量、发行量上升。股票市场指数回升，成交量和筹资额同比增加。保险业保费收入增速回升，资产增速提高。,179.0
73,一、金融市场运行概况（一）货币市场利率维持较低水平，市场交易活跃银行体系流动性合理充裕，货币市场利率维持较低水平。2019年12月，同业拆借月加权平均利率为2.09%。质押式回购月加权平均利率为2.10%，其中银行业存款类金融机构间利率债质押式回购月加权平均利率为1.98%。2019年末，隔夜和1周Shibor分别为1.69%和2.74%。银行间回购和拆借交易活跃。,184.0
74,2019年，银行间市场债券回购累计成交819.6万亿元，日均成交3.3万亿元，同比增长14.3%；同业拆借累计成交151.6万亿元，日均成交6065亿元，同比增长9.7%。从期限结构看，回购和拆借隔夜品种的成交量分别占各自总量的85.2%和91.4%，占比分别较上年同期上升3.6个和1.3个百分点。交易所债券回购累计成交238.9万亿元，同比上升3.4%。同业存单和大额存单业务有序发展。2019年全年，银行间市场发行同业存单2.8万只，发行总量为17.9万亿元，二级市场交易总量为145万亿元，年末同业存单余额为10.7万亿元。,266.0
75,2019年全年，3个月期同业存单发行加权平均利率为2.97%，比同期限Shibor高14个基点。金融机构全年发行大额存单5.04万期，发行总量为12.0万亿元，同比增加2.8万亿元。利率互换交易活跃。2019年全年，人民币利率互换市场达成交易23.77万笔，同比增长26%；名义本金总额18.1万亿元，同比减少16%。从期限结构来看，1年及1年期以下交易最为活跃，名义本金总额达11.12万亿元，占总量的61.27%。,209.0
76,人民币利率互换交易的浮动端参考利率主要包括7天回购定盘利率和Shibor，与之挂钩的利率互换交易名义本金占比为72%和26.4%。LPR形成机制改革后，以LPR为标的的利率互换成交开始增加，全年共交易654笔，名义本金751亿元。（二）债券发行利率回落，现券交易量、发行量上升国债收益率曲线陡峭下移，债券市场指数上行。2019年末，1年期和10年期国债收益率分别为2.36%和3.14%，分别较上年末下行24bp和9bp。各类债券发行利率回落。,222.0
77,2019年12月，10年期国债发行利率为3.13%，比上年同期低12个基点；国开行发行的10年期金融债利率为3.48%，比上年同期低11个基点；主体评级AAA的非金融企业发行的一年期短期融资券（债券评级A-1）平均利率为3.47%，比上年同期低55个基点。,128.0
78,债券现券交易量快速增长。2019年，银行间债券市场现券交易213.7万亿元，日均成交8550亿元，同比增长42.9%。交易所债券现券成交8.2万亿元，同比增长29.4%。债券发行同比增加。2019年累计发行各类债券45.2万亿元，同比增加2.1万亿元。,126.0
79,2019年末，国内各类债券余额99万亿元，同比增长15.1%。（三）票据融资快速增长，利率震荡下行票据承兑业务快速增长。2019年，企业累计签发商业汇票20.4万亿元，同比上升11.6%；期末商业汇票未到期金额12.7万亿元，同比上升15.3%。票据承兑余额持续快速增长，年末较年初增加1.7万亿元，较上季度末增加2919亿元。由中小微企业签发的银行承兑汇票占比70.2%。,187.0
80,票据融资快速增长，利率略有下行。2019年，金融机构累计贴现34.3万亿元，同比上升25.5%。12月末，票据融资余额7.6万亿元，同比上升31.8%，占各项贷款的比重为5.0%，同比增加0.7个百分点。全年票据市场利率震荡下行。（四）股票市场指数回升，成交量和筹资额同比增加股票市场指数上升。,147.0
81,2019年末，上证综合指数收于3050点，比上年末上涨22.3%；深证成份指数收于10431点，比上年末上涨44.1%。股票市场成交量明显增加。2019年，沪、深股市累计成交127.4万亿元，日均成交5222亿元，同比增长40.7%。股票市场筹资额同比增加。2019年A股筹资6148亿元，同比增加11.2%。,155.0
82,（五）保险业保费收入和资产增速回升2019年，保险业累计实现保费收入4.3万亿元，同比增长12.2%，比2018年增速高13.7个百分点；累计赔款、给付1.3万亿元，同比增长4.8%，其中，财产险赔付同比增长10.3%，人身险赔付同比下降0.1%。,124.0
83,2019年末，保险业总资产20.6万亿，同比增长12.2%，增速比上年末高2.8个百分点。其中银行存款同比增长3.5%，投资类资产同比增长14.5%。（六）外汇交易总体平稳2019年，人民币外汇即期成交金额7.9万亿美元，同比增长4%；人民币外汇掉期成交金额16.4万亿美元，同比减少0.5%，其中隔夜美元掉期成交金额9.5万亿美元，占掉期总成交额的57.9%；人民币外汇远期成交金额760亿美元，同比减少13.2%。“外币对”成交金额4756亿美元，同比增长154.7%，其中成交最多的产品为欧元对美元，占“外币对”总成交金额的57.4%。外汇市场交易主体进一步扩展。,285.0
84,截至2019年末，共有即期市场会员711家，远期、外汇掉期、货币掉期和期权市场会员各245家、239家、197家和146家，即期市场做市商30家，远掉期市场做市商27家。（七）黄金市场运行平稳，价格整体上升黄金价格整体呈上升趋势。2019年，国际黄金价格年末收于1523美元/盎司，较2018年末上涨18.83%。上海黄金交易所Au9999年末收于340.8元/克，较2018年末上涨19.75%。上海黄金交易所黄金交易规模平稳增长。,217.0
85,2019年，上海黄金交易所黄金成交量6.86万吨，同比增长1.63%，成交额21.49万亿元，同比增长17.43%。二、金融市场制度建设（一）债券市场制度建设2019年5月，与证监会联合发布《关于做好开放式债券指数证券投资基金创新试点工作的通知》，推动债券指数公募基金在银行间市场和交易所市场发展。8月发布《关于支持商业银行发行创新创业金融债券的意见》，鼓励商业银行发行创新创业金融债券，增加创新创业领域信贷投放。10月发布《标准化债权类资产认定规则（征求意见稿）》，明确标债资产的界限、认定标准及监管安排，引导市场规范发展。12月起草《关于公司信用类债券违约处置有关事宜的通知（征求意见稿）》，促进投资者保护制度与国际接轨，并正式推出到期违约债券转让机制，丰富违约债券处置渠道。,340.0
86,12月起草《公司信用类债券信息披露管理办法（征求意见稿）》，推动公司信用类债券信息披露标准统一尽快落地。（二）资本市场和证券期货业制度建设完善资本市场制度。2019年6月13日科创板正式开板，全年共有70家公司完成科创板上市。新三板启动新一轮改革，证监会于12月明确在新三板引入公开发行制度。证监会于12月发布《上市公司分拆所属子公司境内上市试点若干规定》。,179.0
87,健全证券期货业监管规则。证监会于2019年6月发布修订后的《期货公司监督管理办法》，增加控股股东、第一大股东净资本要求，细化境外股东条件，完善期货子公司监管要求；7月发布《证券公司股权管理规定》；12月发布《证券投资者保护基金实施流动性支持管理规定》。（三）保险市场制度建设提高保险业服务实体经济能力。2019年2月25日，银保监会发布《关于进一步加强金融服务民营企业有关工作的通知》，要求保险机构提供更灵活的民营企业贷款保证保险服务，鼓励保险机构加大对民营企业债券的投资力度，支持保险资金参与化解处置民营上市公司股票质押风险。强化资产负债管理，防范匹配失衡风险，建立健全消费者权益保护机制。,296.0
88,7月24日，银保监会发布《保险资产负债管理监管暂行办法》，要求保险公司承担资产负债管理的主体责任，建立健全资产负债管理体系，持续提升资产负债管理水平。11月4日，银保监会发布《关于银行保险机构加强消费者权益保护工作体制机制建设的指导意见》，要求银行保险机构将消费者权益保护融入公司治理各环节、建立消费者权益保护审查机制、完善消费者权益保护内部考核机制等。推动保险业高质量发展。12月30日，银保监会发布《关于推动银行业和保险业高质量发展的指导意见》，提出到2025年，实现金融结构更加优化，形成多层次、广覆盖、有差异的保险机构体系。对保险企业实施税收优惠。,278.0
89,5月28日，财政部、税务总局发布《关于保险企业手续费及佣金支出税前扣除政策的公告》，提高人身险企业和财产险企业发生与其经营活动有关的手续费及佣金支出税前扣除比例。（四）进一步扩大金融业对外开放2019年7月20日，国务院金融稳定发展委员会办公室宣布11条关于进一步扩大金融业对外开放有关举措，重点是大幅放宽银行、证券、保险业的市场准入，提前至2020年不再设股比限制，并大幅扩大业务范围；进一步便利境外机构投资者投资银行间债券市场等。2019年4月及9月，中国债券先后被纳入彭博巴克莱全球综合指数，摩根大通全球新兴市场多元化指数等国际主要债券指数。证监会于5月正式批准中日ETF互通中方产品申请。证监会与英国金融行为监管局于6月17日发布联合公告，正式启动上海证券交易所和伦敦证券交易所互联互通存托凭证（GDR）业务。,359.0
