,paragraph,length
45,人民银行会同银保监会起草《系统重要性银行附加监管规定（试行）（征求意见稿）》，于4月2日向社会公开征求意见。《附加监管规定》从附加监管指标体系、恢复与处置计划、审慎监管措施等方面对系统重要性银行提出附加监管要求，是系统重要性银行附加监管的一般性框架。完善金融控股公司监管制度。2021年以来，人民银行积极做好金融控股公司行政许可相关工作，于3月31日发布《金融控股公司董事、监事、高级管理人员任职备案管理暂行规定》（中国人民银行令〔2021〕第2号），明确由人民银行对金融控股公司董监高实行备案管理，规定人员任职条件和备案程序，并加强任职管理，防控关键岗位人员风险，规范兼职、代为履职、公示人员信息等行为。四、积极发挥结构性货币政策工具作用积极运用支农、支小再贷款、再贴现和抵押补充贷款等工具，引导金融机构加大对小微、民营企业、“三农”、扶贫等国民经济重点领域和薄弱环节的支持力度。,391.0
46,继续发挥再贷款精准滴灌和正向激励作用，支持巩固脱贫攻坚成果同乡村振兴有效衔接。运用好专项扶贫再贷款支持扩大“三区三州”信贷投放，降低“三区三州”融资成本，促进巩固拓展脱贫攻坚成果。第一季度，发放专项扶贫再贷款88亿元，3月末，全国专项扶贫再贷款余额458亿元。3月末，全国支农再贷款余额为4422亿元，支小再贷款余额为9295亿元，扶贫再贷款余额为2090亿元，再贴现余额为5744亿元。第一季度，人民银行对政策性银行和开发性银行净收回抵押补充贷款共410亿元，3月末余额为31940亿元。,245.0
47,当季到期的定向中期借贷便利以中期借贷便利的形式续做。定向中期借贷便利为金融机构扩大对小微、民营企业的信贷投放提供了优惠利率长期稳定资金来源。1月15日，人民银行开展了5000亿元中期借贷便利操作，期限为1年，利率为2.95%，其中包含对当月到期的定向中期借贷便利的续做，该工具可滚动续做，总期限为3年。3月末，定向中期借贷便利余额561亿元。突出直达性、精准性特点，持续推进两个直达实体经济的货币政策工具支持中小微企业发展。,212.0
48,根据国务院常务会议部署，3月30日，人民银行会同银保监会、财政部、发展改革委、工业和信息化部印发《关于进一步延长普惠小微企业贷款延期还本付息政策和信用贷款支持政策实施期限有关事宜的通知》（银发〔2021〕81号），保持政策连续性、稳定性和可持续性，将两项直达实体经济货币政策工具的实施期限进一步延长至2021年12月31日，保持对小微企业的支持力度不减，更好发挥其稳就业的作用。,189.0
49,2020年初至2021年3月末，全国银行业金融机构共对9.2万亿元贷款本息实施延期，累计发放普惠小微信用贷款5.3万亿元。五、发挥信贷政策的结构引导作用深入推进金融支持稳企业保就业。召开全国主要银行信贷结构调整座谈会，加强政策指导，推动银行持续改善小微企业金融服务，促进小微企业融资“增量、降价、提质、扩面”。加大制造业中长期贷款投放力度，助力制造业高质量发展。切实支持巩固拓展脱贫攻坚成果。,196.0
50,严格落实“四个不摘”要求，保持主要金融帮扶政策总体稳定，继续发挥再贷款的精准滴灌和正向激励作用，降低“三农”融资成本。做好脱贫人口小额信贷工作。继续落实好创业担保贷款、助学贷款等政策。做好易地搬迁后续金融服务，研究加大对国家乡村振兴重点帮扶县的金融资源倾斜。着力加大对乡村振兴领域资源投入。,145.0
51,做好春耕备耕、粮食安全、种业发展、高标准农田建设等重点领域的金融服务，支持开展农机具、大棚设施、农村承包土地经营权等抵质押贷款业务。鼓励金融机构发行“三农”专项金融债券，拓宽低成本资金来源。六、深化利率市场化改革继续释放改革促进降低贷款利率的潜力，优化存款利率监管，推动实际贷款利率进一步降低。,147.0
52,一是持续推进贷款市场报价利率（LPR）改革，进一步推动LPR运用，企业融资成本明显下降。,44.0
53,二是规范信贷市场秩序。2021年3月，人民银行发布公告要求所有贷款产品均应明示贷款年化利率，并明确年化利率计算方法，切实保护金融消费者知情权。,71.0
54,三是加强存款管理，规范存款利率定价行为，停办地方法人银行异地存款。明确要求金融机构停止新办周期付息型存款产品，督促其科学合理定价，切实维护存款市场竞争秩序。将地方法人银行吸收异地存款情况纳入宏观审慎评估（MPA），禁止其通过各种渠道开办异地存款，已发生的存量存款自然到期结清。目前，各金融机构的周期付息型存款产品已基本整改完毕。绝大多数地方法人银行已停办异地存款，异地存款余额正有序压降，为保持银行负债端成本稳定，推进利率市场化改革和促进企业综合融资成本稳中有降创造良好环境。,238.0
55,七、完善人民币汇率市场化形成机制继续推进人民币汇率市场化改革，完善以市场供求为基础、参考一篮子货币进行调节、有管理的浮动汇率制度，保持人民币汇率弹性，发挥汇率调节宏观经济和国际收支自动稳定器的作用。注重预期引导，保持人民币汇率在合理均衡水平上的基本稳定。2021年第一季度，人民币对美元汇率中间价最高为6.4391元，最低为6.5713元，58个交易日中27个交易日升值、31个交易日贬值。最大单日升值幅度为1.00%（648点），最大单日贬值幅度为0.83%（543点）。人民币对国际主要货币汇率有贬有升，双向浮动。,259.0
56,3月末，人民币对美元、欧元、英镑、日元汇率中间价分别较2020年末贬值0.71%、升值4.18%、贬值1.56%和升值6.18%。2005年人民币汇率形成机制改革以来至2021年3月末，人民币对美元汇率累计升值25.95%，对欧元汇率累计升值30.01%，对日元汇率累计升值22.68%。银行间外汇市场人民币直接交易成交较为活跃，流动性平稳，降低了微观经济主体的汇兑成本，促进了双边贸易和投资。3月末，在人民银行与境外货币当局签署的双边本币互换协议下，境外货币当局动用人民币余额为608.62亿元，人民银行动用外币余额折合5.12亿美元，对促进双边贸易投资发挥了积极作用。八、稳妥有序推进金融风险处置，深化金融机构改革有序推进中小金融机构风险处置和改革重组。,329.0
57,努力克服疫情影响，推动高风险中小金融机构处置取得关键进展和重要阶段性成果。恒丰银行改革重组方案顺利实施，锦州银行风险处置和改革重组工作基本完成，确保了关键敏感时期金融体系的平稳运行，守住了不发生系统性金融风险的底线。稳妥有序推进包商银行风险处置。接管包商银行以来，各项工作进展顺利，有序打破刚性兑付，如期完成清产核资。2020年11月23日，北京一中院裁定受理包商银行破产申请，并指定清算组担任包商银行管理人。,205.0
58,2021年1月12日，北京一中院组织召开第一次债权人会议，管理人完成743户债权人债权审查工作。2月7日，北京一中院裁定宣告包商银行破产，原包商银行的股东权益清零，大额债权人承担部分损失，包商银行风险处置工作基本完成。下一步，包商银行管理人将在资产交割、诉讼仲裁主体变更等工作完成后，尽快完成包商银行及其分支机构的注销工作。持续深化开发性、政策性金融机构改革。推动全面落实开发性、政策性金融机构改革方案，厘清职能定位，明确业务边界，完善治理体系，强化约束机制，防范金融风险，引导开发性、政策性金融机构坚守定位，聚焦主业，在加强风险防控的基础上，发挥好支持经济结构转型和高质量发展的作用。,293.0
59,九、深化外汇管理体制改革推动贸易便利化试点扩容提质。稳步有序扩大试点地区和业务范围，优化业务办理流程，引领市场主体不断提升信用等级、管理能力和内控水平。截至目前，试点范围已扩大至22个地区。提升个人外汇业务便利化水平。发布《国家外汇管理局关于进一步推进个人经常项目外汇业务便利化的通知》（汇发〔2021〕13号），优化《个人购汇申请书》填报项目及方式，提高填报效率。,183.0
60,加强外汇市场管理。加强非现场监督能力建设，继续严厉打击地下钱庄、跨境赌博等非法金融活动，重点查处虚假欺骗性交易，有力维护外汇市场良性秩序。第一季度，共查处外汇违规案件661起，罚没款2.16亿元。货币市场保持平稳，利率在合理区间运行，市场交易稳步增长。债券发行利率下降，信用利差收窄，债券发行量增加，现券交易活跃。,157.0
61,股票市场指数先升后降，成交量和筹资额同比大幅增加。一、金融市场运行概况（一）货币市场运行平稳货币市场利率平稳。3月质押式回购月加权平均利率为2.01%，比上年末有所上升，接近2019年末的水平。银行业存款类金融机构间利率债质押式回购月加权平均利率为1.91%，低于质押式回购月加权平均利率10个基点。当月同业拆借月加权平均利率为2.01%，月末隔夜和1周Shibor分别为2.12%和2.25%。,198.0
62,货币市场交易平稳增长。一季度，银行间市场债券回购累计成交223.2万亿元，日均成交3.7万亿元，同比增长8.5%，增速比上年全年放缓9.1个百分点；同业拆借累计成交29.1万亿元，日均成交4851亿元，同比减少11.6%。一季度，交易所债券回购累计成交75.8万亿元，同比上升20.7%。同业存单和大额存单业务平稳运行。第一季度，银行间市场发行同业存单7489期，发行总量为5.6万亿元，二级市场交易总量为35.1万亿元，3月末同业存单余额为12.0万亿元。,229.0
63,第一季度，3个月期同业存单发行加权平均利率为2.83%，比同期限Shibor高11个基点。第一季度，金融机构发行大额存单2.0万期，发行总量为3.8万亿元，同比增加0.2万亿元。利率互换市场有序发展。第一季度，人民币利率互换达成交易7.5万笔，同比增长23.0%；名义本金总额5.4万亿元，同比增加24.8%。从期限结构来看，1年及1年期以下交易最为活跃，名义本金总额3.6万亿元，占总量的68.0%。,201.0
64,人民币利率互换的浮动端参考利率主要包括7天回购定盘利率和Shibor，与之挂钩的利率互换名义本金占比为85.7%和13.2%。第一季度，以LPR为标的的利率互换成交290笔，名义本金288.5亿元。LPR利率期权业务稳步发展。银行间市场于2020年3月正式推出挂钩LPR的利率期权业务，2021年3月29日新增挂钩银行间回购定盘利率（FDR）的利率期权品种。第一季度，利率期权成交177笔、236.4亿元。,203.0
65,其中，利率互换期权成交29笔、名义本金15.2亿元；利率上/下限期权成交148笔、名义本金221.2亿元；LPR期权成交112笔，名义本金197.9亿元；FDR期权成交65笔，名义本金38.5亿元。（二）债券发行利率下行，发行量增加债券发行利率总体下行。2021年3月，财政部发行的10年期国债收益率为3.22%，比上年12月低3个基点；国开行发行的10年期金融债利率为3.52%，比上年12月低13个基点；主体评级AAA的企业发行的一年期短期融资券（债券评级A-1）平均利率为3.56%，比上年12月低66个基点。国债收益率小幅上升。3月末，1年期和10年期国债收益率分别为2.57%和3.19%，较上年末上升10个和5个基点。,315.0
66,信用利差有所收窄，3年期AAA和AA级中短期票据与国开债收益率利差较上年末收窄16个和29个基点。债券发行同比增加。一季度累计发行各类债券14.1万亿元，同比增长16.7%，比上年同期增加2万亿元，主要是金融债发行增加1.9万亿元。3月末，国内各类债券余额120万亿元，同比增长16.6%。银行间现券交易量下降，交易所现券交易量保持增长。,169.0
67,一季度债券市场现券总成交51.3万亿元，同比减少1.5%，其中银行间债券市场现券成交46.1万亿元，同比减少5.5%。交易所债券现券成交5.2万亿元，同比增长56.5%。（三）票据融资稳中有增，票据市场利率有所上行票据承兑业务保持稳定。第一季度，企业累计签发商业汇票6.1万亿元，同比上升1.4%；3月末商业汇票未到期金额14.1万亿元，同比上升4.9%。票据承兑余额保持稳定，较年初减少25亿元。,199.0
68,由中小微企业签发的银行承兑汇票占比68.6%。票据融资基本平稳。第一季度，金融机构累计贴现11.4万亿元，同比上升3.8%。3月末，票据融资余额7.9万亿元，同比下降4.5%，占各项贷款的比重为4.4%，同比下降0.8个百分点。（四）股票市场先升后降，成交量和筹资额同比增加第一季度，股票市场指数呈先扬后抑走势，3月中旬后有所企稳。,166.0
69,年初至春节前，受经济恢复性增长势头持续巩固、海外股市上涨等因素影响，沪深主要股指震荡上行，2月上证综合指数和深证成份指数最高分别报收于3732点和16293点。此后A股市场出现回调，3月末上证综合指数收于3442点，比上年末下降0.9%；深证成份指数收于13779点，比上年末下降4.8%。股票市场成交量增加。第一季度，沪、深股市累计成交54.9万亿元，日均成交9472亿元，同比增长9.9%。股票市场筹资额同比大幅增加，第一季度累计筹资3404亿元，同比增长142.6%，支持实体经济力度稳固。,248.0
70,（五）保险业保费收入增速提高，资产增速减缓第一季度，保险业累计实现保费收入1.8万亿元，同比增长7.8%，比上年同期增速高1.7个百分点；累计赔款、给付3951亿元，同比增加30.4%，其中，财产险赔付同比增加35%，人身险赔付同比增加27%。,122.0
71,保险业资产增速减缓。3月末，保险业总资产24.3万亿元，同比增长11.7%，增速比上年末低1.6个百分点。其中，银行存款同比减少3.5%，投资类资产同比增长19.1%。（六）外汇交易活跃第一季度，人民币外汇即期交易累计成交金额折合2.3万亿美元，同比增长39.8%；人民币外汇掉期交易累计成交金额折合4.5万亿美元，同比增长37.9%，其中隔夜美元掉期交易累计成交金额2.9万亿美元，占总成交金额的64%；人民币外汇远期交易累计成交金额折合258亿美元，同比减少4.2%。“外币对”累计成交金额折合3129亿美元，同比增长167.6%，成交最多的产品为欧元对美元，占市场份额为57.2%。,294.0
72,（七）黄金价格下跌3月末国际黄金价格收于1691.05美元/盎司，较上年末下跌10.58%。上海黄金交易所AU99.99收于356.79元/克，较上年末下跌8.52%。第一季度，上海黄金交易所黄金累计成交9333.37吨，同比下降48.3%；成交金额3.51万亿元，同比下降45.2%。二、金融市场制度建设（一）债券市场制度建设4月，人民银行、发展改革委、证监会联合发布《关于印发〈绿色债券支持项目目录（2021年版）〉的通知》，进一步规范绿色债券市场，发挥绿色金融在调结构、转方式、促进生态文明建设、推动经济可持续发展等方面的积极作用，助力实现碳达峰、碳中和的目标。（二）资本市场和证券期货业制度建设进一步完善资本市场行为监管。,315.0
73,2021年1月，证监会发布《关于加强私募投资基金监管的若干规定》，对私募基金管理人等主体提出“十不得”禁止性要求，重申和强化私募基金行业执业的底线行为规范。1月，证监会发布《公开募集证券投资基金运作指引第3号——指数基金指引》，规范指数基金投资运作，保护投资者合法权益。2月，证监会修订发布《关于上市公司内幕信息知情人登记管理制度的规定》，规范上市公司内幕信息知情人登记和报送行为，强化内幕交易综合防控。2月，证监会修订发布《证券市场资信评级业务管理办法》，取消行政许可，新增备案管理相关规定，完善证券评级业务规则，增加独立性要求。进一步深化证券注册制改革。,279.0
74,2021年2月，证监会修订发布《公司债券发行与交易管理办法》，明确注册条件、注册程序及相关监管要求。3月，证监会发布修订后的《上市公司信息披露管理办法》，完善信息披露基本要求和定期报告制度，降低信息披露成本。（三）保险市场制度建设加强保险公司偿付能力监管。2021年1月，银保监会修订发布《保险公司偿付能力管理规定》，以风险为导向，制定定量资本要求、定性监管要求、市场约束机制相结合的偿付能力监管规则，明确了偿付能力监管的三支柱框架体系。规范短期健康保险业务。,230.0
75,2021年1月，银保监会发布《关于规范短期健康保险业务有关问题的通知》，从产品续保、产品销售、信息披露和核保理赔等方面对保险公司开展短期健康保险业务进行规范。扩大保险业对外开放。2021年3月，银保监会发布《中华人民共和国外资保险公司管理条例实施细则》，删除合资寿险公司外资比例限制等表述，保持相关制度体系的一致性。同时，进一步明确外国保险集团公司和境外金融机构投资外资保险公司的准入标准，并从外资保险公司股东变更及准入要求、境内保险集团公司管理相关制度、外商投资安全审查等方面作了补充完善。（四）推动债券市场对外开放推动富时罗素纳指中期评估顺利实施。,276.0
76,富时罗素公司宣布于2021年10月29日起，分36个月将中国国债纳入富时世界政府债券指数（WGBI）。至此，全球三大债券指数提供商已先后将中国债券纳入其主要指数。也要看到，经济复苏进程中的不平衡问题凸显，不同国家和地区、不同行业和企业、不同就业群体以及金融和实体间的分化加大，近期多国疫情反弹进一步增加了经济恢复的不确定性。未来还需对主要发达经济体货币政策可能进行的调整转向及其外溢影响保持关注。（一）主要经济体经济和金融市场概况疫苗接种速度有所加快，但3月下旬以来疫情出现反复。,240.0
77,截至4月末，全球新冠疫苗接种总量已超过10亿剂次，但各地接种进度不一致，加之病毒变异和部分地区防疫有所放松，全球疫情有所反弹，4月末单日新增确诊病例回到80万以上。多个欧洲国家收紧了防疫措施，法国、捷克、匈牙利等国重启了全国性封锁。全球经济增长预期明显改善。3月份美国、欧元区、日本、英国的制造业PMI分别达到64.7、62.5、52.7和58.9，均为疫情暴发以来新高。国际货币基金组织（IMF）、经济合作与发展组织（OECD）4月和3月分别预测2021年全球经济增速为6.0%、5.6%，较此前预测分别上调了0.5个、1.4个百分点。,269.0
78,劳动力市场恢复相对缓慢。3月份美国失业率为6.0%，较疫情前减少了约750万个工作岗位；劳动参与率为61.5%，低于疫情前2019年末的63.3%。3月份欧元区、2月份英国的失业率分别为8.1%和4.9%，仍处于相对高位。主要经济体出现再通胀迹象。3月份，美国CPI同比涨幅升至2.6%。,144.0
79,一季度欧元区HICP走出了去年下半年持续5个月的同比负增长区间，3月份同比涨幅达到1.3%；日本CPI同比降幅也较去年底明显收窄。部分新兴经济体通胀压力上升，3月份巴西IPCA和俄罗斯CPI同比涨幅分别走高至6.1%和5.8%，较去年同期分别上升2.8个和3.3个百分点。受经济增长和通胀预期升温、市场预期调整等因素影响，金融市场波动加大。大宗商品价格明显上涨，一季度布伦特原油期货以及伦敦金属交易所（LME）锡、铜、铝的期货价格分别上涨了24.3%、24.0%、13.6%和11.7%。发达经济体国债收益率明显上行，美国和德国10年期国债收益率从年初的0.93%、-0.57%升至3月末的1.74%、-0.27%。,308.0
80,主要经济体股市总体上涨，但波动明显加大。上调至6.0%，将美国经济增速预测值从5.1%上调至6.4%。目前看，2021年美债预计将保持较高发行量。从供求角度分析，若其他因素不变，美债供求缺口或将通过收益率上行来平衡。从供给端看，美国国会预算办公室在《预算和经济展望：2021-2031》中预计2021财年赤字为2.3万亿美元，美国政府推出的1.9万亿美元财政刺激也将在2021年进一步增加赤字；同时美国财政部在一季度公告中预计，到2021年6月末持有现金规模将下降约1.2万亿美元至0.5万亿美元。,249.0
81,综合考虑这三项，一些市场机构预测2021年新增融资需求可能超过2.5万亿美元，预计美债将继续保持较高发行量。从需求端看，若2021年美联储保持每月800亿美元的国债购买规模不变，可消化约1万亿美元国债，除美联储外的市场投资者还需消化超1.5万亿美元国债。近年来外国投资者持有美债规模占比有所下降，从2015年初的34.4%降至2020年末的25%左右，除美联储外的美国国内投资者需要消化的美债金额将继续维持高位。美债收益率后续走势还取决于经济走势、通胀水平以及美联储反应。2020年8月美联储推出新的货币政策框架，采用平均通胀目标制，新框架如何实施还有待进一步观察。,283.0
82,美联储主席鲍威尔在接受采访时表示，待经济基本完全复苏的情况下，将以非常逐步且保持极大透明度的方式收回在紧急时期提供的政策支持；如果法定政策目标进一步取得实质性进展，将考虑逐步减少资产购买规模。未来若财政刺激加码和经济复苏较强导致通胀预期上升过快，可能会触发美联储行动，这将影响美债收益率走势。美债收益率上行的影响渠道主要包括：一是资产价格渠道。将推升无风险收益率，引发全球资产价格调整和重定价风险。,199.0
83,二是资本流动渠道。美债收益率上行后，跨境资本流动方向可能逆转，资本回流美国，增大新兴市场资本流出风险，部分基本面较为脆弱的新兴经济体可能面临债务偿付和再融资风险。,81.0
84,三是汇率渠（二）主要经济体货币政策主要发达经济体央行普遍重申保持宽松货币政策立场，以支持经济实现更全面复苏。第一季度，美联储和欧央行均维持政策利率和资产购买规模不变，美联储3月份议息会议纪要显示其将继续维持宽松立场直至实现最大化就业和物价稳定的法定目标。日本央行维持12万亿日元的交易所交易基金（ETFs）购买上限不变，并将其收益率曲线控制的10年期国债收益率目标范围扩大至正负0.25%之间。新兴经济体货币政策出现分化迹象，多数仍维持宽松立场，也有部分新兴经济体为应对通货膨胀、汇率贬值、资本外流等压力已提前行动，边际上收紧货币政策。第一季度，印尼、墨西哥央行分别降息25个基点；印度、南非、马来西亚、菲律宾等国央行维持政策利率不变；土耳其、巴西、乌克兰、俄罗斯央行则分别加息200个、75个、50个和25个基点。,358.0
85,（三）值得关注的问题一是全球经济复苏前景仍然存在高度不确定性，分化加大和不平衡问题日益凸现。未来一段时间全球经济复苏的决定性因素仍在于疫情防控，目前各国疫苗接种和疫情防控成效差异较大，宏观政策和市场修复能力也不相同，经济分化较为明显。部分地区新增病例明显反弹、封锁措施趋严，经济恢复进程面临较大挑战。,150.0
