,paragraph,length
0,中国货币政策执行报告2021年第一季度中国人民银行货币政策分析小组2021年5月11日内容摘要今年以来，面对冬春疫情考验和外部环境的不确定性，在以习近平同志为核心的党中央坚强领导下，各地区各部门统筹推进常态化疫情防控和经济社会发展成效持续显现。,122.0
1,我国经济呈现稳定恢复态势，稳中加固、稳中向好，供给量增质升，需求持续回暖，市场活力不断释放，就业民生保障有力，高质量发展取得新成效。2021年第一季度国内生产总值（GDP）同比增长18.3%，两年平均增长5.0%，居民消费价格指数（CPI）同比持平，进出口贸易增长势头稳健。人民银行坚持以习近平新时代中国特色社会主义思想为指导，坚决贯彻党中央、国务院的决策部署，稳健的货币政策灵活精准、合理适度，保持了连续性、稳定性、可持续性，预期管理科学有效，保持对经济恢复的必要支持力度，金融风险有效防控，金融服务实体经济质量和效率逐步提升，为经济高质量发展提供了适宜的货币金融环境。,286.0
2,一是保持流动性合理充裕。综合运用中期借贷便利、公开市场操作等多种货币政策工具，对流动性精准调节，维护市场预期稳定和货币市场利率平稳运行。,68.0
3,二是发挥好结构性货币政策工具牵引带动作用。对特殊时期出台的政策分类施策、适时适度调整，将两项直达实体经济的货币政策工具延续至今年年底，对科技创新、小微企业、绿色发展等需要长期支持的领域进一步加大政策支持力度。,104.0
4,三是持续释放贷款市场报价利率改革红利。推动金融机构充分运用贷款市场报价利率定价，引导综合融资成本稳中有降。要求所有贷款产品明示贷款年化利率，保护金融消费者合法权益。优化存款利率监管，维护银行负债成本基本稳定。,104.0
5,四是以我为主，兼顾对外均衡。持续推进汇率市场化改革，保持人民币汇率弹性，发挥汇率调节宏观经济和国际收支自动稳定器作用。,59.0
6,五是健全现代货币政策框架。完善货币供应调控机制，保持货币供应量和社会融资规模增速同名义经济增速基本匹配。完善央行政策利率体系，引导市场利率围绕政策利率为中枢波动，健全市场化利率形成和传导机制。,96.0
7,六是坚持市场化法治化原则，有效防控金融风险，牢牢守住不发生系统性金融风险的底线。总体来看，今年以来稳健的货币政策坚持稳字当头，体现了前瞻性、主动性、精准性和有效性，对实体经济支持力度稳固。3月末广义货币（M2）同比增长9.4%，社会融资规模存量同比增长12.3%。信贷结构持续优化，3月末普惠小微贷款和制造业中长期贷款余额同比增速分别达到34.3%和40.9%。贷款利率持续处于较低水平，3月企业贷款加权平均利率为4.63%，较上年同期下降0.19个百分点，小微企业综合融资成本稳中有降。,244.0
8,人民币汇率以市场供求为基础双向浮动，弹性增强，在合理均衡水平上保持基本稳定。3月末中国外汇交易中心（CFETS）人民币汇率指数报96.88，较上年末升值2.15%。目前我国经济发展动力不断增强，积极因素明显增多。也要看到，外部环境依然复杂严峻，我国经济恢复不均衡、基础不稳固，仍面临不少风险挑战，要坚定信心，攻坚克难，巩固恢复性增长基础，努力保持经济社会持续健康发展。下一阶段，中国人民银行将坚持以习近平新时代中国特色社会主义思想为指导，贯彻党的十九届五中全会、中央经济工作会议精神，落实《政府工作报告》要求，按照党中央、国务院的决策部署，坚持稳中求进工作总基调，稳字当头，立足新发展阶段，贯彻新发展理念，构建新发展格局，坚持跨周期设计理念，兼顾当前和长远，保持宏观政策连续性、稳定性、可持续性，稳定预期，精准实施宏观政策，巩固拓展疫情防控和经济社会发展成果，强化对实体经济、重点领域和薄弱环节的支持，以适度的货币增长支持经济高质量发展。,419.0
9,稳健的货币政策要灵活精准、合理适度，把服务实体放到更加突出的位置，珍惜正常的货币政策空间，处理好恢复经济和防范风险的关系。健全现代货币政策框架，完善货币供应调控机制，管好货币总闸门，保持流动性合理充裕，保持货币供应量和社会融资规模增速同名义经济增速基本匹配，保持宏观杠杆率基本稳定。进一步发挥好再贷款、再贴现和直达实体经济货币政策工具的牵引带动作用，构建金融有效支持实体经济的体制机制，引导金融机构加大对科技创新、小微企业、绿色发展等领域的支持，研究推出央行碳减排支持工具。健全市场化利率形成和传导机制，完善央行政策利率体系，优化存款利率监管，继续释放改革促进降低贷款利率的潜力，推动实际贷款利率进一步降低。发挥市场供求在汇率形成中的决定性作用，增强人民币汇率弹性，加强宏观审慎管理，引导社会预期，保持人民币汇率在合理均衡水平上的基本稳定。,370.0
10,加强监测分析和预期管理，保持物价水平基本稳定。健全金融风险预防、预警、处置、问责制度体系，维护和塑造金融安全，牢牢守住不发生系统性金融风险的底线。保持经济运行在合理区间，使经济在恢复中达到更高水平均衡，以高质量发展为“十四五”开好局，以优异成绩庆祝中国共产党成立100周年。当前流动性合理充裕，货币信贷合理增长，金融支持实体经济力度保持稳固。一、银行体系流动性合理充裕2021年第一季度，人民银行坚持稳健的货币政策灵活精准、合理适度，综合运用再贷款、再贴现、中期借贷便利（MLF）、公开市场操作等多种货币政策工具投放流动性，及时熨平春节前后现金投放、财政税收、季末等多种短期波动因素，保持流动性合理充裕，春节前不紧，春节后不松，维护市场预期稳定和货币市场利率平稳运行。,334.0
11,同时，通过多种方式加强与公众沟通，进一步提高货币政策操作的精准性和有效性，引导货币市场短期利率围绕公开市场7天期逆回购操作利率在合理区间波动，政策利率的中枢作用进一步增强。3月末，金融机构超额准备金率为1.5%，比上年同期低0.6个百分点。二、金融机构贷款合理增长，结构优化，利率处于较低水平货币信贷合理增长。随着贷款市场报价利率（LPR）改革深入推进，货币政策传导效率显著提升，信贷投放保持较快增长，有力支持了经济恢复、稳中加固、稳中向好。3月末，金融机构本外币贷款余额为186.4万亿元，同比增长12.3%，比年初增加8.0万亿元，同比多增6734亿元。,279.0
12,人民币贷款余额为180.4万亿元，同比增长12.6%，比年初增加7.7万亿元，同比多增5741亿元。金融机构信贷投放节奏把握适度，保持了支持实体经济的连续性、稳定性、可持续性，增强了服务高质量发展的后劲。信贷结构持续优化。企（事）业单位中长期贷款比年初增加4.5万亿元，同比多增1.4万亿元。3月末，制造业中长期贷款增速为40.9%，连续上升17个月，其中高技术制造业中长期贷款同比增长达45.0%。,200.0
13,普惠小微贷款余额16.7万亿元，同比增长34.3%，比上年末高4个百分点。普惠小微贷款支持小微经营主体3527万户，同比增长26.6%。贷款加权平均利率持续处于较低水平。2021年，人民银行持续释放LPR改革潜力，充分发挥LPR改革在优化资源配置中的作用，以市场化方式促进金融机构将更多金融资源配置到小微企业，增强小微企业贷款竞争性，继续促进金融系统向实体经济让利。3月，1年期和5年期以上LPR分别为3.85%和4.65%，均与上年12月持平。,223.0
14,3月，贷款加权平均利率为5.10%，保持在历史低位。其中，一般贷款加权平均利率为5.30%，同比下降0.18个百分点。企业贷款加权平均利率为4.63%，同比下降0.19个百分点，金融对实体经济的支持效果持续显现。3月一般贷款中利率高于LPR的贷款占比为69.54%，利率等于LPR的贷款占比为8.42%，利率低于LPR的贷款占比为22.03%。外币存贷款利率略有下降。,184.0
15,3月，活期、3个月以内大额美元存款加权平均利率分别为0.14%和0.55%，分别较上年12月下降0.02个和0.04个百分点；3个月以内、3（含）～6个月美元贷款加权平均利率分别为1.23%和1.09%，分别较上年12月上升0.01个和下降0.27个百分点。,129.0
16,存款增长平稳。3月末，金融机构本外币各项存款余额为227.2万亿元，同比增长10.1%，比上年末低0.1个百分点。人民币各项存款余额为220.9万亿元，同比增长9.9%，比上年末低0.3个百分点。外币存款余额为9568亿美元，比年初增加675亿美元，同比多增599亿美元，这与我国经济基本面向好，顺差增多，且企业持有外汇意愿增强等因素有关。三、货币供应量、社会融资规模适度增长3月末，广义货币供应量（M2）余额为227.6万亿元，同比增长9.4%。,224.0
17,狭义货币供应量（M1）余额为61.6万亿元，同比增长7.1%。流通中货币（M0）余额为8.7万亿元，同比增长4.2%。一季度现金净投放2229亿元，同比少投放3604亿元。初步统计，3月末社会融资规模存量为294.55万亿元，同比增长12.3%，增速比上年末低1个百分点。一季度社会融资规模增量累计为10.24万亿元，比上年同期少8730亿元，是季度增量的次高水平。,183.0
18,总体上看社会融资规模的增长保持平稳，主要有以下特点：一是人民币贷款同比多增较多。,40.0
19,二是委托贷款和信托贷款净减少，未贴现的银行承兑汇票同比多增。,30.0
20,三是企业债券同比少增，股票融资同比多增。,20.0
21,四是受地方政府专项债的影响，政府债券融资同比少增。,25.0
22,五是存款类金融机构资产支持证券融资和贷款核销均同比略有多增。专栏1健全现代货币政策框架党的十九届五中全会提出“建设现代中央银行制度”。建设现代中央银行制度要求健全现代货币政策框架，支持经济高质量发展，加快构建新发展格局。现代货币政策框架包括优化的货币政策目标、创新的货币政策工具和畅通的货币政策传导机制。中央银行需要不断创新货币政策工具体系，发挥政策工具的作用，提高货币政策传导效率，实现货币政策目标，将这三者形成有机的整体系统。,215.0
23,一、坚守币值稳定的最终目标，优化中介目标锚定方式《中国人民银行法》赋予货币政策“保持货币币值的稳定，并以此促进经济增长”的最终目标。要保持物价稳定，关键要管好货币总闸门。随着我国转向高质量发展阶段，发展方式转向更多依靠创新驱动，实体经济发展所需要的货币增速应与名义经济增速更趋适应，以适度的货币增长支持高质量发展。2020年中央经济工作会议、《“十四五”规划和2035年远景目标纲要》提出，保持货币供应量和社会融资规模增速同名义经济增速基本匹配，从而清晰明确地界定了货币政策框架的“锚”。这一中介目标锚定方式，有利于搞好跨周期政策设计，在长期稳住货币总量；有利于根据宏观经济形势变化，使M2和社会融资规模增速向反映潜在产出的名义经济增速靠拢，为实施宏观政策提供更加科学合理的“锚”；有利于引导市场形成理性、稳定的预期；内嵌了稳定宏观杠杆率的机制，有利于实现稳增长和防风险长期均衡。,390.0
24,同时，要增强人民币汇率弹性，保持人民币汇率在合理均衡水平上基本稳定，把握好内部均衡和外部均衡的平衡。二、健全中央银行操作目标体系，疏通货币政策传导近年来，人民银行深化利率市场化改革，推动完善贷款市场报价利率（LPR）形成机制，货币政策传导效率明显提升。LPR作为信贷市场的定价基准，具有调节信贷供求，进而影响货币供应的重要作用，保持LPR在合理水平有利于稳住货币供应的“锚”。LPR基于政策利率报价形成，坚持市场化方向，人民银行通过完善以公开市场操作利率为短期政策利率和以中期借贷便利利率为中期政策利率的政策利率体系，引导DR007为代表的市场利率围绕政策利率为中枢波动，健全从政策利率到LPR再到实际贷款利率的市场化利率形成和传导机制，以此调节资金供求和资源配置，实现货币政策目标。值得注意的是，国际上央行实现货币政策操作目标主要有两类做法，一类是将市场利率作为操作目标，通过流动性调节引导市场利率在操作目标附近运行，另一类是将货币政策工具利率作为央行政策利率，并以此为操作目标，从而将操作目标、政策利率和货币政策工具利率合而为一。,467.0
25,2008年国际金融危机之后，第二类做法提高货币政策有效性和传导效率的优势显现，逐渐成为主流。我国的央行操作目标体系也采取了第二类做法，更为直观，市场和公众观察货币政策取向时，只需看政策利率是否发生变化即可，无需过度关注公开市场操作数量，也无需过度关注个别机构的市场成交利率，或受短期因素扰动的市场利率时点值。三、创新货币政策工具，完善货币供应调控机制总量方面，完善中央银行调节银行货币创造的流动性、资本和利率约束的长效机制。抓准作为货币创造直接主体的银行，综合运用多种货币政策工具，保持流动性合理充裕；以永续债为突破口，促进银行多渠道补充资本；推动LPR改革，打破利率隐性下限，引导贷款利率下行，缓解银行货币创造面临的流动性、资本、利率约束，保持货币供应量和社会融资规模增速同名义经济增速基本匹配。结构方面，构建金融有效支持实体经济的体制机制。,372.0
26,持续健全结构性货币政策工具体系，通过设计激励相容机制，将流动性的量价与银行贷款创造存款的行为联系起来，根据经济发展不同时期的需要动态调整支持重点，引导金融资源流向科技创新、小微企业、绿色发展等国民经济重点领域和薄弱环节，促进提升经济发展的可持续性和韧性。,127.0
27,总的看，货币政策坚守币值稳定的最终目标，保持货币供应量和社会融资规模增速同名义经济增速基本匹配的中介目标在制度上更加定型，与健全市场化利率形成和传导机制、完善货币供应调控机制形成有机整体，共同构建了现代货币政策框架。,108.0
28,这一框架更为公开、透明、直观，提升了央行与公众的沟通效率，降低了沟通成本，有效引导预期的同时增强了公众获取信息的公平性，提高了货币政策传导的有效性，有利于为经济高质量发展提供适宜的货币金融环境。四、人民币汇率在合理均衡水平上保持基本稳定，跨境人民币业务保持增长2021年以来，跨境资本流动和外汇供求基本平衡，市场预期总体平稳。人民币汇率以市场供求为基础，有贬有升，在合理均衡水平上保持基本稳定。一季度，人民币对一篮子货币汇率有所升值。3月末，中国外汇交易中心（CFETS）人民币汇率指数报96.88，较上年末升值2.15%；参考特别提款权（SDR）货币篮子的人民币汇率指数报95.66，较上年末升值1.52%。,305.0
29,根据国际清算银行测算，2020年末至2021年3月，人民币名义和实际有效汇率分别升值2.15%和2.10%；2005年人民币汇率形成机制改革以来至2021年3月末，人民币名义和实际有效汇率分别升值40.63%和54.55%。,112.0
30,一季度，人民币对美元汇率小幅贬值。3月末，人民币对美元汇率中间价为6.5713元，较上年末贬值0.71%，2005年人民币汇率形成机制改革以来累计升值25.95%。第一季度，人民币对美元汇率年化波动率为3.9%。2021年第一季度，跨境人民币收付金额合计9万亿元，同比增长48%，其中实收4.6万亿元，实付4.3万亿元。经常项目下跨境人民币收付金额合计1.7万亿元，同比增长17%，其中，货物贸易收付金额1.3万亿元，服务贸易及其他经常项目下收付金额4129.7亿元；资本项目下人民币收付金额合计7.3万亿元，同比增长58%。,263.0
31,精准开展公开市场操作，深入推进利率汇率市场化改革，进一步发挥好结构性货币政策工具的精准导向作用，推动资金更多流向科技创新、小微企业、绿色发展等重点领域和薄弱环节，为经济高质量发展营造了适宜的货币金融环境。,102.0
32,一、有效开展公开市场操作精准开展公开市场操作。2021年第一季度，影响银行体系流动性供求的不确定性因素较多，特别是春节因素的扰动较大。人民银行结合疫情防控形势，深入分析春节现金投放、财政收支等多种因素对市场资金供求的影响，提前谋划、动态微调、精准操作、引导预期，以《公开市场业务交易公告》等多种方式说明央行春节前后操作的有关考虑，以历年来春节前最低投放量保障了节前流动性平稳。同时，春节前开展的短期逆回购操作于节后数个交易日内全部到期，确保春节流动性“节前不紧、节后不松”。春节后，连续适量开展公开市场7天期逆回购操作，精准保持市场资金供求平衡，维护季末流动性平稳。,283.0
33,引导市场利率围绕央行政策利率波动。2021年以来，央行中期借贷便利（MLF）和逆回购操作中标利率均保持不变，继续展现稳健货币政策姿态。同时，公开市场操作的连续性进一步提高，通过每日开展7天期逆回购操作持续释放央行短期政策利率信号，引导货币市场利率围绕公开市场操作利率在合理区间波动，央行公开市场操作利率作为市场短期利率中枢的作用持续增强。2021年第一季度，银行间市场存款类机构7天期回购加权平均利率（DR007）均值为2.21%，与公开市场7天期逆回购操作利率2.2%非常接近。连续开展央行票据互换（CBS）操作。,258.0
34,2021年第一季度，人民银行开展了3次、150亿元CBS操作，期限均为3个月，费率均为0.10%。目前，人民银行以每月一次的频率稳定开展CBS操作，对于提升银行永续债的二级市场流动性，支持银行特别是中小银行发行永续债补充资本发挥了积极作用。常态化在香港发行人民币央行票据。2021年第一季度，人民银行在香港成功发行3期共300亿元人民币央行票据。其中，3个月期、6个月期和1年期分别为100亿元、50亿元和150亿元。,209.0
35,人民银行通过常态化发行香港人民币央行票据，在持续丰富香港市场人民币投资产品系列和流动性管理工具的同时，也带动了境内外市场主体在离岸市场发行人民币债券及开展人民币业务，有利于促进离岸人民币市场持续健康发展。,102.0
36,据统计，2021年第一季度，除香港人民币央行票据以外的离岸人民币债券发行约480亿元，比2020年同期增加50%，人民币离岸市场活跃度继续提升。等季节性因素的影响。今年春节由于疫情防控等原因，流动性形势与往年差异较大，不确定因素进一步增加。人民银行实时跟进疫情防控最新情况，加强分析研究，对春节现金投放、财政收支以及市场资金需求等因素进行滚动预测，通过“提前谋划、动态微调、精准操作、引导预期”，实现了春节前后市场利率平稳运行的操作目标。春节前，总共投放跨节资金4300亿元，为近年最低投放量。,247.0
37,同时，为提高货币政策透明度，进一步稳定市场预期，人民银行在《公开市场业务交易公告》中对“今年春节前居民提现需求明显减少，同时节前财政支出增加较多”的情况前瞻性进行说明，使市场能够更好地理解央行政策意图。,101.0
38,从实际效果看，春节前后货币市场运行平稳，DR007始终运行在公开市场7天期逆回购操作利率2.20%附近，体现了货币政策既不松也不紧的稳健姿态，央行公开市场操作的精准性和前瞻性进一步提高。目前，人民银行逐步形成了在每月月中固定时间开展中期借贷便利（MLF）操作、每日连续开展公开市场操作的惯例，通过持续释放央行政策利率信号，引导市场利率围绕政策利率波动，显著提高了货币政策传导的效率。同时，人民银行在公开市场操作中更加关注DR007等货币市场短期基准利率，并综合考虑现金投放回笼、财政收支以及市场需求等因素灵活调整公开市场操作的规模和期限品种。因此，市场在观察央行公开市场操作时，应重点关注公开市场操作利率、中期借贷便利利率等政策利率，以及市场基准利率在一段时间内的运行情况，而不应过度关注央行操作数量，避免对货币政策取向产生过分解读。年初货币市场利率曾一度短暂上行，主因是市场宽松预期下短期流动性需求增加较多，相比其他发展中国家，目前我国货币市场利率的波动性并不高。,433.0
39,同时，市场利率适度波动也是市场机制发挥作用、市场定价功能正常的体现。随着利率市场化改革不断深化，我国已形成以中期借贷便利利率为中期政策利率、以公开市场操作利率为短期政策利率的央行政策利率体系，央行公开市场操作利率的中枢作用不断增强。市场利率围绕央行政策利率波动，表明央行政策利率既能够有效引导市场利率，又充分体现市场资金供求变化，是市场机制在利率形成中发挥决定性作用的体现。同时，央行根据宏观经济金融运行情况和货币政策目标确定政策利率水平，引导市场利率走势，这既是央行履行货币调控职能的客观要求，也体现了货币政策服务实体经济的宗旨和以人民为中心的理念。二、适时开展常备借贷便利和中期借贷便利操作适时开展中期借贷便利操作。,310.0
40,保证中长期流动性合理供给，发挥中期政策利率信号作用和利率引导功能。第一季度，累计开展中期借贷便利操作8000亿元，期限均为1年，利率均为2.95%。3月末，中期借贷便利余额为53500亿元，比年初增加2000亿元。及时开展常备借贷便利操作。对地方法人金融机构按需足额提供短期流动性支持。,143.0
41,第一季度，累计开展常备借贷便利操作共475亿元，3月末余额为64亿元。发挥常备借贷便利利率作为利率走廊上限的作用，促进货币市场平稳运行。3月末，隔夜、7天、1个月常备借贷便利利率分别为3.05%、3.20%、3.55%，与上季度末持平。三、继续完善宏观审慎政策框架发挥好宏观审慎评估（MPA）在优化信贷结构和促进金融供给侧结构性改革中的作用。2021年第一季度，人民银行按照中央经济工作会议部署的重点任务进一步完善MPA框架，更加突出对实体经济重点领域和薄弱环节的考核要求，动态调整优化相关考核指标，引导金融机构继续加大对普惠小微企业和制造业中长期融资的支持力度。,282.0
42,同时，将地方法人银行吸收异地存款情况纳入MPA考核，维护存款市场竞争秩序，保持银行负债端成本稳定。优化宏观审慎调节系数。,60.0
43,一是发布《中国人民银行国家外汇管理局关于调整企业跨境融资宏观审慎调节参数的通知》（银发〔2021〕5号），将非金融企业跨境融资宏观审慎调节参数由1.25下调至1。,81.0
44,二是发布《中国人民银行国家外汇管理局关于调整境内企业境外放款宏观审慎调节系数的通知》（银发〔2021〕2号），将境外放款宏观审慎调节系数由0.3上调至0.5。推动房地产贷款集中度管理制度有序落地。2020年末房地产贷款集中度管理制度出台后，人民银行会同银保监会指导省级分支机构合理确定地方法人银行房地产贷款集中度管理要求，督促集中度超出上限的商业银行制定过渡期调整方案。目前，信贷结构优化有序推进，房地产贷款集中度管理制度进入常态化政策执行和实施阶段。完善系统重要性金融机构监管框架。,242.0
