,paragraph,length
232,"强化系统重要性金融机构的吸收损失能力。FSB认为SIFIs应在巴塞尔芋确立的最低资本要求之上,保有额外资本。但对额外资本的具体构成和比例,国际社会尚未达成共识。有的意见认为,额外资本要求应是一级资本中的普通股,也有意见认为可通过应急资本工具、债务工具、其他具有“自救冶(bail-in)性质的债务等方式满足额外资本要求。一些国家已着手对本国SI鄄FIs提出了额外资本要求,有的国家建议一级资本的普通股占风险加权资产的1%~2%,有的国家提出了更高的要求,建议应为6%。",234.0
233,"但也有意见认为,在确定具体比例时要避免造成金融机构过高的资本成本。在额外资本要求之外,有关国际组织还在研究其他政策措施,包括对SIFIs实施更严格的大额风险暴露限制和额外流动性要求等,以限制金融机构从事高风险金融业务、避免其规模过于庞大。提高监管力度和有效性。FSB建议各国从以下五方面改善监管体系:一是明确监管权力与独立性,以识别早期风险并进行干预;二是各国监管机构应具有对SIFIs基于风险实施差别化监管的权力;三是强化针对金融体系复杂性和关联性的监管措施,提高监管标准,实现宏观和微观风险监测一体化;四是各国应建立不同监管机构之间的信息收集和共享机制,促进监管协调;五是针对所有大型跨境金融机构,各国监管机构应共同建立联合监管机制,并与大型跨境金融机构定期进行磋商,全面评估其经营行为及面临的风险。FSB还要求BCBS、国际证监会组织(IOSCO)和国际保险监管官协会(IAIS)在更新相关核心原则时充分考虑上述建议,并且要求各国监管当局改进监管方法和提高监管技术。",436.0
234,"完善风险处置安排。FSB提出,所有SIFIs应建立处置计划,一旦出现风险,要对其进行有序处置。根据FSB的上述要求,有关国际组织正在对SIFIs有效处置的核心工具、处置计划的关键要素、评估可处置性的标准、自救工具以及针对单个机构的危机处置跨境合作协议等问题进行深入研究。各国应明确指定负责处置的机构,并赋予相应的权力,建立相应制度安排,避免动用纳税人资金。专栏17宏观审慎管理中有关中央银行作用的观点国际金融危机爆发后,加强宏观审慎管理、发挥中央银行在宏观审慎管理中的核心作用成为国际社会共识。",247.0
235,"国际货币基金组织(IMF)在“宏观审慎政策:亚洲视角冶国际研讨会的会议总结中指出,宏观审慎政策应纳入宏观经济政策框架,货币政策制定者应在宏观审慎管理中发挥核心作用。作为宏观审慎管理的唯一或主导机构,中央银行应有权针对系统性风险提出并实施监管措施。IMF总裁卡恩认为,常规的宏观经济政策与宏观审慎工具之间具有内在联系,需要通盘考虑,这意味着中央银行今后的作用将发生变化。欧洲中央银行(ECB)行长特里谢指出,中央银行具有维护金融稳定的天然职能,其政策导向是中长期的,在宏观审慎管理中应发挥重要作用。经济学家布兰查德认为,宏观审慎职责集中于中央银行,有利于中央银行分析、调整货币政策对杠杆率和风险偏好等的潜在影响。",305.0
236,"货币政策与审慎管理政策的有效结合能够提供许多应对危机的逆周期性工具。国际清算银行(BIS)行长卡如阿那指出,货币政策与金融稳定的紧密关系,决定了中央银行必须在宏观审慎管理框架中发挥重要作用,因为中央银行是唯一能在短时间内为金融体系注入大量流动性的机构,中央银行是“最后贷款人冶,支付清算系统是现代金融系统的核心,中央银行拥有大量资源分析宏观经济和金融形势。ECB理事思马杰认为,中央银行难以以利率这一单一政策工具来实现物价稳定和资产价格稳定两个目标,因此中央银行需要其他工具来应对资产价格变化,而这些工具属于宏观审慎管理的范畴。经济学家库德哈特指出,中央银行的本质在于通过调整自身的资产负债表创造流动性,而流动性管理又是金融稳定的关键。如果全权负责流动性管理的中央银行没有宏观审慎管理权,局面将会非常复杂。",353.0
237,"英国财政大臣奥斯本指出,只有中央银行才具有对宏观经济的深入理解、权威和知识来作出宏观审慎决策。中央银行作为最后贷款人,需要全面了解其要支持的金融机构的各方面情况。美联储主席伯南克指出,金融危机最深刻的教训是金融机构“大而不能倒冶的问题必须解决。美联储原本可以于危机前在银行资本标准方面做更多事情,但美联储缺乏对金融机构进行全面监管的权力。美联储最适合监管大型、复杂金融机构。",187.0
238,"白宫经济顾问沃尔克认为,货币政策和金融稳定这两个方面不可分割,应赋予美联储对系统重要性银行的监管权。美联储需要获得关于银行运作的、有价值的第一手资料,以统揽市场和经济全局。日本银行行长白川方明指出,中央银行维护金融体系稳定是不可或缺的,也必将在宏观审慎管理中扮演重要角色。危机前,日本央行就开始进行宏观审慎管理,对在其开立存款账户的金融机构开展现场检查,掌握更多关于金融机构业务表现和资产质量的信息,以便分析评估金融体系的整体风险。三、加快构建我国宏观审慎管理制度框架近年来,我国金融管理当局在加强宏观审慎管理方面进行了有益探索。",265.0
239,"人民银行在总结现有宏观审慎管理做法的基础上,不断丰富和完善相关政策工具。下一阶段,应在吸收借鉴危机教训和国际有效做法的基础上,根据我国国情,统筹建立我国宏观审慎管理制度框架,建立宏观审慎管理和微观审慎监管协调配合、互为补充的体制、机制,发挥中央银行的主导作用,加强部门协调,有效维护金融体系稳定,提升金融支持经济增长的可持续性。(一)处理好宏观审慎管理的几个关键问题构建我国宏观审慎管理制度框架,需要处理好几个关键问题。",210.0
240,"一是处理好促进金融体系稳定与影响金融体系效率之间的关系,坚持积极稳妥、边试边看的原则,起步阶段旨在建立基本制度和职责分工,政策力度把握上力求稳妥。",73.0
241,"二是处理好宏观审慎管理、微观审慎监管与货币政策之间的关系。宏观审慎管理关键是在客观准确判断宏观形势基础上进行适时的逆风向调控,本质上是宏观管理和金融稳定的有机组成部分。负责制定宏观审慎政策的机构应当对宏观经济及其风险变化相当敏感,在货币信贷管理以及宏观经济判断的经验、手段、数据、人才等方面具有优势。同时,吸取金融危机的教训,金融宏观调控有必要更加关注更广泛意义上的整体价格水平稳定,更多地考虑金融稳定和宏观总量风险问题,因此,在充分发挥利率等传统工具作用的同时,金融宏观调控也亟须通过实施宏观审慎管理以丰富和补充新的手段。",262.0
242,"三是要处理好宏观审慎管理与会计标准之间的关系,注意在符合会计标准前提下设计和实施政策工具。",45.0
243,"四是既需要考虑标准统一和国际协调,避免监管套利,也需要根据各国国情确定工具和参数,增强政策调节的灵活性。(二)建立逆周期宏观调控机制从国际情况看,建立逆周期宏观调控机制是以银行融资为主的经济体加强宏观审慎管理的主要做法。由于历史和体制的原因,我国银行信贷在全社会融资中占比仍较高,信贷波动与经济周期变化和系统性金融风险之间关系较大,因此,建立逆周期信贷调控机制是我国加强宏观审慎管理的主要内容之一。近年来,人民银行不断探索逆周期的信贷调控模式,既重视利率等价格型指标变化,也重视货币信贷增长状况,通过窗口指导等方式加强风险提示,并运用信贷政策、差别准备金、调整按揭成数等手段加强宏观审慎管理,引导货币信贷平稳增长。其中,差别准备金动态调整基于银行信贷偏离经济增长和物价指数的程度,同时考虑各金融机构对总体趋势的影响、系统重要性程度和稳健性状况,有助于引导金融机构信贷合理、适度、平稳投放,优化信贷结构,同时还可以为金融机构提供一种自我约束、自我调节的弹性机制,从提高资本水平和改善资产质量两个方面增强风险防范能力,达到防范系统性风险积累的目的。",472.0
244,"下一阶段,应继续完善差别准备金动态调整机制,把货币信贷和流动性管理的总量调节与构建宏观审慎管理制度框架结合起来,引导货币信贷适度增长,提升金融机构抗风险能力。在这一过程中,要严格把握银行业金融机构的信贷总量和进度,密切监测金融机构资本充足水平、资产质量、流动性、拨备覆盖程度、杠杆率水平等状况,及时掌握相关数据,并结合金融机构年度审计结论、评级结果、内控水平、案件及支付风险等信息,全面准确评估金融机构稳健性状况。在此基础上,合理设置、不断完善稳健性调整参数,并据此对差别准备金进行调整,从而激励银行从可持续发展的角度,调整自身经营行为,实现稳健经营。研究表明,我国信贷/GDP对自身长期趋势的偏离度大体领先于经济周期变化。用信贷/GDP作为基础指导变量,建立银行体系的逆周期资本缓冲,有助于防范银行贷款损失风险,提高宏观经济政策的前瞻性,强化资本对商业银行经营行为的约束力。",388.0
245,"因此,要积极研究建立符合我国银行体系特点的逆周期资本缓冲机制。(三)降低我国系统性金融机构风险的政策措施近年来,我国金融行业、金融市场之间的关联性更加密切,金融产品复杂程度大幅提高,大型金融机构的规模和实力日益增强,在大力服务经济社会发展的同时,其经营状况和风险隐患也具有系统重要性影响。为切实维护金融稳定,当前应把握国际趋势,立足我国国情,研究制定我国SIFIs评估方法以及降低风险的政策措施。从防范和化解系统性风险、维护金融稳定的目标出发,我国SIFIs评估应采用定量指标和定性判断相结合的方法,由负责金融稳定的宏观审慎部门会同行业监管机构共同作出判断。定量指标要考虑规模、关联性、可替代性、复杂性等指标,定性判断要考虑金融机构的公司治理、内控机、风险管理能力、风险传递途径等因素。",343.0
246,"SIFIs的业务活动和风险管理与系统性风险密切相关,需要从金融体系的整体角度考虑,对SIFIs提出更严格的监管要求和标准。",61.0
247,"一是根据SIFIs系统重要性程度的不同,实施不同的额外资本要求。",32.0
248,"二是在杠杆率、流动性、大额风险暴露和风险拨备等方面建立更严格的监管要求和标准,定期开展压力测试。",48.0
249,"三是研究SIFIs并购投资行为的管理政策,对其开办业务、新设分支机构、营业网点布局采取审慎态度。为降低SIFIs经营失败对金融体系可能产生的负面影响,防范道德风险,对陷入经营困境的SIFIs需要建立有序的风险处置和清算安排。要强调股东、债权人和经营者的责任,建立特别清算安排,利用存款保险机制作为风险处置平台,发挥中央银行的后援作用并建立有效的跨境合作机制。专栏18宏观审慎分析探索:基于支付结算信息的金融网络稳定状况跟踪随着对此次金融危机反思的不断深入,各方关于系统性风险的讨论也进入到新的阶段,特别是不同机构间相互影响和传染所导致的系统性和网络化风险更是成为了当前讨论的焦点。金融网络主要指金融机构间(主要是银行间)由各种实际金融交易而形成的相互联系的整体,金融网络结构则重点描述不同网络的整体形态与结构特征,并从相互联系的角度对整个金融体系的内部特征和风险传递机制进行剖析。",390.0
250,"本章在2010年构建的基于银行间支付结算信息的金融网络模型基础上增加了波及强度指标(I)以进一步反映网络结构与稳定性状况,通过对2007年5月至2010年12月共44个月度支付结算数据的实证分析,对整个金融网络的稳定状况、网络的结构变化以及各金融机构间(主要是银行间)的流动性风险传递过程进行了更全面的动态描述与跟踪分析。",161.0
251,"一、我国金融网络稳定状况跟踪通过对支付数据的实证分析,可以得到我国金融网络稳定性的广度(B)、深度(D)与强度(I)指标。研究表明,稳定性指标的变化主要源于每个网络节点流动性的变化以及网络结构、节点之间连接程度的改变,而且深度指标(D)对网络连接度变化更敏感,而广度(B)与强度(I)指标则较多地反映了节点承受能力的变动。从金融网络稳定性指标的走势来看,2010年无论是广度(B)、深度(D)还是强度(I)指标的波动均表现出了低位增强的特点,即与历史走势相比,2010年的B、D和I虽然平均水平仍然不高,但在个别时段曾出现过一定程度的上升与波动,如8月和11月。其中,B与I的走势大体相近,均出现了先升后降的趋势,而D的波动则相对剧烈。这既反映了节点流动性变动的影响,也反映了网络连接程度的改变,但其中网络节点流动性的变动对于整个网络稳定性的影响比网络结构本身的改变更显著,这与我国2010年的金融宏观审慎调控的节奏大体吻合。",413.0
252,"二、我国金融网络结构的变化选取2010年6月这一截面对我国银行网络的结构特点及其变化进行跟踪分析。考虑到数据细化的困难以及时间维度上的可比性,研究主要针对由大型商业银行、政策性银行、股份制商业银行、城市商业银行、农村商业银行、农村合作银行、农村信用社、城市信用社、邮政储蓄银行及外资银行共84个节点构成的支付网络。其中,城市商业银行、农村商业银行、城市信用社与农村信用社均为单个节点。(一)大型商业银行从流动性风险的传递情况看,当一家大型商业银行发出流动性冲击的时候,平均有约30家银行受到不同程度的波及,机构数量占比接近36%,且波及平均延续5轮,涉及资金比例达18%。受波及的节点主要为政策性银行和外资银行,其他机构并未受到严重影响。",319.0
253,"而将4家大型商业银行作为一个整体时,波及将延续7轮,涉及资金与机构比率均超过80%,而且除邮政储蓄银行、城市信用社及少数外资银行外,大部分银行机构都将受到影响。这表明,与2009年6月相比,大型商业银行在网络中的核心地位得到了进一步强化和提升,而且各大型商业银行在网络中的覆盖范围并不完全重叠。(二)政策性银行当单个政策性银行发出流动性冲击时,波及机构的平均数量由2009年6月的5家增加到了10家,波及最高可延续6轮,影响的平均资金比例为3%,且影响机构均为外资银行。总体上看,尽管政策性银行在网络中的整体影响力依然不高,但与历史数据相比,其网络影响力已出现了明显的提升。这主要是由于不同的政策性银行节点在网络中的行为模式出现了一定程度的分化,即某些政策性银行表现出了较强的网络依赖性,而另一些对网络的影响能力则越来越强。",362.0
254,"(三)股份制商业银行将股份制商业银行作为一个整体时,其发出流动性冲击所产生的影响将延续3轮,总波及机构达48家,涉及资金比例为44%,受波及机构包括政策性银行、农村信用社及多家外资银行。而当单个股份制商业银行分别发出流动性冲击时,平均波及机构数量为11家,平均延续为3轮,影响的资金比率仅为3%。这表明,股份制商业银行联系广泛,其整体网络影响强度与2009年6月相比明显增加,但其单一节点网络影响力还远不及大型商业银行。(四)邮政储蓄银行与农村信用社邮政储蓄银行资产规模较大,但其对整个网络的影响力和受网络的影响程度都不强,在网络中仍然是相对孤立的。但值得注意的是,与2009年6月相比,邮政储蓄银行的网络连接程度有所提高,其发出流动性冲击所波及的机构数量为7家,延续的轮数也达到了4轮,且受其影响的主要为外资银行。",358.0
255,"将农村信用社作为一个整体时,对整个网络产生的影响仍为2轮,受影响机构比例下降为3%,涉及资金比例也降为5%。而当单个大型商业银行或股份制商业银行整体发出冲击时,农村信用社均不会受到严重波及。由此可见,农村信用社作为局部的子集在网络中的独立性有所提高。(五)外资银行当单个外资银行分别发出流动性冲击时,平均影响机构数量为7家,波及的延续轮数仅为2轮,影响的交易量也只有0.7%,说明外资行在网络中影响力较弱。但由于外资银行在支付网络中的节点数量较多,对金融网络稳定性的广度(B)与深度(D)指标的影响较大。",252.0
256,"实证跟踪发现,2010年8月和11月,由于部分外资银行节点与邮政储蓄银行、农村信用社、部分股份制商业银行及政策性银行的网络连接程度上升,导致了网络稳定性指标波动的加剧。整体来看,我国金融网络结构并未出现大的变化,网络的稳定基础较好。但是由于外资银行及部分股份制商业银行与政策性银行网络关联度的上升,加之银行现金头寸的变化,使得整个网络的稳定性出现了一定程度的波动。(四)加强金融统计和系统性风险监测预警体系建设风险监测预警体系是宏观审慎管理制度框架的重要组成部分,而有效的监测和预警有赖于真实、及时、完整的金融数据和信息。应加快建立覆盖全面、标准统一、信息共享的金融业综合统计体系,构建银行、证券、保险及境内外业务相互协调的统计体系,建立金融控股公司、表外实体、金融衍生产品统计制度,确保金融统计体系建设跟上经济发展与金融创新的步伐;积极推进金融统计标准化建设,切实提高信息共享水平和统计信息透明度,避免重复统计并强化信息安全和保密工作,搭建跨部门工作交流与信息共享平台。",436.0
257,"同时,在全面提升金融统计水平的基础上,借鉴国际经验,开发全面反映金融体系内部状况、金融体系与实体经济之间联系的金融监测指标体系,完善系统性金融风险监测评估框架,建立具有前瞻性的风险预警体系。专栏19加强金融统计标准化建设随着国际经济全球化和金融创新的迅猛发展,现行统计指标体系难以适应新形势的问题日益突出。特别是2007年爆发的国际金融危机更加凸显了对跨机构、跨市场、跨境交易及创新型机构和产品监测的迫切需要。尽快建立银行、证券、保险及境内外相互协调的系统性金融风险监测指标体系已成为国际共识。一些国际组织和国家对此已进行了大量的有益探索,并建立了相应的统计体系,但仍不能解决数据缺失和共享基础薄弱等问题。",303.0
258,"金融统计标准化是建立统一、科学的综合金融统计体系的前提,也是提升我国金融统计水平、完善监测体系的重要手段。用统计信息标准化的手段能从源头上解决和促进各类金融信息的协调,提高数据质量,有效推动信息共享。重新构建中央银行金融统计体系,既要满足宏观审慎管理的需要,也要立足于现实基础。我国金融统计标准化遵循了国际通行的做法,从源头上规范统计信息,包括机构部门、金融机构、金融工具统计分类标准、金融工具计值标准及金融统计常用术语标准等。标准具体分为通用标准、专项标准和数据元标准。",236.0
259,"金融统计标准化框架通过标准化的统计机构分类明确金融统计范围,根据国民经济核算理论和我国金融体系的现状及发展趋势,除包含银行业、证券业、保险业机构外,也要包含企业年金、贷款公司、农村资金互助社、村镇银行及特定目的载体(SPV)等金融机构,还要将交易结算类金融机构、金融控股公司及小额贷款公司等纳入统计范围。",152.0
260,"金融工具统计分类标准化应按照金融资产特征规范逻辑分类和标准定义,根据宏观审慎管理的需要,涵盖银行、证券、保险及交叉性金融业务,统一社会各界对金融工具和产品的认识,提高宏观数据的同质性、协调性和可比性。对金融统计术语进行标准化,推进金融统计信息从采集到披露过程用语的规范化,有利于避免因缺乏术语标准而引起歧义和误解,提高信息交流的效率和准确性。此外,还应对录入、采集、存储、生产和披露等统计处理流程进行标准化。目前,中国人民银行已发布《金融机构编码规范》、《金融工具统计分类及编码标准》、《贷款统计分类及编码标准》、《存款统计分类及编码标准》、《特定目的载体(SPV)编码标准》、《理财、资金信托统计数据元标准》等多项标准。下一步,将继续完善金融统计标准化框架,为构建我国宏观审慎管理制度框架奠定基础。",350.0
261,"(五)建立健全危机管理和系统性风险处置框架从欧美等主要国家(地区)应对此次国际金融危机的过程看,中央银行最后贷款人、财政超常规救助职能和存款保险制度等发挥了关键性作用。我国应进一步完善中央银行最后贷款人功能定位,丰富相关政策工具和手段。完善金融风险处置中的成本分担机制,科学界定不同救助工具的功能、实施主体、适用条件及范围,加强部门之间及政策工具之间的协调配合,完善国家应对突发金融风险的快速反应机制。加快推出功能完善、权责统一、运行有效的存款保险制度。不断完善相关法律法规,建立金融机构的市场化退出机制。",253.0
262,"专题一部分国家和地区金融监管改革及启示金融监管体制不适应金融业发展变化,是本次国际金融危机发生和蔓延的一个重要原因。2010年,美欧等国家和地区相继出台金融改革方案,对金融监管体制进行重大调整,集中体现为以防范和化解系统性风险为目标,促进货币政策、金融稳定和金融监管的协调统一,反映了国际金融监管发展的主流趋势。改革后,金融监管环境趋于严格,金融机构经营行为更加审慎,将对全球金融稳定产生积极作用。中国应借鉴这些国家和地区金融监管改革的有益经验和做法,从我国金融业改革发展的实际出发,进一步深化金融体制改革,完善维护金融稳定的制度安排。一、改革的主要内容(一)美国金融监管改革的主要内容2010年7月,美国颁布《多德—弗兰克华尔街改革和消费者保护法案》(以下简称《多德—弗兰克法案》),以强化防范和化解系统性风险为主线,着重从以下几个方面完善金融监督和管理体系。",381.0
263,"设立金融稳定监督委员会,识别和防范系统性风险。新设立的金融稳定监督委员会(FSOC)由10名有投票权成员和5名无投票权成员构成,承担以下职责:识别系统重要性机构、工具和市场,以及源于金融体系内外的、威胁金融稳定的风险,对风险提出应对措施;经委员会2/3以上成员同意,确定哪些非银行金融机构属于系统重要性机构,并指定美联储监管;建议美联储对系统重要性机构提高监管标准;在必要时批准美联储分拆严重威胁金融稳定的金融机构。扩大监管范围,填补监管漏洞。",222.0
264,"一是美联储作为系统重要性机构的监管主体,不仅监管资产超过500亿美元的银行,还监管所有具有系统重要性的证券、保险、金融控股公司,如果对冲基金和私募基金被认为规模过大或风险过大,将被置于美联储的监管之下。美联储有权对金融控股公司及其任何一个子公司(包括非存款类子公司)进行直接检查,有权直接从金融控股公司获取信息。对于在金融活动之外还从事非金融活动的公司,美联储可要求其成立中间持股公司,以更好地管理金融业务。强化美联储对系统重要性支付、清算、结算活动及系统重要性金融市场公用设施的监管,在必要时提供贴现窗口支持和优惠贷款。保留美联储对小银行的监管权。",275.0
