,paragraph,length
78,"2010年房产开发贷款增速未出现下滑态势,主要与当年房地产投资快速增长,尤其是国家大力推进保障性住房建设等因素有关。全年房产开发贷款新增4269亿元,同比多增1910亿元,其中上半年房产开发贷款新增3187亿元,占全年新增额的75%。个人住房贷款增速1~4月缓慢上升,5月以来持续下滑。截至2010年年末,主要金融机构个人住房贷款余额5.73万亿元,同比增长29.8%,增速比4月末低29.3个百分点。全年个人住房贷款新增1.31万亿元,同比少增818亿元,当月新增额从4月的1767亿元逐步回落至12月的633亿元。",259.0
79,"地产开发贷款增速持续大幅下滑,在经历了2009年的大幅攀升之后逐步回归到正常发展轨道。截至2010年年末,主要金融机构地产开发贷款余额8326亿元,同比增长24.7%,增速比上年末低79.5个百分点。其中,政府土地储备机构贷款余额7342亿元,同比增长27.5%,增速比上年末低95.2个百分点。全年地产开发贷款新增1647亿元,同比少增1759亿元,11月和12月连续两个月出现负增长。(三)资本质量持续提升,资本补充和约束机制有待完善资本质量持续提升。",228.0
80,"我国商业银行资本主要由质量较高的普通股和储备等核心资本构成。与国际同业相比,次级债务、优先股等损失吸收能力较弱的附属资本占比不高,资本质量保持在较高水平。截至2010年年末,商业银行核心资本占资本净额的85.83%,比商业银行股份制改革初期的2005年提高20个百分点,保持了较强的损失吸收能力,资本质量持续提升。资本补充和约束机制有待完善。当前我国商业银行资本补充方式仍较单一,主要依靠配股、发行次级债券及混合资本债券等外部融资渠道补充资本,内源性融资动力不足。",232.0
81,"同时,银行业金融机构虽然逐渐树立资本约束意识,开始应用经济资本、经济增加值和风险调整后的资本回报等先进管理方法,逐步建立资本监管和管理体系,但相关政策和技术手段还需改进,资本约束机制亟待完善。特别是在良好的经济环境下,银行业盈利过于依赖利差收入,很多银行倾向于粗放式增长,规模扩张冲动强烈,资本对银行业务发展的约束弱化,资本补充压力加大。(四)结合国际银行业监管改革,监管水平进一步提升积极参与国际银行业监管改革和标准制订,审慎评估巴塞尔芋对银行业的影响。2010年,国际银行业监管改革取得重大进展,巴塞尔银行监管委员会(BCBS)出台了巴塞尔芋等一系列国际银行业监管标准和准则。加强微观审慎监管和宏观审慎管理,强化资本质量、提高最低资本要求、扩大资本的风险覆盖范围,建立国际统一的流动性监管框架,提出实施国际统一的资本留存缓冲标准,建立逆周期资本缓冲,对系统重要性银行实施额外的资本和流动性要求,建立国际跨境银行处置机制。",412.0
82,"人民银行和银监会作为BCBS成员,全面深入参与巴塞尔芋等国际新监管标准的讨论和制订,对巴塞尔芋对我国银行业的影响进行研究。初步来看,与欧美国家银行业高杠杆、高风险的经营发展模式不同,我国银行业经营相对稳健,业务开展以传统的信贷业务为主,产品结构较为单一,国际业务规模及占比较小,且资本构成以普通股为主、质量较高,巴塞尔芋对我国银行业的短期直接影响比较有限。但从中长期看,我国商业银行主要依靠信贷扩张盈利的业务发展模式资本消耗高,监管标准的提高将使银行面临更大的资本补充压力。借鉴国际银行业监管改革成果,提升银行业稳健性标准。结合巴塞尔芋监管理念和措施,针对缓解顺周期性、加强系统重要性银行监管等宏观审慎管理主要包括资本公积、盈余公积、一般风险准备和未分配利润。",330.0
83,"的要求,2010年我国积极制定和完善银行业监管标准,引导商业银行建立动态资本补充和拨备机制,探索在最低资本充足率的基础上计提资本保留缓冲和逆周期资本缓冲;强化核心资本要求;进一步完善流动性监管框架,研究流动性覆盖率和净稳定融资比率等风险计量新指标。",124.0
84,"同时,研究加强对系统重要性银行机构的监管,探讨建立额外的资本和流动性要求等。专栏7逆周期资本缓冲的研究及实践此次国际金融危机暴露出金融体系存在较强的顺周期性,金融机构在经济上行时扩张资产和信贷,在经济下行时收缩资产和信贷,加剧了经济周期的波动。危机后,为加强逆周期调节、降低金融体系顺周期性,BCBS提出建立逆周期资本缓冲机制。逆周期资本缓冲是设置在资本留存缓冲基础上的资本要求,具体标准为普通股充足率增加0~2.5个百分点。其政策目标是通过发挥资本对信贷增长的约束作用,平抑信贷周期。",243.0
85,"BCBS建议各经济体以私人部门信贷总量/GDP对自身长期趋势的偏离度作为计提逆周期资本缓冲的指导变量,当一国信贷/GDP接近或低于其长期趋势时,表明信贷风险较低,逆周期资本缓冲设定为零;当信贷/GDP超过其长期趋势,表明信贷过度增长,系统性风险累积,应计提逆周期资本缓冲,控制信贷规模。",143.0
86,"根据这一制度安排,各国可依据本国信贷状况和系统性风险评估情况,自主确定逆周期资本缓冲的实施时机和缓冲规模,并可在信贷周期出现逆转时释放缓冲,帮助银行维持信贷资金正常周转。目前,逆周期资本缓冲框架已初步确立,但国际统一规则与自由裁量权之间的平衡将成为政策制定的难点。各国逆周期资本缓冲要求不一致可能导致监管套利,国际活跃银行可能会调整在不同国家的风险暴露,以达到较低的逆周期资本缓冲。此外,统一的逆周期资本缓冲要求有可能导致银行逆向选择,倾向于开展高风险、高收益的信贷业务。针对单个银行提出有效的缓冲要求,将成为完善逆周期资本缓冲框架的挑战。",270.0
87,"逆周期资本缓冲框架得到了国际社会的积极响应,已有部分国家着手推动建立本国的逆周期资本缓冲制度,如瑞士就已表示将要求瑞士信贷和瑞银集团两家大银行建立0~2.5%的逆周期资本缓冲。我国也在研究以信贷/GDP为指导变量,建立银行体系的逆周期资本缓冲,并运用差别准备金率等政策工具激励金融机构执行更加审慎的资本要求。探索建立宏观审慎管理框架,丰富监管工具和手段。针对此次国际金融危机暴露出系统性风险管理不足的弊端,2010年,人民银行会同有关部门研究制定宏观审慎管理框架,丰富有关管理工具和手段,探索建立差别准备金动态调整制度,指导商业银行开展压力测试,不断完善监管工具和手段,提升系统性风险防范能力。监管部门出台了一系列指引和办法,强化银行风险管理和公司治理建设,规范外部审计监管和融资性担保行为,加强信托公司净资本管理,促进银行业稳健经营。",368.0
88,"专栏82010年我国银行业压力测试取得新进展根据2009年人民银行与国际货币基金组织、世界银行签订的《中国金融部门评估规划评估范围备忘录》,2010年,中国金融部门评估规划(FSAP)稳步实施。开展银行业压力测试是其中的一项重要内容,旨在对中国银行业的稳健性及风险状况进行定量分析,考察银行体系的抗风险能力和稳健性状况,揭示潜在的风险隐患。为有序推进FSAP压力测试工作,人民银行和银监会联合成立了FSAP压力测试工作小组,组织17家主要商业银行开展压力测试工作。此次FSAP压力测试采用自上而下和自下而上相结合的方式,重点考察17家主要商业银行的信用风险、市场风险、流动性风险和传染性风险。其中,信用风险压力测试考察银行整体信贷资产以及房地产贷款等结构性信贷资产质量变化对银行的不利影响;市场风险压力测试考察存贷款基准利率变化、各类债券市场收益率曲线平行移动以及人民币汇率变化对银行的不利影响;流动性风险压力测试考察银行的存款流失、存款准备金率上调、资产价格下降以及同业存款或拆借资金规模下降等因素共同作用对银行的不利影响;传染性风险压力测试考察大型商业银行之间的风险关联性和传染性。",493.0
89,"压力测试结果表明,受益于股份制改革,我国银行内控体系不断完善、资产质量不断提高,银行资本普遍比较充足、流动性状况良好、对各类风险敞口的管理比较审慎,银行体系对各类风险冲击的缓释能力较强,总体运行稳健。三、展望及改革措施2011年,银行业经营环境仍将面临较大的不确定性,按照“十二五冶规划的总体要求,金融支持经济发展方式转变和经济结构调整的任务依然十分艰巨。为此,银行业要落实好稳健的货币政策,进一步加强宏观审慎管理,着力防范和化解重点领域潜在风险,转变发展方式,提高稳健性标准,强化内部约束,继续深化改革,全面提升综合实力和抗风险能力。落实稳健的货币政策,支持经济结构调整和发展方式转变。均衡把握贷款投放总量和节奏,认真落实差别准备金动态调整政策,保持银行体系流动性和社会融资总量适度合理。",345.0
90,"坚持“区别对待、有扶有控冶的原则,着力优化信贷结构,充分发挥信贷政策在经济结构调整中的引导作用,加大对战略性新兴产业、节能环保产业、现代服务业、科技自主创新等的金融支持,严格控制对高耗能、高排放和产能过剩行业贷款。",107.0
91,"将更多的信贷资金投向中小企业和“三农冶领域,加大金融支持经济发展方式转变和经济结构调整的力度。强化重点领域信用风险管理,提高信贷资产的安全性。银行业金融机构应密切关注经营环境的变化,加大对重点领域信用风险的管理力度,防止信贷资产质量下滑。强化政府融资平台贷款风险管理,切实做好地方政府融资平台贷款清理工作,严格控制、审慎发放并科学管理新增平台贷款。认真落实国家房地产调控政策,严格实施差别化的住房信贷政策,加强房地产信贷管理,防止出现假按揭和“次级房贷冶,严禁信贷资金违规进入房地产投资投机领域。",248.0
92,"同时,合理调整信贷投向和期限结构,降低贷款集中度风险,缓解资金期限错配问题。转变经营发展方式,强化资本约束机制。今后一个时期,银行业要加快转变发展方式,改变过于依赖规模扩张的粗放经营模式,结合自身优势和区域特点稳步推进金融服务和金融产品创新,避免低水平同质化竞争。大力发展中间业务,改善收入结构,增强综合盈利能力。同时,要强化资本约束机制,提高资本质量,根据资本的风险承受能力合理拓展业务,加强内部积累,增强资本约束机制的有效性。",215.0
93,"加强宏观审慎管理,提升银行业稳健性标准。我国将积极借鉴国际银行监管改革最新成果,根据银行业发展实际,构建逆周期宏观审慎管理框架,合理提高银行业稳健性标准。提高资本质量和水平,扩大资本的风险覆盖范围,探索建立资本留存缓冲和逆周期资本缓冲,引入杠杆率监管指标;探索建立国际统一的流动性监管标准;加强系统重要性银行监管,研究对系统重要性银行实施更高、更审慎的监管标准,全面实施巴塞尔域和巴塞尔芋;完善跨境银行监管和处置的合作机制。拓展压力测试应用范围,完善数据基础和技术方法,逐步将其纳入银行业金融机构全面风险管理体系。加强对信托投资公司、金融租赁公司、财务公司等非存款类金融机构的监督管理,积极防范和化解非存款类金融机构、融资性担保公司、典当行以及民间融资行为的关联性风险,进一步夯实银行业稳健运行的基础。",351.0
94,"继续深化改革,完善多元化的银行组织体系。进一步推进已改制大型商业银行完善现代金融企业制度,重点推动农业银行“三农金融事业部冶改革。深入推进国家开发银行商业化转型,完善公司治理。加快推进中国进出口银行改革,不断提高其服务对外经贸和企业“走出去冶的能力和水平。研究推动农业发展银行改革。",141.0
95,"积极推动中小商业银行改革。稳步推进金融资产管理公司改革试点。继续深化农村信用社改革,提升服务“三农冶和中小企业的水平,完善农村金融政策扶持配套体系。在科学规划的基础上规范发展新型农村金融机构,健全和完善多元化的银行组织体系。第三章证券期货业2010年,证券期货经营机构坚持合规运作、规范发展,经营保持总体稳健。",155.0
96,"资本市场运行基本平稳,股指期货顺利推出,市场发展实现新突破,服务国民经济发展的能力进一步提高。一、运行状况(一)市场规模继续增长,机构投资者主导地位进一步增强股市规模稳步扩大。2010年末,沪深两市上市公司2063家,比上年增加345家。A股市场总市值26.54万亿元,流通市值19.31万亿元,同比分别增长8.81%和27.67%。上证综合指数收于2808.08点,比上年末下跌14.31%,深证成分指数收于12458.55点,比上年末下跌9.06%。",227.0
97,"2010年全年,沪深两市日均股票交易金额2254亿元,比上年增长2.64%。531家企业在A股市场发行融资,股权和债务融资规模达10275.21亿元,同比增长122.91%,融资总额和发行家数均创历史新高。期货交易规模大幅增长。2010年,期货市场共成交15.67亿手,成交金额154.56万亿元,同比分别增长42.25%和136.8%。其中,商品期货成交15.21亿手,成交金额113.49万亿元,同比分别增长40.9%和73.9%;股指期货成交0.46亿手,成交金额41.07万亿元。",244.0
98,"投资者数量稳步增长。2010年末,沪深两市共有A股账户15204.1万户,B股账户250万户,基金账户3404.2万户,分别比上年末提高10.32%、1.57%和9.05%。其中,机构投资者持有已上市流通A股市值13.74万亿元,占已上市流通A股市值70.85%,比上年末增加2.17个百分点,机构投资者市场的主导地位进一步增强。(二)市场基础性制度建设稳步推进,市场运行机制不断完善股指期货推出后运行总体平稳。2010年4月16日,沪深300指数期货在中国金融期货交易所挂牌交易。",241.0
99,"推出股指期货、引入做空机制有利于构建市场稳定运行的内在机制,是我国资本市场基础性制度建设的重要举措之一。上市以来,股指期货总体运行平稳,客户交易较为理性,交割平稳顺利,与沪深300现货指数拟合性良好,市场风险基本可控。专栏9股指期货的功能及需关注的问题股指期货是资本市场的基础性制度之一,股指期货的推出意义重大。",156.0
100,"一是为市场提供对冲风险的金融工具,有利于构建市场运行的内在稳定机制。股指期货具有做空机制,在市场上涨出现泡沫迹象时,卖出股指期货,可以抑制市场的非理性;在市场下跌时,卖出股指期货,可以对冲股票现货市场整体下跌的系统性风险,缓解投资者集体性抛售股票引发的市场过度调整。",133.0
101,"二是丰富了市场品种,有利于促进市场投资策略和盈利模式的多样化。作为基础性金融工具,股指期货的推出进一步丰富了投资者特别是机构投资者进行资产配置和交易投资的手段,有利于发展多样化的投资策略和投资方式,满足不同风险偏好的投资者需求,促进市场和机构盈利模式的多样化和差异化发展。国股指期货市场自2010年4月推出以来开局良好,运行总体平稳,但仍需要关注以下问题。",178.0
102,"一是交易持仓比较高机构投资者参与尚不充分。截至2010年年末,我国股指期货个人客户占比超过90%,交易持仓比高达9.43倍,远高于成熟市场股指期货主力合约交易持仓比10%的水平。与成熟市场股指期货主要参与者是各类专业机构投资者相比,目前我国股指期货市场的机构投资者较为单一,主要以证券公司为主,保险等其他机构投资者尚未参与,市场投资者结构有待进一步改善。",177.0
103,"二是关注潜在的信息型市场操纵行为,进一步完善防范机制。股指期货市场对各类宏观政策的反应较为敏感和迅速,随着互联网的广泛应用,不排除部分市场主体故意散布虚假信息和传言影响市场走势的可能,导致信息型操纵行为的出现。有必要加强部委间的沟通协调,进一步规范政府信息发布机制,防范信息被人蓄意利用引发股指期货市场上的违规操作。",158.0
104,"三是基差较大,期现套利机制有待进一步完善。股指期货挂牌交易以来,部分远月合约的基差(即期货点数减现货点数)水平持续高于成熟市场的水平,反映了我国股指期货的定价效率有待进一步提高。",89.0
105,"四是催生高频交易等新交易方式,潜在的跨市场风险值得关注。随着股指期货的推出,国际市场一些新的交易方式(如高频交易)也在我国期货市场中陆续出现。高频交易的大量运用不仅会给交易所的交易系统稳定性带来挑战,加剧市场波动,影响市场稳定,还会使期货和现货市场之间的传导机制更加复杂,跨市场联动性增强,与之伴随的风险值得关注。融资融券业务试点启动。按照“试点先行,逐步推开冶的思路,2010年3月,证券公司融资融券业务试点工作启动。",210.0
106,"截至2010年年末,共有25家证券公司获试点资格,累计开户4.2万户,成交金额1197.7亿元,其中融资交易金额累计1173.24亿元,占98%;融券交易金额累计24.45亿元,占2%。目前,证券公司融资融券业务试点工作运行平稳,证券市场的信用交易机制初步建立。新股发行体制改革深化。按照不断提高市场约束、积极推动市场主体归位尽责的原则,在全面总结第一阶段改革经验的基础上,2010年10月,新股发行体制第二阶段改革启动。主要措施包括:进一步完善询价过程中报价和配售约束机制,提高单个机构获配股份数量,扩大询价对象范围,充实网下机构投资者,增强定价信息透明度,完善回拨和中止发行机制。",292.0
107,"这些措施进一步强化了新股发行过程中各参与主体的市场约束,改革的市场化方向得到认同,改革的成效逐步显现。期货市场功能不断完善。出台加强交易所自律管理工作指引,对品种上市、监查、规则修改等环节进行全面规范。强化市场监测监控,妥善处置部分高频交易(High-frequencyTrading)是一系列计算机自动化交易策略的统称,高频交易者应用计算机程序分析市场数据,通过计算发现瞬间的交易机会,频繁买进卖出。期货品种价格剧烈波动风险。",214.0
108,"推广期货产品服务产业发展的成功经验和典型模式,推动实体企业利用期货市场指导生产经营、贸易定价和管理风险。开展已上市品种功能评估,完善产品合约和业务规则。引导期货公司更多地发展产业客户,提供专业化服务。(三)法律体系进一步完善,防范和打击内幕交易工作初见成效2010年,法制建设继续推进,积极推动《证券投资基金法》和《期货交易管理条例》的修订,进一步完善《上市公司监督管理条例》、《证券投资基金保护条例》草案。推动制定内幕交易、操纵市场犯罪认定标准,研究制定证券期货犯罪案件移送、集中管辖等程序性规定。",250.0
109,"同时,国务院转发五部委《关于依法打击和防控内幕交易的意见》,对内幕交易打击防控工作进行了统一部署,进一步明确了国务院相关部门、地方政府和监管部门的职责任务,“群防联控、综合防治冶的内幕交易防控体系初步形成。",103.0
110,"证券监管部门研究完善股价异动的信息披露和停复牌制度,坚持“异常即核查、涉嫌即暂停、违规即终止冶,推进上市公司内幕信息知情人登记制度,开展内幕交易专项打击行动,快速查处了“中山公用冶等内幕交易大案。(四)诚信合规监管得到强化,市场主体规范运作发展上市公司监管得到加强。证券监管部门开展“解决同业竞争、减少关联交易冶专项活动,出台《上市公司现场检查办法》,将控股股东、实际控制人纳入检查范围,规范上市公司财务信息披露,强化创业板上市公司募集资金使用和高管减持行为监管。证券期货经营机构得到规范。强化证券公司合规管理和分类监管,督促证券公司建立信息隔离墙制度和压力测试制度,完善风险控制指标动态调整机制。",299.0
111,"支持符合条件的证券公司上市,鼓励设立直接投资、资产管理子公司。促进基金业创新发展,实施基金产品分类审核,稳步推进特定客户资产管理业务发展和基金销售机构专业化发展。开展第三方支付机构参与基金网上销售结算业务试点。推动基金公司、证券公司的香港子公司境外募集资金境内证券投资的试点工作。规范证券服务机构执业,制定《证券投资顾问业务暂行规定》和《发布证券研究报告暂行规定》,发布律师事务所证券法律业务执行规则。",201.0
112,"推进期货公司净资本监管和保证金监管。推行期货公司分类监管制度,完成分类评价工作。启动期货投资者保障基金筹集工作。研究期货公司开展创新业务试点方案。证券期货诚信监管取得突破。",86.0
113,"创新推出诚信监管与约束制度,建立完善全国统一的证券期货市场诚信档案,记录市场主体违法失信行为信息,大力推动部际诚信信息共享,实现诚信档案与人民银行征信系统成功联通,制定出台专门管理办法,把诚信记录与市场准入门槛和监管执法尺度挂钩,强化失信惩戒与约束。",125.0
114,"(五)对外开放不断推进,我国资本市场国际影响力得到提升2010年,新批合资基金管理公司2家,合资基金管理公司总数达37家,约占全部63家基金管理公司的58.7%。批准3家合资证券公司筹建,合资证券公司总数将达12家。新批13家合格境外机构投资者(QFII)资格,进一步扩大了境外中长期投资机构参与境内资本市场的资金规模。积极支持企业利用境外资本市场融资,2010年境外筹资超过353.8亿美元,达到历史第二高位。研究论证国际板建设总体方案,探索国际板建设的制度安排。",233.0
115,"二、稳健性评估(一)股票融资功能不断增强,社会融资结构进一步优化2010年,股票融资功能进一步强化,A股股票筹资总额达9672.29亿元,创历史新高。其中,首发筹资4882.63亿元,公开增发筹资377.15亿元,定向增发筹资2172.68亿元,配股筹资1438.25亿元,权证行权筹资84.28亿元,可转债筹资717.3亿元。股票融资功能的强化提升了我国直接融资比例,进一步优化了社会融资结构。(二)A股市场估值总体合理,但创业板高估值问题需关注2010年,A股市场估值水平总体合理。截至2010年年末,A股静态市盈率为20.09倍,较年初34.42倍的市盈率下降了41.63%。",291.0
116,"从细分市场来看,创业板上市公司的估值水平明显偏高。截至2010年年末,中小板、创业板静态市盈率分别为49.12倍、70.75倍。创业板公司的高市盈率通常可以用企业的高成长性来解释,但2010年上半年的财务数据并不支持这一点。2010年上半年,117家创业板上市公司的净利润为34.35亿元,扣除不具可比性的12家创业板公司,105家创业板上市公司净利润同比增长25.75%,与创业板上市公司2009年47.04%的增幅相比出现较大下滑,也低于全部A股上市公司2010年上半年46.48%的净利润增幅。从创业板上市公司2010年上半年净利润的增幅分布来看,增幅在30%以下的公司有61家,占比高达58.1%。",303.0
117,"由于创业板公司经营具有较高的波动性,业绩增速下滑的现象还有待进一步观察,但创业板高估值的问题值得关注。(三)证券公司抗风险能力增强,单一盈利模式有所改善截至2010年年末,全国106家证券公司净资产5664亿元,同比增长17%;净资本4319亿元,同比增长13%。全行业平均来看,每家证券公司净资本40.7亿元,净资本/各项风险资本准备之和为3.9倍,净资本/净资产为76%,净资本/负债为2.5倍,净资产/负债为3.3倍,按照剔除客户资金的资产和负债计算的资产负债率为23%。证券公司各项风控指标均符合监管规定,全行业流动性充足,负债水平较低,抵御市场风险能力较强。全行业全年实现营业收入1911.02亿元,同比下降6.8%。",314.0
