,paragraph,length
154,"专栏13我国债券市场创新2010年,面对复杂多变的宏观经济形势,人民银行在加强风险防范的基础上,大力推动银行间债券市场创新,有力支持了经济金融的发展。推动信用风险缓释工具试点。2010年10月,人民银行推动中国银行间市场交易商协会推出信用风险缓释工具。该工具具有交易结构简单、配置风险合理、市场透明度高、严格控制杠杆等特点。信用风险缓释工具的推出,顺应了我国金融市场发展的趋势,有利于丰富投资者的信用风险管理手段,完善债券市场信用风险分担机制,是由市场成员推动完成的一项重大创新,对推动我国金融市场的深化、维护金融体系的稳定具有重要的现实意义。",272.0
155,"正式启动超短期融资券发行试点。2010年12月,中国银行间市场交易商协会正式开始接受企业在银行间债券市场发行超短期融资券的注册。与其他债务融资产品相比,超短期融资券市场化程度高、适用性广,给予发行人和中介服务机构的选择空间较大,具有信息披露简洁、注册效率高、发行便利等特点。超短期融资券产品的推出进一步拓宽了大型企业直接债务融资渠道,可以推动企业提高流动性管理水平,丰富货币市场投资品种,满足投资者多元化需求,促进实体经济进一步增强利率政策敏感性,为进一步提高宏观调控有效性夯实基础。截至年末,超短期融资券累计发行金额150亿元。",265.0
156,"稳步扩大金融债券发行主体范围。为拓宽外资法人银行人民币资金筹集渠道,改善外资银行资产负债期限错配状况,核准外资法人银行在银行间债券市场发债筹资。拓宽金融租赁公司和汽车金融公司资金来源渠道,增强其支持中小企业融资和发展汽车消费信贷业务的能力。允许三类境外机构进入银行间债券市场进行投资试点。配合跨境贸易人民币结算试点,允许境外中央银行或货币当局、港澳人民币清算行、跨境贸易境外参加银行等三类机构进入银行间债券市场投资试点。",210.0
157,"为境外机构依法获得的人民币资金提供一定的保值渠道,有利于促进跨境贸易人民币结算业务的开展。(三)票据市场快速增长2010年,我国票据市场累计签发商业汇票11.95万亿元,比上年增长了16.36%;累计办理贴现48.64万亿元,比上年增长了1.1倍;累计办理再贴现1671亿元,比上年增长了5.7倍。截至2010年年末,未到期商业汇票余额为5.61万亿元,比上年增长了35.8%;票据贴现余额为1.48万亿元,比上年减少了32.4%;再贴现余额为791亿元,比上年增长了7.4倍。2010年,票据市场价格呈上升趋势,除年中出现峰值外,前十个月运行比较平稳,11月底开始较快上升。“工商银行票据转贴现价格指数冶年末报收3026点,较年初大幅上升2071点。",326.0
158,"上半年,市场资金面较宽裕,票据需求较强,转贴现利率低位平稳运行;下半年宏观政策和资金面出现调整,票据市场利率稳中见升。最后五周,由于跨年资金压力以及市场预期货币政策收缩等因素的共同影响,票据市场利率快速升高。(四)外汇市场波动幅度扩大2010年,人民币外汇即期市场平稳发展,远期市场大幅增长,掉期和“外币对冶交易规模快速扩张。全年人民币外汇即期成交额同比增长3.5%;人民币远期市场成交额同比增长234.5%。外币对即期市场交易趋于活跃,全年成交金额折合502亿美元,同比上涨44.4%;重启汇改后,人民币掉期交易增速明显放缓,特别是外汇管理局对银行按照收付实现制原则计算的头寸余额进行下线管理,给人民币外汇衍生品市场带来了结构性变化。",318.0
159,"全年人民币外汇掉期交易累计成交金额折合1.3万亿美元,同比增长60.1%。(五)黄金市场量价均创历史新高2010年,国际黄金价格持续上涨,11月初达到每盎司1421美元的历史最高价,年底收于每盎司1410.25美元,比年初上涨了25.75%。国内金价从年初的241.15元/克上涨至年底的301.17元/克,年底比年初上涨了24.89%,国内外黄金价差幅度较上年有所扩大。2010年,上海黄金交易所黄金成交6051.50吨,同比增加1340.68吨,增长28.46%;成交金额16157.81亿元,同比增加5869.05亿元,增长57.04%。白银成交73614.96吨,同比增加57367.17吨,增长353.08%;成交金额3863.28亿元,同比增加3276.70亿元,增长558.61%。",348.0
160,"二、市场融资情况2010年,债券发行规模稳步扩大,股票筹资规模创历史新高,国内非金融机构部门(包括住户、企业和政府部门)融资继续增加较多,融资结构呈明显多元化发展态势。(一)债券融资快速发展债券融资已成为我国直接融资的主渠道之一,债券市场的快速发展便利了企业债券融资,在国际金融危机期间对于国民经济稳定增长发挥了重要作用。在直接融资(不包括金融机构融资)中,债券融资的比重从2005年开始超过股票融资,2010年债券融资总额约为2万亿元,是股票融资的3.3倍,债券融资占直接融资的比重已经达到77%。2010年,债券发行利率总体有所走高。受两次上调存贷款基准利率和市场通货膨胀预期较强等影响,各期限债券发行利率均呈走高趋势。",312.0
161,"2010年12月发行的5年期记账式附息国债利率为3.64%,比上年末发行的同期限国债利率上升0.74个百分点;2010年11月发行的30年期国家开发银行固定利率债券利率为4.61%,比3月发行的同期限债券利率上升0.19个百分点。",115.0
162,"(二)政府融资市场化程度提高2010年,银行间债券市场通过市场化招投标方式发行记账式国债60期,共计1.5万亿元,期限从91天到50年,均衡覆盖了短期、中期和长期债券品种,期限结构进一步完整,促进了国债基准收益率曲线的改进与完善,为债券市场中其他各类债券合理定价提供了基础。",137.0
163,"截至2010年年末,国债余额6.7万亿元,约占债券市场债券存量的41.1%。此外,财政部通过市场化招投标方式全年代理发行地方政府债券2000亿元。由于采用市场化发行方式,2010年记账式国债与地方政府债券保持了较低的发行成本,为积极财政政策的顺利实施和国家宏观调控措施的落实奠定了基础。三、市场制度建设银行间实时收益率曲线正式发布。2010年2月,银行间同业拆借中心以基准债券为基础的实时收益曲线正式对外发布,实时曲线提供日内定价基准,可用于债券池选券、盘中债券估值和实时中后台风险控制等。",245.0
164,"修订《国际开发机构人民币债券发行管理暂行办法》。2010年9月,人民银行、财政部、发展改革委和证监会联合发布公告,对《国际开发机构人民币债券发行管理暂行办法》(以下简称《办法》)进行了修订,允许发行人将发债资金汇出境外使用,明确《办法》适用于多边、双边和地区国际开发性金融机构,并且调整了对发行人在会计准则、信用评级方面的要求。推动上市商业银行证券交易所债券交易试点。2010年10月,证监会、人民银行、银监会联合发布《关于上市商业银行在证券交易所参与债券交易试点有关问题的通知》,推动债券市场的互联互通,提高市场运行效率,促进债券市场健康协调发展。推出信用风险缓释工具试点。",288.0
165,"2010年下半年,《银行间市场信用风险缓释工具试点业务指引》发布,有利于丰富投资者的信用风险管理手段,完善债券市场信用风险分担机制。规范贷款转让市场。2010年9月,全国银行间市场贷款转让交易系统正式启动。作为首个全国统一的银行间信贷资产交易系统,有利于规范我国贷款转让市场发展,优化银行信贷结构、防范和化解潜在金融风险等,同时也丰富和发展了银行业金融机构满足资本约束要求、主动管理资产的产品与手段。推进人民币汇率机制改革。",212.0
166,"2010年6月,人民银行宣布进一步推动汇率形成机制改革,对人民币外汇市场影响明显。人民币升值速度明显,人民币汇率弹性增强,汇率波动幅度明显扩大。做市商在外汇即期市场依然占据主导地位,普通会员交易更加主动积极。加强黄金市场制度建设。2010年7月,人民银行会同有关部门发布《关于促进黄金市场发展的若干意见》,明确黄金市场发展定位,积极推进黄金市场交易方式、标准认定体系、仓储运输体系和清算服务体系建设。",200.0
167,"意见要求进一步完善黄金市场税收政策和外汇政策,切实做好黄金市场融资服务,拓宽黄金实物供给渠道,加强对黄金市场的监管,保护投资者利益,为维护黄金市场秩序,促进黄金市场健康发展奠定了基础。第六章政府、企业和住户财务状况2010年,政府部门财务状况良好,债务水平总体较低;企业部门盈利能力提高,偿债能力稳定;住户部门持有的金融资产继续增长,整体债务水平较低,违约风险较小。但需合理调整国民收入分配关系,逐步提高住户部门收入在国民收入分配中的比重。一、政府部门财政收入增速提高。2010年,全国实现财政收入83080亿元,同比增长21.3%,比上年提高9.6个百分点。",280.0
168,"从收入结构看,全年税收收入73202亿元,占同期财政收入的88%;非税收入9878亿元,占比12%。税收收入中,国内增值税、企业所得税和营业税是主要收入来源,全年分别征得21092亿元、12843亿元和11158亿元,占同期财政收入的25.4%、15.5%和13.4%,同比分别增长13.3%、7.9%和24.4%。全年非税收入同比增加881亿元,增长9.8%,增速比上年同期低17个百分点。财政支出增幅回落。2010年,全国财政支出89575亿元,同比增长17.4%,比上年回落3.8个百分点。",248.0
169,"在财政支出中位居前五位的项政府部门债务水平较低,但隐性负债问题值得关注。2010年,全国财政赤字10000亿元,占GDP比重为2.5%。年末,中央政府国债余额67685亿元,比上年增加9735亿元,增长16.8%,国债余额占GDP的比重为17.01%。总的来看,政府部门名义债务余额占GDP比重不高,但隐性负债规模较大,主要表现为:大型金融机构改革过程中形成的一些共管基金;一些政策性或准政策性金融机构大量发债;一些政企不分的部门负债较高,如铁道部的债务余额较大;医疗、养老等社会保障存在缺口。同时,地方政府的隐性负债问题也不容忽视,2010年,地方融资平台贷款继续保持快速增长,贷款余额占同期一般贷款的比重仍然较高,部分地方融资平台运作不够规范,在经济结构调整步伐加快的背景下出现损失的可能性加大。",350.0
170,"此外,地方政府在社会保障资金和住房公积金等方面存在的欠账以及村镇债务等隐性负债问题,都增加了财政风险。二、企业部门(一)企业生产经营状况继续好转,盈利能力大幅提高企业销售收入增速继续回升。2010年1~11月,规模以上工业企业实现主营业务收入同比增长31.8%,增速较上年提高24.7个百分点。2010年,人民银行监测的5000户工业企业(以下简称5000户企业)实现销售收入同比增长20%,增速较上年提高21.3个百分点。企业盈利能力大幅提高。",223.0
171,"2010年1~11月,规模以上工业企业实现利润同比上升49.4%,增速比上年提高41.6个百分点。2010年,5000户企业利润总额同比增长32.1%,增速比上年提高11.2个百分点。企业营运能力有所改善。2010年,5000户企业营业周期为119.8天,较第一季度减少5.4天,同比减少6.3天。企业总资产周转率为0.9次,与第一季度和上年基本持平。",176.0
172,"(二)企业偿债能力提高,流动性较为充足企业偿债能力稳步提高。2010年11月末,规模以上工业企业资产负债率为58.8%,比去年同期下降0.5个百分点;年末,5000户企业资产负债率为60.2%,与上年末基本持平,资产负债率总体变化较小。利息保障能力增强,2010年年末,5000户企业利息保障倍数为7.3倍,比上年末上升1.2倍,企业长期偿债能力基本稳定。从短期偿债能力看,2010年年末,5000户企业流动比率为109.5%,速动比率为78.1%,分别比上年末提高6.5和4.6个百分点,短期偿债能力有所提高。企业流动性状况有所改善。",268.0
173,"从资产方来看,2010年年末,5000户企业流动资产占总资产比例为47.6%,较上年末提高1.8个百分点;其中,流动性较强的货币资金占比30%,流动性较弱的应收及预付款项和存货占比59.4%。从负债结构来看,5000户企业流动负债占负债总额比例为72.5%,其中,企业短期借款占流动负债比例为26.4%,应付及预收款占流动负债比例为46.3%。目前,对于全口径的规模以上工业企业效益数据,国家统计局只统计有1~2月、1~5月、1~8月、1~11月数据,对于其他月份和全年数据,只有22个省市的汇总数据;因此,此处仅以1~11月数据说明规模以上工业企业的生产经营情况。(三)企业成本有所上升,部分企业面临融资压力人民银行2010年第四季度企业家问卷调查结果显示,原材料购进价格指数出现明显上升,多数企业预期2011年原材料价格仍将震荡趋升,但涨幅可能趋小。由于市场竞争激烈,一些企业难以通过提高销售价格来覆盖成本的上升。",409.0
174,"同时,随着房地产调控的效果逐渐显现,预计房地产开发和住房消费相关企业生产经营状况将出现下滑。另据人民银行调查结果显示,大多数企业目前资金周转基本正常,资金状况总体良好。但受流动性持续收缩影响,信贷投放紧张,银行议价能力的提高以及企业资金需求的增加将导致企业融资成本上升,部分企业,尤其是小企业、微型企业、房地产企业将面临资金紧张。此外,随着经济结构调整步伐不断加快,企业在经营方式、盈利能力、财务管理和风险控制水平等方面的变化也应引起关注。三、住户部门(一)住户部门金融资产稳步增长,结构基本稳定住户部门金融资产稳步增长。",261.0
175,"住户部门金融资产稳步增长,2010年我国经济的快速复苏促进了居民收入的稳步增长,为居民金融资产增长奠定了物质基础。2010年第三季度末,我国住户部门金融资产达到48.2万亿元,同比增长17.4%,比2009年年末水平增长17.2%。从人均水平看,我国住户部门的金融资产规模仍处于较低水平。按期末汇率折算,2010年第三季度末,我国居民人均持有金融资产仅为5361美元,而美国、英国、德国、日本四国人均持有金融资产分别。为14.7万美元、10.8万美元、7.7万美元和13.6万美元。",241.0
176,"金融资产结构基本稳定。我国住户部门金融资产主要由存款、证券类资产和保险准备金构成。2010年资本市场波动导致证券类资产比重略有下滑,存款类资产比重上升,保险准备金比重基本稳定。2010年第三季度末,存款占住户部门金融资产比重为64%,比上年末下降1.4个百分点。证券类资产(包括国债、股票、证券投资基金份额)占比14.1%,与上年末基本持平。",171.0
177,"保险准备金在住户部门金融资产中的比重仍然较低。2004年到2010年第三季度末,保险准备金在我国住户部门金融资产中的比重虽然从7郾8%上升到11.3%,但是仍然低于发达国家20%以上的平均水平。(二)住户部门负债增长较快,贷款质量总体较好住户部门的负债增长较快。2010年第三季度末,我国住户部门金融负债达到10.9万亿元,比上年末增长31.2%,占GDP比重为27.4%,负债来源主要为银行贷款。从贷款期限看,短期贷款占比31.3%,中长期贷款占比68.6%。",231.0
178,"从金融资,2004年至2010年第三季度末,我国住户部门的金融资产负债率呈产负债率看小幅上升态势,但与发达国家同期30%左右的比率相比,仍处于较低水平。从居民负债与可支配收入比率看,相比发达国家普遍在100%以上的平均水平,我国住户部门负债占可支配收入的比率很低,2004~2008年该比率在30%~33%,住户部门整体上财务可持续性较强。住户部门贷款质量较好。近年来,我国个人贷款(不含个人经营性贷款)中的不良贷款余额和不良率连续“双降”。2010年年末,个人中的不良贷款余额822亿元,比年初减少616亿元;个人贷款不良率1%,比年初降低1个百分点,低于同期各项贷款不良率1.4个百分点。",296.0
179,"其中,个人住房按揭不良贷款余额210亿元,比年初减少61亿元;不良率0.4%,比年初下降0.2个百分点。汽车贷款不良率为1.4%,比年初下降1.4个百分点。个人信用卡不良贷款余额74亿元,比年初减少4亿元;不良率1.5%,比年初下降1.3个百分点。住户部门贷款质量总体良好,但应关注房地产价格变动可能对个人住房按揭贷款质量所产生的影响。专栏14国民收入分配结构分析近年来,政府、企业和住户部门收入大幅增加。",203.0
180,"其中,企业部门在初次分配中的收入增长最快,政府部门次之,住户部门最慢。国民收入的再分配并没有改变这种状况。政府和企业部门收入增长较快。2000~2008年,政府和企业部门初次分配收入的年均增速分别是15.8%和20.2%。2008年,政府和企业部门的初次分配收入分别是5.5万亿元和8万亿元,占国民总收入的17.5%和25.3%,比2000年低0.2和高6.3个百分点。",185.0
181,"住户部门收入占比持续下降。2000~2008年,住户部门初次分配收入年均增速14.4%。2008年,住户部门的初次分配收入为18.1万亿元,占国民总收入的57.2%,比2000年低6.2个百分点。再分配调整未缓解收入分配不均衡状况。2000~2008年,政府、企业和住户部门再分配收入(可支配收入)的年均增速分别是17.5%、20.0%和14.3%。",175.0
182,"其中,政府部门可支配收入的年均增速高于初次分配收入年均增速1.7个百分点,企业和住户部门可支配收入的年均增速分别低于初次分配收入年均增速0.2和0.1个百分点。政府和住户部门的再分配收入平均占比分别高于初次分配占比2.7和0.2个百分点,均来自企业部门。再分配收入中,政府部门占比大幅提高,住户部门占比基本持平,说明在利用转移支付机制改善全社会收入分配结构的过程中,收入主要从企业部门流入了政府部门,在提高住户部门收入方面作用不显著。今后,应合理调整国民收入分配关系、逐步提高住户部门收入在国民收入中的比重。这是有效扩大内需、优化国民经济结构的基本战略,从长远看,有助于为金融体系稳健发展奠定坚实基础。",301.0
183,"第七章金融基础设施2010年,我国金融基础设施建设稳步推进,支付体系建设取得显著成效,金融法律体系进一步完善,会计领域改革和会计标准国际趋同取得重要进展,信用环境不断改善,反洗钱工作有效性持续提升,为金融业稳健运行提供了有力支撑。",115.0
184,"一、支付体系(一)支付体系建设取得显著成效支付系统不断完善,运行安全平稳。",37.0
185,"一是银行间市场清算所加入支付系统,大额支付系统对金融市场的基础作用增强;开通港澳两地人民币清算行之间人民币资金汇划业务,推动人民币跨境结算与境外结算。",75.0
186,"二是集中代收付中心和中国银联接入小额支付系统,进一步为零售支付市场提供结算服务。",40.0
187,"三是开展应对会计集中核算系统(ABS)故障的应急演练,推广数据异地备份。",36.0
188,四是网上支付跨行清算系统成功上线运行。,19.0
189,"五是严格支付系统监督管理,全面加强对支付系统参与者的日常监督,评估并完善支付清算系统应急预案,确保支付体系安全平稳运行。2010年,全国各类支付系统共处理人民币支付业务120.04亿笔,金额1663.86万亿元,同比分别增长36.1%和37.8%。非现金支付工具创新发展,风险管理得到加强。电子商业汇票系统在全国范围内推广。通过推广支票授信业务,改善支票流通环境。",182.0
190,"中职学生资助卡广泛运用,公务卡试点推广,银行卡使用环境进一步改善。加强银行卡安全管理,人民银行会同有关部门对银行卡风险管理情况进行检查督导,敦促商业银行清理不合格持卡人和特约商户,开展了银行卡犯罪专项打击行动。非金融机构支付服务管理加强,支付机构监管取得重大突破。人民银行开展特定非金融机构登记,全面摸清了非金融机构从事支付业务的现状。发布《非金融机构支付服务管理办法》及其实施细则,进一步明确非金融支付服务机构申请开办支付业务的程序,在支付服务市场的监管方面取得重大突破。",237.0
191,"专栏15非金融机构支付业务监督管理非金融机构从事支付业务是网络信息和通信技术快速发展、支付服务市场分工不断细化的产物。在我国,多数非金融机构主要从事互联网支付、手机支付、电话支付以及发行预付卡等业务。非金融机构支付服务丰富了服务方式,拓展了支付业务的广度和深度,推动了支付服务市场主体的多元化发展,满足了电子商务企业和个人的支付需求,促进了支付服务效率的提高。随着非金融机构支付服务范围和规模的不断扩大,一些不规范行为和风险隐患逐渐暴露,主要存在客户备付金权益保障、预付卡发行和受理、反洗钱义务履行以及无序竞争等问题。为了更好地满足社会经济活动对支付服务的需求,防止不正当竞争,保护当事人的合法权益,维护支付服务市场稳定运行,人民银行作为我国支付体系的法定监督管理者,按照“结合国情、促进创新、市场主导、规范发展冶的指导思想,大力推进支付服务市场相关制度建设,强化对非金融机构支付服务的监督管理,防范风险。",403.0
192,"2009年4月,人民银行发布公告,明确对我国境内从事支付业务的非金融机构实行登记。2010年6月,人民银行发布《非金融机构支付服务管理办法》(以下简称《办法》),明确了支付机构行政审批程序,强化了人民银行对非金融机构支付服务的监管职责,明确了支付机构的市场准入资质要求,强调非金融机构必须依法取得《支付业务许可证》后方可提供支付服务。同时,人民银行还研究落实非金融机构支付业务配套制度文件。《办法》强调了客户备付金的安全管理要求。规定支付机构接受的客户备付金不构成支付机构的自有财产,不得以任何形式挪用客户备付金;支付机构应将在同一商业银行专户存放客户备付金;支付机构的实缴货币资本不得低于客户备付金总量的10%等。",308.0
193,"《办法》还明确了支付机构支付业务的规范经营要求,包括支付机构应按核准范围从事业务、报备与披露业务收费情况、制定并披露服务协议、核对客户身份信息、执行实名制规定、保守客户商业秘密、保管业务及会计档案等资料、规范开具发票、履行反洗钱义务等。",118.0
194,"《办法》平等适用于在我国境内从事支付业务的非金融机构,包括《办法》实施前未经批准但已从事支付业务的非金融机构,以及拟于《办法》实施后申请从事支付业务的非金融机构。为确保支付服务的稳定运行,允许《办法》实施前未经批准但已从事支付业务的非金融机构可在《办法》实施后1年内依法取得《支付业务许可证》。逾期未能取得《支付业务许可证》的,将不得继续从事支付业务。截至2010年11月登记工作结束之日,共有370多家非金融机构法人向人民银行提交了支付业务登记材料。目前,相关审批工作正在进行中。",241.0
195,"农村支付环境取得新进展,服务水平显著提高。人民银行设置了山东寿光等10个农村支付服务环境建设联系点,探索不同地域、不同经济发展水平下农村支付服务环境建设模式。截至2010年年末,全国145个农村支付服务环境建设省级示范县中,单位结算账户和个人结算账户分别超过100万户和1.6亿户;人均持卡量超过1张,同比增长超过30%;持卡消费总额近2000亿元,同比增长50%。账户管理不断完善,金融账户实名制进一步落实。《境外机构人民币银行结算账户管理办法》的发布规范了境外机构开立和使用人民币银行结算账户的行为。",252.0
