,paragraph,length
0,"中国金融稳定报告2011内容摘要2010年是国内外经济金融形势复杂多变的一年,全球经济持续复苏,但各经济体表现不均衡。中国经济继续朝宏观调控的预期方向发展,金融业改革成效显著,整体抗风险能力进一步增强,金融市场平稳健康发展,政府、企业和住户部门财务状况总体较好,金融基础设施建设稳步推进,金融体系稳健运行。同时,全球经济不稳定、不确定因素仍然较多,欧元区主权债务危机持续产生负面影响,国际金融市场持续震荡,大宗商品价格高位运行,国内通货膨胀压力明显加大,金融体系潜在风险仍然存在,维护金融稳定面临新的挑战。宏观经济总体良好。2010年,我国继续实施积极的财政政策和适度宽松的货币政策,经济实现平稳较快增长,经济结构进一步优化。",313.0
1,"国内需求增长动力强劲,外部需求逐步改善。财政收入增速较快,用于民生和“三农冶的财政支出大幅增加。物价上涨较快,通货膨胀预期增强。房地产市场调控力度加大,房价涨势趋缓。货币信贷逐步向常态回归,汇率形成机制改革进一步推进。",109.0
2,"当前,我国经济运行中一些长期问题和短期问题交织,体制性矛盾和结构性矛盾并存,宏观调控难度加大。下一阶段,要实施积极的财政政策和稳健的货币政策,注重从社会融资总量的角度衡量金融对经济的支持力度,加快构建逆周期的金融宏观审慎管理制度框架,加快转变经济发展方式,提升经济增长内生动力。银行业认真贯彻宏观调控政策,继续优化信贷结构,整体运行稳健。金融机构资产负债规模持续扩大,资产质量不断提高,拨备覆盖率高位提升,资本充足水平保持稳定,中间业务收入绝对量大幅增加,存贷比与上年基本持平,流动性较为充足。金融机构改革成效显著,综合经营和金融创新取得新进展。",273.0
3,"银行业信贷总量和结构日趋合理,涉农贷款和小企业贷款占比有所提高。稳健性标准和监管水平进一步提升,风险管理和危机应对能力显著增强。但存款活期化和贷款长期化趋势明显,期限错配风险有所加大,贷款集中度较高的问题仍然存在,风险管控仍需进一步加强。下一阶段,要落实好稳健的货币政策,继续深化改革,加强宏观审慎管理,强化杠杆率监管,完善资本补充和约束机制,着力防范和化解重点领域潜在风险,全面提升银行业综合实力和整体抗风险能力。证券期货业健康发展,证券经营机构稳健运营,股票市场规模稳步扩大,融资功能显著增强。",249.0
4,"股指期货顺利推出,融资融券业务试点启动,新股发行体制改革继续深化,期货市场功能不断完善。合规监管得到强化,市场主体规范发展,防范和打击内幕交易初见成效。但随着新业务、新产品的推出和发展,应关注创业板高估值、证券公司盈利模式相对单一及私募基金的潜在风险等问题。下一阶段,要继续推进市场机制建设,进一步加强监管,强化投资者保护,扩大直接融资规模,稳步推进资本市场创新,促进资本市场更好地服务经济社会发展全局。保险业继续保持良好的发展势头,资产规模继续扩大,保费收入大幅增长,经营体系更加健全,保险覆盖面不断扩大,监管进一步加强,基础性制度建设取得新进展。",275.0
5,"保险公司偿付能力整体充足,保险市场结构进一步优化。但保险业资金运用收益率下降,保险公司资本补充渠道仍较狭窄,产品结构不均衡有所加剧,银保渠道有待继续改善。下一阶段,要抓住保险业快速发展机遇期,推动业务结构调整和产品创新,加快建立巨灾保险体系,建立多渠道资本补充机制,强化偿付能力监管,提高资金运用水平,防范投资风险,规范市场秩序,更好地发挥经济补偿和社会风险管理功能。金融市场保持平稳健康发展,充分发挥了改善融资结构和完善资源配置的基础性作用。货币市场保持活跃,市场利率明显上升。",240.0
6,"债券市场规模进一步扩大,债券成交量大幅增加,债券价格呈总体上行趋势。票据市场快速增长,外汇市场波动较大,黄金市场量价大幅攀升。融资结构多元化发展,政府融资市场化程度提高。市场基础性制度建设取得积极进展,银行间实时收益率曲线正式发布,国际开发机构人民币债券发行管理得到加强,信用缓释工具试点顺利推出,银行间贷款转让市场和黄金市场进一步规范。政府、企业、住户财务状况表明,政府债务水平总体良好,财政赤字和国债占GDP的比重较低。",212.0
7,"企业部门生产经营状况持续好转,盈利能力大幅提高,偿债能力稳步提升,流动性状况有所改善。住户部门金融资产和负债规模增长较快,负债占GDP的比重有所增加。但政府部门隐性负债问题和部分企业面临的融资压力值得关注,国民收入分配结构仍需改善,住户部门收入在国民收入中的比重有待提高。金融基础设施建设稳步推进。支付体系不断完善,非现金支付工具创新发展,非金融机构支付服务管理不断加强,农村支付环境取得新进展;金融业法律法规不断建立健全,金融运行的法律基础进一步强化;新会计准则全面实施,会计标准国际趋同取得重要进展;信用环境不断改善,征信系统作用日益显著,中小企业和农村信用体系建设取得积极成效;国家洗钱风险评估首次开展,反洗钱监管进一步加强,国际合作推向深入。",325.0
8,"下一阶段,应进一步建立健全支付结算制度,完善金融法律体系,加快会计标准建设,优化社会信用环境,提高反洗钱力度和成效。探索建立金融宏观审慎管理制度框架。建立逆周期资本缓冲和强化系统重要性金融机构(SIFIs)监管等内容在危机后取得积极进展。我国“十二五冶规划明确提出,要构建逆周期的金融宏观审慎管理制度框架,需要处理好促进金融体系稳定与影响金融体系效率、宏观审慎管理与微观审慎监管及货币政策、宏观审慎管理与会计标准之间的关系,建立逆周期的宏观调控机制,降低系统性金融机构风险,加强金融统计和系统性风险监测预警体系建设,建立健全危机管理和系统性风险处置框架。构建我国宏观审慎管理制度框架,对于熨平经济周期性波动,防范系统性风险,维护金融稳定,提升金融支持经济增长的可持续性具有重要的现实意义。",344.0
9,"第一章宏观经济2010年是国内外经济金融形势复杂多变的一年。全球经济持续复苏,但各经济体复苏不均衡,主要发达经济体复苏动力不强,失业率仍处高位,新兴市场经济体增长强劲,但面临的资本流入及通货膨胀压力上升。中国经济继续朝宏观调控的预期方向发展,运行态势总体良好,但通货膨胀压力明显增大,结构性矛盾仍未根本解决。2011年,世界经济有望继续增长,新兴经济体仍将引领全球经济复苏,国内经济保持平稳较快增长存在较多有利条件,但不稳定、不确定因素仍然较多。发达经济体高失业和低增长状况短期内难以得到明显改观。",249.0
10,"国内经济结构调整压力加大,资源环境约束强化,改善民生任务艰巨,需要进一步增强经济发展的协调性、可持续性和内生动力。一、2010年全球经济金融形势2010年,全球经济持续复苏,全年经济增长率为5.0%。但各经济体表现不均衡,其中发达经济体与新兴及发展中经济体分别增长3.0%和7.3%。国际金融市场持续震荡,股票市场出现分化,大宗商品价格高位运行。(一)主要经济体经济形势美国经济出现积极迹象,但阻碍经济复苏的因素仍未消除。",211.0
11,"2010年美国GDP增长2.8%,与2009年的负增长2.6%形成鲜明对比。全年失业率为9.6%,CPI同比上涨1.6%,为近两年最低值。但美国经济在逐渐好转的同时,仍存在不确定性:一是债务问题和贸易逆差仍较突出。2010财年联邦赤字接近1.3万亿美元,多个州政府面临财政困境。全年贸易赤字为4978亿美元,同比增长32.8%。",164.0
12,二是量化宽松政策加剧了市场对美元贬值和中长期通货膨胀预期的担忧。,32.0
13,"三是失业率仍处高位,经济在短期内尚难摆脱“无就业复苏冶问题。",30.0
14,"四是银行和住户部门去杠杆化的过程仍在持续,房地产市场仍较低迷,房屋止赎率居高不下,实体经济复苏动力不足。欧元区各成员国经济表现分化明显,主权债务危机可能继续拖累整体经济复苏。2010年,欧元区GDP增长1.7%,相比2009年增速明显回升,但各国经济表现分化明显。德国经济复苏远好于其他欧元区国家,成为带动欧元区复苏的主要动力。2010年德国GDP增长3.5%,失业率降至6.9%,均为1991年以来最好水平。其他欧元区国家复苏乏力,法国、意大利缓慢复苏,GDP分别增长1.5%和1.3%;希腊、爱尔兰和西班牙等国家则因债务危机而陷入负增长。全年欧元区通货膨胀率为1.6%,明显高于上年0.3%的水平。欧元区未来经济复苏趋势将主要受两方面因素的影响:一是欧元区采取的一系列财务整顿和危机救助措施虽然有助于稳定欧洲金融市场,但引发主权债务危机的深层次问题并未得到根本解决,市场信心仍较脆弱,欧洲主权债务危机的下一步走向尚待观察。",413.0
15,"二是通货膨胀和加息预期可能影响经济复苏前景。日本通货紧缩和就业状况无明显改善,增长动力减弱。2010年,日本GDP增长3.9%。通货紧缩仍然存在,核心CPI同比下降1%,为连续第二年负增长。失业率仍然较高,全年平均失业率为5.1%,与上年持平。",122.0
16,"政府债务持续攀升,2010年年末,国家债务余额达919万亿日元,占GDP的比重超过190%,创历史新高。此外,消费增长乏力、出口增速放缓、日元升值等问题也会对日本经济复苏形成压力。新兴经济体总体复苏强劲,但面临的资本流入风险和通货膨胀压力上升。2010年以来,受国内需求增长及大宗商品价格企稳回升影响,亚洲、拉丁美洲等地区的新兴及发展中经济体复苏强劲,成为拉动全球经济增长的主要动力。2010年,印度、巴西、俄罗斯全年经济增长分别为10.4%、7.5%、4.0%。",232.0
17,"同时,由于全球流动性持续过剩和发达经济体复苏乏力,套利资本大量流入经济增长相对强劲、利差较大的新兴经济体,加剧了新兴市场股票、房地产等资产价格的上涨压力及货币升值压力。资本流入还加大了新兴市场的输入性通货膨胀压力,印度、巴西和俄罗斯全年CPI涨幅分别达到13.2%、5.0%和6.9%。为防止经济过热和抑制通货膨胀,部分新兴经济体率先进入加息周期,经济增速有放缓迹象。专栏12010年全球主要经济体经济刺激政策动向2010年以来,各主要经济体在经济刺激政策方面呈现明显差异。美国和日本相继出台了新一轮的财政货币刺激政策;欧洲国家在维持宽松货币政策的同时,加大了财政整顿力度;部分国家加快了经济刺激政策退出步伐。",305.0
18,"美国政府推出新的经济刺激计划,美联储出台第二轮量化宽松政策(QE2)。2010年9月,为刺激经济和就业增长,奥巴马政府宣布推出新一轮总额达3500亿美元的经济刺激计划,主要用于增加基础设施投资、减免个人所得税和研发企业税收。12月,美国国会通过了奥巴马政府提出的总额为8580亿美元的税收法案,再次将减税作为推动经济增长的引擎。11月3日,美联储决定继续将联邦基金利率维持在0~0.25%的历史最低水平,同时宣布在2011年第二季度末之前再购买6000亿美元的长期国债,并表示将把到期的抵押贷款担保证券所得用于国债再投资。日本政府进一步加大经济刺激力度,日本银行时隔四年后重启零利率政策。",294.0
19,"2010年9月和10月,日本政府先后两次出台经济刺激计划,总额接近6万亿日元,主要用于加强就业与人才培养、推进增长战略、支持绿色产业和小型企业发展等方面。为应对通货紧缩和日元升值,日本银行于10月5日决定将银行间无担保隔夜拆借利率从0.1%降至0~0.1%,同时宣布了规模达5万亿日元的资产购买计划。日本银行还把对商业银行的固定利率资金供给规模提高到30万亿日元,并于9月15日进行了大规模的外汇市场干预以阻止日元大幅升值。欧洲推迟退出非常规的货币政策,并加强财政整顿。2010年,为应对债务危机,欧洲中央银行继续将主要再融资利率维持在1%的历史低位,并通过再融资操作、证券市场计划等措施向市场提供流动性支持。",305.0
20,"英格兰银行继续维持0.5%的短期利率水平和2000亿英镑的资产购买规模不变。为提高财政可持续性,欧盟推动建立惩罚机制,要求各成员国加强财政整顿,以达到《稳定与增长公约》的相关要求;同时,为防止债务危机蔓延,欧盟出台了7500亿欧元的救助计划,推动建立欧洲金融稳定基金(EFSF)、欧洲金融稳定机制(EFSM)以及永久性的欧洲稳定机制(ESM)。欧洲主要国家相继推出大规模的财政整顿计划,以降低政府债务和赤字水平。欧盟、欧洲央行、国际货币基金组织(IMF)等与希腊和爱尔兰政府先后达成1100亿欧元和850亿欧元的救助方案,在一定程度上稳定了欧洲金融市场。部分经济复苏强劲、通货膨胀压力较大的经济体逐步加快了经济刺激政策的退出步伐。",315.0
21,"2010年,部分新兴经济体和资源型经济体为控制通货膨胀率先进入加息周期,印度、巴西、韩国、加拿大、澳大利亚等经济体为抑制通货膨胀多次提高基准利率。印度通过调高消费税、恢复成品油关税等措施逐步退出财政刺激政策。巴西、韩国、印度尼西亚、泰国、马来西亚等新兴经济体加强资本流入管制和外汇市场干预。新加坡、中国香港、澳大利亚等经济体则强化了对房地产市场的税收和信贷政策调控。(二)国际金融市场形势外汇和债券市场波动明显。",206.0
22,"2010年,受欧洲主权债务危机和美国第二轮量化宽松政策等因素影响,主要货币汇率宽幅震荡。全年欧元对美元贬值6.7%,日元对美元升值14.5%,美元广义贸易加权指数累计贬值2.4%。为防止本国货币过度升值,多个国家先后加强了外汇市场干预和资本流入管制。同时,随着欧洲主权债务危机形势不断变化、全球经济复苏前景逐渐改善,主要国债收益率先降后升且大幅波动。截至12月31日,美国、欧元区和日本的10年期国债收益率分别收于3.36%、2.97%和1.12%,较上年末分别下跌0.43个、0.41个和0.17个百分点,但较上季度末分别上升0.85个、0.71个和0.18个百分点。",285.0
23,"主要股指走势出现分化。2010年,受美联储第二轮量化宽松政策、经济数据转好、上市公司盈利水平改善等利好因素带动,美国股市震荡上扬。截至12月31日,道琼斯指数收于11578点,较上年末上涨10.9%,恢复至2008年9月雷曼公司破产前水平。受经济复苏乏力、债务危机和日元升值等不利因素影响,欧洲和日本股市表现相对疲弱,欧元区STOXX50指数年末收于2601点,较上年末上涨0.85%;日经225指数年末收于10229点,较上年末下跌3.0%。主要新兴市场股市分化明显,俄罗斯蓝筹MICEX指数上涨22%,印度孟买BSE指数上涨17%;而巴西BOVESPA指数下跌1%,中国上证指数下跌14.3%。",299.0
24,"大宗商品价格持续走高。2010年,受全球经济复苏带动需求回升、流动性过剩以及通货膨胀预期强化等因素影响,国际原油和贵金属价格大幅上涨。12月31日,纽约国际原油期货收于每桶91.38美元,比上年末上涨15.1%;布伦特原油现货收于每桶94.63美元,比上年末上涨21.5%。伦敦贵金属交易所黄金现货价格收于每盎司1410.3美元,比上年末上涨27.7%,为2007年以来最大升幅。铜、锡、镍等主要金属期货价格也分别出现30%~60%的大幅上涨。",222.0
25,"此外,受全球需求回升和俄罗斯、巴西、澳大利亚等国极端灾害天气影响,主要农产品价格大幅上扬,全球小麦、稻米、玉米等谷物价格都创下金融危机以来的最高水平。二、2010年中国经济金融运行特点2010年,面对国内外复杂多变的形势,我国继续实施积极的财政政策和适度宽松的货币政策,在保持政策连续性和稳定性的同时,提高针对性和灵活性,根据形势发展要求逐步引导货币条件向常态回归。总体来看,我国经济向着宏观调控的预期方向发展,经济平稳较快增长的态势进一步巩固。(一)经济平稳较快增长,结构进一步优化据国家统计局初步核算,2010年我国GDP达到39.80万亿元,同比增长10.3%,增速比上年加快1.1个百分点。分季度看,各季度GDP分别增长11.9%、10.3%、9.6%和9.8%。",336.0
26,"分产业看,第一产业增加值4.05万亿元,增长4.3%;第二产业增加值18.65万亿元,增长12.2%;第三产业增加值17.10万亿元,增长9.5%。从各产业增加值占国内生产总值的比重看,经济结构进一步优化。第一产业为10.2%,比上年下降0.4个百分点;第二产业为46.9%,比上年略升0.1个百分点;第三产业为43%,比上年上升0.8个百分点。(二)国内需求增长动力强劲,外部需求明显改善2010年,全社会消费品零售总额为15.5万亿元,比上年增长18.4%;扣除价格因素,实际增长14.8%。其中,城镇消费品零售额13.4万亿元,增长18.8%;乡村消费品零售额2.1万亿元,增长16.1%。",298.0
27,"全年全社会固定资产投资27.8万亿元,比上年增长23.8%。其中,城镇固定资产投资24.1万亿元,增长24.5%;农村固定资产投资3.67万亿元,增长19.7%。随着全球经济逐步复苏,我国外需环境逐步改善。2010年进出口总额2.97万亿美元,比上年增长34.7%。其中,出口1.58万亿美元,增长31.3%;进口1.4万亿美元,增长38.7%;全年实现贸易顺差1831亿美元,比上年下降6.4%。",199.0
28,"初步测算,2010年内需(资本形成和最终消费)带动GDP增长9.5个百分点,净出口带动GDP增长0.8个百分点,内外需在拉动经济增长中的作用更趋平衡。专栏2人民币跨境贸易结算试点和跨境投融资个案试点稳步推进2010年,人民银行会同有关部门采取灵活有力的措施,积极开展人民币跨境贸易结算试点和跨境投融资个案试点,有力地促进了贸易和投资便利化。跨境贸易人民币结算试点工作取得突破性进展。2010年6月,《关于扩大跨境贸易人民币结算试点工作有关问题的通知》发布,将跨境贸易人民币结算试点地区由上海市、广东省的4个城市扩大到北京、天津等20个省(区、市),有力推动了跨境贸易人民币结算业务的开展。全年结算量累计达5063.43亿元,其中货物进出口人民币结算量4380亿元,占同期进出口总额的2.2%。",346.0
29,"境内先期开展试点的广东、上海地区结算量较大,占结算量总额的50%以上,8个边境省(区)的结算量占比为7.84%。截至2010年年末,与境内发生人民币实际收付业务的境外国家和地区达92个。人民币跨境投融资个案试点稳步进行。为配合跨境贸易人民币结算试点工作,支持企业“走出去冶领域的大型项目,人民银行开展了人民币跨境投融资个案试点,以服务于实体经济为重点,加强交易真实性审核,严格防控风险。2010年,各试点地区共办理人民币跨境投融资交易386笔,金额为701.70亿元。",234.0
30,"2010年10月,新疆率先开展跨境直接投资人民币结算试点。人民币跨境使用配套措施逐步完善。2010年3月,人民银行发布《人民币跨境收付信息管理系统管理暂行办法》,保障人民币跨境收付信息管理系统(RCPMIS)的平稳、有效运行。8月,人民银行发布《境外机构人民币银行结算账户管理办法》,允许非居民账户用于各类现行制度允许的跨境人民币业务结算,为跨境人民币结算提供了新的结算渠道,也增加了间接调控境外人民币资金流向和价格的工具。当月,人民银行还发布《关于境外人民币清算行等三类机构运用人民币投资银行间债券市场试点有关事宜的通知》,为境外机构依法持有的人民币提供了合理的保值渠道,有助于增强人民币在境外的接受度和认可度,扩大人民币在跨境贸易和投资中的作用。",325.0
31,"(三)财政收入增速较快,财政支出增幅回落2010年,在经济平稳较快发展、物价上涨等因素综合作用下,财政收入总体增长较快。全国财政收入8.31万亿元,同比增加1.46万亿元,增长21.3%,增速比上年高9.6个百分点。其中,全年财政收入超过预算9150亿元,主要原因在于年初收入预算所依据的相关经济指标表现超越预期。同时,全国财政支出8.96万亿元,增长17.4%,增速比上年低4.5个百分点。但是用于民生和“三农冶的支出仍有较大程度增长,其中用于与人民群众生活直接相关的教育、医疗卫生、社会保障和就业、住房保障等方面的民生支出合计8898.54亿元,增长19.9%;用于“三农冶的支出合计8579.7亿元,增长18.3%。",311.0
32,"(四)物价指数持续上升,通货膨胀压力加大2010年,CPI总体呈现上行态势,尤其是第三季度后上行速度有所加快。各季度CPI分别为2.2%、3.1%、3.4%和4.7%,全年CPI为3.3%。其中食品和居住价格是带动CPI上涨的主要因素,分别上涨了7.2%和4.5%,进入第四季度后非食品价格上涨幅度也有所上升。PPI同比上涨5.5%,比上年高10.9个百分点;原材料、燃料、动力购进价格同比上涨9.6%,比上年高17.5个百分点。GDP平减指数变动率为5.8%,比上年高6.4个百分点。",243.0
33,"物价指数持续上升,主要是由于金融危机爆发以来,全球货币条件总体相当宽松,主要经济体继续保持宽松货币条件刺激经济的预期强烈,大量资金流入经济增长较快的新兴经济体。在流动性充裕的大背景下,随着经济逐步企稳回升,容易形成持续的通货膨胀预期,富余资金必然寻找各种途径和出口。同时,受巴拉萨—萨缪尔森效应及劳动年龄人口增长趋缓等因素影响,劳动力成本趋升,农产品、服务业等包含人工成本较高的商品价格上涨压力加大,资源性产品价格也有待理顺,这些也加大了价格上行压力。人民银行2010年第四季度城镇储户问卷调查显示,居民对物价满意度为1999年第四季度以来的最低,居民未来物价预期指数升至81.7%,较上季度提高了8.5个百分点,预测下季度物价上涨的居民比例较上季度提高了15.2个百分点,预期未来房价上涨的居民占比也较上季度再次上升6.8个百分点。“巴拉萨—萨缪尔森冶(Balassa-Samuelson)效应描述了这样一类经济现象:一国经济由可贸易部门(如一般工业制造品等)和不可贸易部门(如房地产、服务业等)组成。",452.0
34,"可贸易部门生产率提升的速度一般比不可贸易部门快,因此其工资水平通常会高于不可贸易部门。但随着部门之间劳动力流动,不可贸易部门工资也随之增长,从而超过其生产率上升的速度,使得不可贸易商品价格上涨。经济学家以此来解释发达经济体和经济增长较快国家的住房、餐饮及人工服务价格比相对落后国家更贵的原因。(五)房地产市场调控力度加大,房价涨势趋缓2010年,针对部分城市房价上涨过快问题,国家加大房地产市场调控力度。1月,《关于促进房地产市场平稳健康发展的通知》发布,在鼓励和支持居民合理住房消费的同时,抑制投资投机性购房。",256.0
35,"4月,《国务院关于坚决遏制部分城市房价过快上涨的通知》发布,要求商业银行对贷款购买第二套住房的家庭,严格执行首付款比例不低于50%、贷款利率不低于基准利率1.1倍的规定;针对商品住房价格过高、上涨过快、供应紧张的地区,商业银行可根据风险状况,暂停发放购买第三套及以上住房贷款。",138.0
36,"9月,人民银行、银监会发布《关于完善差别化住房信贷政策有关问题的通知》,要求商业银行暂停发放第三套及以上住房贷款。12月,中央经济工作会议召开,提出要强化政府责任,加大保障性安居工程建设力度,加快棚户区和农村危房改造,大力发展公共租赁住房,逐步形成符合国情的保障性住房体系和商品房体系,着力保障和改善民生。一系列调控措施的出台,对于抑制投机需求、控制部分城市房地产价格过快上涨起到了积极作用。2010年,全国商品房销售面积增长10.1%,比上年回落32个百分点;商品房销售额增长18.3%,比上年回落57.2个百分点。房屋销售价格涨幅放缓。",270.0
