,paragraph,length
191,"二是国际金融危机爆发后,美国高失业率和居民收入下降导致税收增长缓慢,而财政支出由于应对危机(救助金融机构和刺激经济)、人口老龄化、医疗保障水平和范围的提高而快速增长。与欧洲相比,美国主权债务形势相对稳定,但潜在风险仍需关注。短期内,由于美国具有美元储备货币地位和国际金融中心的优势,加上欧债危机使得美国国债能保持对投资者的吸引力,美国主权债务风险不大。但就中长期而言,美国如果不进行根本性财政改革并采取有力的财政整顿措施,其债务水平将持续上升,进而陷入财政不可持续的境地。二、企业部门(一)企业利润增速下降,营业周期延长主营业务收入增速回落。",271.0
192,"2011年,规模以上工业企业主营业务收入同比增长27.2%,增速同比下降4.6个百分点。人民银行监测的5000户工业企业(以下简称5000户企业)主营业务收入同比增长12.5%,增速同比下降16.1个百分点;工业总产值(现价)同比增长11.6%,增速同比下降16.6个百分点。利润总额同比增速明显下降。2011年,全国规模以上工业企业利润总额同比增长25.4%,增速同比下降24个百分点。5000户企业利润总额同比增长3.4%,增速同比下降40.7个百分点。",229.0
193,"企业资产周转率小幅下降,营业周期延长。2011年5000户企业存货周转率为5.6次,同比下降0.2次。其中,产成品周转率为21.5次,同比下降1.2次;原材料周转率为14.7次,同比下降0.3次。总资产周转率为0.93次,同比下降0.3次。2011年,5000户企业的营业周期为122.8天,同比增加8.2天。",155.0
194,"(二)企业偿债能力高位回落,流动性有所趋紧企业偿债能力高位回调,资产负债率小幅上升。2011年末,5000户企业的流动比率为106.7%,同比下降0.6个百分点;速动比率为76.3%,与上年基本持平。利息保障能力下降,年末,5000户企业利息保障倍数为6.5倍,同比下降1倍,企业偿债能力下降。企业资产负债率上升至61%,同比上升0.8个百分点。货币资金增速回落,应收账款净额增长较快。",193.0
195,"2011年末,5000户企业货币资金同比增长10.3%,增速同比下降8.5个百分点。其中,大型企业增长11.3%,增速同比下降6.5个百分点;中型企业增长4.6%,增速同比下降20.6个百分点;小型企业增长6.6%,增速同比下降18.4个百分点。年末,规模以上工业企业应收账款同比增长19.6%,增速同比下降2.8个百分点,产成品资金同比增长20.8%,增速同比提高9.6个百分点。2011年,5000户企业应收账款净额同比增长22.3%,增速同比提高7.1个百分点。(三)企业原材料成本上涨的压力减轻,通胀预期下降明显2011年,原材料购进价格指数和生产资料综合价格指数逐季回落,企业家感受成本压力较上年减轻。",306.0
196,"2011年第四季度,原材料购进价格指数和生产资料综合价格指数分别为68.2%和68.6%,同比分别大幅下降11.2个和8个百分点。预计2012年第一季度物价进一步下行趋势更加明显。2011年第四季度,原材料购进价格预期指数和生产资料综合价格预期指数为66.3%和66.4%,较2011年第一季度分别回落6.3个和6个百分点,仅有33.1%的企业家预测下一季度成本走势“趋升”,环比下降4.8个百分点,企业成本压力逐步减弱。(四)国内外需求同步下滑出口订单指数先升后降,总体回落。2011年第四季度,出口订单指数为48.7%,同比下降3.3个百分点。",274.0
197,"其中,指数下降的行业数从2010年第四季度的19个上升到23个,覆盖面增加了14.8%。从预期看,企业出口订单预期指数为49%,同比下降1.6个百分点。国内订单指数连续走低,逐季回落。2011年第四季度,国内订单指数为53.2%,同比下降4.7个百分点,连续四个季度回落;国内订单预期指数为52.5%,同比下降4.1个百分点。三、住户部门(一)住户部门金融资产较快增长,居民理财意识增强住户部门金融资产增长较快,但人均水平较低。",214.0
198,"2010年末,我国住户部门金融资产达到49.5万亿元,同比增长20.4%。从人均水平看,我国住户部门的金融资产规模仍处于较低水平。按期末汇率折算,2010年末,我国居民人均持有金融资产仅为5591美元,而美国、英国、德国、日本四国人均持有金融资产分别为15.7万美元、11.2万美元、8.1万美元和15万美元。理财和信托权益等金融资产增长显著。随着收入水平持续提高、财富规模不断扩大,居民对金融资产保值增值与多元化配置有了更高的要求。",217.0
199,"近年来,存款占居民金融资产的份额持续下降,2010年末存款占比为63.8%,较2004年末下降8个百分点。证券、证券投资基金和证券客户保证金等金融资产价值随2007—2008年资本市场的波动变化较大,近几年比重趋于稳定,保持在15%左右。居民购买的理财产品和资金信托权益增长显著,2010年末代客理财资金和资金信托计划权益达1.8万亿元,占居民金融资产的3.7%。居民金融资产多元化程度有待提高。从金融资产构成来看,存款在我国居民金融资产中的比重仍远高于一些发达国家,股票、债券和基金等证券产品比重与其他国家差距缩小,保险及养老金比重仍然较低。",272.0
200,"与主要发达国家相比,我国居民对各种保险产品的消费水平较低,2010年末保险准备金在我国居民部门金融资产中的比重仅为10.6%,而保险及养老金准备在美国、英国、德国和日本居民金融资产中的比重分别为29.2%、53.4%、36.1%和28.6%。",121.0
201,"(二)住户部门负债水平低,贷款质量较好住户部门的负债水平较低。金融资产负债率是反映住户部门负债风险的重要指标,2004—2010年,我国住户部门的金融资产负债率为15%~24%,表明我国住户部门的负债水平较低。2011年,美国、英国、德国、日本四国住户部门的金融资产负债率分别为28.1%、35.4%、33.3%和24.1%。住户部门偿债能力较强。负债与可支配收入的比率反映住户部门的债务偿还能力和债务可持续性。",206.0
202,"2004—2008年,我国住户部门负债占可支配收入的比率为30%~32%于。同期,美国、英国和日本等发达国家住户部门负债与可支配收入比重均超过100%。与发达国家相比,我国住户部门整体财务可持续性较强。住户部门贷款质量较好。我国个人贷款(不含个人经营性贷款)的不良贷款余额和不良率继续保持“双降”,2011年末,不良贷款余额717亿元,比年初减少105亿元;不良率0.8%,比年初下降0.3个百分点。",200.0
203,"其中,个人住房按揭不良贷款余额197亿元,比年初减少14亿元;不良率0.3%,比年初下降0.1个百分点。汽车贷款不良率1.1%,比年初下降0.3个百分点;个人信用卡不良贷款余额102亿元,比年初增加28亿元;不良率1.2%,比年初下降0.4个百分点。第七章金融基础设施2011年,我国金融基础设施建设稳步推进,支付、清算和结算体系建设取得新进展,金融法律法规不断健全,会计准则体系进一步完善,信用环境逐渐优化,反洗钱工作深入推进,有力地促进了金融生态环境的改善和金融体系的稳健运行。一、支付、清算和结算体系(一)体系建设取得新进展支付系统建设稳步推进,运行安全稳定。2011年,支付系统业务量继续保持快速增长态势,全国各类支付系统共处理人民币支付业务155.23亿笔、金额1991.90万亿元,同比分别增长29.3%和19.7%。",365.0
204,"支付系统的稳定运行提高了金融市场资金结算效率,是安全高效金融体系的重要支撑。此外,网上支付跨行清算系统在全国范围推广完成,提高了网上支付等新型电子支付业务跨行清算效率。第二代支付系统及中央银行会计核算数据集中系统(ACS)建设工作稳步推进。规章制度不断健全,监管体制逐步完善。",138.0
205,"一是发布《关于中国支付体系发展(2011—2015年)的指导意见》,阐明当前和今后一段时期内支付、清算和结算系统发展的政策取向。",64.0
206,二是建立和完善了支付、清算和结算业务管理制度。强化对互联网支付、移动支付、预付卡等新兴业务的规范和管理。,52.0
207,"三是组织开展支付结算执法检查,规范支付结算秩序,维护相关主体的合法权益。",36.0
208,"四是推动成立中国支付清算协会,在加强政府监管的同时,引入市场主体自我管理、自我约束和创新机制。",47.0
209,"五是确立了支付服务“政府监管、行业自律、公司治理、自我约束”的监管工作机制。非现金支付工具得到广泛应用。2011年,我国共使用票据、银行卡等非现金支付工具办理支付业务338.30亿笔、金额1104.35万亿元,同比分别增长22.1%和22.0%。境内流通中现金(M0)与GDP的比值从2006年的12.8%持续下降至2011年的10.8%。基本形成了适应企事业单位和居民需要的、多样化的非现金支付工具体系,银行卡已成为居民个人使用最为广泛的支付工具。",225.0
210,"人民银行通过组织开展农民工银行卡特色服务、银行卡助农取款服务等,积极推动银行卡在农村地区的发行与使用,便利涉农、惠农资金及时到账。此外,票据电子化、网络支付等也得到蓬勃发展。中央债券结算和集中清算业务快速增长。2011年,中央债券综合业务系统办理人民币债券资金结算业务74.05万笔、金额232.48万亿元,同比分别增长51.36%和14.35%。券款对付(DVP)业务规模持续扩大,进一步降低了银行间债券市场的流动性风险,提高了结算效率。",220.0
211,"已开办DVP业务机构共1728家,较上年新增721家。市场成员间DVP结算共66.43万笔、金额218.09万亿元,同比增长52.54%和14.71%。债券系统建设进一步加强,中央国债登记结算公司新一代客户端、质押品管理系统成功上线。上海清算所推出外汇即期竞价净额和现券交易集中清算业务,实现了场外市场部分产品的集中登记、清算和监测,有助于防范系统性风险。(二)发展展望下一步,组织实施《关于中国支付体系发展(2011—2015年)的指导意见》,统筹协调支付、清算、结算体系发展,切实保障其安全稳定运行。",252.0
212,"一是进一步健全支付结算法规制度,强化支付系统的风险管理,建立健全银行和支付机构的电子支付业务制度安排,完善支付清算结算服务收费定价机制。",68.0
213,"二是继续完善基础设施,切实提高支付体系的安全性和可靠性,推动各类市场主体持续优化零售支付服务,为社会公众提供更加安全、便捷、低成本的支付服务,统筹协调支付系统与外汇结算系统、证券结算系统、中央对手方等的发展。研究推动证券、外汇结算系统与境内外支付系统的衔接应用。",131.0
214,"三是加强支付服务市场监督管理,全面加强对银行机构、清算组织、支付机构从事支付业务的日常监督检查,健全跨部门监管协调机制,继续推广落实金融账户实名制、强化银行卡安全管理、加强对重要支付系统和支付机构的监管。",102.0
215,"四是推动改善农村支付服务环境,加大新兴支付方式在农村地区的推广使用,鼓励农村地区金融机构以多种方式接入支付系统。二、法律环境(一)金融法律法规不断健全出台法律制度,进一步夯实金融法律基础。2011年2月通过的《中华人民共和国刑法修正案(八)》,规定了强迫交易罪,有利于净化金融市场交易秩序。6月通过的《中华人民共和国行政强制法》,规范了行政强制的设定和实施,明确了冻结、划拨存款和汇款的法律依据、实施程序和有关各方的权利义务,有利于金融机构依法配合行政机关履行职责,防范可能产生的法律风险。10月通过的《全国人大常委会关于加强反恐怖工作有关问题的决定》,解决了金融机构和特定非金融机构协助迅速冻结涉恐财产时的法律障碍。",309.0
216,"此外,国务院还发布了一系列法规性文件,对维护金融市场秩序、规范投融资行为、防范系统性金融风险起到积极作用。专栏19金融消费者权益保护国际金融危机后,主要发达国家和经济合作与发展组织(OECD)等国际组织普遍认识到,金融消费者权益保护是维护金融体系信心、促进消费增长、推动经济发展、维护金融稳定的关键因素。2011年11月,G20戛纳峰会发布了包括金融消费者权益保护有关原则在内的共同宣言。美国、英国、加拿大、澳大利亚等国也相继出台或正在研究加强金融消费者保护的相关措施。目前,我国的金融消费者保护制度建设和组织建设方面尚不完善,主要体现为缺乏完善的金融消费者保护法律体系、维权程序不健全、监管机制不足等,导致近年来侵犯金融消费者利益案件时有发生。",323.0
217,"为加强金融消费者权益保护,国务院已批准人民银行、银监会、证监会和保监会成立金融消费者保护的专门机构,我国金融消费者权益保护不足的问题正在逐步得到改善。人民银行于2010年启动金融消费者保护试点工作。2011年,试点工作进一步向纵深推进,截至年末,人民银行的563个分支机构已经在我国29个省(自治区、直辖市)开展了金融消费者权益保护工作,单独或配合地方政府设立了454个金融消费者维权中心。通过建立金融消费申诉处理评价制度、纠纷调解制度、投诉案例报告与共享制度等,人民银行分支机构受理并解决各类金融消费纠纷4000多件,消费者满意度近100%。同时,人民银行还发挥分支机构覆盖面广的优势,在一些地区将银行业、证券业和保险业的消费者投诉纳入工作范围。",324.0
218,"总体上看,人民银行开展金融消费者保护试点取得了明显成效。为保护存款人和其他客户合法权益,银监会开设了面向公众的“公众教育服务区冶,开通“公众教育服务网冶,强调商业银行“卖者有责冶,制定发布有关理财产品销售、信用卡、银行代理销售保险、银行收费服务等规章文件,规范商业银行经营,保护银行消费者的知情权、选择权、隐私权和公平交易等合法权益。证监会组织开展投资者保护集中宣传工作,积极推动建立证券纠纷调解机制,研究落实利用网络平台开展投资者保护工作。保监会不断完善消费者利益保护的监管组织体系,建立健全保险纠纷调处机制、理赔服务监督机制和保险投诉机制,大力开展保险消费者教育,宣传普及保险知识,提高公众风险意识和维权能力,通过出台专项制度、严查重处等举措,重点解决车险理赔难和寿险销售误导问题。出台司法解释,保障金融稳定运行。",359.0
219,"2011年,最高人民法院发布《最高人民法院关于审理涉及中国农业银行股份有限公司处置股改剥离不良资产案件适用相关司法解释和司法政策的通知》、《最高人民法院印发掖关于审理证券行政处罚案件证据若干问题的座谈会纪要业的通知》、《最高人民法院关于非法集资刑事案件性质认定问题的通知》、《关于依法妥善审理民间借贷纠纷案件促进经济发展维护社会稳定的通知》、《最高人民法院关于人民法院委托评估、拍卖工作的若干规定》等司法解释,对于防止国有资产流失、推动监管部门依法行政、保护广大投资者合法权益、妥善化解民间借贷纠纷、维护社会稳定起到了重要作用。",264.0
220,"发布部门规章办法,促进金融市场稳健经营。人民银行制定的《境外直接投资人民币结算试点管理办法》、《非金融机构支付服务业务系统检测认证管理规定》、《外商直接投资人民币结算业务管理办法》等,支持了银行业金融机构和境内机构开展境外直接投资人民币结算业务,加强了非金融机构支付服务业务的信息安全管理与技术风险防范,规范了银行业金融机构办理外商直接投资人民币结算业务。监管部门制定了《商业银行杠杆率管理办法》、《商业银行贷款损失准备管理办法》、《商业银行理财产品销售管理办法》、《期货公司期货投资咨询业务试行办法》、《基金管理公司特定客户资产管理业务试点办法》、《证券投资基金销售管理办法》、《转融通业务监督管理试行办法》、《保险公司保险业务转让管理暂行办法》等,进一步规范相关行业的管理。(二)立法展望2012年,继续推动《证券投资基金法》与《预算法》的修订。根据《国务院2012年立法工作计划》,力争完成《国际收支统计申报办法》、《期货交易管理条例》的修订和“征信业管理条例”的出台。",438.0
221,推动“上市公司监管条例”、“银行业金融机构破产条例”、“农业保险条例”的适时出台。积极研究论证制定“黄金市场管理条例”、“存款保险条例”、“金融统计管理条例”、“证券投资者保护基金条例”和修订《现金管理暂行条例》、《结汇、售汇及付汇管理规定》、《机动车交通事故责任强制保险条例》。三、会计标准(一)会计准则和内控规范体系进一步完善推进会计准则的制定和实施工作。,180.0
222,"一是《小企业会计准则》发布,将于2013年起在小企业范围内施行,标志着我国会计准则体系进一步完善。",49.0
223,"二是企业会计准则可扩展商业报告语言(XBRL)通用分类标准开始施行。首批实施单位包括国家开发银行、中国人寿保险股份有限公司,2012年实施范围进一步扩大到所有上市商业银行。推动企业会计准则通用分类标准银行业扩展分类标准的制定,初步建立统一的电子财务报告数据标准。推动内控规范体系的建立和实施。《企业内部控制配套指引》在境内外同时上市的公司施行,并逐步扩大到所有主板上市公司、中小板和创业板上市公司,标志着我国企业内部控制规范体系的基本建立。",220.0
224,"(二)发展展望下一步,继续推进我国金融领域会计改革与发展。积极推进我国企业会计准则的趋同与等效。根据国际财务报告准则改革情况,结合国内实际,保持我国企业会计准则与国际财务报告准则持续趋同,为逆周期的宏观审慎管理提供高质量的会计信息支持。此外,力争尽快实现中欧会计准则最终等效的目标,继续推进与美国、俄罗斯等其他国际主要资本市场的双边会计准则等效,以有效减少企业的融资成本。同时,围绕“十二五”规划,进一步完善会计标准体系,推进金融会计领域改革发展,继续指导推动金融企业完善内控体系工作。",243.0
225,"专栏20中央银行资产负债表管理2007年国际金融危机爆发后,发达经济体央行纷纷通过改变其资产负债表结构和规模实施非常规货币政策。主要工具包括:一是创新融资融券工具,向市场注入流动性。美联储陆续推出“短期拍卖便利冶等十余种创新金融工具,为金融系统和私人部门提供贷款或直接购买金融资产;英格兰银行推出“特别流动性计划冶和“资产购买便利冶,允许英格兰银行通过增发货币购买二级市场的政府债券等资产;欧央行通过“有资产担保证券的购买计划冶分批购入以抵押贷款或公共部门贷款支持的证券,并在希腊主权债务危机爆发后,通过“证券市场计划冶在二级市场购买欧元区成员国政府债券以确保市场流动性。",286.0
226,"二是向存款类机构准备金付息。美联储向存款机构在美联储的准备金账户支付相当于联邦基金目标利率的利率,以鼓励银行将储备资金留存在美联储;日本银行推出了类似的“互补性存款便利冶。",86.0
227,三是救助系统重要性金融机构。美国、英国、瑞士、德国、法国、意大利和荷兰等国央行先后对面临倒闭的系统重要性金融机构注资或将其国有化。,65.0
228,"四是实行超宽松的货币政策。美联储两次实施量化宽松的政策,购买总额达1.65万亿美元的长期国债、抵押贷款证券等金融工具。",59.0
229,"五是设立特殊实体承担专门政策性任务。美联储先后设立了三家公司收购贝尔斯登和美国国际集团的资产,购买大量“两房冶和吉利美(GinnieMae)发行和担保的抵押贷款证券;英格兰银行设立“资产购买便利基金冶,为“资产购买便利冶计划提供贷款。中央银行之所以能通过调整资产负债表结构和规模实施非常规货币政策,在于其资产负债形成机制的特殊性,即央行作为货币发行主体,可以通过信贷、贴现、购买有价证券等资产操作,派生出商业银行存款、政府存款等负债。央行资产负债形成机制与一般商业主体相反,央行因而具有调整其资产负债结构和规模的主动权。非常规货币政策对央行资产负债表主要产生了以下影响:一是资产负债规模出现不同程度扩张。",302.0
230,"例如美联储、英格兰银行和欧央行2010(财)年末的资产规模相比危机发生前(2007年6月)分别增长了169%、151%和66%;二是资产负债结构发生了变化。主要是长期证券资产比例上升,短期证券资产比例下降,对商业企业的信贷资产增加,金融机构和政府存款比例增加。如2006年末美联储持有的90%的资产为国债,美联储2010年末资产负债表项目数相比2006年增加了近一倍,创新金融工具已占总资产比重的53%。中央银行通过扩张资产负债表,实施非常规货币政策,在应对危机和维护方面发挥积极作用。但也增加了自身资产负债管理难度。",259.0
231,"许多国家中央银行通过灵活有效的资产负债管理控制风险敞口。例如欧央行等采用增资、计提一般风险准备金的方式应对风险;英格兰银行通过设立特殊实体将一部分信用风险与央行资产负债表隔离开;荷兰、南非等央行通过对冲外汇储备资产,或将汇率风险转移给政府以减少央行承担的外汇风险。为此,应在强化中央银行维护金融稳定职能的同时,探讨防范央行财务风险和增强央行财务实力的途径,研究建立政府补偿机制。四、信用环境2011年,社会信用体系建设取得积极进展,征信市场、行业和地方信用建设稳步推进,社会信用意识普遍提升,信用环境进一步优化。(一)征信与社会信用体系建设稳步推进,信用环境持续向好征信法规、标准建设取得新进展。",298.0
232,"《征信管理条例(征求意见稿)》第二次向社会公众和地方政府、相关部委、科研院所、金融机构、征信机构征求意见,基本完成起草工作。开展机构信用代码试点,推进机构信用代码制度建设,推动落实金融账户实名制,提高金融服务水平,促进各部门信息实现共享。社会信用体系建设系统推进。行业信用建设加强,失信惩戒机制初步建立,行业间信用信息的互联互通范围进一步扩大。金融业统一征信平台共建工作逐步推进,初步实现了人民银行个人和企业信用信息基础数据库信息与银监会、证监会信息的交换和共享。",232.0
233,"地方信用建设取得积极进展,地方政府整合各部门信用信息,推动信用信息共享。中小企业和农村信用体系建设继续推进,缓解了中小企业和农户融资难问题。截至2011年末,全国共建立农户信用档案1.43亿户;其中,评定信用农户9360万户,获得银行贷款的农户近8185万户,贷款余额1.52万亿元。补充完善未与银行发生信贷关系的中小企业信息226.54万户;其中,取得银行授信意向的企业36.36万户,获得银行贷款的企业21.66万户,贷款余额4.28万亿元。征信市场继续扩大,防范信用风险的作用不断增强。",246.0
234,"人民银行个人和企业信用信息基础数据库覆盖范围继续扩大,在商业银行防范信用风险中发挥了重要作用。截至2011年末,个人和企业信用信息基础数据库分别收录8.05亿自然人和1809.2万户企业及其他组织的信息,开通查询用户19.8万个和12.6万个;全年累计查询2.41亿次和0.69亿次。服务中小企业的动产融资登记公示系统运行平稳,登记量和查询量显著上升,在应收账款质押融资和融资租赁业务中发挥出越来越重要的作用。截至年末,应收账款系统累计发生登记50.18万笔,查询64万笔;融资租赁系统累计发生登记4.72万笔,查询1.27万笔。证监会诚信数据库建设升级,诚信信息内容进一步丰富,目前诚信档案收录了近8500家次机构和14000人次人员的诚信信息,2011年,诚信信息查询量日均近100批次。",346.0
