,paragraph,length
80,"继续深化大型商业银行改革,推动大型商业银行不断完善公司治理,建立现代金融企业制度,深化内部治理和风险管理,提高创新发展能力和国际竞争力。扎实推进中国农业银行“三农金融事业部”改革,促进其全面改进“三农”金融服务。统筹考虑政策性金融的总体发展,坚持分类指导、“一行一策”的原则,深化国家开发银行商业化改革,研究推动中国进出口银行和中国农业发展银行改革。继续推动中国邮政储蓄银行深化改革、资产管理公司商业化转型等工作。专栏6国际上政策性金融改革和发展的最新动态政策性金融在世界各国国民经济和社会发展中具有不可替代的作用。",258.0
81,"从国际发展趋势看,政策性金融机构的政策性功能逐步缩减,更多的政策性业务通过市场化方式运作。但在金融危机等特殊时期,政策性金融机构在应对危机、促进经济结构调整等方面的政策性功能有所强化,其改革发展出现新动向。许多国家政策性金融机构继续发挥积极作用,支持本国经济发展。2011年,美国进出口银行共提供320亿美元的出口融资,比2008年增长了127%,连续三年创出新高,其中60亿美元的出口融资服务于美国中小企业,比2010年增长了20%。泰国进出口银行大力支持中小企业出口业务,2011年1~9月共为泰国中小企业提供1289.8亿泰铢的出口信贷,占其出口信贷总额的39%。",285.0
82,"日本政策投资银行(DBJ)扩大对大中型企业贷款、商业票据认购、为大中型企业提供债务担保等业务。日本国际协力银行(JBIC)增加贷款融资额度,介入中短期业务领域并扩大支持项目的范围。部分国家调整政策性金融改革的方向或者推迟商业化改革进程。",118.0
83,"一是日本政府将日本国际协力银行重新独立出来,并推迟日本政策投资银行的民营化进程。2011年5月,《日本国际协力银行新法案》公布并开始实施,主要内容包括保持日本国际协力银行的政策性金融机构性质不变,强调改革目标是维持并提高日本产业的国际竞争力,将日本国际协力银行从日本政策金融公库中分离出来成为独立机构,将应对金融危机过程中的一些临时业务作为常规业务固定下来。按照该法案,新日本国际协力银行已于2012年4月成立。2011年5月,日本国会修订了《新日本政策投资银行法》,主要内容包括再次推迟日本政策投资银行的民营化进程至“2015年4月起5~7年后冶,对启动日本政策投资银行改革设置财务基础、业务运营、资金来源等方面的前提条件,政府在2014年末之前必须确保持有至少1/3的日本政策投资银行股份并持续关注其经营状况。",357.0
84,"二是韩国政府延缓韩国产业银行(KDB)的私有化进程。2009年4月,韩国产业银行启动私有化改革,决定在当年9月底前分成商业银行、韩国产业银行控股公司(负责投资银行业务)和韩国政策金融公司(负责政策性金融业务),同时韩国政府在持股比例小于49%前延续对韩国产业银行债务担保。但受危机影响,韩国政府延缓了韩国产业银行私有化进程,宣布将原计划推迟到2014年后完成。尽管韩国产业银行自身积极寻求推进私有化进程,但至今尚无实质性进展。部分国家积极构建出口政策性金融体系。",231.0
85,"2011年9月,越南政府公布了7家可在2011—2013年开展出口信用保险试点业务的保险公司名单,并对购买出口信用保险的出口企业实行20%的保费补贴,以降低出口信用风险,扩大出口贸易规模。俄罗斯政府计划成立出口信贷保险机构,作为俄罗斯外经银行的全资子公司,为非能源和高技术产品出口提供融资和付款担保,以改变一直以来由政府直接经办优惠出口贷款和出口信用担保的模式。稳步推进金融创新,分散银行体系风险。适应经济社会发展需要,充分运用现代科技成果,促进科技与金融结合,继续稳步开展各类有益于服务实体经济发展的金融创新,推动扩大直接融资,促进多层次资本市场的发展和完善,分散银行体系风险。在坚持简单、透明和风险成本合理分担的基础上,积极推动扩大信贷资产证券化试点。",328.0
86,"稳妥有序地扩大商业银行投资设立基金管理公司试点,支持资本市场健康发展。借鉴国际银行业监管改革成果,完善监管框架。结合我国银行业改革发展实际,构建与国际标准接轨的银行业监管框架,引导商业银行稳步实施新监管标准,强化资本管理,建立有效的资本约束机制,完善流动性管理框架。制定国内系统重要性金融机构的评估方法和监管规则,稳步推进系统重要性金融机构有效处置机制建设。加强风险管控,进一步提升银行业稳健性水平。",200.0
87,"银行业金融机构需着力提高房地产贷款风险防范的针对性和有效性。继续强化地方政府融资平台贷款风险管理,积极有效推进风险缓释工作,在控制风险的前提下,继续支持有还款能力的项目建设,避免资金链断裂,严把新增平台贷款的投向和流向关口。在规范地方政府举债融资机制基础上,支持地方政府的投融资合理需求。积极应对利率市场化的挑战,进一步提升风险定价和风险管理能力,转变业务模式和增长方式,提高在市场竞争中对产品和服务进行科学合理定价的水平。加强流动性风险管理,提高精细化水平,特别是中小银行业金融机构要拓展资金来源渠道,解决存款客户单一、负债集中度过高等问题,有效降低流动性风险。",282.0
88,"加强对理财、信贷资产转让、同业代付等表外业务的风险管理。加强内部控制,严防各类案件和重大风险事件的发生。密切关注具有金融功能的非金融机构的风险,切实维护金融稳定。加强对小额贷款公司、担保公司、典当行等非金融机构融资活动的监测分析,加大对非金融机构的管理力度,引导其规范发展。关注非金融机构违规经营行为,努力做到对各类风险事件早发现、早提示、早处置,防止局部风险演化为区域性风险乃至系统性风险。",196.0
89,"加强投资者教育,严厉打击非法集资等违法犯罪行为。金融机构需采取措施,防止非法集资、高利贷、金融传销、民间融资等领域风险向银行体系传递。第三章证券期货业2011年,面对严峻的外部环境,证券期货业总体经营稳健,各项业务稳步发展,业务创新积极推进,监管不断强化,风险管控能力进一步提升。一、运行状况(一)各项业务稳步发展经营主体不断增加。截至2011年末,全国证券公司109家,较上年新增3家。",194.0
90,"其中,上市证券公司18家,新增3家;期货公司161家,因行业兼并减少2家;基金管理公司69家,新增6家。资产规模继续增长。截至2011年末,证券公司总资产为9010.9亿元,同比增加近1397亿元,增长18.3%。期货公司总资产402亿元,同比增加68亿元,增长20.35%。基金管理公司共管理915只基金,基金总份额达2.65万亿份,同比增长5.16%,基金净值约2.19万亿元,同比下降13.02%。",202.0
91,"(二)业务创新工作稳步推进2011年,证券公司融资融券交易量稳步增长,风险得到有效控制,市场交易和登记结算活动有序进行。截至年末,25家证券公司获准开展此项业务,两市融资融券余额383亿元,其中,融资余额为376亿元,融券余额为7亿元。《转融通业务监督管理试行办法》(以下简称《转融通办法》)颁布实施,证券金融公司成立,为推出证券转融通业务做好各项准备。根据《证券公司业务(产品)创新指引(试行)》,8家证券公司分别开展报价回购、约定购回式交易和现金管理产品等3项创新试点。证券公司直投子公司累计达34家,新增4家。",258.0
92,"期货公司投资咨询业务顺利推出,截至年末,47家期货公司取得投资咨询业务资格。《基金管理公司特定客户资产管理业务试点办法》的发布,为基金公司扩大专户理财业务试点,实现差异化发展创造了条件。专栏7证券转融通业务转融通业务,是指证券金融公司将自有或者依法筹集的资金和证券出借给证券公司,以供其办理融资融券业务的经营活动。适时推出转融通,为证券公司开展融资融券业务提供资金和证券支持,是促进我国融资融券交易机制逐步完善、健全证券市场功能的重要内容。2010年3月,证券公司融资融券业务试点启动。",243.0
93,"融资融券业务是成熟市场的常规业务之一,投资者通过向证券公司融券卖出或融资买入,增强了市场的价格发行功能,并提高了市场流动性。试点阶段,由于证券公司只能使用自有资金和证券开展业务,融资融券业务规模一直难以扩大,不能完全满足客户的需求,限制了融资融券业务功能的发挥。为解决资金和证券来源问题,2011年,证券监管部门发布了《转融通办法》,明确了转融通业务相关规则,并成立了证券金融公司。证券金融公司的自有资金和证券数量有限,在运营中还需要融入资金和证券,以向证券公司提供转融通服务。根据《转融通办法》的规定,证券金融公司开展转融通业务,除使用自有资金和证券外,融入资金和证券的方式主要有四种:一是依照《公司法》、《证券法》等有关规定,发行公司债券;二是向股东或者其他特定投资者借入次级债;三是按照证券交易所的业务规则,通过证券交易所的业务平台融入资金和证券;四是通过证券金融公司的业务平台融入资金。",397.0
94,"转融通业务不仅涉及资本市场、货币市场等多个市场,还涉及银行、证券公司、基金公司和保险公司等金融机构,具有典型的跨市场、跨机构的业务特征。证券金融公司是提供转融通业务的唯一机构,集中承担了市场的各类风险,具有系统重要性。《转融通办法》明确了证券金融公司需满足的风控指标,并建立了行业性的互保基金以应对可能的系统性风险。但由于转融通是一项创新业务,其风险特征并未充分暴露,相关风险防范措施也未经历极端市场情况的考验,有必要建立跨部门的监管协调机制,加强信息共享,推进跨市场、跨行业的风险监测。(三)对外开放工作稳步推进2011年,境外合格机构投资者(QFII)参与境内市场投资取得新进展,全年新增29家QFII。",304.0
95,"截至年末,135家QFII获得投资额度216.4亿美元。离岸人民币投资境内资本市场(RQFII)试点启动,9家基金公司、12家证券公司取得业务资格。境内投资港股交易所交易基金(港股ETF)的准备工作基本完成。同时,合格境内机构投资者(QDII)业务有序开展,全年新增22只QDII基金,QDII基金募集规模约188.5亿元。境内证券公司和基金管理公司积极探索在香港开展业务,截至年末,已开业的证券公司香港子公司达16家,在香港设立的基金管理公司子公司达到15家。",231.0
96,"证券公司对外开放工作稳步推进,1家合资证券公司获准设立。(四)监管不断强化在证券公司监管方面,借鉴国际监管的经验,组织开展全行业统一的压力测试,推动证券公司将压力测试引入风险管理体系;加强对各项业务尤其是股指期货、融资融券等新业务风险的动态监测和分析;督促证券公司健全完善并严格执行信息隔离墙制度,切实防范公司与客户、客户与客户之间的利益冲突和内幕交易。在期货公司监管方面,修订期货公司分类监管制度,进一步引导期货公司深化中介职能定位,鼓励优质期货公司通过兼并重组做强;重点关注期货公司风险控制能力、信息技术水平,摸清中介机构服务能力和潜在风险点,提高了监管工作的有效性和针对性。在基金管理公司监管方面,加强对基金的日常监控和风险提示,及时跟踪处置基金债券投资的信用风险及多起基金停牌估值事件;查处3起基金行业的“老鼠仓”案件,并将2名涉案人员移交司法机关追究刑事责任,发挥了较好的震慑和教育作用。专栏8积极参与国际证券监管规则的制定和修订全球金融危机爆发后,国际证监会组织(IOSCO)针对金融领域发生的变革进行了战略方向调整,首次明确了自身作为“全球证券市场监管标准制定者冶的角色定位。",495.0
97,"为此,IOSCO修订了《证券监管的目标和原则》,并启动了监管规则研究、制定以及系统性风险防范等方面的工作。证券监管部门认真贯彻“十二五冶规划中提出的“参与国际金融规则修订冶的工作部署,增派人员加入IOSCO下设的各常设委员会,积极参与相关监管规则的讨论、修订和制定工作,与其他成员机构一起共同起草中介机构资本监管、投资者适当性管理、信用评级机构内控制度等规则和指引,加强了与境外监管机构的国际合作,提升了我国在国际证券监管领域的影响力。同时,证券监管部门研究借鉴国际金融监管改革的经验,探索将国际监管规则与我国资本市场实际相结合。资本监管方面,改进完善以净资本为核心的风险控制指标体系和压力测试工作机制,动态调整风控指标值,支持证券公司扩大业务规模,提高资金使用效率。投资者保护方面,吸收借鉴投资者适当性管理的相关理念,制定和修订《证券公司销售金融产品暂行规定》、《证券公司投资咨询机构管理规定》、《证券公司客户资产管理业务试行办法》等法规及实施细则。",426.0
98,"二、稳健性评估(一)证券公司总体经营稳健,抗风险能力较强截至2011年末,证券公司净资产总额6303亿元,净资本总额4634亿元,连续三年稳步增加。证券公司期末各项风险资本准备之和为1057亿元,净资本与各项业务风险资本准备之和的比为439%,净资本/净资产为74%,净资本/负债为49%,净资产/负债为67%,各项风控指标近三年总体呈现逐步向好的态势,显示全行业总体流动性充足,负债水平较低,抵御市场风险能力较强。证券公司全行业压力测试显示,行业在面临市场变化、业务发展及政策调整等多方面的压力情景下,总体仍能保持稳健运行。专栏9证券公司压力测试2011年3月,为评估证券行业整体风险状况,促进证券公司持续稳健经营,中国证券业协会发布《证券公司压力测试指引(试行)》,指导证券公司建立健全压力测试机制,提高风险管理水平。根据该指引,证券公司压力测试是指采用以定量分析为主的风险分析方法,测算压力情景下净资本等各项风险控制指标和财务指标的变化情况,评估风险承受能力,并采取必要应对措施的过程。",446.0
99,"2011年7月,中国证监会首次对证券公司进行全行业压力测试。本次压力测试采用情景压力测试法,对全行业106家证券公司(不含2011年新成立的3家公司)设定统一的压力情景,包括A股市场日均交易额增减幅度、经纪业务战略性投入增减幅度、A股市场筹资额增减幅度、沪深300指数涨跌幅度、基准利率加息幅度等5个对证券业务有直接、重大影响的风险参数,以2010年末的资产负债表、利润表及净资本等风控指标监管报表为基础,并结合公司未来两年经营计划和财务预算,测算2011年末、2012年末公司收入、支出、利润等主要财务指标及净资本等风控指标承压情况。在测试区间内,在设定压力情景下,证券行业总体风险在可承受范围之内。总体来看,即使在重度压力情景下,全行业净资本仍比较充足、流动性仍较为充裕。但经营财务指标对股市行情较为敏感,行业“靠天吃饭冶特征仍比较明显,随着压力情景的程度加深、时期拉长,证券公司亏损的比例增大,显示出较为明显的顺周期特征。",414.0
100,"目前证券公司压力测试体系尚待完善,数据支持、模型构建和应对方案等方面有待改进。下一步,在全面总结本次压力测试经验的基础上,将不断完善和改进证券业压力测试框架和方法,把压力测试转化为全面风险管理的基础工具,促进行业经营水平的提升。(二)证券公司收入受市场波动影响明显,业务结构有待改善受股市波动影响,2011年全行业实现营业收入1360亿元,同比下降29%。其中,手续费及佣金净收入955亿元,同比下降30%,自营业务收入(含投资收益和公允价值变动收益)185亿元,同比下降50%,利息净收入194亿元,同比增长24%。全年累计实现净利润394亿元,同比下降50%。",282.0
101,"从收入构成看,证券公司营业收入主要来源仍然是证券经纪等业务,代理买卖证券业务净收入占营业收入的51%,略低于上年56%的水平,盈利模式单一的状况未得到根本性改变。证券公司各项业务和产品同质化特征明显,专业服务水平有待提升,创新能力亟待加强,服务的深度和广度难以满足我国实体经济多样化的投融资需求。(三)期货市场风险防范和化解机制基本建立,期货公司综合实力仍然较弱截至2011年末,期货行业客户保证金接近1594亿元,可用于应对市场风险的各项准备金为108.5亿元,其中,期货公司风险准备金19亿元,期货交易所风险准备金68亿元,期货投资者保障基金21.5亿元,行业抗风险能力增强。但与其他金融机构相比,期货公司综合实力仍然较弱。截至2011年末,全国共有期货公司161家,合计净资本总额329亿元,平均每家公司仅2亿元,单体实力较弱。",367.0
102,"2011年底,排名前十位的期货公司净资本仅占全行业的28%,客户保证金仅占32%,手续费收入仅占28%。长期以来,期货公司收入来源单一,主要依靠经纪业务手续费和客户保证金存款利息。2011年,161家期货公司营业收入为153亿元,其中经纪业务手续费99.8亿元,客户保证金利息收入32亿元,全年净利润为23亿元,部分期货公司甚至出现净亏损。(四)证券投资基金总体发展平稳,货币市场基金流动性管理难度加大截至2011年末,证券投资基金规模为2.19万亿元,其中,开放式基金占比为94.4%。在开放式基金中,股票型基金和混合型基金占比为77.1%,债券型基金和货币市场基金占比为20.1%。",293.0
103,"针对基金管理公司因法律风险、技术故障和操作风险等原因而可能引起的赔偿责任,基金行业建立了风险准备金制度。截至2011年末,所有基金管理公司的风险准备金金额为154亿元,行业抗风险能力较强。总体来看,证券投资基金呈平稳发展态势,但个别类型的基金如货币市场基金规模年内出现大幅波动,因赎回压力面临的流动性管理难度加大。2011年6月末,货币市场基金规模由上年末的1532.77亿份下滑至1181.32亿份,降幅高达21.7%。下半年,货币市场基金份额大幅增加,截至年末,货币市场基金规模扩大到2948.95亿元,较6月末增长150%。",265.0
104,"造成货币市场基金规模波动的多种因素中,银行理财产品对货币市场基金影响较大。上半年,银行理财产品发展迅速,部分银行理财产品特别是超短期产品对货币市场基金具有较强的替代性,且收益率普遍高于货币市场基金,诱发了投资者对货币市场基金的赎回。下半年,随着有关部门对银行理财产品的规范,货币市场基金呈现净申购。(五)私募股权投资基金发展迅速,亟待规范引导2011年,我国私募股权投资基金行业继续保持快速增长势头。据清科研究中心统计,2011年全国共有617只可投资于我国大陆地区的股权基金完成募集,是上年的2.57倍,募资总额达670.60亿美元,是上年的1.73倍。",278.0
105,"行业发展出现新情况:一是金融机构开始涉足私募股权投资基金行业。证券公司获准成立直投基金,募集并管理客户资金进行股权投资;中国人寿和中国平安等保险机构既可以直接投资未上市企业,也可以通过投资基金的方式开展股权投资业务。",108.0
106,"二是合格境外有限合伙人(QFLP)试点政策相继出台。上海、北京、重庆和天津等地颁布QFLP在当地的实施办法,境外机构投资者将境外资金兑换为人民币资金作为有限合伙人参与国内股权投资工作稳步推进。",96.0
107,"三是股权投资机构探索多元化投资策略,参与企业定向增发案例逐步增加。私募股权投资基金的发展,在支持中小企业融资、优化企业融资结构、促进产业结构调整中发挥了重要作用。但由于我国私募股权基金行业发展历史较短,快速发展过程中也暴露出一些不容忽视的问题,一些私募股权基金违规经营,蕴含潜在的风险,有待加强政策引导,规范其健康发展。专栏10私募股权投资基金私募股权投资基金(PrivateEquity,PE)是指通过非公开方式募集资金,对企业进行权益性投资,并提供经营管理、财务管理等增值服务,使所投资企业价值增值,然后通过股权转让获得回报的专业投资机构。根据主要投资对象所处发展阶段的不同,私募股权投资基金主要可分为创业基金(VentureCapital,VC)和非创业型股权投资基金。",338.0
108,"目前活跃在国内的私募股权投资基金主要包括四类:一是设立在国外但投资于我国的股权投资基金,如黑石集团、凯雷投资集团等;二是以海外资金为主但在国内设立的基金,如弘毅投资、鼎晖投资等;三是国有资本主导的基金,如渤海产业投资基金、深圳市创新科技投资有限公司等;四是以民间资本为主的基金等。",140.0
109,"目前私募股权投资基金快速发展中暴露出的主要问题有:一是投资结构不合理。目前私募股权投资基金同质化现象比较突出,大量基金集中于投资拟上市公司,从事早中期投资的创业基金相对缺乏。部分基金盲目发展,基金融资和行业投向可能影响宏观调控效果,蕴含较大的金融风险。",126.0
110,"二是部分私募股权投资基金运作不规范。一些私募股权投资基金涉嫌变相公募,存在非法集资苗头,一旦出现风险可能影响社会稳定。",59.0
111,"三是行业监管有待加强。目前,尚未明确私募股权投资基金的行业监管主体,仅对一定规模以上的股权投资企业提出备案要求,在行业持续监管方面存在分歧和欠缺。",73.0
112,"四是专业人才缺乏,增值服务能力较弱。为促进私募股权投资基金行业健康规范发展,应借鉴国际经验,结合我国的实际情况,坚持私募股权基金适度监管的理念,对超过一定规模、具有系统重要性的基金及其管理人予以监管。加强行业自律机制建设,提高行业自身发展规范性。同时加强投资者教育,完善资本市场相关制度建设,促进创业基金和非创业型股权投资基金均衡发展。三、展望2012年,证券期货业面临的经营环境将更加复杂,提升服务能力、实现自身转型发展的任务将更加迫切。",220.0
113,"下一步,需继续深化改革,稳步推进对外开放,大力鼓励创新,着力培育证券期货经营机构核心竞争力,积极提高其为实体经济服务的水平。推进证券公司专项创新业务试点,引导优化收入结构。引导证券公司拓宽创新思路,充分发挥自身优势,研究开发创新业务和产品;密切跟踪、监测和分析现金管理产品、报价回购和约定购回式证券交易等3项创新业务(产品)的试点运行情况,认真总结试点经验,适时扩大试点或转入常规业务。鼓励证券公司探索多渠道盈利模式,优化收入结构。完善资产管理业务监管细则,支持证券公司丰富资产管理产品,提高资产管理能力;研究制定证券公司销售金融产品的业务规则,支持证券公司围绕自身功能定位,探索综合金融服务模式。",299.0
114,"鼓励基金管理公司、期货公司加强创新,提高服务能力。继续支持基金管理公司进行产品创新,重点推动跨境交易所交易基金(ETF)产品。继续推动QDII法规的修订工作,为扩大QDII业务试点奠定法规基础。继续跟踪基金参与转融通和融资融券业务的情况,继续研究保障性房地产信托投资基金(RE-ITs)推出的可行性。鼓励期货公司建立试错纠错机制,激发其自主创新活力,对创新方案经过综合评估后允许有条件的期货公司进行试点,引导期货公司拓宽服务渠道,更好地满足实体经济发展需求。",229.0
