,paragraph,length
0,"中国金融稳定报告2012内容摘要2011年,全球经济增长放缓,主要发达经济体的财政风险和金融风险加大,国际金融市场剧烈震荡,各类不确定性明显增多。中国经济继续朝着宏观调控预期方向发展,金融业改革持续深化,整体抗风险能力进一步提升,金融市场运行平稳,政府、企业和住户部门财务状况良好,金融基础设施建设稳步推进,金融体系总体稳健。2012年,世界经济形势仍将十分严峻复杂,经济复苏的不稳定性、不确定性上升,欧洲主权债务危机短期内难以有效解决,主要发达经济体的经济复苏进程依然缓慢,新兴经济体宏观调控难度加大。我国经济发展中不平衡、不协调、不可持续的矛盾和问题仍将突出,经济增长下行压力加大,物价走势仍需关注,金融领域潜在风险仍然存在,维护金融稳定面临新的挑战。宏观经济运行良好。",337.0
1,"2011年,我国实施积极的财政政策和稳健的货币政策,经济保持平稳较快发展,结构调整有序推进。国内需求平稳增长,外部需求相对稳定。财政收入增长迅速,用于民生和“三农”的财政支出力度加大。物价指数前升后降,通货膨胀压力有所缓解。房地产调控继续加强,房地产价格逐步回落。",132.0
2,"货币信贷增速回归常态,人民币汇率稳中有升。下一阶段,要继续实施积极的财政政策和稳健的货币政策,增强政策的前瞻性、针对性、有效性,保持合理的社会融资规模,加大金融对实体经济的支持力度。同时,进一步深化利率市场化和汇率形成机制等重点领域改革和完善逆周期的金融宏观审慎管理制度框架,为保持经济长期平稳较快增长创造良好的金融环境。银行业认真贯彻宏观调控政策,保持合理的信贷投放,整体运行稳健。各项改革稳步推进,资产负债规模持续扩大,对“三农”和小微企业的金融支持力度进一步加强,资产质量不断提高,稳健性标准和监管水平进一步提升。",260.0
3,"但受经营环境和结构调整等因素影响,不良贷款反弹和资本补充压力加大,重点领域风险管控仍需加强,部分机构流动性管理有待加强。下一阶段,要落实好稳健的货币政策,坚持金融服务实体经济的本质要求,继续深化改革,稳步推进金融创新,完善银行业监管框架,着力防范和化解重点领域潜在风险,密切关注具有金融功能的非金融机构风险,全面提升银行业综合实力和抗风险能力。证券期货业继续保持健康发展,机构数量和资产规模持续增加。业务创新积极推进,证券公司融资融券交易量稳步增长,期货公司投资咨询业务顺利推出。证券期货业合规监管不断强化,抗风险能力有所增强。",264.0
4,"但证券公司业务结构单一、期货公司综合实力较弱及私募股权基金的潜在风险问题值得关注。下一阶段,要着力培育证券期货经营机构的核心竞争力,加大业务创新,加强行业诚信建设,稳步推进对外开放,提高服务实体经济的水平。保险业总体保持平稳发展态势,资产规模持续扩大,机构体系不断完善,保费收入增长,服务领域拓宽,改革创新继续推进,监管体系不断完善,对外开放水平进一步提高。但保险业资金运用收益率降低,偿付能力总体下降,部分公司资本补充压力加大。下一阶段,要加快转变行业发展方式,优化业务结构,加大创新力度,完善保险监管,加强消费者权益保护,同时,要积极创造良好的外部环境,推动行业平稳较快发展,更好地服务于社会和实体经济。",304.0
5,"金融市场在改革创新中稳步发展,继续保持了健康平稳的运行态势,发挥了优化资源配置、支持实体经济发展的积极作用。货币市场交易活跃,利率波动幅度较大。债券市场交易量稳定,债券指数总体上行,投资主体不断扩大。股票市场估值处于历史较低水平。商品期货市场交易量大幅下滑,金融期货市场稳步增长。",140.0
6,"票据市场总体平稳,外汇市场交易活跃,黄金市场交易规模显著增加。下一阶段,要积极推动债券市场健康发展,继续深化新股发行体制改革,稳步推进退市制度改革,完善资源配置的市场机制,更好地服务实体经济,促进经济结构调整和经济发展方式转变。政府、企业、住户的财务分析表明,政府部门财务状况良好,债务水平安全可控,一些地方政府性债务风险隐患仍需关注。企业部门利润继续增长,偿债能力稳中略降,流动性趋紧,企业原材料成本压力减弱,国内外订单需求呈下降趋势。住户部门的金融资产继续增长,但多元化程度有待提高,整体债务水平较低,偿债能力较强。",260.0
7,"金融基础设施建设稳步推进。支付、清算和结算体系运行安全稳定,监管体制逐步完善,非现金支付工具广泛应用,中央债券结算和集中清算业务快速增长。金融业法律法规和部门规章不断推出,金融法律基础进一步夯实。会计准则的制定和实施工作不断推进,会计准则体系进一步完善。社会信用体系建设稳步推进,征信系统作用日益显著,信用环境持续改善。",160.0
8,"反洗钱工作深入推进,监管水平不断提高,调查有效性进一步提升,国际合作继续深化。下一阶段,应进一步加强支付、清算和结算体系的监管,完善金融法律法规,推进会计准则的国际趋同与等效,改善社会信用环境,优化反洗钱监管。宏观审慎管理进一步强化。国际组织继续加强宏观审慎国际标准和准则的研究制定,主要国家的金融监管改革持续推进,进一步强化了宏观审慎职能。2011年,我国在加强宏观审慎管理方面进行了有益探索,不断加强和改进金融统计和风险监测评估,完善以差别准备金动态调整为着力点的逆周期宏观调控机制,研究加强系统重要性金融机构监管,积极构建危机管理和风险处置框架。",276.0
9,"下一阶段,应在借鉴国际金融危机教训和国际有效做法的基础上,结合国情,进一步健全宏观审慎政策框架,建立宏观审慎管理和微观审慎监管协调配合、互为补充的体制机制,提高系统性风险防范能力,提升金融支持经济发展的可持续性。",106.0
10,"第一章宏观经济2011年,全球经济增长放缓,国际贸易增速回落,国际金融市场剧烈震荡,各类不确定性明显增多。主要发达经济体的财政风险和金融风险加大,经济增长动力不足,欧洲主权债务危机明显恶化。新兴经济体增长势头普遍趋缓,部分国家面临较为严重的通货膨胀和短期资本大进大出的风险。中国经济继续朝着宏观调控预期方向发展,运行态势总体良好,通货膨胀压力在年末有所减轻。2012年,世界经济形势总体上仍将十分严峻复杂,经济复苏的不稳定性、不确定性上升。",220.0
11,"欧债危机成为拖累全球经济复苏的主要因素,新兴经济体增长速度将进一步放缓。在外部需求和国内经济周期的共同影响下,国内经济增长将有所放缓,需加快转变经济增长方式,调整经济结构,保持经济平稳较快发展。一、2011年全球经济金融形势2011年,全球经济复苏放缓,全年经济增长率为3.9%,各经济体表现分化,发达经济体与新兴经济体分别增长1.6%和6.2%。国际金融市场持续大幅震荡,全球股市总体下行,大宗商品价格从峰值回落。(一)主要经济体经济形势美国就业、通胀形势略有改善,财政赤字问题依然严重。",245.0
12,"2011年美国GDP增长1.7%,同比下降1.3个百分点。年末失业率8.5%,为2009年以来的最低水平。通胀压力有所减轻,12月CPI同比上涨3.0%,连续3个月回落。2011年,贸易赤字为5580亿美元,同比上升11.6%。2011财年,联邦财政赤字为1.3万亿美元,占GDP的8.7%,较上年的9.0%略有下降,但仍为1945年以来第三高的赤字比率。",178.0
13,"欧元区经济复苏动力减弱,各国增速进一步分化。2011年,欧元区GDP增长1.4%,增速放缓,失业率仍居高不下,12月为10.4%,通胀连续13个月高于2%的目标,12月综合物价指数(HICP)同比上涨2.7%。从国别来看,德国GDP增长3.1%,较上年回落0.5个百分点,但仍明显快于其他欧元区国家。法国GDP增长1.7%,同比上升0.3个百分点。而希腊、葡萄牙等重债国形势持续恶化,GDP同比分别萎缩6.9%和1.5%。",211.0
14,"日本经济反弹强于预期,贸易和债务情况有所恶化。2011年,在地震和海啸灾害发生后,日本采取一系列刺激政策使经济快速下滑的势头得到遏制,经济增长先降后升,全年GDP增长-0.7%。年末失业率为4.5%,同比下降0.4个百分点。消费价格指数持续处于低位,12月核心CPI同比下降0.2%。受日元升值、地震灾害和外部需求下降影响,出口形势恶化,全年贸易逆差2.5万亿日元,使日本在时隔31年后再次成为贸易赤字国。",203.0
15,"地震灾害导致财政支出大幅增加,政府债务负担进一步加重,2011年第三季度末,债务余额创下954万亿日元的历史新高,债务余额与GDP之比为199%。新兴经济体增长势头明显放缓,政策调控难度加大。受国内政策持续紧缩、经济周期性下行以及外部需求下降等多重因素影响,主要新兴经济体2011年的经济增长速度普遍放缓。印度全年GDP增长7.2%,同比下降3.4个百分点,12月CPI降至7.5%,为近两年来最低,通胀压力有所减轻。巴西全年GDP增长2.7%,同比下降4.9个百分点。",235.0
16,"此外,南非、土耳其、印度尼西亚、越南等新兴市场国家的经济增长显著放缓。经济增长前景恶化影响了投资者对新兴市场国家资产的信心,加上欧元区银行通过出售在这些国家的资产以弥补自身资金缺口,部分新兴市场国家出现了资本外流、本币贬值的趋势,加大了宏观政策决策的难度。专栏1G20框架下的全球经济金融政策2008年,随着国际金融危机的爆发,二十国集团(G20)由财长和央行行长会议升格为领导人峰会,并扩大发展中国家的发言权,G20峰会成为全球经济金融治理的重要平台,在促进就业和经济增长、防范应对国际金融危机、改革国际货币体系、推动金融监管改革、加强多边贸易体系等方面发挥了重要作用。2011年11月,G20领导人在法国戛纳召开峰会,重点提出了以下领域的经济金融政策。",328.0
17,"一是促进就业和经济增长。努力推动世界经济实现强劲、可持续和平衡增长,鼓励成员国实施结构性改革以稳定经济增长,解决短期内经济脆弱的问题,加强中期经济增长基础。",78.0
18,"二是防范和应对国际金融危机。支持国际货币基金组织(IMF)进一步增强全球金融安全网,敦促欧元区有关国家切实执行改革计划,恢复市场信心和维护金融稳定。",74.0
19,"三是改革国际货币体系。落实IMF份额改革方案,提升IMF的代表性并充实可用资源,完善特别提款权(SDR)的构成标准。",58.0
20,"四是大力推进金融监管改革。依托金融稳定理事会(FSB),针对国际金融危机暴露出的金融监管的主要问题,加强系统重要性金融机构、影子银行、场外衍生品、薪酬制度等方面的监管与改革。",87.0
21,"五是加强多边贸易体系。采取切实措施避免贸易保护主义,支持世界贸易组织(WTO)在提高贸易关系和政策的透明度、提升争端解决机制效能方面发挥更加积极的作用。在G20成员国的通力合作下,当前世界经济已逐步走出国际金融危机的影响,但受到欧债危机等各类风险的威胁,全球经济仍面临较大不确定性。面对复杂多变的国际经济金融形势,G20应在平等互信的基础上,不断加强与相关国际组织以及非成员国家的对话与合作,以期在协调国际经济政策、推动国际金融改革、维护全球稳定等方面发挥更大的作用。(二)国际金融市场形势主要货币汇率宽幅震荡。",256.0
22,"2011年,美元汇率先抑后扬,虽然全年变化率不高,但年内反复大幅波动。年末,美元广义名义贸易加权指数全年累计升值1.65%。欧元对美元汇率先升后贬,年末为1.2945美元/欧元,较上年末贬值3.23%。1~4月,欧洲经济整体运行平稳,市场加息预期强烈,欧元对美元持续升值;5月以后,受欧债危机恶化和蔓延的影响,欧元对美元震荡回落。受避险需求的影响,日元对美元持续保持高位,震荡升值5.22%。",196.0
23,"大部分新兴市场货币对美元汇率呈现先升后贬态势。主要国家国债收益率下降。2011年,随着国际评级公司相继下调希腊、爱尔兰、意大利等国的信用评级,国际资本避险需求上升。尽管标准普尔和穆迪分别下调了美国和日本的主权信用评级,但美国和日本的国债收益率不升反降,德国国债收益率也呈现震荡走低趋势。截至年末,美国、德国和日本的10年期国债收益率分别收于1.88%、1.83%和0.99%,较上年末分别下跌1.48个、1.14个和0.13个百分点。",217.0
24,"全球股市大幅波动。2011年上半年,全球股市总体运行相对平稳,仅在3月中旬受日本大地震影响而短暂大跌。第三季度,受美欧债务问题恶化加剧市场恐慌情绪及全球经济复苏趋缓等因素影响,全球主要股市暴跌后在低位宽幅震荡。第四季度,受市场对美欧债务危机预期的起伏以及美欧第三季度经济表现较好等因素交替影响,美欧主要股市震荡上扬。截至年末,道琼斯指数、纳斯达克指数和STOXX50指数分别收于12217.56点、2605点和2369.52点,较上年末分别上涨5.5%、上涨1.8%和下跌8.9%。",241.0
25,"受经济复苏动力趋缓和严重的地震海啸灾害双重影响,日本股市全年出现较大幅度下跌,日经225指数年末收于8455点,较上年末下跌17.3%。主要新兴市场股市大幅下跌,俄罗斯RTS指数下跌21.94%,印度孟买Sensex指数下跌24.64%,巴西圣保罗IBOVESPA指数下跌18.11%,韩国KOSPI指数下跌10.98%,中国上证综指下跌21.68%。大宗商品价格自峰值回落。2011年,伦敦布伦特原油期货价格在4月8日达到126.65美元的峰值后振荡回落,年末收于每桶107.38美元,同比上涨13.3%。伦敦金属交易所黄金现货价格在9月5日创下每盎司1898.99美元的历史新高后大幅下跌,年末收于每盎司1563.8美元,同比上涨10.2%。",323.0
26,"涵盖全球19种大宗商品的美国商品调查局(CRB)指数累计下跌8.49%。其中铜、铁、锡等金属期货价格下跌在20%以上,食糖、小麦、天然气等跌幅百分比也在两位数以上。二、2011年中国经济金融运行特点2011年,面对复杂多变的国际政治经济环境和国内经济运行的新情况、新变化,我国实施积极的财政政策和稳健的货币政策,在保持宏观经济政策连续性和稳定性的同时,着力增强调控的针对性、灵活性、前瞻性,较好地处理了保持经济平稳较快发展、调整经济结构、管理通胀预期的关系,中国经济在保持平稳较快发展的同时,物价过快上涨势头得到初步遏制,经济结构有所改善,国民经济继续朝着宏观调控预期方向发展。(一)经济保持平稳较快增长,结构调整有序推进据国家统计局初步核算,2011年我国名义GDP总额达到47.16万亿元,同比实际增长9.2%,增速较上年回落1.2个百分点。分季度看,第一季度至第四季度GDP同比分别增长9.7%、9.5%、9.1%和8.9%,呈平稳回落趋势。",424.0
27,"分产业看,第一产业增加值4.77万亿元,增长4.5%;第二产业增加值22.06万亿元,增长10.6%;第三产业增加值20.33万亿元,增长8.9%。从产业增加值占GDP的比重看,第一产业为10.1%,比上年下降0.06个百分点;第二产业为46.8%,比上年下降0.08个百分点;第三产业为43.1%,比上年上升0.14个百分点。(二)国内需求平稳增长,外部需求相对稳定2011年,全社会固定资产投资31.10万亿元,比上年增长23.6%,扣除价格因素,实际增长15.9%。其中,城镇固定资产投资30.19万亿元,增长23.8%。全社会消费品零售总额18.12万亿元,比上年增长17.1%,扣除价格因素,实际增长11.6%。",311.0
28,"进出口总额3.64万亿美元,比上年增长22.46%。其中,出口1.9万亿美元,增长20.34%;进口1.74万亿美元,增长24.87%。全年实现贸易顺差1551.4亿美元,同比下降14.5%。从月度走势看,除了受季节性因素影响,年初进出口增速出现短暂较大波动外,全年基本呈平稳、缓慢下降态势。初步测算,2011年,资本形成总额对GDP增长的贡献率是54.2%,最终消费对GDP增长的贡献率是51.6%。",201.0
29,"专栏2人民币跨境使用和人民币离岸市场我国“十二五”规划明确提出:扩大人民币跨境使用,逐步实现人民币资本项目可兑换;支持香港发展成为离岸人民币业务中心和资产管理中心。2011年,人民银行继续会同有关部门以促进贸易和投资自由化、便利化为目标,积极推动人民币跨境使用和离岸市场发展。跨境人民币业务取得突破性进展。人民银行出台了一系列跨境人民币业务新政策,将跨境贸易人民币结算境内地区扩大至全国;允许境内机构使用人民币开展对外直接投资;允许境外投资者使用人民币开展来华投资;允许境内银行向境内机构在境外投资的企业或项目发放人民币贷款;允许符合一定资格条件的境内基金管理公司、证券公司的香港子公司(RQFII)运用在香港募集的人民币资金开展境内证券投资业务,这些政策的出台拓宽了人民币跨境流动渠道,跨境人民币业务取得了突破性进展。2011年,全国共办理跨境贸易人民币结算业务2.08万亿元,同比增长3.1倍,全国共办理人民币对外直接投资结算金额201.5亿元,外商直接投资人民币结算金额907.2亿元。",446.0
30,"截至2011年末,与境内发生人民币实际收付业务的境外国家和地区达181个。货币合作持续推进,截至2011年末,我国与14个国家和地区签订了双边本币互换协议,互换规模达到13012亿元人民币。香港人民币市场发展较快。截至2011年末,香港经营人民币业务的机构数已超过130家,人民币贷款余额约308亿元,人民币存款余额达5885亿元,约占香港全部银行存款余额的10%,人民币成为香港除港元和美元的第三货币。全年香港共发行人民币债券约1100亿元(其中包括财政部在香港发行的200亿元债券)。",244.0
31,"香港人民币债券市场发行主体日趋多元化,市场交投活跃,参与主体日趋丰富,市场深度不断拓展。跨境人民币业务的开展为香港人民币市场发展提供了重要支持,香港人民币市场的发展也有利于扩大人民币跨境使用,有利于境内金融市场的开放,有利于探索实现人民币资本项目可兑换。下一步,人民银行将继续按照稳妥有序的原则开展各项跨境人民币业务,促进贸易投资自由化和便利化,发挥香港人民币市场优势,促进人民币在境外循环使用。(三)财政收入增长较快,财政支出增长较快2011年,我国财政收入10.37万亿元,同比增加2.06万亿元,增长24.8%,增速比上年高3.5个百分点。从全年走势看,前高后低态势较为明显。",291.0
32,"下半年特别是第四季度,随着经济增长逐步放缓和物价高位回落,加上个人所得税起征点提高以及房地产、汽车成交量下降等减收因素影响,财政收入增速有所放缓。全国财政支出10.89万亿元,同比增加1.91万亿元,增长21.2%,增速比上年高3.4个百分点。财政对“三农”、教育、医疗卫生、社会保障和就业、保障性安居工程、文化等民生领域的支持力度加大,其中用于与人民群众生活直接相关的教育、医疗卫生、社会保障和就业、住房保障、文化等方面的民生支出合计3.81万亿元,增长30.3%;用于“三农”的支出合计29342亿元,增长21.2%。(四)物价指数前升后降,通货膨胀压力有所缓解2011年上半年,在能源资源、劳动力等要素成本上升、通货膨胀预期较强、国内需求继续较快增长等多种因素的共同作用下,价格上涨压力持续增大,推动CPI同比涨幅不断扩大,7月达到6.5%,创国际金融危机以来的新高。进入下半年,随着国内经济增长继续放缓和稳健货币政策效果逐步显现,加之国际大宗商品价格整体出现回落,价格上涨压力有所减轻,主要价格指标开始趋稳回落,物价过快上涨势头得到初步遏制。",475.0
33,"自8月开始,CPI涨幅逐月回落,12月降至4.1%,全年同比上涨5.4%,比上年高2.1个百分点。食品和非食品价格分别上涨11.8%和2.7%,分别比上年高4.6个和1.3个百分点。前三季度工业生产者价格(PPI)同比涨幅基本处于7%左右的高位,工业生产者购进价格(PPIRM)同比涨幅在10%以上。自8月以来,PPI同比涨幅开始逐步回落,第四季度回落幅度明显加大,全年PPI同比上涨6%,比上年高0.5个百分点。(五)货币信贷增速回归常态,人民币汇率稳中有升面对通货膨胀压力增大和国际收支顺差较大的形势,人民银行认真落实中央经济工作会议精神,将稳定物价总水平作为金融宏观调控的首要任务,实施稳健的货币政策,加强宏观审慎管理,综合运用多种货币政策工具,有力地促进了货币信贷条件进一步向常态回归。",347.0
34,"2011年末,广义货币(M2)余额85.16万亿元,同比增长13.6%,增速同比下降6.1个百分点;狭义货币(M1)余额28.98万亿元,同比增长7.9%,增速同比下降13.3个百分点。全年人民币贷款增加7.47万亿元,同比少增3901亿元。社会融资规模为12.83万亿元,同比减少1.11万亿元。2011年,人民币汇率形成机制得到进一步完善,汇率弹性不断增强。人民币汇率有升有贬,预期出现分化。",198.0
35,"人民币对美元全年升值5.1%,人民币汇率中间价日均波动44个基点。据国际清算银行测算,全年人民币实际有效汇率升值6.12%。人民币汇率形成机制的不断完善,对促进我国经济结构优化和全面协调可持续发展、抑制通货膨胀发挥了积极作用。专栏3高通胀压力下稳健货币政策的实施2010年中以后,随着中国经济恢复较快增长,通货膨胀开始出现上升势头,第四季度CPI升至4.7%。进入2011年,地方发展热情较高,投资和货币信贷扩张动力较强,经济运行总体上处在较高的通胀压力下,前三季度CPI涨幅分别为5.1%、5.7%和6.2%。",256.0
36,"在此背景下,按照党中央、国务院的决策部署,人民银行把货币政策取向由“适度宽松”调整为“稳健”,围绕保持物价总水平基本稳定这一宏观调控的首要任务,综合、交替使用数量型、价格型和宏观审慎政策工具,把好流动性总闸门,控制物价上涨的货币条件,加强宏观审慎管理,并根据新形势新情况着力提高调控的针对性、灵活性和前瞻性,处理好保持经济平稳较快发展、调整经济结构和管理通胀预期的关系。",185.0
37,"一是搭配使用存款准备金率和公开市场操作工具对冲银行体系多余的流动性。在国际收支总体上继续保持较大顺差的背景下,2011年上半年,人民银行充分发挥存款准备金率工具主动性较强、能够深度冻结流动性的作用,先后6次上调金融机构存款准备金率共3个百分点。同时,合理把握公开市场操作力度和节奏,促进银行体系流动性供求的适度均衡。全年累计发行中央银行票据约1.4万亿元,开展正回购操作约2.5万亿元,年末中央银行票据余额约为1.9万亿元。",212.0
38,"二是引入新的宏观审慎政策工具进行逆周期引导。在总结国际金融危机教训的基础上,从2011年起,人民银行引入差别准备金动态调整机制,通过透明、可预期、规则化的方式对信贷总量进行逆周期的引导。该机制将信贷投放与宏观审慎所要求的资本水平相联系,考虑了经济景气变化以及金融机构系统重要性、稳健状况和信贷政策执行情况,具有引导和激励金融机构自我保持稳健、逆周期调节信贷投放以及引导信贷投向的功能,在信贷调控中发挥了积极作用,信贷投放的季度及月度均衡性明显提高。",224.0
39,"三是适时发挥利率杠杆的调控作用。2011年前三季度,人民银行三次上调金融机构人民币存贷款基准利率。其中,1年期存款基准利率由2.75%提高到3.50%,1年期贷款基准利率由5.81%提高到6.56%。同时,引导银行间市场利率适当上行。第四季度,随着国内外形势的变化,特别是国内价格涨幅逐步回落,存贷款基准利率保持稳定。",159.0
40,"四是进一步完善人民币汇率形成机制。继续按主动性、可控性和渐进性原则,重在坚持以市场供求为基础,参考一篮子货币进行调节,增强汇率弹性,保持人民币汇率在合理均衡水平上的基本稳定。2011年,人民币小幅升值,双向波动特征明显。年末人民币对美元汇率中间价为6.3009元,全年升值幅度为5.11%,在一定程度上减弱了国际大宗商品价格上涨对国内通货膨胀的影响。",175.0
