,paragraph,length
248,稳步发展货币、衍生品、外汇和黄金等市场。鼓励货币市场工具创新，增强流动性管理功能。进一步完善商品期货和金融衍生品市场，健全价格形成机制，推出成熟的金融期货衍生工具，完善场外衍生品市场体系，适应金融机构风险管理、居民理财和区域经济发展等多元化需求。加强外汇市场制度和基础设施建设，进一步完善人民币汇率形成机制，推动汇率风险管理工具创新。继续丰富黄金市场参与主体，鼓励产品创新，加强监测预警和风险防范，推动市场平稳健康发展。,210.0
249,专栏15加快多层次资本市场体系建设十八届三中全会明确提出，要“健全多层次资本市场体系，推进股票发行注册制改革，多渠道推动股权融资”。继续完善主板、中小企业板和创业板市场，加快推进全国性场外市场建设，多层次、多渠道促进股权融资，对于更好地服务实体经济发展，推动经济结构调整和产业转型升级有重要意义。深刻理解多层次资本市场体系建设内涵。资本市场要服务实体经济。实体经济中不同类型和处于不同发展阶段的企业差异性大，企业和投资者的投融资需求较为多元，客观上需要资本市场在发行、交易、监管等制度安排上有所区别，形成差异化的制度安排。,261.0
250,因此，建设多层次资本市场体系，要牢牢把握两个核心内涵：一是多层次资本市场体系本身不是静态的，而是一个发展的概念，核心是要服务实体经济；二是资本市场的多层次性，源于实体经济的多层次和多样化，资本市场的建设要以实体经济的需要为根本前提。,116.0
251,继续完善主板、中小企业板和创业板市场建设。十八届三中全会明确了股票发行注册制改革的方向，这是继续完善主板、中小企业板和创业板市场建设的重要举措。注册制改革要求股票发行监管应当以充分信息披露为核心，减少证券监管部门对发行人资质的实质性审核和价值判断，弱化行政审批，降低股票发行成本，提高融资效率。同时，应当进一步完善上市公司退市制度，通过优胜劣汰，提高上市公司质量。加大对虚假陈述、市场操纵和内幕交易等证券违法违规行为的打击力度，强化上市公司、中介机构等市场参与主体的市场约束和诚信约束，促进市场参与各方归位尽责，切实保护投资者利益，维护证券市场“三公”原则。,279.0
252,进一步发展场外市场。场外市场包括全国性场外市场和区域性股权转让市场等。我国地域广阔、地区差异明显，中小企业数量众多，需求多样，客观上需要多层次的场外市场体系。在全国性场外市场以外，建立区域性股权转让市场，有利于调动中央和地方两个积极性，微观上释放基层的改革活力。2013年12月，国务院发布《关于全国中小企业股份转让系统有关问题的决定》，全国性场外市场建设取得突破性进展。,186.0
253,下一步，在清理整顿各类交易场所基础上，将区域性股权转让市场纳入多层次资本市场体系，要发挥区域性股权转让市场在资本形成和股份流转中的积极作用，积极规范发展区域性股权转让市场，在统一规则的前提下，允许区域性股权转让市场根据当地实际进行差异化的制度安排，真正为不同规模、不同类型、不同成长阶段的企业提供差异化服务。,154.0
254,第七章金融基础设施2013年，我国金融基础设施建设继续推进，支付系统建设取得重大进展，金融法律法规逐步健全，会计准则和标准进一步完善，征信和社会信用体系建设成效显著，洗钱防控体系有效性稳步提升，金融服务和管理水平全面提高，有力地促进了金融体系的稳健运行。,127.0
255,一、支付、清算和结算体系（一）体系建设不断完善制度建设取得新进展。,33.0
256,一是发布《银行卡收单业务管理办法》，构建银行卡收单业务监管的基础制度；二是发布《支付机构客户备付金存管办法》，全面规范客户备付金的存放、归集、使用、划转等存管活动；三是发布《票据印制管理办法》，针对票据凭证改版、制版、订货、发运、票据鉴别服务和监督管理责任等环节作出明确规定；四是改革现行人民币银行账户管理制度，起草《人民币银行账户管理条例》及实施细则。此外，研究银行卡清算市场准入制度设计，推动银行卡清算机构审批行政许可相关工作。执行中美电子支付世贸组织争端案裁决，废除或修改了涉案措施。基础设施稳定运行。2013年，支付系统、证券结算系统、中央对手和交易数据库等金融市场基础设施功能不断完善，业务处理规模持续扩大，运行管理水平进一步提高。,321.0
257,一是第二代支付系统上线切换和中央银行会计数据核算集中系统（ACS）的试点运行工作顺利完成。,45.0
258,二是全国各类支付系统安全稳定运行，业务量保持快速增长态势。各类支付系统共处理支付业务235.80亿笔，金额2939.57万亿元，同比分别增长23.38%和17.19%。,84.0
259,三是中国银联、城市商业银行资金清算中心和农信银资金清算中心等清算机构的业务品种和业务规模不断扩大，中国银联银行卡跨行交易清算系统共成功处理交易151.2亿笔和32.3万亿元，较上年分别增长21.3%和48.4%；农信银支付清算系统支付结算业务1.21亿笔，金额2.46万亿元，同比增长40.23%和22.55%。,156.0
260,四是中央国债登记结算有限责任公司、上海清算所和中国证券登记结算公司的综合业务系统整体运行平稳，债券登记、托管和结算业务继续保持增长。全年债券托管总量达到29.48万亿元，同比增长13.39%，继续平稳增长。全年办理债券现券和回购交易结算270.82万亿元，同比增长1.15%，比2012年增速下降31.52%，交易活跃度有所降低。,165.0
261,五是上海清算所中央对手清算业务不断扩展。其中，现券净额清算会员已达56家、外汇竞价清算会员249家、外汇询价交易清算会员26家。人民币利率互换业务集中清算准备工作顺利完成。,86.0
262,六是银行间市场交易信息集中管理职能进一步加强，外汇交易中心运行管理的银行间市场数据仓库系统的数据代表性日益凸显，本外币市场的信息覆盖面趋于完备。专栏16第二代支付系统成功上线运行为满足银行机构、金融市场、广大企事业单位和人民群众日益增长的、多样化的跨行支付需求，适应商业银行经营管理方式调整的需要，遵循信息化系统运行生命周期的客观规律，2009年以来，立足现有支付系统的各项功能，引入先进的支付清算管理理念和技术，进一步丰富系统功能，提高清算效率，拓宽服务范围，加强运行监控，完善灾备系统，稳步开展第二代支付系统的组织建设。经人民银行、各银行业金融机构及各有关单位精心组织、协同奋战，2013年10月第二代支付系统成功上线运行。第二代支付系统在设计上充分考虑了我国支付体系发展的实际情况，并借鉴国际先进经验，主要有以下改进：第一，支持商业银行以法人为单位一点集中接入。商业银行总行及其分支机构的支付业务可以集中通过一个账户完成处理。,416.0
263,与第一代支付系统运行环境下，各家银行需要以各省分行为单位开立账户并接入系统相比，有利于提高业务处理效率，也有利于节约商业银行的流动性，提高资金使用效率。各家银行总行的资金管理部门可以方便地监测全行的流动性使用情况，更加灵活地调度资金。第二，提供了更加丰富的流动性管理功能。流动性风险是支付系统面临的主要风险，一家机构不能及时支付可能连锁影响其他机构的正常支付。第二代支付系统新增了大额支付系统排队业务撮合、“资金池”管理、“一揽子”流动性实时查询等功能，能够促进系统提高清算效率。,240.0
264,第三，支持在线支付业务的跨行处理。客户通过开户银行的网上银行或自助服务终端发起跨行支付业务后，一般在10秒钟之内就可以了解资金到账情况，有助于改进客户网上支付体验，促进电子商务发展。第四，系统运行维护更加高效。第二代支付系统的风险预警能力和运行监控效率都有很大提高，系统运行更加安全、稳定。第五，系统备份功能更加健全。,159.0
265,第二代支付系统以生产中心、远程备份中心和同城数据备份中心为架构，具有健全的生产恢复能力，确保突发事件发生时支付业务的连续处理及信息数据的安全完整。第六，采用国际通用的报文标准。第二代支付系统的报文标准采用国际通用的ISO20022报文规范，有利于各系统之间的互联互通，如计划通过第二代支付系统与有关外币清算系统对接，实现本外币交易的同步收付（PVP）结算，提高本外币交易的结算效率，防范结算风险。非现金支付工具蓬勃发展。随着信息技术在零售支付领域的广泛应用，零售支付的创新日新月异，支付和结算效率提高，成本降低，极大地便利了社会公众的生活。,270.0
266,2013年，非现金支付业务量呈现持续增长态势。全国累计办理非现金支付业务501.58亿笔，金额1607.56万亿元，同比分别增长21.92%和24.97%。境内流通中现金M0与GDP的比值从2006年的12.8%持续下降至2013年的10.3%。截至年末，全国累计发行银行卡42.14亿张，同比增长19.23%，其中金融IC卡5.93亿张。全年银行卡渗透率达到47.45%。,187.0
267,信用卡期末应偿信贷总额1.84万亿元，同比增长61.80%。网上支付、电话支付和移动支付等电子支付业务快速发展。其中，网上支付达236.74亿笔，金额1060.78万亿元，同比分别增长23.06%和28.89%。农村地区手机支付试点范围和规模不断扩大，部分省市开展代理服务点手机取现业务。监督管理工作进一步加强。,156.0
268,一是完善支付体系监督管理制度。发布《支付结算执法检查规定》、《农信银资金清算中心监督管理办法》，编制《银行业金融机构支付结算现场检查手册》，明确监督管理职责和程序。,82.0
269,二是加强对支付机构的监督管理。截至2013年末，获得许可的支付机构累计达到250家。通过建立重大事项报告、年度监管报告等非现场监管工作机制和现场检查监督工作，强化了支付机构的风险防控和合规意识。,97.0
270,三是在全国范围内统一组织开展银行卡收单业务和预算单位银行账户执法检查工作，完善银行卡收单业务、支付机构客户备付金存管等管理制度。,64.0
271,四是完成存量个人人民币银行账户真实性核实工作，有力推动个人银行账户实名制的贯彻落实。实施《金融市场基础设施原则》。2012年4月，国际清算银行支付结算体系委员会（CPSS）与国际证监会组织（IOSCO）发布《金融市场基础设施原则》（以下简称《原则》），全面加强金融市场基础设施的风险管理和监管要求。2013年，CPSS和IOSCO就《原则》实施情况开展首次“一级评估”，并计划于2014年再次开展一级评估，确认各成员是否完全符合一级评估的要求。我国作为其成员，已承诺实施《原则》。,240.0
272,2013年5月和8月，中国人民银行和证监会分别发布了《关于实施〈金融市场基础设施原则〉有关事项的通知》，明确了我国的实施计划。2013年12月，人民银行和证监会联合发布《关于开展金融市场基础设施评估工作的通知》，统一部署国内金融市场基础设施自评估和外部评估工作。农村地区支付环境显著改善。近年来，各地改善农村支付服务环境，实现惠农补贴直接入户，扩大网络覆盖面，推出助农特色银行卡服务，推动便农零售，促进了城乡金融服务协调发展和支付服务的包容性增长。截至2013年末，农民工银行卡特色服务取款交易笔数超过1400万笔、金额210亿元。,266.0
273,同时，鼓励并支持农村地区金融机构结合自身实际和业务需要通过支付系统办理各类业务。截至2013年末，超过8万个农村金融机构网点接入人民银行支付清算系统，近8万个农村金融机构网点接入农信银支付清算系统，有效畅通了农村地区资金汇划渠道。深化支付体系境内外交流与合作。通过CPSS、东亚及太平洋地区央行行长会议组织支付结算体委员会（EMEAP-WGPSS）、东南亚中央银行组织（SEACEN）、东盟10+3等国际组织的交流平台，提高对支付结算有关国际事务的参与度，继续加强与各成员单位在支付、清算、结算领域的交流和合作，增强区域内支付结算发展的话语权。深化央行间合作机制，发布《中国支付体系发展报告》，加强对外宣传交流。,306.0
274,（二）发展展望下一步，继续按照《关于中国支付体系发展的指导意见（2011—2015）》，统筹协调支付、清算、结算体系发展，不断提升金融市场基础设施和零售支付服务市场的安全和效率。,89.0
275,一是维护支付系统整体安全稳定运行。,17.0
276,二是继续推广和规范非现金支付工具使用，逐步把关注重点从交易方式和介质转向风险控制和非现金支付工具的清算、结算处理，避免抑制市场主体的创新活力。,71.0
277,三是强化支付服务市场监督管理。,15.0
278,四是加快实施《原则》，加强对金融市场基础设施的风险管理。,28.0
279,五是继续按照党的十八大有关“强农惠农富农”和“推动城乡发展一体化”的方针部署，逐步构建多层次、低成本、可持续的农村支付服务体系，为城乡金融服务一体化发展奠定基础。,81.0
280,六是继续深化支付体系境内外交流与合作。专栏17比特币比特币（Bitcoin）自2009年诞生以来，发展迅速。2013年初，比特币价格仅为13美元，4月初突破100美元关口，12月最高价超过1000美元。比特币的迅速发展引发了人们对虚拟货币是否真正意义上的货币的思考。有人认为比特币的出现是对现行货币体系的巨大挑战，甚至有人称其是“未来的黄金”。,172.0
281,从属性看，比特币不是真正意义上的货币。第一，比特币没有国家信用支撑，没有法偿性和强制性，因此比特币的流通范围是有限的、也是不稳定的，难以真正发挥流通支付手段的作用。第二，比特币规模存在上限，难以适应经济发展的需要，若比特币成为货币，会导致通货紧缩，抑制经济发展。第三，比特币缺乏中央调节机制，容易被过度炒作，导致价格剧烈波动，无法成为计价货币和流通手段，目前接受比特币支付的商品，其标价货币大多仍是该国的本位货币。第四，比特币具有很强的可替代性，很难固定地充当一般等价物。,236.0
282,任何有自己的开采算法、遵循P2P协议、限量、无中心管制的数字“货币”都有可能取代比特币。目前，比特币更多的是作为投机工具，而非实体经济中的支付工具，持有比特币的人更愿意把它收藏起来而不是用于购买其他商品。社会公众对比特币还缺乏足够了解，一些个人出于跟风或者投机的心理持有、使用和交易比特币，可能带来以下风险。,154.0
283,一是比特币的网络交易平台、过程和规则等都缺乏监管和法律保障，容易产生价格操控和虚假交易等行为，其账户资金安全和清算结算环节也存在风险。,67.0
284,二是比特币价格缺少合理的支撑，其涨跌主要取决于参与者的信心和预期，甚至主要依赖于比特币未来将成为“世界货币”这一假想，容易沦为投机炒作的工具，一旦市场或政策出现风吹草动，就有可能泡沫破裂。,94.0
285,三是比特币交易具有较高的隐蔽性、匿名性和不受地域限制的特点，其资金流向难以监测，为毒品、枪支交易和洗钱等违法犯罪活动提供了便利。2013年12月，中国人民银行等五部委发布《关于防范比特币风险的通知》，要求各金融机构和支付机构不得开展与比特币相关的业务；提供比特币登记、交易等服务的网站应当在电信管理机构备案，并切实履行反洗钱义务，对用户身份进行识别、报告可疑交易；相关部门和金融机构、支付机构要加强对社会公众货币知识的教育，引导社会公众树立正确的货币观念和投资理念。二、法律环境（一）金融法律法规不断健全2013年，我国加快推进行政审批制度改革和政府职能转变，制定和修改相关法律法规，取消和下放了一批行政审批权，进一步激发市场主体创造活力，增强经济发展内生动力。修订法律法规，健全法律体系。全国人大常委会修改《中华人民共和国证券法》，放宽了对证券公司调整注册资本和变更公司形式的限制；修改《中华人民共和国公司法》，将注册资本实缴登记制改为认缴登记制，放宽注册资本登记条件，简化登记事项和登记文件。,448.0
286,国务院修改《中华人民共和国外资保险公司管理条例》，允许外国保险公司以人民币形式出资设立合资保险公司、独资保险公司；修订通过《国际收支统计申报办法》，对统计范围、申报主体、申报要求等内容作出修改。修改《期货交易管理条例》，取消了对境内单位或者个人从事境外商品期货交易的品种进行核准的规定。发布司法解释，完善金融司法。最高人民法院发布《关于适用〈中华人民共和国保险法〉若干问题的解释（二）》，规范了保险公司的承保行为，细化了投保人和保险人的告知和说明义务，规范了保险合同内容的认定，明确了理赔核定期间起算点。发布《关于审理出口信用保险合同纠纷案件适用相关法律问题的批复》，对出口信用保险合同的法律适用问题作出规定。,305.0
287,发布了《关于网络查询、冻结被执行人存款的规定》，对人民法院办理执行案件过程中通过网络查询、冻结被执行人存款及其他财产的行为作出了规定。制定规章规范性文件，维护市场秩序。人民银行发布规范性文件，细化征信机构的监督管理，明确人民币合格境外投资者的账户开立以及进入银行间债券市场的相关事项，进一步完善银行间债券市场交易结算管理，明确银行间市场发行同业存单及相关的交易、登记、托管、结算等问题，规范支付机构客户备付金管理和银行卡收单业务。监管部门发布规章和规范性文件，规范了商业银行行政许可事项、消费金融公司试点、银行业消费者权益保护等，明确了证券发行与承销、证券公司客户资产管理业务、证券投资基金销售和托管、合格境外机构投资者境内证券投资试点、中小企业股份转让系统等，强化了保险消费投诉处理、保险经纪机构监管、保险经纪和销售从业人员监管等。（二）立法展望2014年，积极研究推动《中国人民银行法》的修订。,399.0
288,现行《中国人民银行法》于1995年发布实施，并于2003年进行了修订。近年来，我国经济金融发展日新月异，金融体制改革创新持续推进，金融业对外开放不断深化，对调整和完善人民银行职责提出了迫切要求。国际金融危机后，国际社会对强化中央银行的宏观审慎管理和金融稳定职能形成了基本共识，美国、英国等主要发达经济体进行了全方位的金融监管体制改革，这为我国完善金融管理体系提供了有益借鉴。在这一背景下，有必要对现行《中国人民银行法》进行修改，从深化金融体制改革、促进金融业发展的战略高度，充分体现市场化导向，尊重市场机制，鼓励金融创新，在完善监管体制的同时加强金融服务，实现法律和行政手段对市场发展的正向激励作用，为较长一段时期内人民银行的履职和金融业发展提供坚实的法律保障。修改内容应着重强化人民银行宏观调控和宏观审慎管理职责，细化维护金融稳定的手段和工具，完善金融市场管理、金融统计、人民币管理等规定。,396.0
289,为适应我国金融业改革发展的需要，将尽快研究推动《证券法》、《保险法》的修订及“期货法”的起草工作，推动《现金管理暂行条例》、《外资银行管理条例》、《机动车交通事故责任强制保险条例》的修订，积极研究制定“存款保险条例”、“非存款类放贷组织条例”、“人民币银行账户管理条例”、“商业银行破产风险处置实施条例”、“融资担保公司管理条例”、“私募投资基金管理暂行条例”、“上市公司监督管理条例”等。,195.0
290,三、会计标准（一）会计标准建设取得进展2013年，会计标准持续完善。,34.0
291,一是会计财务制度的制定和修订工作取得多领域进展。发布《企业产品成本核算制度（试行）》和《企业会计信息化工作规范》，整合了原分布在各项会计准则中关于产品成本要素的内容，进一步规范企业会计信息化。修订多类事业单位的财务制度，以适应改革和发展的实际情况。发布新《行政单位会计制度》，使会计核算兼顾行政单位预算管理需求和财务管理需求。,163.0
292,二是进一步改进信息披露。修订了上市公司半年报和季报的信息披露规定，增强报告披露的针对性和有效性，合理降低信息披露成本。统一并改进了证券公司年度报告的信息披露内容和格式。,84.0
293,三是修订《企业会计准则通用分类标准编报规则》，适应石油和天然气行业、银行业扩展分类标准的实施要求。（二）发展展望继续推进我国企业会计准则与国际财务报告准则的持续趋同，发布并实施公允价值计量等会计准则，研究适应金融工具创新和资本市场发展的会计准则补充规定，进一步健全完善金融领域企业会计准则体系。积极推动、落实行政单位会计制度、中小学校会计制度以及科学事业单位会计制度等一系列会计制度，做好《会计信息化工作规范》的宣传工作。进一步扩大企业会计准则通用分类标准的实施范围。积极参与国际准则的制定与修订，发挥我国在新建立的会计准则咨询论坛等国际组织的影响力，大力开展会计工作的对外交流与合作。,293.0
294,四、信用环境（一）征信和社会信用体系建设成效显著征信立法和制度建设迈上新台阶。2013年3月15日，《征信业管理条例》正式实施，征信业发展步入了法制化轨道。人民银行制定《征信机构管理办法》，规范征信机构设立、退出及日常监管，于2013年12月20日起实施。专栏18颁布实施《征信机构管理办法》为贯彻落实党的十八届三中全会关于“建立健全社会征信体系”的要求，配合《征信业管理条例》实施，2013年11月15日，中国人民银行发布《征信机构管理办法》（以下简称《办法》）。《办法》是《征信业管理条例》的重要配套制度，遵循了个人征信机构从严、企业征信机构从宽、征信机构市场化运作与监督管理并重、征信机构的行政监管和社会监督兼顾的监管思路。,315.0
295,《办法》规范了征信机构设立、变更和终止，强化征信机构公司治理和风险防控。《办法》将和《征信业管理条例》等法律法规共同构成征信机构管理的制度框架，在促进征信机构规范运行、保护信息主体合法权益等方面发挥重要作用。为了充分保护个人信息主体的合法权益，《办法》完善了个人征信机构设立时所应具备的条件，明确要求设立个人征信机构应具有健全的组织机构、完善的业务操作、安全管理、合规性管理等内控制度，且信用信息系统应当符合国家信息安全保护等级二级或二级以上标准。同时，《办法》完善了个人征信机构市场退出程序，着重解决了数据库处理流程和征信机构退出流程的衔接问题。在监管措施方面，《办法》在明确征信机构报告要求的基础上，建立了重点监管制度。,312.0
296,规定在征信机构出现严重违法违规行为、可能发生信息泄露、出现财务状况异常或严重亏损以及被大量投诉等情形时，人民银行可以将其列为重点监管对象，酌情缩短业务开展情况报告周期、信息系统安全测评周期，并采取相应的监管措施。,106.0
