,paragraph,length
125,适应国家发展需要和金融体制改革要求，继续深化国家开发银行改革，妥善解决债券信用、资金来源等问题。发展普惠金融，推动建立服务可得、价格合理、竞争适度、发展持续、惠及广大人民群众的普惠金融服务体系。鼓励金融创新，丰富金融市场层次和产品。加快转变政府职能，简化行政审批，使市场在金融资源配置中起决定性作用，探索管理制度创新，释放改革红利，激发市场主体的发展活力。推进支持实体经济的金融产品和服务创新，重点围绕信贷资产证券化、开发主动负债工具等加大创新力度，研究探索大中型农机具、农村土地承包经营权和宅基地使用权等抵押贷款试点，拓展市场发展空间。,269.0
126,推动中小型银行业金融机构特色化经营，降低同质化竞争带来的风险共振。防范和化解重点领域金融风险，进一步提升银行业稳健性水平。银行业金融机构要牢固树立风险意识，准确把握重点领域的风险总量、风险结构和风险动向，积极化解“两高一剩”行业结构调整时暴露的金融风险。继续按照“总量控制、分类管理、区别对待、逐步化解”的原则，严控新增平台贷款，优化存量贷款结构，审慎稳妥地缓释平台贷款风险。继续认真执行房地产调控政策，落实差别化住房信贷政策，加强名单制管理和压力测试。,227.0
127,加强流动性风险监测分析和预警，完善流动性风险管理工具和方法，合理配置资产负债期限结构，做好应急预案，切实提高流动性风险管控能力。加强同业业务和理财风险防控，严防风险传染和蔓延。完善同业业务管理制度，不断增强同业业务透明度，疏堵结合，既要限制发展不合理的同业业务，又要推动开展规范的资产负债业务创新。研究制定综合性、系统性的商业银行理财业务管理办法，督促银行建立单独的机构组织体系和业务管理体系，切实做到资金来源和运用一一对应。银行业金融机构应构建与自身风险管控能力相适应的同业业务和理财发展规划和运营模式，建立健全相关内控制度和操作流程。,269.0
128,落实国际金融监管改革措施和稳健标准，加强和改进银行业监管。构建与国际标准接轨的银行业监管框架，引导商业银行按照既定计划稳步实施资本监管新标准，研究制定逆周期资本缓冲要求，建立更加有效的资本约束机制，完善商业银行流动性管理框架。根据我国金融市场结构和特点，细化金融机构分类标准，统一监管政策，减少监管套利，弥补监管真空，增强监管的针对性和有效性。第四章证券期货业2013年，证券期货机构稳健经营，业务创新取得积极进展，监管改革稳步推进，对外开放不断深化，基础性制度建设继续完善。需进一步优化证券期货机构业务模式，持续提升抗风险能力。,265.0
129,一、运行状况（一）市场主体发展总体稳健上市公司稳步发展。2013年末，沪、深两市共有上市公司2489家，同比减少5家，均为正常退市。总市值和流通市值分别为23.91万亿元和19.96万亿元，同比分别增长3.79%和9.87%，在机构数量有所减少的情况下，上市公司总体发展仍呈稳步增长态势，市场主体优胜劣汰逐步体现。全国性场外市场挂牌公司数量大幅增加。2013年1月16日，全国中小企业股份转让系统正式揭牌运营。,205.0
130,国务院发布《关于全国中小企业股份转让系统有关问题的决定》，全国股份转让系统市场结束高新园区试点，实现覆盖全国。截至2013年末，全国中小企业股份转让系统挂牌公司355家，同比增加155家，总股本和总市值分别为96.39亿股和552亿元，同比分别增长74.4%和36.57%。市场规模逐步拓展，运行平稳有序。证券期货经营机构数量小幅增加。2013年末，全国共有证券公司115家，较上年新增1家；其中上市证券公司20家，较上年新增1家。,216.0
131,期货公司156家，较上年减少5家。基金管理公司89家，较上年新增12家，增幅较大。证券期货业资产规模整体有所增长。2013年末，证券公司总资产（不含客户资产）1.52万亿元，同比增加约4100亿元，增长36.79%。期货公司总资产（不含客户资产）629.89亿元，同比增加78.50亿元，增长14.24%。,153.0
132,基金管理公司共管理1553只公募基金，基金总份额达3.12万亿份，同比下降1.66%，基金净值约3万亿元，同比增长4.76%。证券公司产品创新稳步推进。《证券公司分支机构监管规定》发布，放开分支机构设立的主体资格限制、地域范围限制和数量限制。融资融券业务市场覆盖面稳步扩大、规模不断增长，截至2013年末，共有84家证券公司开展融资融券业务，融资融券余额3465.47亿元，同比增长287.07%。2013年2月推出转融券业务试点，融资融券配套机制得到进一步完善；推出股票质押式回购交易，截至2013年末，共有86家证券公司开展了股票质押式回购交易，待回购金额846亿元。,286.0
133,15家证券公司经行业协会备案开展柜台市场试点，开展收益互换、场外股票期权等交易。资产管理业务规模继续大幅增长，截至2013年末，证券公司资产管理业务受托资金规模达5.2万亿元，同比增长175%。《证券公司资产证券化业务管理规定》发布，将该业务由试点转为常规，降低准入门槛，扩大基础资产范围。证券公司自主创新加速，推出了私募基金综合托管试点方案、客户资金消费支付服务试点方案、上市公司股权激励行权融资试点方案、研究制定贵金属现货合约代理业务及黄金现货合约自营交易试点审核方案。基金管理公司创新发展成效明显。,252.0
134,截至2013年末，基金管理公司已设立的62家子公司资产管理规模达9414亿元，占基金管理公司非公募业务资产管理规模的44%，占基金行业资产管理总规模的18%。货币市场基金与互联网合作创新，2013年6月，支付宝网络技术公司与天弘基金管理公司合作推出了余额宝业务，对接天弘增利宝货币市场基金，目前该款基金产品已经成为国内客户数最多和保有规模最大的基金。此外，推出债券交易型开放式指数基金（ETF）、黄金ETF、浮动管理费率基金、目标收益触发式基金、定期支付基金、绝对收益基金等创新产品。期货公司业务进一步多元化。2013年，期货公司创新步伐明显加快。,274.0
135,期货投资咨询、资产管理、风险管理子公司等业务试点逐步推开，效果初显。截至2013年末，已有93家期货公司获许经营期货投资咨询业务，29家期货公司取得资产管理业务资格，28家公司已正式开展期货资产管理业务，全国期货公司资产管理账户受托资金余额达12.6亿元。《期货公司设立子公司开展以风险管理服务为主的业务试点工作指引》正式实施，标志着期货公司风险管理服务子公司业务试点启动。机构投资者类型有所增加。2013年，商业银行设立基金管理公司试点再次扩大，先后有5家商业银行设立了基金管理公司，进一步拓宽了储蓄资金向资本市场有序分流的渠道。,266.0
136,《资产管理机构开展公募证券投资基金管理业务暂行规定》发布，允许证券公司、保险资产管理公司、私募证券基金管理机构以及股权投资管理机构、创业投资管理机构等机构直接申请开展公募基金管理业务。截至2013年12月末，沪、深两市机构投资者持有的已上市流通股占A股流通市值比例达72.74%，较上年末小幅减少1.93个百分点，连续第4年保持在70%以上水平。（二）市场基础性制度建设继续完善积极推进新股发行体制改革。发布了《关于进一步推进新股发行体制改革的意见》，制定完善了《证券发行与承销管理办法》等配套政策性文件。新股发行以信息披露为中心，引导市场各方归位尽责。,277.0
137,进一步理顺发行、定价、配售等环节的市场化运行机制，推出包括老股转让、股债结合在内的发行融资方式，强化发行人及其控股股东等责任主体的诚信义务。按照受理即披露、违规即担责的原则，建立提前介入调查制度，完善发行监管与稽查执法衔接机制，加强新股发行事中事后监管，严惩发行造假等违法违规行为。开展IPO公司财务会计信息专项检查，稳步重启IPO发行。场外市场制度规则体系初步建立。形成了以《证券法》、《关于全国中小企业股份转让系统有关问题的决定》为核心，《非上市公众公司监督管理办法》、《全国中小企业股份转让系统有限责任公司管理暂行办法》及配套指引准则为具体内容的监管制度框架体系，以及涵盖挂牌准入、信息披露、发行融资、股票交易、投资者准入、主办券商管理、市场监管、市场收费等多方面的市场规则体系。,343.0
138,上市公司并购重组市场化改革加速。简化上市公司并购重组审批流程，实施并购重组分道制审核，2013年，经核准重大资产重组交易金额为3142.6亿元，同比增长35%。中小投资者保护机制逐步完善。国务院发布《关于进一步加强资本市场中小投资者合法权益保护工作的意见》，围绕中小投资者权益保护，提出了健全投资者适当性制度、优化投资回报机制、保障中小投资者知情权等九方面政策举措，有利于完善保护中小投资者合法权益的政策体系，提高投资者信心，推进资本市场的持续健康发展。证券期货市场产品进一步丰富。,241.0
139,11月，国务院发布《关于开展优先股试点的指导意见》，决定开展优先股试点，以此推动直接融资的发展和企业兼并重组，为投资者提供多元化投资渠道，促进资本市场稳定发展。9月，平稳推出国债期货，对完善国债发行体制，推进利率市场化改革，引导资源优化配置，增强金融机构服务实体经济的能力具有重要意义。动力煤、铁矿石等4个战略性资源期货品种以及鸡蛋、胶合板等4个宜农期货品种上市，黄金期货、白银期货和铜、铝、锌、铅等有色金属期货连续交易试点启动。专栏7开展国债期货交易国债期货是以约定品种国债为标的物的利率期货合约，买卖双方通过在有组织的交易场所内交易标准化合约，从而预先确定标的国债的价格并于未来特定时间内进行券款交割。开展国债期货交易，是建设多层次资本市场和金融市场化改革的重要内容，对深化金融市场改革和推进资本市场创新具有重要意义。,361.0
140,我国具备了开展国债期货交易的条件。,17.0
141,一是我国国债发行制度逐步完善，国债发行规模不断扩大。财政部国债发行机制已实现市场化，并对关键期限的国债品种采用国际通行的定期滚动发行制度。国债发行规模不断扩大，2012年发行量超过1.3万亿元。,97.0
142,二是国债二级市场日益成熟，市场已具备相当规模。我国债券市场已形成场外市场为主、交易所市场为辅的市场格局。截至2012年末，我国银行间市场记账式国债余额已突破7万亿元，是1995年国债期货试点时期国债存量的60余倍；国债交易量大幅增加，流动性日渐增强，2012年，银行间市场国债交易量为9.1万亿元，年换手率为133%，若剔除持有到期账户中的大部分国债，则可交易类账户中，国债实际年换手率为600%~700%。,204.0
143,三是市场参与主体日益多元化。银行间债券市场已形成了以商业银行为核心、金融机构为主体、其他机构投资者共同参与的多层次投资者结构，银行间债券市场已成为各类市场机构进行投融资活动的重要平台。,92.0
144,四是我国国债市场登记托管机制可支持国债期货顺利交割。,26.0
145,五是股指期货的成功推出与平稳运行，为国债期货市场积累了宝贵经验。2013年9月6日，经国务院批准，五年期国债期货合约在中国金融期货交易所挂牌交易。国债期货具有以下特点：一是采用名义标准券设计，剩余期限在4~7年的记账式国债均可交收，大幅增加了可交割券范围。,128.0
146,二是实行买卖双边举手滚动交割和集中交割的规则，反映买卖双方真实交割意愿，延长交割期限，显著降低了交割违约风险。,55.0
147,三是在跨部委协调机制推动下，由中国金融期货交易所在银行间市场、交易所市场分别设立国债期货交收账户，解决了两个国债市场投资者不一致、部分投资者无法交收债券的问题，确保国债跨市场转托管和交收的顺利进行。,99.0
148,四是推动财政部调整5年期、7年期记账式国债招标时间，确保所有投资者只能在国债期货交易时段获知招标结果，防止利用国债招标信息优势进行内幕交易。2013年12月，国债期货TF1312合约交割业务顺利完成，国债期货走完了首个合约从挂牌、交易到交割的完整周期，市场运行总体平稳，国债期货市场功能逐步显现。,148.0
149,一是价格发现和避险功能初步发挥，进一步提高国债发行效率。12月国债招投标的最终中标价格与国债期货之间的收益率最低相差不到2个基点。,65.0
150,二是提高现券市场流动性，进一步盘活存量国债。国债期货上市后，最便宜可交割券“13国债15”日均成交20.18亿元，较国债期货上市前增长19.59%。,74.0
151,三是推动国债跨市场转托管，夯实国债收益率曲线的市场基础。,28.0
152,四是及时反映货币政策信息，提高货币政策传递效率。,24.0
153,五是激发机构创新活力，增强市场在资源配置中的决定性作用。截至2013年末，各类金融机构推出了87个金融产品参与国债期货交易。（三）稳步推进监管转型精简行政审批备案登记等事项，提高监管透明度。证监会落实国务院转变政府职能、简政放权的部署，制定行政审批事项精简方案，2013年取消了2项行政审批事项，2014年至2016年拟取消和调整19项行政审批事项。同时，建立专职新闻发言人制度，健全定期新闻发布会制度。,202.0
154,加强法制建设和稽查执法。《证券法》修订和“期货法”制定取得积极进展，《上市公司监督管理条例》、《私募投资基金管理暂行条例》制定稳步推进，公募基金管理、销售、托管制度安排出台。万福生科欺诈发行案和光大证券内幕交易案等典型案件得到严肃查处。截至2013年末，29个省（市、区）和5个计划单列市各类交易场所清理整顿工作基本完成，200余家交易场所关闭。证券期货监管合作工作进一步加强。,189.0
155,根据人民银行同证监会签订的《关于加强证券期货监管合作共同维护金融稳定的备忘录》，2013年，已有32家人民银行分支行与证监会派出机构签订了辖区监管合作备忘录，加强信息沟通和共享，共同打击证券期货违法违规活动，协调清理整顿各类交易场所，监测金融风险，共同开展金融消费者保护和投资者教育。,142.0
156,（四）对外开放进一步推进2013年，共有8家公司在境外首发，10家公司在境外增发，共筹集资金174亿美元。3月，《关于合格境外机构投资者投资银行间债券市场有关事项的通知》发布，允许获得证监会核发资格及外汇局核批投资额度的合格境外机构投资者（QFII）向人民银行申请进入银行间债券市场，拓宽QFII的投资渠道，规范其投资行为。QFII和人民币合格境外机构投资者（RQFII）发展明显加快，7月，QFII投资额度增加到1500亿美元，RQFII试点进一步拓展到新加坡、伦敦等地。《资本市场支持促进中国（上海）自由贸易试验区的若干政策》出台，证监会批准上海期货交易所在自贸区成立上海能源交易中心。二、稳健性评估（一）部分上市公司业绩下滑，资金存在“脱实向虚”倾向2013年，受宏观经济增速放缓、企业经营成本上升等因素的影响，上市公司经营困难有所增加。,372.0
157,截至2014年2月底，共有1750家上市公司公布了业绩预报，占全部上市公司的69.64%，预计亏损的上市公司198家，占比11.31%，其中首次亏损162家，持续亏损36家。与2012年年报数据相比，预计亏损的上市公司比例上升了2.24个百分点。预计亏损公司主要集中于“化学原料和化学制品制造业”、“计算机、通信和其他电子设备制造业”以及“专用设备制造业”。2013年，上市公司参与委托理财、委托贷款明显增加，据统计，全年上市公司涉及委托理财、委托贷款的公告分别为204件、397件，较上年增长168.4%、42.8%。部分上市公司在参与委托理财、委托贷款时存在使用银行信贷资金、资金流向宏观调控限制领域等问题。,306.0
158,（二）证券公司负债增长较快，但整体依然稳健截至2013年末，证券公司资产总额20788亿元，同比增长20.80%，负债总额13250亿元，同比增长29.10%，净资产总额7539亿元，净资本总额5205亿元，同比分别增长8.54%和8.78%。,122.0
159,全行业平均来看，单家证券公司净资本与各项业务风险资本准备之和的比为612.35%，净资本/净资产为69.04%，净资本/负债为65.18%，净资产/负债为94.41%，较上年出现一定程度的下降。证券公司负债增长快于资产增长，但各项风控指标符合监管规定，风险总体可控，证券公司整体经营稳健。（三）证券公司盈利能力增长，盈利模式仍需进一步改善2013年，全行业实现营业收入1592亿元，同比增长22.37%。其中，手续费及佣金净收入987亿元，同比增长30.90%，自营业务收入（含投资收益和公允价值变动收益）306亿元，同比增长5.52%，利息净收入182亿元，同比增长4.00%。全年累计实现净利润440亿元，同比增长32.93%。,316.0
160,从收入构成看，手续费及佣金收入仍然是证券公司主要的收入来源，且比重由上年的57.96%上升至62.00%。证券公司创新业务发展速度较快，融资融券和券商资产管理业务维持高速增长，有利于证券公司摆脱“靠天吃饭”的经营现状。在这一过程中，证券公司应平衡好业务创新与风险控制之间的关系，认真汲取光大证券在“8·16”异常交易事件中的教训，加强内部控制，提高风险管理水平，以实体经济的需要为导向加大金融创新力度，进一步发挥证券业服务实体经济的能力。专栏8关注证券公司定向资产管理业务的快速增长证券公司资产管理业务有定向资产管理、集合资产管理和专项资产管理三类。近年来，证券公司资产管理业务快速发展。,294.0
161,其中，定向资产管理业务投资范围广，近两年呈现爆发式增长。截至2013年末，证券公司定向资产管理业务规模达4.83万亿元，较2012年末增长186%，占全部资产管理业务规模的93%。证券公司与银行合作开展定向资产管理业务（以下简称银证通道业务）模式主要为：银行募集资金，与证券公司签订定向资产管理合同，证券公司作为管理人，执行银行投资指令，将资金投向银行指定投资品种，证券公司收取基本管理费。证券公司开展此类业务主要基于银行如下需求：一是将受托资金投资于已贴现票据资产、信托资产等资产收益权，满足银行存量资产出表需求。,258.0
162,二是将受托资金投资于未贴现票据资产、应收账款收益权、股票收益权等资产收益权，进行委托贷款，或者投资于贷款类信托计划，满足银行表外放贷需求。,69.0
163,三是将受托资金投资于保险理财产品，再返存入银行，将同业存款转化为一般存款，或者通过证券公司直接作为同业存款返存入银行，满足银行调节存款结构需求。,72.0
164,四是将存贷业务资金借道银信、银证、银基通道业务转为托管业务资金，将利差收入转为中间业务收入，满足银行收入结构调整需求。对证券公司而言，开展银证通道业务，存在充分利用银行资源、加强与银行合作、做大资产管理规模、拓宽收入来源等需求。但是，银证通道业务属于跨市场、跨行业交叉金融业务，风险具有传导性、隐蔽性。证监会密切关注银证通道业务风险，加强现场检查，加大执法力度，指导行业协会发布了《关于规范证券公司与银行合作开展定向资产管理业务有关事项的通知》、《关于进一步规范证券公司资产管理业务有关事项的补充意见》，督促证券公司合规审慎经营，有效防范、及时化解业务风险。目前证券公司定向资产管理业务制度体系及操作流程日趋完备，大部分公司对委托银行财务状况及资质水平等调查较为审慎，资产管理合同约定责任义务较为明确，风险提示比较充分，定向资产管理业务整体规范程度明显提高。下一步，应进一步加强证券行业规划与顶层设计：一是在对证券公司资产管理业务发展阶段性评估基础上，进一步完善现有法规制度，创造公平竞争环境，引导证券公司探索和实施主动资产管理战略转型。,469.0
165,二是充分发挥“一行三会”金融监管协作平台作用，研究建立统一全面的理财产品市场统计分析及风险预警系统，及时监测、分析和评估跨市场、跨行业、跨区域的金融业务风险。,79.0
166,三是加强金融监管部门沟通协作，密切关注监管政策动向，及时调整证券公司通道业务监管导向，促进行业持续健康发展。（四）期货公司规模增长但利润下滑，综合实力仍待提升截至2013年末，期货公司总资产（不含客户资产）629.89亿元，净资产522.14亿元，净资本439.37亿元，同比分别增长14.24%、14.34%和5.38%。代理的客户保证金总额1939.18亿元，同比增长9.74%，全年实现营业收入183.04亿元，同比增长7.30%，净利润35.49亿元，同比下降0.50%。与其他金融机构相比，期货公司综合实力仍然较弱。截至2013年末，期货公司平均净资本2.82亿元。,288.0
167,期货公司业务创新有所发展，但收入来源单一的问题未得到显著改善，仍主要依靠客户佣金收入和客户保证金利息收入，2013年手续费收入125.51亿元，利息收入53.99亿元，在总营业收入中占比高达68.57%和29.50%。,109.0
168,（五）基金业总体发展平稳，货币市场基金创新步伐加快截至2013年末，基金净值约3万亿元，同比增长4.53%。其中，股票型基金占比38.47%，较上年末下降1.57个百分点，混合型基金占比18.88%，较上年末下降0.82个百分点，债券型基金占比15.78%，较上年末上升2.60个百分点，货币市场基金占比24.90%，较上年末上升4.95个百分点。受股票市场下跌及债券市场波动等因素影响，股票类和债券类基金发展速度有所下降，但货币市场基金利用互联网加大产品、渠道和服务创新，满足了企业和居民资金流动性管理和保值增值的需求，也促进了自身发展。专栏9货币市场基金创新及影响货币市场基金是指以现金、协议存款、一年以内（含一年）的银行定期存款，剩余期限在三百九十七天以内（含三百九十七天）的债券，剩余期限在一年以内（含一年）的债券回购，剩余期限在一年以内（含一年）的中央银行票据，中国证监会、中国人民银行认可的其他具有良好流动性的货币市场工具为投资对象的基金。,426.0
169,近年来，我国货币市场基金不断创新，在赎回、支付、转账、投资等方面的便利性逐步提升，主要具有以下特点：一是部分产品通过相关机构垫资实现T+0赎回，投资者一定额度内可以实现当日赎回。,89.0
170,二是开通支付和还款功能，通过第三方支付平台等，实现货币市场基金产品与多家银行还款账户、指定网络购物商户或生活支付平台的对接，为投资者增加生活消费的便利。,76.0
