,paragraph,length
335,在国际标准制定方面，BCBS和IOSCO于2013年9月出台非集中清算衍生品的保证金规则，要求各国于2015年12月起将其纳入本国监管框架内实施。CPSS和IOSCO于2013年8月发布关于当局获取交易信息库数据的报告。BCBS正在会同CPSS和IOSCO修改银行对中央对手方风险敞口的资本要求，最终指引将于2014年出台。（六）降低对信用评级机构的依赖2013年，FSB启动了降低对信用评级机构（CRA）依赖的同行评估，推动各国按照2012年G20峰会制定的路线图开展改革。评估分为两个阶段，第一阶段的评估已于2013年8月结束，评估报告显示，美国和欧盟在消除法律法规对CRA评级的硬性依赖方面进展显著，美国《多德—弗兰克法案》设定了比FSB原则更为严格的规定，要求完全取消对CRA评级的使用；欧盟实施的信用评级机构监管条例，就如何落实FSB原则提供了最为全面的实施方案。,387.0
336,报告认为，不同金融行业对于CRA评级的依赖程度不同，银行业监管规则仍大量依赖CRA，而保险业和其他非银行监管对CRA的依赖较少。BCBS已于2013年12月公布关于修订巴塞尔证券化业务框架的征求意见稿，针对证券化业务对于外部评级的机械性依赖、资本要求的陡壁效应等提出了建议措施，并正在研究资本标准法计量中可替代的评级方式。第二阶段的评估于2013年10月启动，目前包括中国在内的FSB成员国均提交了推动金融机构开发内部信用评级方法的行动计划。（七）其他改进数据缺口（DataGap）。为加强G-SIBs的数据收集和共享，FSB计划分三个阶段实施“数据缺口与系统连接”项目。,286.0
337,第一阶段已于2013年3月实施，主要内容是采集G-SIBs的信贷风险敞口数据，机构需按周向国际清算银行（BIS）下设的数据中心（DataHub）报送对前50名交易对手的信贷风险敞口。除中国和瑞典外，其余G-SIBs母国均加入了该项目。6月，数据中心向参与机构的母国监管部门共享了数据信息。按计划，第二阶段和第三阶段分别将于2014年和2015年实施。推动建立法人机构识别编码（LEI）。,193.0
338,FSB继续推动建立“全球法人机构识别编码”体系，为全球所有参与金融交易的机构进行统一编码。该体系将建立独立于FSB的三层非盈利体系，由各国监管机构代表组成的监督委员会（ROC）负责进行总体决策，ROC下设中央运行机构（COU），负责全球数据的集中和处理，各国设立本地运行机构（LOU），负责本国、本领域LEI编码的注册运行维护。所有机构将获得唯一的由数字和字母组成的20位编码，其中前4位是分配给LOU的国家代码，5~18为LOU分配，最后两位是校验位。目前，美国、德国、爱尔兰和巴勒斯坦等国已申请获得LEI国家代码。二、主要国家和地区加强宏观审慎管理的进展（一）美国金融稳定监督委员会（FSOC）识别和防范系统性风险。,310.0
339,2013年，FSOC主要开展了以下工作：一是发布年报，总结美国宏观经济金融形势和金融市场发展情况，梳理金融监管改革进展，分析美国金融稳定面临的潜在风险，并提出下一步政策建议。,87.0
340,二是确定系统重要性非银行金融机构名单。7月，按照《多德—弗兰克法案》规定的评估指标以及FSOC制定的评估方法，认定美国国际集团、通用电气金融服务公司和保德信金融公司3家系统重要性非银行金融机构，将由美联储对其进行更加严格的审慎监管。提高金融监管标准。,125.0
341,一是落实巴塞尔协议Ⅲ的改革要求，严格资本要求。美联储、联邦存款保险公司和货币监理署联合出台了一系列政策新规，要求银行核心一级资本充足率（核心一级资本/风险加权资产）提高到4.5%，一级资本充足率提高到6%，建立2.5%储备资本要求，对使用高级法的银行提出了补充杠杆率不得低于3%的要求。,143.0
342,二是建立流动性监管框架。发布加强流动性风险监管的新规，适用于所有总资产超过500亿美元的银行控股公司和储蓄贷款控股公司、总资产超过2500亿美元或海外表内资产超过100亿美元的非银行金融机构，对流动性覆盖比率的适用范围与最低要求、优质流动性资产和现金净流出量的计算等作出详细规定。,140.0
343,三是强化对货币市场基金（MMF）的监管。作为全球第一大MMF市场，FSOC于2012年11月提出实施结构性改革以降低MMFs脆弱性的建议，证券交易委员会（SEC）也发布改革MMFs运作方式的建议规则，为降低MMFs挤兑的可能性，可采取机构类的MMFs转化为浮动资产净值、非政府的MMFs设定赎回门槛或收取赎回费等措施。“沃尔克”规则最终条款出台。2013年12月，美联储、商品期货交易委员会、联邦存款保险公司、货币监理署和SEC五家监管机构联合发布“沃尔克”规则最终条款，限制银行业机构开展证券、衍生品、商品期货等高风险自营业务，限制其发起或投资对冲基金和私募股权基金，进一步明确了限制业务的豁免情形，包括允许银行机构开展外国主权债务交易等。根据银行机构的资产规模设定门槛，制定实施相应的合规计划、记录和报告要求。,357.0
344,“沃尔克”规则的实施将促使美国大型银行采取更加稳健的经营战略和业务模式，有助于减少投机交易业务对传统银行体系的冲击，重建对银行体系的信任和修复市场信心。（二）英国新的金融监管体系正式运行。2013年4月1日，《金融服务法》生效，英国新的金融监管体制正式运行，确立了英格兰银行负责货币政策、宏观审慎管理与微观审慎监管的核心地位。其内部成立金融政策委员会（FPC），负责宏观审慎管理，并下设审慎监管局（PRA），与金融行为局（FCA）一同负责微观审慎监管，取代原来的金融服务局（FSA）。12月18日，《金融服务（银行改革业）法》获得最终签署批准，标志着英国银行业结构改革正式立法。,289.0
345,法案规定银行集团需设立独立的实体分别开展零售银行业务和投资银行业务，提高损失吸收能力，促进有序的银行业市场竞争，加强支付结算系统监管。金融政策委员会履行宏观审慎职责。FPC自2013年正式成立以来，主要开展了以下工作：一是每半年发布金融稳定报告，对英国金融体系系统性风险状况进行分析和评估，确定今后的工作重点集中在提高银行资本水平、解决“大而不能倒”、影子银行三方面。,184.0
346,二是定期向财政部、英格兰银行、PRA和FCA等监管部门提出一系列政策建议，包括起草压力测试指引、修订流动性监管要求、评估长期利率骤升的脆弱性、提高网络攻击的应对能力、要求抵押房贷机构进行利率压力测试等内容。,103.0
347,三是FPC被赋予制定、决策逆周期资本缓冲和行业资本要求两项宏观审慎工具的职责。1月，FPC发布政策报告，阐述了将如何应用上述宏观审慎工具，及其对金融稳定和经济发展的潜在影响，并确定了涵盖银行业资产负债表、实体经济杠杆率、市场状况等一系列核心指标作为决策参考。关注货币政策对金融稳定的影响。2013年，英格兰银行发布的金融稳定报告认为，货币政策通过需求和金融两个渠道影响金融稳定。,189.0
348,一是需求渠道。宽松货币政策将鼓励住户和企业增加消费和投资，从而增加信贷融资需求，一旦未来利率提高，现有的债务规模将带来高昂的偿债成本。,67.0
349,二是金融渠道。货币政策通过影响银行的盈利水平进而影响其资本补充能力，还可通过影响金融机构的融资能力，改变资产负债表的流动性。同时，货币政策会改变银行和非银行金融机构的风险预期和容忍度，名义利率的下降会使金融机构和市场参与者愿意承担更多风险。低利率也导致信贷快速增长，加大信贷调控的难度。此外，长期利率的下降将使保险公司和养老金的负债价值超出资产价值，从而产生资金缺口。,184.0
350,英格兰银行被指定为处置机构。危机后，英国建立了针对银行类机构的“特别处置机制”（SpecialResolutionRegime），明确英格兰银行为处置机构，负责问题金融机构的有序处置和退出。随着英国金融监管体制改革的逐步推进，特殊处置机制的适用范围已从银行和建筑协会扩大到所有受PRA、FCA监管的机构，包括存款吸收机构、投资公司、金融控股公司、中央交易对手方等。《金融服务法》进一步规定，英格兰银行及其下设PRA负责危机管理的实施：PRA负责判断是否需要启动处置程序，一旦进入处置程序，即由英格兰银行新设的特殊处置部门（SpecialResolutionUnit，SRU）负责，包括动用处置工具、与相关机构协调等。危机也促使英国对其存款保险制度进行反思，对金融服务补偿计划（FSCS）的一些制度性安排进行改进。,356.0
351,一是要求每家存款吸收机构进行“单一客户概览”（SingleCustomerView），即对所有受保的存款人账户信息进行集中统计，以便于发生赔付时迅速向FSCS提供存款人的存款信息。,90.0
352,二是取消原有需存款人提出申请才能进行赔付的规定，要求FSCS在银行破产后自动启动存款人赔付程序。,48.0
353,三是制定严格的赔付期限，要求FSCS必须在银行破产7天内进行赔付。（三）欧盟欧洲银行业联盟（BankingUnion）取得实质性进展。,67.0
354,一是继2013年4月欧洲议会通过新的银行业监管规则，督促欧盟各国以法律形式落实金融监管改革后，9月12日欧洲议会高票通过欧盟银行业单一监管机制（SingleSupervisoryMechanism，SSM），迈出了建立银行业联盟的第一步。欧央行（ECB）将对欧元区和其他自愿加入SSM的总资产大于300亿欧元，或者总资产达到其所在国GDP20%以上的系统重要性银行以及请求或接受欧洲稳定基金（EFSF）或欧洲稳定机制（ESM）救助的欧盟国家银行进行直接监管。在此之前，ECB将对这些欧洲大型银行进行全面的压力测试，以掌握真实风险情况。各国监管当局将在ECB指导下对本国中小银行实施监管，并在消费者保护、反洗钱、支付服务等领域继续发挥重要作用。ECB在必要时可接管中小银行并采取早期干预措施。欧洲银行管理局（EBA）负责制定具体的监管规则，并继续定期开展银行业压力测试。,384.0
355,二是欧盟委员会于12月19日审议通过了单一处置机制（SingleResolutionMechanism，SRM）的基本框架，成为继SSM之后建立欧洲银行业联盟的又一重要步骤。SRM将在欧盟建立银行业处置的统一规则，避免各国政府在处置银行时的政策措施不协调，降低处置成本，确保金融体系正常运行。ECB、欧盟委员会和各国处置当局将共同成立单一处置委员会（SingleResolutionBoard），负责分析和决定救助工具的类型及欧洲处置基金的运用方式。若各国处置当局不遵从单一处置委员会的处置决定，处置委员会有权直接对问题银行进行处置。加强影子银行监管。,276.0
356,继2012年3月发布关于影子银行监管的绿皮书后，欧盟委员会于2013年9月4日发布针对影子银行风险的监管提案，从提高流动性标准、强化信息披露要求、加强运作透明度等方面对影子银行设定新规，并计划针对MMFs提出新的监管规则，以提升其运营稳健性。,121.0
357,2012年12月，欧洲系统性风险委员会（ESRB）公布了有关MMFs的监管建议，提出强制转化为浮动资产净值、额外流动性要求、额外的信息披露要求及更详细的报告要求等。强化系统性风险监测评估。ESRB继续发布风险监测表，对内部关联性和系统性风险、宏观经济风险、信用风险、流动性和融资风险、市场风险等进行监测。根据欧盟各成员国的情况，建议采用不同的宏观审慎工具应对银行业、保险业和金融基础设施等领域风险，对工具的实施效果进行评估。ESRB建议采取一系列措施解决非金融私人部门外币债务的系统性风险问题，采用宏观审慎工具确保欧洲资本规则的有效实施。,269.0
358,（四）俄罗斯建立金融监管新体制。2013年7月，俄罗斯颁布法案，撤销联邦金融市场局，组建隶属于俄罗斯中央银行的金融监管委员会，承担金融市场领域的管理和监督职能，对证券公司、保险公司、小型金融组织和养老基金等金融机构的经营活动实行统一监管。俄央行需向国家杜马提供（每三年一次）关于金融市场重点领域发展和稳定运行的草案。此项改革进一步强化了俄央行的宏观审慎管理职能，将货币政策和金融监管两项职能同时归属于一个机构，确保了金融政策的统一性和连续性，进一步增强了俄央行防范和化解系统性风险的能力。三、我国宏观审慎管理的实践（一）建立金融监管协调部际联席会议制度党中央、国务院高度重视金融监管协调机制建设。,298.0
359,2003年12月修订的《中国人民银行法》中明确要求“国务院建立金融监管协调机制，具体办法由国务院规定”。2008年人民银行“三定”方案规定，在国务院领导下，人民银行会同银监会、证监会、保监会建立金融监管协调机制。根据上述规定，人民银行、银监会、证监会、保监会通过多种方式，在加强金融监管沟通和协调方面进行了积极探索。2013年以来，我国经济社会发展呈现出新的阶段性特征，经济结构调整步伐加快，利率汇率市场化改革稳步推进，金融创新和新的金融业态不断涌现，金融业的外部经营环境和内部经营机制发生深刻变化，对建立金融监管协调机制提出了迫切要求。8月，国务院批复建立由人民银行牵头，银监会、证监会、保监会和外汇局参加的金融监管协调部际联席会议制度，联席会议办公室设在人民银行，承担金融监管协调日常工作。,347.0
360,部际联席会议通过季度例会或临时性会议等方式履行工作职责，加强货币政策与金融监管政策之间以及监管政策与法律法规之间的协调，促进维护金融稳定和防范化解系统性、区域性金融风险的协调，强化交叉性金融产品、跨市场金融创新的协调，加强金融信息共享和金融业综合统计体系的协调，这标志着我国金融监管协调工作走向了制度化和规范化。,156.0
361,建立金融监管协调部际联席会议制度，是国务院根据国内外经济金融形势发展需要作出的重大决策，是完善我国金融监管体制的重要举措。首先，建立金融监管协调机制有利于弥补金融创新快速发展过程中出现的监管缺位和监管不足等问题，统一监管尺度和标准，是分业监管体制下维持金融业健康、高效运行的内在要求。其次，建立金融监管协调机制有利于促进宏观调控和金融监管以及监管政策措施之间的协调，形成政策合力，是发展金融市场、服务实体经济的有效保障。最后，建立金融监管协调机制有利于将金融体系视作一个整体，加强货币市场、信贷市场、资本市场、保险市场之间政策措施及执行的统筹协调，强化宏观审慎管理，切实防范和化解系统性风险。自金融监管协调机制建立以来，相关部门积极开展工作，研究协调建立金融监管信息共享和金融业综合统计协调机制、规范互联网金融发展与监管、规范银行同业业务管理、完善地方金融管理体制等问题。,386.0
362,下一步，部际联席会议将在国务院领导下认真履行职责，不断提升监管协调工作规范化和制度化水平。（二）实施逆周期宏观调控近年来，人民银行采用了数量、价格以及宏观审慎政策相结合的调控模式，综合发挥不同调控手段的作用，相互协调，形成合力。国际金融危机爆发后，吸取发达经济体的教训，人民银行在研究健全宏观审慎政策框架和管理手段的基础上，于2011年初正式引入了差别准备金动态调整机制。2013年，人民银行根据经济金融形势变化、金融机构稳健性状况以及信贷政策执行情况，继续实施并完善差别准备金动态调整制度，对有关参数进行调整，引导金融机构落实好稳健货币政策的要求，保持自身稳健经营，合理适度投放信贷，优化信贷结构。年初时，注意引导农村金融机构充分考虑农时和农业生产经营特点，及时安排春耕备耕贷款资金，切实满足“三农”信贷需求。,356.0
363,第三季度，适当加大了对有关政策参数的调整力度，以进一步鼓励和引导金融机构增加对小微企业、“三农”及中西部欠发达地区的信贷投入。总体看，差别准备金动态调整机制与公开市场操作、利率、准备金率等传统货币政策工具相配合，在保持总量稳定、促进结构优化、提升金融机构稳健性方面发挥了重要作用。下一阶段，可根据形势发展需要，通过适时调整有关政策参数，继续发挥差别准备金动态调整工具的逆周期调节作用。同时，针对金融深化和创新发展，研究探索将更多信用创造活动纳入宏观审慎政策框架。人民银行和银监会继续研究制定逆周期资本缓冲的相关规则。,258.0
364,建立和完善宏观审慎管理和微观审慎监管协调配合、互为补充的体制机制。（三）加强系统性风险监测评估2013年，人民银行从宏观全局的角度出发，加强对国内外宏观经济运行形势的研判，深入分析国际经济金融形势变化、资本跨境流动等对我国流动性和价格水平的影响，深刻把握我国转轨经济的体制特征，重点对具有转轨经济特征的风险进行分析，密切监测和评估地方政府融资平台、房地产贷款、产能过剩行业、交叉性金融产品、跨市场金融创新快速发展的潜在风险等。继续开展金融稳定压力测试，结合国际国内经济形势变化和金融改革部署，合理设置压力测试情景，完善压力测试方法，丰富承压指标。不断完善银行业、证券业和保险业日常监测和风险评估体系，深入推进金融机构稳健性现场评估。强化金融机构重大事项及风险事件的报告制度，做好应对预案，及时处置突发风险。,353.0
365,建立存款保险制度，完善市场化退出机制。专栏21银行业金融机构风险传染分析结合2007年至2013年银行间支付结算数据，可以对我国金融网络的稳定性开展进一步的动态跟踪和分析。2013年1月至12月，反映我国金融网络稳定性的主要指标普遍经历了较为明显的波动过程。广度（B）、深度（D）与强度（I）指标均表现出了先升后降的特点，且高点都出现在5月、6月。为进一步分析稳定性指标的波动，辨析金融机构风险传染情况，我们引入新的稳定性指标（L），对金融机构的网络依赖程度进行衡量。,234.0
366,网络依赖程度指标（L）为银行业金融机构流入（流出）资金占其头寸的比重，反映了金融机构在流动性供需方面与整个金融网络的依赖关系。从整体走势看，指标L自2010年以来一直处于较低水平，2012年下半年开始逐步升高，至2013年6月达到最高点后迅速下降。金融机构与网络之间依赖程度的迅速提高，一方面表明资金流出方对整个网络的重要性在不断上升，另一方面则反映了资金流入机构对外部资金的依赖程度也在增强。深入分析后发现，5月、6月，由于部分机构（尤其外资银行）出现头寸明显下降或资金流动规模显著增大的趋势，导致其对外部资金的依赖程度大幅度增加，进而对整个网络稳定性产生了影响。选取2013年6月这一时间截面，我们对大型商业银行、政策性银行、股份制商业银行、邮政储蓄银行、农村信用社及各外资银行等参与主体构成的网络进行分析。,356.0
367,大型商业银行。当大型商业银行分别发出流动性冲击时，平均约38家银行将受到不同程度的影响，波及将平均延续5轮，其涉及资金占比平均超过13%。网络对大型银行的依赖远远大于大型银行对网络的依赖。若大型银行整体作为问题集合，波及将延续7轮，绝大多数机构均受影响。对比2012年6月的情况，大型商业银行属于重要的资金供给方，网络影响力较高。,165.0
368,政策性银行。当政策性银行发出流动性冲击时，平均波及的机构为19家，波及的轮数为5轮，影响的平均资金比例为2%。与2012年相比，政策性银行在网络中的影响力相对稳定，但从网络依赖角度看，网络对政策性银行的依赖不高，政策性银行对网络的依赖程度却相对较强。股份制商业银行。股份制银行分别发出流动性冲击时，平均波及机构数量增加至23家，平均波及提高至5轮，影响的资金比率超过4%。,186.0
369,整体而言，股份制商业银行对网络的平均依赖程度比较适中，也有个别股份制商业银行较多依赖网络，但网络对部分股份制商业银行的依赖程度较高。这表明，尽管与大型商业银行相比，股份制商业银行整体影响力依然较弱，但其对整个网络的影响方式已经有所改变。邮政储蓄银行与农村信用社。与历史相比，2013年6月，邮政储蓄银行的网络影响力与影响方式都有较大变化。不仅影响机构的数量下降至12家，波及延续的平均轮数为5轮，而且影响的资金比率也下降至1%。,214.0
370,值得注意的是，网络对邮政储蓄银行的依赖程度出现了显著上升。表明在此期间，邮政储蓄银行的资金供给对维护网络稳定变得非常重要，并成为除大型商业银行外最重要的资金供给力量。农村信用社与邮政储蓄银行相似。2013年6月，当农村信用社作为整体冲击集合的时候，波及机构的平均数量及轮数分别达到12家和8轮，涉及的资金比例也超过8%。但与邮政储蓄银行不同的是，与其他机构相比，农村信用社对网络的依赖程度较强，而且程度仍在逐步上升。,208.0
371,外资银行。外资银行的影响力和影响范围比较稳定。2013年6月单个外资银行面临冲击时，平均影响机构数量为15家（大部分为外资银行），波及的延续轮数将近5轮，影响的交易量则稳定在1%。然而从网络依赖程度看，大部分外资银行对网络的依赖程度都很高。这表明，尽管外资银行的网络影响力依然较弱，但容易受到资金条件变化的影响，对流动性风险变动较为敏感。,169.0
372,整体而言，2013年我国金融网络结构变化较大，但网络稳定的基础较好，大型商业银行等金融机构的地位依然稳固。值得注意的是，2013年5月、6月，反映网络稳定性的各项指标平均水平较高，这主要受流动性环境转变、机构行为调整以及整个宏观经济运行波动的影响。（四）强化系统重要性金融机构监管相关部门在借鉴G20、FSB关于系统重要性金融机构评估具体方法的基础上，立足我国国情，研究制定国内系统重要性金融机构（D-SIFIs）的认定标准和评估框架，适当强化监管要求，建立有序处置和清算安排。2013年，中国银行的危机管理小组（CMG）积极开展工作，指导制定恢复和处置计划。年末，中国银行的可处置性评估启动。,297.0
373,相关部门正在推动建立中国工商银行和中国平安保险集团的CMGs，研究制定恢复和处置计划。2013年，银监会制定了《商业银行全球系统重要性评估指标披露指引》，要求表内外资产余额为1.6万亿元人民币以上或者上一年度被认定为全球系统重要性银行的商业银行从2014年起披露全球系统重要性评估指标。发布实施该指引，有利于加强对商业银行的市场约束，促进银行改进内部信息系统和管理水平，增加透明度，也有利于加强系统性风险的分析、监测与防范。（五）规范影子银行发展2013年，人民银行进一步健全社会融资规模统计制度，将中央银行金融统计对象范围拓展至影子银行体系。监管部门不断加大对影子银行的监管力度，规范银行理财产品的规模、投资范围、透明度、信息披露、会计核算和销售等。,326.0
